作者,作者 ID,标题,年份,来源出版物名称,卷,期,论文编号,起始页码,结束页码,页码计数,施引文献,DOI,链接,文献类型,出版阶段,开放获取,来源出版物,EID
"De Lacerda, R., Hayar, A., Debbah, M.","24450126600;8931657500;35588784300;","Channel division multiple access: The access solution for UWB networks",2014,"Proceedings - IEEE International Conference on Ultra-Wideband",,,"6958998","309","314",,,"10.1109/ICUWB.2014.6958998","https://www.scopus.com/inward/record.uri?eid=2-s2.0-84912122919&doi=10.1109%2fICUWB.2014.6958998&partnerID=40&md5=75fef5b311b0b98dc65cedeeda12aabc",Conference Paper,"Final","All Open Access, Green",Scopus,2-s2.0-84912122919
"Kammoun, A., Müller, A., Björnson, E., Debbah, M.","57193693109;55371312800;24478602800;35588784300;","Low-complexity linear precoding for multi-cell massive MIMO systems",2014,"European Signal Processing Conference",,,"6952770","2150","2154",,5,,"https://www.scopus.com/inward/record.uri?eid=2-s2.0-84911884153&partnerID=40&md5=0f9e1ad91c79023a16b2b55e4641d866",Conference Paper,"Final","",Scopus,2-s2.0-84911884153
"Maham, B., Saad, W., Debbah, M., Han, Z.","24475159800;57203259001;35588784300;55767186700;","Interference analysis and management for spatially reused cooperative multihop wireless networks",2014,"IEEE Transactions on Communications","62","11","6935004","3778","3790",,10,"10.1109/TCOMM.2014.2364609","https://www.scopus.com/inward/record.uri?eid=2-s2.0-84912570054&doi=10.1109%2fTCOMM.2014.2364609&partnerID=40&md5=9d8e1d9c29bb24d4e38c13ce75d0fdd5",Article,"Final","All Open Access, Green",Scopus,2-s2.0-84912570054
"Azarian, S., Godard, L., Debbah, M.","55321239100;23967643100;35588784300;","Cloud-based spectrum sensing system: First field results",2014,"2014 1st International Workshop on Cognitive Cellular Systems, CCS 2014",,,"6933809","","",,2,"10.1109/CCS.2014.6933809","https://www.scopus.com/inward/record.uri?eid=2-s2.0-84912084507&doi=10.1109%2fCCS.2014.6933809&partnerID=40&md5=ad9ea71b8f185e8aae43e82bd1c19f5e",Conference Paper,"Final","All Open Access, Green",Scopus,2-s2.0-84912084507
"Karadimitrakis, A., Debbah, M., Moustakas, A.L.","55797949900;35588784300;35577484600;","Optical MIMO: Results and analysis",2014,"2014 11th International Symposium on Wireless Communications Systems, ISWCS 2014 - Proceedings",,,"6933493","966","970",,,"10.1109/ISWCS.2014.6933493","https://www.scopus.com/inward/record.uri?eid=2-s2.0-84911974523&doi=10.1109%2fISWCS.2014.6933493&partnerID=40&md5=1892a62d8780455fd79e070ccb7f00b0",Conference Paper,"Final","All Open Access, Green",Scopus,2-s2.0-84911974523
"Makki, B., Svensson, T., Debbah, M.","21743027800;35389765200;35588784300;","Reinforcement-based data transmission in temporally-correlated fading channels: Partial CSIT scenario",2014,"2014 11th International Symposium on Wireless Communications Systems, ISWCS 2014 - Proceedings",,,"6933342","176","181",,,"10.1109/ISWCS.2014.6933342","https://www.scopus.com/inward/record.uri?eid=2-s2.0-84911974205&doi=10.1109%2fISWCS.2014.6933342&partnerID=40&md5=dc308ffd18773d1f71a126ce3da7f9ca",Conference Paper,"Final","All Open Access, Green",Scopus,2-s2.0-84911974205
"Bastuʇ, E., Bennis, M., Debbah, M.","55650303100;23007914800;35588784300;","Cache-enabled small cell networks: Modeling and tradeoffs",2014,"2014 11th International Symposium on Wireless Communications Systems, ISWCS 2014 - Proceedings",,,"6933434","649","653",,92,"10.1109/ISWCS.2014.6933434","https://www.scopus.com/inward/record.uri?eid=2-s2.0-84911951068&doi=10.1109%2fISWCS.2014.6933434&partnerID=40&md5=acdf503f3d5ca11b4090534c5d8b90c3",Conference Paper,"Final","All Open Access, Green",Scopus,2-s2.0-84911951068
"Mohaisen, M., Mohaisen, A., Debbah, M.","24329635300;14027298300;35588784300;","Parallel QRD-M encoder for multi-user MIMO systems",2014,"Telecommunication Systems","57","3",,"261","270",,1,"10.1007/s11235-013-9856-1","https://www.scopus.com/inward/record.uri?eid=2-s2.0-84911007008&doi=10.1007%2fs11235-013-9856-1&partnerID=40&md5=081ef53319896aca5c717adbc7715576",Article,"Final","All Open Access, Green",Scopus,2-s2.0-84911007008
"Shariati, N., Bjornson, E., Bengtsson, M., Debbah, M.","54795952000;24478602800;57193744800;35588784300;","Low-complexity polynomial channel estimation in large-scale MIMO with arbitrary statistics",2014,"IEEE Journal on Selected Topics in Signal Processing","8","5","6783987","815","830",,123,"10.1109/JSTSP.2014.2316063","https://www.scopus.com/inward/record.uri?eid=2-s2.0-84907218156&doi=10.1109%2fJSTSP.2014.2316063&partnerID=40&md5=ada40a4b6c527aee92943efa953e6888",Article,"Final","All Open Access, Green",Scopus,2-s2.0-84907218156
"Kammoun, A., Müller, A., Björnson, E., Debbah, M.","57193693109;55371312800;24478602800;35588784300;","Linear precoding based on polynomial expansion: Large-scale multi-cell MIMO systems",2014,"IEEE Journal on Selected Topics in Signal Processing","8","5","6812124","861","875",,119,"10.1109/JSTSP.2014.2322582","https://www.scopus.com/inward/record.uri?eid=2-s2.0-84907212024&doi=10.1109%2fJSTSP.2014.2322582&partnerID=40&md5=4a43e235f55667cfb52c61569827fced",Article,"Final","All Open Access, Green",Scopus,2-s2.0-84907212024
"Rose, L., Belmega, E.V., Saad, W., Debbah, M.","47562015400;24398549200;57203259001;35588784300;","Pricing in heterogeneous wireless networks: Hierarchical games and dynamics",2014,"IEEE Transactions on Wireless Communications","13","9","6820798","4985","5001",,22,"10.1109/TWC.2014.2326678","https://www.scopus.com/inward/record.uri?eid=2-s2.0-84907200809&doi=10.1109%2fTWC.2014.2326678&partnerID=40&md5=602c5499cac0104069454d954c7905f5",Article,"Final","All Open Access, Green",Scopus,2-s2.0-84907200809
"De Mari, M., Strinati, E.C., Debbah, M.","55532185600;6507934419;35588784300;","Matching coalitions for interference classification in large heterogeneous networks",2014,"IEEE International Symposium on Personal, Indoor and Mobile Radio Communications, PIMRC","2014-June",,"7136232","580","584",,,"10.1109/PIMRC.2014.7136232","https://www.scopus.com/inward/record.uri?eid=2-s2.0-84944328472&doi=10.1109%2fPIMRC.2014.7136232&partnerID=40&md5=3526ecc0632feed197d52263401ee8fb",Conference Paper,"Final","",Scopus,2-s2.0-84944328472
"Achir, N., Debbah, M., Muhlethaler, P.","23007843900;35588784300;6603140195;","Massive MIMO cooperative communications for wireless sensor networks: Throughput and energy efficiency analysis",2014,"IEEE International Symposium on Personal, Indoor and Mobile Radio Communications, PIMRC","2014-June",,"7136234","590","594",,3,"10.1109/PIMRC.2014.7136234","https://www.scopus.com/inward/record.uri?eid=2-s2.0-84944324808&doi=10.1109%2fPIMRC.2014.7136234&partnerID=40&md5=a28441e81796f669e9568f2596b1bd12",Conference Paper,"Final","All Open Access, Green",Scopus,2-s2.0-84944324808
"Cardoso, L.S., Maso, M., Debbah, M.","8267822300;36663826600;35588784300;","Null-space precoder for dense 4G and beyond networks",2014,"Resource Allocation and MIMO for 4G and Beyond","9781461480570",,,"475","521",,,"10.1007/978-1-4614-8057-0_11","https://www.scopus.com/inward/record.uri?eid=2-s2.0-84949180360&doi=10.1007%2f978-1-4614-8057-0_11&partnerID=40&md5=04f7cbf478014165a1ab9b27b8a73865",Book Chapter,"Final","",Scopus,2-s2.0-84949180360
"Perabathini, B., Kountouris, M., Debbah, M., Conte, A.","56296620400;8902345100;35588784300;8688261400;","Optimal area power efficiency in cellular networks",2014,"2014 IEEE Globecom Workshops, GC Wkshps 2014",,,"7063589","1157","1161",,4,"10.1109/GLOCOMW.2014.7063589","https://www.scopus.com/inward/record.uri?eid=2-s2.0-84946692545&doi=10.1109%2fGLOCOMW.2014.7063589&partnerID=40&md5=30932991fd181ae5dbcd3a317bfa0075",Conference Paper,"Final","All Open Access, Green",Scopus,2-s2.0-84946692545
"De Mari, M., Becvar, Z., Strinati, E.C., Debbah, M.","55532185600;23011752200;6507934419;35588784300;","Interference empowered 5G networks",2014,"Proceedings of the 2014 1st International Conference on 5G for Ubiquitous Connectivity, 5GU 2014",,,"7041025","29","34",,1,"10.4108/icst.5gu.2014.258227","https://www.scopus.com/inward/record.uri?eid=2-s2.0-84946691896&doi=10.4108%2ficst.5gu.2014.258227&partnerID=40&md5=02a8e0a7f9f1e94a5ca1f948f57a032d",Conference Paper,"Final","All Open Access, Bronze",Scopus,2-s2.0-84946691896
"Sanguinetti, L., Moustakas, A.L., Debbah, M.","6602643889;35577484600;35588784300;","Analysis and management of interference in 5G reverse TDD HetNets",2014,"Proceedings of the 2014 1st International Conference on 5G for Ubiquitous Connectivity, 5GU 2014",,,"7041041","122","127",,2,"10.4108/icst.5gu.2014.258124","https://www.scopus.com/inward/record.uri?eid=2-s2.0-84946690203&doi=10.4108%2ficst.5gu.2014.258124&partnerID=40&md5=06b37b228ae7b0210359877d910bf191",Conference Paper,"Final","All Open Access, Bronze, Green",Scopus,2-s2.0-84946690203
"Pantisano, F., Bennis, M., Saad, W., Debbah, M.","36810190500;23007914800;57203259001;35588784300;","In-network caching and content placement in cooperative small cell networks",2014,"Proceedings of the 2014 1st International Conference on 5G for Ubiquitous Connectivity, 5GU 2014",,,"7041042","128","133",,45,"10.4108/icst.5gu.2014.258230","https://www.scopus.com/inward/record.uri?eid=2-s2.0-84946688281&doi=10.4108%2ficst.5gu.2014.258230&partnerID=40&md5=21803ee8914f5ae502db5721a1ccf992",Conference Paper,"Final","All Open Access, Bronze, Green",Scopus,2-s2.0-84946688281
"Sanguinetti, L., Björnson, E., Debbah, M., Moustakas, A.L.","6602643889;24478602800;35588784300;35577484600;","Optimal linear precoding in multi-user MIMO systems: A large system analysis",2014,"2014 IEEE Global Communications Conference, GLOBECOM 2014",,,"7037420","3922","3927",,19,"10.1109/GLOCOM.2014.7037420","https://www.scopus.com/inward/record.uri?eid=2-s2.0-84988274691&doi=10.1109%2fGLOCOM.2014.7037420&partnerID=40&md5=897545fd70dcf520d57cb2bc2d2ccbf5",Conference Paper,"Final","All Open Access, Green",Scopus,2-s2.0-84988274691
"Andreotti, R., Marchetti, L., Sanguinetti, L., Debbah, M.","36924543000;55654690800;6602643889;35588784300;","Distributed power control over interference channels using ACK/NACK feedback",2014,"2014 IEEE Global Communications Conference, GLOBECOM 2014",,,"7037464","4186","4190",,1,"10.1109/GLOCOM.2014.7037464","https://www.scopus.com/inward/record.uri?eid=2-s2.0-84949923204&doi=10.1109%2fGLOCOM.2014.7037464&partnerID=40&md5=39a2130f6fcd961a238b8fc81456b91d",Conference Paper,"Final","All Open Access, Green",Scopus,2-s2.0-84949923204
"Bjornson, E., Larsson, E.G., Debbah, M.","24478602800;35555550500;35588784300;","Optimizing multi-cell massive MIMO for spectral efficiency: How Many users should be scheduled?",2014,"2014 IEEE Global Conference on Signal and Information Processing, GlobalSIP 2014",,,"7032190","612","616",,29,"10.1109/GlobalSIP.2014.7032190","https://www.scopus.com/inward/record.uri?eid=2-s2.0-84983160363&doi=10.1109%2fGlobalSIP.2014.7032190&partnerID=40&md5=84663b0230aae9389cb9d51e62791515",Conference Paper,"Final","All Open Access, Green",Scopus,2-s2.0-84983160363
"Sifaou, H., Kammoun, A., Sanguinetti, L., Debbah, M., Alouini, M.-S.","56712963000;57193693109;6602643889;35588784300;35570711700;","Power efficient low complexity precoding for massive MIMO systems",2014,"2014 IEEE Global Conference on Signal and Information Processing, GlobalSIP 2014",,,"7032197","647","651",,10,"10.1109/GlobalSIP.2014.7032197","https://www.scopus.com/inward/record.uri?eid=2-s2.0-84949927759&doi=10.1109%2fGlobalSIP.2014.7032197&partnerID=40&md5=5e6448c454bd815d0a04620bef369c4f",Conference Paper,"Final","All Open Access, Green",Scopus,2-s2.0-84949927759
"Katz, G., Piantanida, P., Couillet, R., Debbah, M.","56533375700;13608109300;34869367400;35588784300;","Joint estimation and detection against independence",2014,"2014 52nd Annual Allerton Conference on Communication, Control, and Computing, Allerton 2014",,,"7028594","1220","1227",,7,"10.1109/ALLERTON.2014.7028594","https://www.scopus.com/inward/record.uri?eid=2-s2.0-84946688484&doi=10.1109%2fALLERTON.2014.7028594&partnerID=40&md5=eecc55687315c76b2c7767b78468babf",Conference Paper,"Final","All Open Access, Green",Scopus,2-s2.0-84946688484
"Björnson, E., Jorswieck, E.A., Debbah, M., Ottersten, B.","24478602800;7003871700;35588784300;7007005676;","Multiobjective signal processing optimization: The way to balance conflicting metrics in 5G systems",2014,"IEEE Signal Processing Magazine","31","6","6924852","14","23",,153,"10.1109/MSP.2014.2330661","https://www.scopus.com/inward/record.uri?eid=2-s2.0-85032751059&doi=10.1109%2fMSP.2014.2330661&partnerID=40&md5=3235d918a9eb9bf9a46269c1f8d927aa",Article,"Final","All Open Access, Green",Scopus,2-s2.0-85032751059
"Passemier, D., Kammoun, A., Debbah, M.","56074264400;57193693109;35588784300;","Detection and estimation of spikes in presence of noise and interference",2014,"20th European Wireless Conference, EW 2014",,,,"775","778",,,,"https://www.scopus.com/inward/record.uri?eid=2-s2.0-84916910549&partnerID=40&md5=c3c125496871303895fb20afa48ca479",Conference Paper,"Final","",Scopus,2-s2.0-84916910549
"Bjornson, E., Hoydis, J., Kountouris, M., Debbah, M.","24478602800;24724343000;8902345100;35588784300;","Massive MIMO systems with non-ideal hardware: Energy efficiency, estimation, and capacity limits",2014,"IEEE Transactions on Information Theory","60","11","6891254","7112","7139",,592,"10.1109/TIT.2014.2354403","https://www.scopus.com/inward/record.uri?eid=2-s2.0-84908222752&doi=10.1109%2fTIT.2014.2354403&partnerID=40&md5=5f9c604c44bc9ac68a9ce7ca6181927f",Article,"Final","All Open Access, Green",Scopus,2-s2.0-84908222752
"Zhang, X., Matthaiou, M., Bjornson, E., Coldrey, M., Debbah, M.","56353273300;23051214500;24478602800;14031129300;35588784300;","On the MIMO capacity with residual transceiver hardware impairments",2014,"2014 IEEE International Conference on Communications, ICC 2014",,,"6884163","5299","5305",,41,"10.1109/ICC.2014.6884163","https://www.scopus.com/inward/record.uri?eid=2-s2.0-84907006021&doi=10.1109%2fICC.2014.6884163&partnerID=40&md5=c276ba4dc31fb99aab5ac8c70196f42a",Conference Paper,"Final","All Open Access, Green",Scopus,2-s2.0-84907006021
"Destounis, A., Assaad, M., Debbah, M., Sayadi, B., Feki, A.","37092839000;56490393700;35588784300;8214788200;36068807500;","On Queue-aware power control in interfering wireless links: Heavy traffic asymptoticmodelling and application in QoS provisioning",2014,"IEEE Transactions on Mobile Computing","13","10","6518111","2345","2356",,2,"10.1109/TMC.2013.65","https://www.scopus.com/inward/record.uri?eid=2-s2.0-84906861989&doi=10.1109%2fTMC.2013.65&partnerID=40&md5=d9f289bed00f98a4cd667cb63ec9f3ac",Article,"Final","All Open Access, Green",Scopus,2-s2.0-84906861989
"Bjornson, E., Matthaiou, M., Debbah, M.","24478602800;23051214500;35588784300;","Circuit-aware design of energy-efficient massive MIMO systems",2014,"ISCCSP 2014 - 2014 6th International Symposium on Communications, Control and Signal Processing, Proceedings",,,"6877826","101","104",,12,"10.1109/ISCCSP.2014.6877826","https://www.scopus.com/inward/record.uri?eid=2-s2.0-84906766428&doi=10.1109%2fISCCSP.2014.6877826&partnerID=40&md5=9013fda36dd8305ee482a15f4ed5221f",Conference Paper,"Final","All Open Access, Green",Scopus,2-s2.0-84906766428
"Bastug, E., Bennis, M., Debbah, M.","55650303100;23007914800;35588784300;","Social and spatial proactive caching for mobile data offloading",2014,"2014 IEEE International Conference on Communications Workshops, ICC 2014",,,"6881261","581","586",,52,"10.1109/ICCW.2014.6881261","https://www.scopus.com/inward/record.uri?eid=2-s2.0-84906748887&doi=10.1109%2fICCW.2014.6881261&partnerID=40&md5=67382174bafddb14d081d71fa4756a11",Conference Paper,"Final","All Open Access, Green",Scopus,2-s2.0-84906748887
"Destounis, A., Assaad, M., Debbah, M., Sayadi, B.","37092839000;56490393700;35588784300;8214788200;","Traffic-aware training and scheduling for the 2-user MISO broadcast channel",2014,"IEEE International Symposium on Information Theory - Proceedings",,,"6875058","1376","1380",,3,"10.1109/ISIT.2014.6875058","https://www.scopus.com/inward/record.uri?eid=2-s2.0-84906545970&doi=10.1109%2fISIT.2014.6875058&partnerID=40&md5=71696e2b4e0261697d4b1cb180b372ee",Conference Paper,"Final","All Open Access, Green",Scopus,2-s2.0-84906545970
"Muller, A., Kammoun, A., Bjornson, E., Debbah, M.","55371312800;57193693109;24478602800;35588784300;","Efficient linear precoding for massive MIMO systems using truncated polynomial expansion",2014,"Proceedings of the IEEE Sensor Array and Multichannel Signal Processing Workshop",,,"6882393","273","276",,26,"10.1109/SAM.2014.6882394","https://www.scopus.com/inward/record.uri?eid=2-s2.0-84906247357&doi=10.1109%2fSAM.2014.6882394&partnerID=40&md5=c126700c5333103867ab86e73cc8ef4d",Conference Paper,"Final","All Open Access, Green",Scopus,2-s2.0-84906247357
"Bastug, E., Bennis, M., Debbah, M.","55650303100;23007914800;35588784300;","Living on the edge: The role of proactive caching in 5G wireless networks",2014,"IEEE Communications Magazine","52","8","6871674","82","89",,866,"10.1109/MCOM.2014.6871674","https://www.scopus.com/inward/record.uri?eid=2-s2.0-84906079345&doi=10.1109%2fMCOM.2014.6871674&partnerID=40&md5=400ef3711f05c6dae502937b5b5535b2",Article,"Final","All Open Access, Green",Scopus,2-s2.0-84906079345
"Abboud, A., Couillet, R., Debbah, M., Siguerdidjane, H.","56303545400;34869367400;35588784300;6602274934;","Asynchronous alternating direction method of multipliers applied to the direct-current optimal power flow problem",2014,"ICASSP, IEEE International Conference on Acoustics, Speech and Signal Processing - Proceedings",,,"6855111","7764","7768",,12,"10.1109/ICASSP.2014.6855111","https://www.scopus.com/inward/record.uri?eid=2-s2.0-84905234154&doi=10.1109%2fICASSP.2014.6855111&partnerID=40&md5=fab4300b283c1a6ce918071371c3c6d6",Conference Paper,"Final","All Open Access, Green",Scopus,2-s2.0-84905234154
"Sanguinetti, L., Moustakas, A.L., Björnson, E., Debbah, M.","6602643889;35577484600;24478602800;35588784300;","Energy consumption in multi-user MIMO systems: Impact of user mobility",2014,"ICASSP, IEEE International Conference on Acoustics, Speech and Signal Processing - Proceedings",,,"6854502","4743","4747",,2,"10.1109/ICASSP.2014.6854502","https://www.scopus.com/inward/record.uri?eid=2-s2.0-84905216589&doi=10.1109%2fICASSP.2014.6854502&partnerID=40&md5=6e58e6887722272148862aa2db58baff",Conference Paper,"Final","All Open Access, Green",Scopus,2-s2.0-84905216589
"Bjornson, E., Matthaiou, M., Debbah, M.","24478602800;23051214500;35588784300;","Massive MIMO systems with hardware-constrained base stations",2014,"ICASSP, IEEE International Conference on Acoustics, Speech and Signal Processing - Proceedings",,,"6854179","3142","3146",,17,"10.1109/ICASSP.2014.6854179","https://www.scopus.com/inward/record.uri?eid=2-s2.0-84905216547&doi=10.1109%2fICASSP.2014.6854179&partnerID=40&md5=6d31983a5780115332b5e2472f4407c7",Conference Paper,"Final","All Open Access, Green",Scopus,2-s2.0-84905216547
"Pantisano, F., Bennis, M., Saad, W., Debbah, M.","36810190500;23007914800;57203259001;35588784300;","Cache-aware user association in backhaul-constrained small cell networks",2014,"2014 12th International Symposium on Modeling and Optimization in Mobile, Ad Hoc, and Wireless Networks, WiOpt 2014",,,"6850276","37","42",,56,"10.1109/WIOPT.2014.6850276","https://www.scopus.com/inward/record.uri?eid=2-s2.0-84905044084&doi=10.1109%2fWIOPT.2014.6850276&partnerID=40&md5=e1dd2d811d9c402d97bdde5fc12b6826",Conference Paper,"Final","All Open Access, Green",Scopus,2-s2.0-84905044084
"Kammoun, A., Khanfir, H., Altman, Z., Debbah, M., Kamoun, M.","57193693109;24587702000;56028199700;35588784300;35743081000;","Preliminary results on 3D channel modeling: From theory to standardization",2014,"IEEE Journal on Selected Areas in Communications","32","6","6824736","1219","1229",,94,"10.1109/JSAC.2014.2328152","https://www.scopus.com/inward/record.uri?eid=2-s2.0-84905013350&doi=10.1109%2fJSAC.2014.2328152&partnerID=40&md5=0757782279c8ef0ba0f1c60fe4c594ae",Article,"Final","All Open Access, Green",Scopus,2-s2.0-84905013350
"Perabathini, B., Varma, V.S., Debbah, M., Kountouris, M., Conte, A.","56296620400;55311713300;35588784300;8902345100;8688261400;","Physical limits of point-to-point communication systems",2014,"2014 12th International Symposium on Modeling and Optimization in Mobile, Ad Hoc, and Wireless Networks, WiOpt 2014",,,"6850354","604","610",,1,"10.1109/WIOPT.2014.6850354","https://www.scopus.com/inward/record.uri?eid=2-s2.0-84904994425&doi=10.1109%2fWIOPT.2014.6850354&partnerID=40&md5=9270e71971d6e457e451648ac704d835",Conference Paper,"Final","All Open Access, Green",Scopus,2-s2.0-84904994425
"De Mari, M., Strinati, E.C., Debbah, M.","55532185600;6507934419;35588784300;","Energy-efficiency and future knowledge tradeoff in small cells prediction-based strategies",2014,"2014 12th International Symposium on Modeling and Optimization in Mobile, Ad Hoc, and Wireless Networks, WiOpt 2014",,,"6850277","43","49",,1,"10.1109/WIOPT.2014.6850277","https://www.scopus.com/inward/record.uri?eid=2-s2.0-84904984697&doi=10.1109%2fWIOPT.2014.6850277&partnerID=40&md5=a204047e42383ffc9758caab8e59c9ce",Conference Paper,"Final","All Open Access, Green",Scopus,2-s2.0-84904984697
"Hamidouche, K., Saad, W., Debbah, M.","56297968300;57203259001;35588784300;","Many-to-many matching games for proactive social-caching in wireless small cell networks",2014,"2014 12th International Symposium on Modeling and Optimization in Mobile, Ad Hoc, and Wireless Networks, WiOpt 2014",,,"6850348","569","574",,95,"10.1109/WIOPT.2014.6850348","https://www.scopus.com/inward/record.uri?eid=2-s2.0-84904964513&doi=10.1109%2fWIOPT.2014.6850348&partnerID=40&md5=527e51c04714e11d4928b216c59a6d85",Conference Paper,"Final","All Open Access, Green",Scopus,2-s2.0-84904964513
"Saad, W., Han, Z., Zheng, R., Debbah, M., Poor, H.V.","57203259001;55767186700;57203196755;35588784300;55665272100;","A college admissions game for uplink user association in wireless small cell networks",2014,"Proceedings - IEEE INFOCOM",,,"6848040","1096","1104",,116,"10.1109/INFOCOM.2014.6848040","https://www.scopus.com/inward/record.uri?eid=2-s2.0-84904438525&doi=10.1109%2fINFOCOM.2014.6848040&partnerID=40&md5=1288386daf43e3014b77dd82fb283457",Conference Paper,"Final","All Open Access, Green",Scopus,2-s2.0-84904438525
"Maso, M., Baştuǧ, E., Cardoso, L.S., Debbah, M., Özdemir, O.","36663826600;55650303100;8267822300;35588784300;57208023329;","Reconfigurable cognitive transceiver for opportunistic networks",2014,"Eurasip Journal on Advances in Signal Processing","2014","1","69","","",,3,"10.1186/1687-6180-2014-69","https://www.scopus.com/inward/record.uri?eid=2-s2.0-84901799567&doi=10.1186%2f1687-6180-2014-69&partnerID=40&md5=78c6bb7cf3f6015659c7e0b250a32d7f",Article,"Final","All Open Access, Gold, Green",Scopus,2-s2.0-84901799567
"Zwingelstein-Colin, M., Debbah, M.","8675509200;35588784300;","Random matrix theory based resource allocation in correlated MIMO Systems with ARQ feedback",2014,"IEEE Communications Letters","18","5","6777392","793","796",,2,"10.1109/LCOMM.2014.031414.140214","https://www.scopus.com/inward/record.uri?eid=2-s2.0-84901480334&doi=10.1109%2fLCOMM.2014.031414.140214&partnerID=40&md5=05763e34afa27176eb8a313bdc962e9c",Article,"Final","All Open Access, Green",Scopus,2-s2.0-84901480334
"Li, H., Song, L., Debbah, M.","57206828055;55585880400;35588784300;","Energy efficiency of large-scale multiple antenna systems with transmit antenna selection",2014,"IEEE Transactions on Communications","62","2","6725592","638","647",,141,"10.1109/TCOMM.2014.011414.130498","https://www.scopus.com/inward/record.uri?eid=2-s2.0-84900605446&doi=10.1109%2fTCOMM.2014.011414.130498&partnerID=40&md5=012e46d39f0f11114c0d65c4287e57f7",Article,"Final","",Scopus,2-s2.0-84900605446
"Pantisano, F., Bennis, M., Saad, W., Debbah, M., Latva-Aho, M.","36810190500;23007914800;57203259001;35588784300;7003450405;","Improving macrocell-small cell coexistence through adaptive interference draining",2014,"IEEE Transactions on Wireless Communications","13","2","6684542","942","955",,9,"10.1109/TWC.2013.120613.130617","https://www.scopus.com/inward/record.uri?eid=2-s2.0-84896390388&doi=10.1109%2fTWC.2013.120613.130617&partnerID=40&md5=4adfb3ee7ffc0cd785ab80894a5a290b",Article,"Final","All Open Access, Green",Scopus,2-s2.0-84896390388
"Rose, L., Perlaza, S.M., Le Martret, C.J., Debbah, M.","47562015400;34870358700;6602372781;35588784300;","Self-organization in decentralized networks: A trial and error learning approach",2014,"IEEE Transactions on Wireless Communications","13","1",,"268","279",,27,"10.1109/TWC.2013.112613.130405","https://www.scopus.com/inward/record.uri?eid=2-s2.0-84893719248&doi=10.1109%2fTWC.2013.112613.130405&partnerID=40&md5=fab95cbbcd91254ec91ef25806f5f6bc",Article,"Final","All Open Access, Green",Scopus,2-s2.0-84893719248
"Destounis, A., Assaad, M., Debbah, M., Sayadi, B.","37092839000;56490393700;35588784300;8214788200;","A randomized probing scheme for increasing the stability region of multicarrier systems",2013,"IEEE International Symposium on Information Theory - Proceedings",,,"6620562","1929","1933",,2,"10.1109/ISIT.2013.6620562","https://www.scopus.com/inward/record.uri?eid=2-s2.0-84890367804&doi=10.1109%2fISIT.2013.6620562&partnerID=40&md5=5ebf28c2051dccdad327d02b6ea29d50",Conference Paper,"Final","All Open Access, Green",Scopus,2-s2.0-84890367804
