作者,作者 ID,标题,年份,来源出版物名称,卷,期,论文编号,起始页码,结束页码,页码计数,施引文献,DOI,链接,文献类型,出版阶段,开放获取,来源出版物,EID
"Kliks, A., Sroka, P., Debbah, M.","26325609500;56618672400;35588784300;","Crystallized rate regions for MIMO transmission",2010,"Eurasip Journal on Wireless Communications and Networking","2010",,"919072","","",,6,"10.1155/2010/919072","https://www.scopus.com/inward/record.uri?eid=2-s2.0-78249253949&doi=10.1155%2f2010%2f919072&partnerID=40&md5=3867eee6df005dcb8af820e61a9cabd7",Article,"Final","All Open Access, Gold, Green",Scopus,2-s2.0-78249253949
"He, G., Lasaulce, S., Hayel, Y., Debbah, M.","24773259800;8576012300;55694789800;35588784300;","A multi-level hierarchical game-theoretical approach for cognitive networks",2010,"2010 Proceedings of the 5th International Conference on Cognitive Radio Oriented Wireless Networks and Communications, CROWNCom 2010",,,"5577789","","",,2,"10.4108/ICST.CROWNCOM2010.9292","https://www.scopus.com/inward/record.uri?eid=2-s2.0-77958171403&doi=10.4108%2fICST.CROWNCOM2010.9292&partnerID=40&md5=590aa62ac7eae9adc7c6ce076fa8b79d",Conference Paper,"Final","All Open Access, Bronze, Green",Scopus,2-s2.0-77958171403
"Wang, H., Jouini, W., Nafkha, A., Palicot, J., Cardoso, L.S., Debbah, M.","55688978600;35932385200;24462215900;6701773104;8267822300;35588784300;","Blind standard identification with bandwidth shape and GI recognition using USRP platforms and SDR4all tools",2010,"2010 Proceedings of the 5th International Conference on Cognitive Radio Oriented Wireless Networks and Communications, CROWNCom 2010",,,"5577678","","",,5,"10.4108/ICST.CROWNCOM2010.9181","https://www.scopus.com/inward/record.uri?eid=2-s2.0-77958167270&doi=10.4108%2fICST.CROWNCOM2010.9181&partnerID=40&md5=c813d246d4bf570478771e5e5027b650",Conference Paper,"Final","All Open Access, Bronze",Scopus,2-s2.0-77958167270
"He, G., Cottatellucci, L., Debbah, M.","24773259800;6602211855;35588784300;","The waterfilling game-theoretical framework for distributed wireless network information flow",2010,"Eurasip Journal on Wireless Communications and Networking","2010",,"482975","","",,9,"10.1155/2010/482975","https://www.scopus.com/inward/record.uri?eid=2-s2.0-77957835708&doi=10.1155%2f2010%2f482975&partnerID=40&md5=9dae3542d9a4736d96bd4e51b93e94e3",Article,"Final","All Open Access, Gold, Green",Scopus,2-s2.0-77957835708
"Couillet, R., Debbah, M.","34869367400;35588784300;","A Bayesian framework for collaborative multi-source signal sensing",2010,"IEEE Transactions on Signal Processing","58","10","5484540","5186","5195",,24,"10.1109/TSP.2010.2052921","https://www.scopus.com/inward/record.uri?eid=2-s2.0-77956781759&doi=10.1109%2fTSP.2010.2052921&partnerID=40&md5=05dda7644b428eb37d84a6eac0939e8c",Article,"Final","All Open Access, Green",Scopus,2-s2.0-77956781759
"Mueck, M., Piipponen, A., Kalliojärvi, K., Dimitrakopoulos, G., Tsagkaris, K., Demestichas, P., Casadevall, F., Pérez-Romero, J., Sallent, O., Baldini, G., Filin, S., Harada, H., Debbah, M., Haustein, T., Gebert, J., Deschamps, B., Bender, P., Street, M., Kandeepan, S., Lota, J., Hayar, A.","35146414800;36462697700;6603232055;56252345700;56213635100;7003528247;35609697500;6701677344;9732551200;26022862400;8843337600;34869729600;35588784300;55945252800;23004062500;24724196100;57197952116;7006191940;9633908400;15923150600;8931657500;","ETSI reconfigurable radio systems: Status and future directions on software defined radio and cognitive radio standards",2010,"IEEE Communications Magazine","48","9","5560591","78","86",,83,"10.1109/MCOM.2010.5560591","https://www.scopus.com/inward/record.uri?eid=2-s2.0-77956371563&doi=10.1109%2fMCOM.2010.5560591&partnerID=40&md5=d58b7717d6403ce464e9a29357c81cce",Article,"Final","All Open Access, Green",Scopus,2-s2.0-77956371563
"Couillet, R., Poor, H.V., Debbah, M.","34869367400;55665272100;35588784300;","Self-organized spectrum sharing in large MIMO multiple-access channels",2010,"IEEE International Symposium on Information Theory - Proceedings",,,"5513642","2303","2307",,1,"10.1109/ISIT.2010.5513642","https://www.scopus.com/inward/record.uri?eid=2-s2.0-77955676497&doi=10.1109%2fISIT.2010.5513642&partnerID=40&md5=032c95bf2577e8ed4b9d0171ce03f6dd",Conference Paper,"Final","All Open Access, Green",Scopus,2-s2.0-77955676497
"Couillet, R., Silverstein, J.W., Debbah, M.","34869367400;7102739530;35588784300;","Eigen-inference for multi-source power estimation",2010,"IEEE International Symposium on Information Theory - Proceedings",,,"5513327","1673","1677",,3,"10.1109/ISIT.2010.5513327","https://www.scopus.com/inward/record.uri?eid=2-s2.0-77955672319&doi=10.1109%2fISIT.2010.5513327&partnerID=40&md5=810c915679513c7e0a378b4c04ed0520",Conference Paper,"Final","",Scopus,2-s2.0-77955672319
"Couillet, R., Debbah, M.","34869367400;35588784300;","Information theoretic approach to synchronization: The OFDM carrier frequency offset example",2010,"6th Advanced International Conference on Telecommunications, AICT 2010",,,"5489867","131","135",,1,"10.1109/AICT.2010.21","https://www.scopus.com/inward/record.uri?eid=2-s2.0-77955406788&doi=10.1109%2fAICT.2010.21&partnerID=40&md5=50c0b7cad595c560eda642e4c921ff1f",Conference Paper,"Final","All Open Access, Green",Scopus,2-s2.0-77955406788
"Wang, H., Jouini, W., Hachemani, R., Palicot, J., Cardoso, L.S., Debbah, M.","55688978600;35932385200;26435231600;6701773104;8267822300;35588784300;","Blind bandwidth shape recognition for standard identification using USRP platforms and SDR4all tools",2010,"6th Advanced International Conference on Telecommunications, AICT 2010",,,"5489864","147","152",,3,"10.1109/AICT.2010.41","https://www.scopus.com/inward/record.uri?eid=2-s2.0-77955350357&doi=10.1109%2fAICT.2010.41&partnerID=40&md5=3a90c4fbb154aaa4584441fcbcae4ae3",Conference Paper,"Final","",Scopus,2-s2.0-77955350357
"Mueck, M.D., Di Renzo, M., Debbah, M.","35146414800;16174747800;35588784300;","Opportunistic relaying for cognitive radio enhanced cellular networks: Infrastructure and initial results",2010,"ISWPC 2010 - IEEE 5th International Symposium on Wireless Pervasive Computing 2010",,,"5483703","556","561",,7,"10.1109/ISWPC.2010.5483703","https://www.scopus.com/inward/record.uri?eid=2-s2.0-77954772192&doi=10.1109%2fISWPC.2010.5483703&partnerID=40&md5=2dab9530361ddcdf8a2d4e5bbc12baf2",Conference Paper,"Final","All Open Access, Green",Scopus,2-s2.0-77954772192
"He, G., Debbah, M., Altman, E.","24773259800;35588784300;10142984200;","A bayesian game-theoretic approach for distributed resource allocation in fading multiple access channels",2010,"Eurasip Journal on Wireless Communications and Networking","2010",,"391684","","",,31,"10.1155/2010/391684","https://www.scopus.com/inward/record.uri?eid=2-s2.0-77954515030&doi=10.1155%2f2010%2f391684&partnerID=40&md5=226ec8fd1cf53044e7fce78ed8dbfd82",Article,"Final","All Open Access, Gold, Green",Scopus,2-s2.0-77954515030
"Kliks, A., Sroka, P., Debbah, M.","26325609500;56618672400;35588784300;","MIMO crystallized rate regions",2010,"2010 European Wireless Conference, EW 2010",,,"5483430","940","947",,1,"10.1109/EW.2010.5483430","https://www.scopus.com/inward/record.uri?eid=2-s2.0-77954440268&doi=10.1109%2fEW.2010.5483430&partnerID=40&md5=161336706d5fb81826d1467e3c2e32a5",Conference Paper,"Final","",Scopus,2-s2.0-77954440268
"Song, L., Hong, G., Jiao, B., Debbah, M.","55585880400;57199443686;7006676820;35588784300;","Joint relay selection and analog network coding using differential modulation in two-way relay channels",2010,"IEEE Transactions on Vehicular Technology","59","6","5447689","2932","2939",,110,"10.1109/TVT.2010.2048225","https://www.scopus.com/inward/record.uri?eid=2-s2.0-77954602623&doi=10.1109%2fTVT.2010.2048225&partnerID=40&md5=862811c4291137f563624dfa40335ef4",Article,"Final","All Open Access, Green",Scopus,2-s2.0-77954602623
"Perlaza, S.M., Fawaz, N., Lasaulce, S., Debbah, M.","34870358700;24466607500;8576012300;35588784300;","From spectrum pooling to space Pooling: Opportunistic interference alignment in MIMO cognitive networks",2010,"IEEE Transactions on Signal Processing","58","7","5433000","3728","3741",,148,"10.1109/TSP.2010.2046084","https://www.scopus.com/inward/record.uri?eid=2-s2.0-77953740462&doi=10.1109%2fTSP.2010.2046084&partnerID=40&md5=3c9613610d8582018f3596790ea2e31d",Article,"Final","All Open Access, Green",Scopus,2-s2.0-77953740462
"Le Treust, M., Lasaulce, S., Debbah, M.","36162522000;8576012300;35588784300;","Implicit cooperation in distributed energy-efficient networks",2010,"Final Program and Abstract Book - 4th International Symposium on Communications, Control, and Signal Processing, ISCCSP 2010",,,"5463435","","",,4,"10.1109/ISCCSP.2010.5463435","https://www.scopus.com/inward/record.uri?eid=2-s2.0-77953816958&doi=10.1109%2fISCCSP.2010.5463435&partnerID=40&md5=2c540e3daa4e4034426223aa68a8959a",Conference Paper,"Final","All Open Access, Green",Scopus,2-s2.0-77953816958
"Ramanath, S., Debbah, M., Altman, E., Kumar, V.","35365089400;35588784300;10142984200;57203774482;","Asymptotic analysis of precoded small cell networks",2010,"Proceedings - IEEE INFOCOM",,,"5461990","","",,5,"10.1109/INFCOM.2010.5461990","https://www.scopus.com/inward/record.uri?eid=2-s2.0-77953309269&doi=10.1109%2fINFCOM.2010.5461990&partnerID=40&md5=b0242412bc0b990154926e21a0d158f8",Conference Paper,"Final","All Open Access, Green",Scopus,2-s2.0-77953309269
"Silva, A., Altman, E., Debbah, M., Alfano, G.","25652226800;10142984200;35588784300;35917460200;","Magnetworks: How mobility impacts the design of mobile ad hoc networks",2010,"Proceedings - IEEE INFOCOM",,,"5461992","","",,3,"10.1109/INFCOM.2010.5461992","https://www.scopus.com/inward/record.uri?eid=2-s2.0-77953305417&doi=10.1109%2fINFCOM.2010.5461992&partnerID=40&md5=98de7aed70ad78e86170ba51acd4d299",Conference Paper,"Final","All Open Access, Green",Scopus,2-s2.0-77953305417
"Silva, A., Altman, E., Bernhard, P., Debbah, M.","25652226800;10142984200;56243071400;35588784300;","Continuum equilibria and global optimization for routing in dense static ad hoc networks",2010,"Computer Networks","54","6",,"1005","1018",,6,"10.1016/j.comnet.2009.10.019","https://www.scopus.com/inward/record.uri?eid=2-s2.0-77949875879&doi=10.1016%2fj.comnet.2009.10.019&partnerID=40&md5=2b781cc8c7d47d4dc78d5f9ce179b2a6",Article,"Final","All Open Access, Green",Scopus,2-s2.0-77949875879
"Bhatnagar, M.R., Hjørungnes, A., Debbah, M.","15833947700;6701708893;35588784300;","Delay-tolerant decode-and-forward based cooperative communication over Ricean channels",2010,"IEEE Transactions on Wireless Communications","9","4","5441346","1277","1282",,26,"10.1109/TWC.2010.04.090343","https://www.scopus.com/inward/record.uri?eid=2-s2.0-77951289113&doi=10.1109%2fTWC.2010.04.090343&partnerID=40&md5=22929a674b7c5a9d7b2253ddf0810b6f",Article,"Final","All Open Access, Green",Scopus,2-s2.0-77951289113
"Cottatellucci, L., Müller, R.R., Debbah, M.","6602211855;7404245964;35588784300;","Asynchronous CDMA systems with random spreadingpart II: Design criteria",2010,"IEEE Transactions on Information Theory","56","4","5437421","1498","1520",,14,"10.1109/TIT.2010.2040898","https://www.scopus.com/inward/record.uri?eid=2-s2.0-77950252239&doi=10.1109%2fTIT.2010.2040898&partnerID=40&md5=261cf11940e4828831b8ca94c8d15e49",Article,"Final","All Open Access, Green",Scopus,2-s2.0-77950252239
"Cottatellucci, L., Müller, R.R., Debbah, M.","6602211855;7404245964;35588784300;","Asynchronous CDMA systems with random spreadingpart I: Fundamental limits",2010,"IEEE Transactions on Information Theory","56","4","5437424","1477","1497",,25,"10.1109/TIT.2010.2040890","https://www.scopus.com/inward/record.uri?eid=2-s2.0-77950247351&doi=10.1109%2fTIT.2010.2040890&partnerID=40&md5=b5f2f784226550e047c2f4d0bc40bd50",Article,"Final","All Open Access, Green",Scopus,2-s2.0-77950247351
"Silva, A., Tembine, H., Altman, E., Debbah, M.","25652226800;24339583100;10142984200;35588784300;","Spatial games and global optimization for the mobile association problem: The downlink case",2010,"Proceedings of the IEEE Conference on Decision and Control",,,"5717550","966","972",,4,"10.1109/CDC.2010.5717550","https://www.scopus.com/inward/record.uri?eid=2-s2.0-79953139062&doi=10.1109%2fCDC.2010.5717550&partnerID=40&md5=26be0c7c24de8114601757d1aaf28628",Conference Paper,"Final","All Open Access, Green",Scopus,2-s2.0-79953139062
"Hoydis, J., Najim, J., Couillet, R., Debbah, M.","24724343000;56028410200;34869367400;35588784300;","Fluctuations of the mutual information in large distributed antenna systems with colored noise",2010,"2010 48th Annual Allerton Conference on Communication, Control, and Computing, Allerton 2010",,,"5706913","240","245",,5,"10.1109/ALLERTON.2010.5706913","https://www.scopus.com/inward/record.uri?eid=2-s2.0-79952399931&doi=10.1109%2fALLERTON.2010.5706913&partnerID=40&md5=bb5c49d0dec733c4f6b089c2446084b3",Conference Paper,"Final","All Open Access, Green",Scopus,2-s2.0-79952399931
"Bianchi, P., Debbah, M., Najim, J.","55621886200;35588784300;56028410200;","Asymptotic independence in the spectrum of the gaussian unitary ensemble",2010,"Electronic Communications in Probability","15",,,"376","395",,7,"10.1214/ECP.v15-1568","https://www.scopus.com/inward/record.uri?eid=2-s2.0-78650429316&doi=10.1214%2fECP.v15-1568&partnerID=40&md5=6aa9dc789a4a0c3bb0651e3c6b7fc1ae",Article,"Final","All Open Access, Gold, Green",Scopus,2-s2.0-78650429316
"Bianchi, P., Najim, J., Maida, M., Debbah, M.","55621886200;56028410200;8256377800;35588784300;","Performance analysis of some eigen-based hypothesis tests for collaborative sensing",2009,"IEEE Workshop on Statistical Signal Processing Proceedings",,,"5278654","5","8",,30,"10.1109/SSP.2009.5278654","https://www.scopus.com/inward/record.uri?eid=2-s2.0-72349092266&doi=10.1109%2fSSP.2009.5278654&partnerID=40&md5=d570231e4ee50fb1577acaf331d0922e",Conference Paper,"Final","All Open Access, Green",Scopus,2-s2.0-72349092266
"Couillet, R., Debbah, M.","34869367400;35588784300;","Outage performance of flexible OFDM schemes in packet-switched transmissions",2009,"Eurasip Journal on Advances in Signal Processing","2009",,"698417","","",,,"10.1155/2009/698417","https://www.scopus.com/inward/record.uri?eid=2-s2.0-71149104031&doi=10.1155%2f2009%2f698417&partnerID=40&md5=1bfa355d158cc09cb520e9a2d3f6b6c1",Article,"Final","All Open Access, Gold, Green",Scopus,2-s2.0-71149104031
"Bianchi, P., Najim, J., Alfano, G., Debbah, M.","55621886200;56028410200;35917460200;35588784300;","Asymptotics of eigenbased collaborative sensing",2009,"2009 IEEE Information Theory Workshop, ITW 2009",,,"5351479","515","519",,21,"10.1109/ITW.2009.5351479","https://www.scopus.com/inward/record.uri?eid=2-s2.0-76249106400&doi=10.1109%2fITW.2009.5351479&partnerID=40&md5=05db1ddad7008d31c105579b06910644",Conference Paper,"Final","",Scopus,2-s2.0-76249106400
"Couillet, R., Debbah, M.","34869367400;35588784300;","Uplink capacity of self-organizing clustered orthogonal CDMA networks in flat fading channels",2009,"2009 IEEE Information Theory Workshop, ITW 2009",,,"5351213","605","609",,4,"10.1109/ITW.2009.5351213","https://www.scopus.com/inward/record.uri?eid=2-s2.0-76249099254&doi=10.1109%2fITW.2009.5351213&partnerID=40&md5=76a2e3ae7d3656f19654d7c5ed3f0863",Conference Paper,"Final","All Open Access, Green",Scopus,2-s2.0-76249099254
"Couillet, R., Debbah, M., Silverstein, J.W.","34869367400;35588784300;7102739530;","Asymptotic capacity of multi-user MIMO communications",2009,"2009 IEEE Information Theory Workshop, ITW 2009",,,"5351274","16","20",,6,"10.1109/ITW.2009.5351274","https://www.scopus.com/inward/record.uri?eid=2-s2.0-76249095407&doi=10.1109%2fITW.2009.5351274&partnerID=40&md5=1909551c5b7f6e948e10a50af28f9d9f",Conference Paper,"Final","All Open Access, Green",Scopus,2-s2.0-76249095407
"Altman, E., Avrachenkov, K., Cottatellucci, L., Debbah, M., He, G., Suarez, A.","10142984200;35583036400;6602211855;35588784300;24773259800;56016220600;","Operating point selection in multiple access rate regions",2009,"21st International Teletraffic Congress, ITC 21: Traffic and Performance Issues in Networks of the Future - Final Programme",,,"5300242","","",,5,,"https://www.scopus.com/inward/record.uri?eid=2-s2.0-70649102338&partnerID=40&md5=8304586ffc5b9dad957566696dcf2bf7",Conference Paper,"Final","",Scopus,2-s2.0-70649102338
"Bennis, M., Debbah, M., Lasaulce, S., Anpalagan, A.","23007914800;35588784300;8576012300;6603667268;","A hierarchical game approach to inter-operator spectrum sharing",2009,"GLOBECOM - IEEE Global Telecommunications Conference",,,"5426023","","",,8,"10.1109/GLOCOM.2009.5426023","https://www.scopus.com/inward/record.uri?eid=2-s2.0-77951547060&doi=10.1109%2fGLOCOM.2009.5426023&partnerID=40&md5=5d4d2e9c277b08dbdd6a7f41e091548b",Conference Paper,"Final","",Scopus,2-s2.0-77951547060
"Han, Z., Marina, N., Debbah, M., Hjørungnes, A.","55767186700;24921801900;35588784300;6701708893;","Improved wireless secrecy rate using distributed auction theory",2009,"MSN 2009 - 5th International Conference on Mobile Ad-hoc and Sensor Networks",,,"5401476","442","447",,19,"10.1109/MSN.2009.73","https://www.scopus.com/inward/record.uri?eid=2-s2.0-77949945136&doi=10.1109%2fMSN.2009.73&partnerID=40&md5=15db6220e931808cf34d14b79d53f7d5",Conference Paper,"Final","",Scopus,2-s2.0-77949945136
"Guillaud, M., Debbah, M.","23008167000;35588784300;","Soft Channel Information for Wireless Communications",2009,"2nd International Symposium on Applied Sciences in Biomedical and Communication Technologies, ISABEL 2009",,,"5373631","","",,,"10.1109/ISABEL.2009.5373631","https://www.scopus.com/inward/record.uri?eid=2-s2.0-77949475085&doi=10.1109%2fISABEL.2009.5373631&partnerID=40&md5=f951bedc9a063cfb91b47b0c1dd3bb1c",Conference Paper,"Final","",Scopus,2-s2.0-77949475085
"Han, Z., Marina, N., Debbah, M., Hjørungnes, A.","55767186700;24921801900;35588784300;6701708893;","Physical layer security game: Interaction between source, eavesdropper, and friendly jammer",2009,"Eurasip Journal on Wireless Communications and Networking","2009",,"452907","","",,94,"10.1155/2009/452907","https://www.scopus.com/inward/record.uri?eid=2-s2.0-76649135514&doi=10.1155%2f2009%2f452907&partnerID=40&md5=3f64306db53e048db18a095886991e53",Article,"Final","All Open Access, Gold, Green",Scopus,2-s2.0-76649135514
"Di Renzo, M., Debbah, M.","16174747800;35588784300;","Wireless physical-layer security: The challenges ahead",2009,"ATC 2009 - Proceedings of the 2009 International Conference on Advanced Technologies for Communications",,,"5349370","313","316",,19,"10.1109/ATC.2009.5349370","https://www.scopus.com/inward/record.uri?eid=2-s2.0-74549186525&doi=10.1109%2fATC.2009.5349370&partnerID=40&md5=f9b22e8925fc49e7d397891c5b3668e2",Conference Paper,"Final","",Scopus,2-s2.0-74549186525
"Silva, A., Reyes, P., Debbah, M.","25652226800;35093186400;35588784300;","Congestion in randomly deployed wireless ad-hoc and sensor networks",2009,"2009 International Conference on Ultra Modern Telecommunications and Workshops",,,"5345632","","",,4,"10.1109/ICUMT.2009.5345632","https://www.scopus.com/inward/record.uri?eid=2-s2.0-74549170638&doi=10.1109%2fICUMT.2009.5345632&partnerID=40&md5=ad897430d58cf16666542a84d86458dc",Conference Paper,"Final","All Open Access, Green",Scopus,2-s2.0-74549170638
"Ramanath, S., Altman, E., Kumar, V., Debbah, M.","35365089400;10142984200;57203774482;35588784300;","Optimizing cell size in pico-cell networks",2009,"Final Proceedings of the 2009 7th International Symposium on Modeling and Optimization in Mobile, Ad Hoc and Wireless Networks, WiOpt 2009",,,"5291586","","",,12,"10.4108/ICST.WIOPT2009.6353","https://www.scopus.com/inward/record.uri?eid=2-s2.0-74349115260&doi=10.4108%2fICST.WIOPT2009.6353&partnerID=40&md5=ac81c70984895f35edba4bdd6d8373bd",Conference Paper,"Final","",Scopus,2-s2.0-74349115260
"Saad, W., Han, Z., Başar, T., Debbah, M., Hjørungnes, A.","57203259001;55767186700;7102588845;35588784300;6701708893;","Physical layer security: Coalitional games for distributed cooperation",2009,"Final Proceedings of the 2009 7th International Symposium on Modeling and Optimization in Mobile, Ad Hoc and Wireless Networks, WiOpt 2009",,,"5291619","","",,44,"10.4108/ICST.WIOPT2009.6322","https://www.scopus.com/inward/record.uri?eid=2-s2.0-74349094229&doi=10.4108%2fICST.WIOPT2009.6322&partnerID=40&md5=d73d5fe7bf12696dbca71bafa72dcd50",Conference Paper,"Final","",Scopus,2-s2.0-74349094229
"Bennis, M., Lasaulce, S., Debbah, M.","23007914800;8576012300;35588784300;","Inter-operator spectrum sharing from a game theoretical perspective",2009,"Eurasip Journal on Advances in Signal Processing","2009",,"295739","","",,26,"10.1155/2009/295739","https://www.scopus.com/inward/record.uri?eid=2-s2.0-70449586975&doi=10.1155%2f2009%2f295739&partnerID=40&md5=d21e82e711fdeade37c9509b13056ea6",Article,"Final","All Open Access, Gold, Green",Scopus,2-s2.0-70449586975
"Khan, B.H., Debbah, M., Ryan, O., Ai-Naffouri, T.Y.","55935257700;35588784300;17435860400;6701750932;","Estimation of the distribution of randomly deployed wireless sensors",2009,"IEEE International Symposium on Information Theory - Proceedings",,,"5206022","2413","2417",,,"10.1109/ISIT.2009.5206022","https://www.scopus.com/inward/record.uri?eid=2-s2.0-70449515643&doi=10.1109%2fISIT.2009.5206022&partnerID=40&md5=56e9c8b6e40990d87712e6f6abb0e270",Conference Paper,"Final","All Open Access, Green",Scopus,2-s2.0-70449515643
"Kobayashi, M., Liang, Y., Shamai, S., Debbah, M.","55574980900;16068942200;35564142000;35588784300;","On the compound MIMO broadcast channels with confidential messages",2009,"IEEE International Symposium on Information Theory - Proceedings",,,"5205953","1283","1287",,32,"10.1109/ISIT.2009.5205953","https://www.scopus.com/inward/record.uri?eid=2-s2.0-70449513409&doi=10.1109%2fISIT.2009.5205953&partnerID=40&md5=3982da3f26dfc3ea0425e1b1b2f4fcc9",Conference Paper,"Final","All Open Access, Green",Scopus,2-s2.0-70449513409
"Kobayashi, M., Debbah, M., Belfiore, J.-C.","55574980900;35588784300;6701809765;","Outage efficient strategies for network MIMO with partial CSIT",2009,"IEEE International Symposium on Information Theory - Proceedings",,,"5206071","249","253",,40,"10.1109/ISIT.2009.5206071","https://www.scopus.com/inward/record.uri?eid=2-s2.0-70449482020&doi=10.1109%2fISIT.2009.5206071&partnerID=40&md5=c61ce5f7af9dacfead31518a89485a31",Conference Paper,"Final","All Open Access, Green",Scopus,2-s2.0-70449482020
"Bhatnagar, M.R., Hjørungnes, A., Debbah, M.","15833947700;6701708893;35588784300;","A simple scheme for delay-tolerant decode-and-forward based cooperative communication",2009,"IEEE International Symposium on Information Theory - Proceedings",,,"5205719","498","502",,10,"10.1109/ISIT.2009.5205719","https://www.scopus.com/inward/record.uri?eid=2-s2.0-70449463476&doi=10.1109%2fISIT.2009.5205719&partnerID=40&md5=67bde12ef5b1ac017f76be747bc66111",Conference Paper,"Final","All Open Access, Green",Scopus,2-s2.0-70449463476
"Saad, W., Han, Z., Debbah, M., Hjørungnes, A., Başar, T.","57203259001;55767186700;35588784300;6701708893;7102588845;","A game-based self-organizing uplink tree for VoIP services in IEEE 802.16j networks",2009,"IEEE International Conference on Communications",,,"5198608","","",,18,"10.1109/ICC.2009.5198608","https://www.scopus.com/inward/record.uri?eid=2-s2.0-70449462120&doi=10.1109%2fICC.2009.5198608&partnerID=40&md5=a1947f576b050b8f450266da081c3e71",Conference Paper,"Final","All Open Access, Green",Scopus,2-s2.0-70449462120
"Perlaza, S.M., Debbah, M., Lasaulce, S., Bogucka, H.","34870358700;35588784300;8576012300;6603404274;","On the benefits of bandwidth limiting in decentralized vector multiple access channels",2009,"Proceedings of the 2009 4th International Conference on Cognitive Radio Oriented Wireless Networks and Communications, CROWNCOM 2009",,,"5189064","","",,11,"10.1109/CROWNCOM.2009.5189064","https://www.scopus.com/inward/record.uri?eid=2-s2.0-70449393272&doi=10.1109%2fCROWNCOM.2009.5189064&partnerID=40&md5=56a11d6b40505b5b95bd6025886dea3f",Conference Paper,"Final","All Open Access, Green",Scopus,2-s2.0-70449393272
"Saad, W., Han, Z., Başar, T., Debbah, M., Hjørungnes, A.","57203259001;55767186700;7102588845;35588784300;6701708893;","A selfish approach to coalition formation among unmanned air vehicles in wireless networks",2009,"Proceedings of the 2009 International Conference on Game Theory for Networks, GameNets '09",,,"5137409","259","267",,49,"10.1109/GAMENETS.2009.5137409","https://www.scopus.com/inward/record.uri?eid=2-s2.0-70349999022&doi=10.1109%2fGAMENETS.2009.5137409&partnerID=40&md5=14d61447af4b4f293e2a4d90d857b872",Conference Paper,"Final","All Open Access, Green",Scopus,2-s2.0-70349999022
"Bennis, M., Le Treus, M., Lasaulce, S., Debbah, M., Lilleberg, J.","23007914800;35094242400;8576012300;35588784300;7004160057;","Spectrum sharing games on the interference channel",2009,"Proceedings of the 2009 International Conference on Game Theory for Networks, GameNets '09",,,"5137440","515","522",,19,"10.1109/GAMENETS.2009.5137440","https://www.scopus.com/inward/record.uri?eid=2-s2.0-70349994406&doi=10.1109%2fGAMENETS.2009.5137440&partnerID=40&md5=5bf2fdc129b4e331203e104d4da72df1",Conference Paper,"Final","All Open Access, Green",Scopus,2-s2.0-70349994406
"Han, Z., Marina, N., Debbah, M., Hjørungnes, A.","55767186700;24921801900;35588784300;6701708893;","Physical layer security game: How to date a girl with her boyfriend on the same table",2009,"Proceedings of the 2009 International Conference on Game Theory for Networks, GameNets '09",,,"5137412","287","294",,60,"10.1109/GAMENETS.2009.5137412","https://www.scopus.com/inward/record.uri?eid=2-s2.0-70349991516&doi=10.1109%2fGAMENETS.2009.5137412&partnerID=40&md5=bfa7db8fc57a41569acd8aae10ec932e",Conference Paper,"Final","All Open Access, Green",Scopus,2-s2.0-70349991516
