作者,作者 ID,标题,年份,来源出版物名称,卷,期,论文编号,起始页码,结束页码,页码计数,施引文献,DOI,链接,文献类型,出版阶段,开放获取,来源出版物,EID
"Li, G.","55800543300;","A human-machine method for web table understanding",2013,"Lecture Notes in Computer Science (including subseries Lecture Notes in Artificial Intelligence and Lecture Notes in Bioinformatics)","7923 LNCS",,,"179","189",,4,"10.1007/978-3-642-38562-9_19","https://www.scopus.com/inward/record.uri?eid=2-s2.0-84879996693&doi=10.1007%2f978-3-642-38562-9_19&partnerID=40&md5=b79d96205707e26de972922bef040e40",Conference Paper,"Final","",Scopus,2-s2.0-84879996693
"Ma, D., Feng, J., Li, G.","42262164800;7403884576;55800543300;","A positional access method for relational databases",2012,"ACM International Conference Proceeding Series",,,,"2164","2168",,,"10.1145/2396761.2398594","https://www.scopus.com/inward/record.uri?eid=2-s2.0-84871100465&doi=10.1145%2f2396761.2398594&partnerID=40&md5=76a0847916256014363a1ba3b37040a5",Conference Paper,"Final","",Scopus,2-s2.0-84871100465
"Zhong, R., Fan, J., Li, G., Tan, K.-L., Zhou, L.","57612511500;36157705800;55800543300;7403999714;7404126550;","Location-aware instant search",2012,"ACM International Conference Proceeding Series",,,,"385","394",,21,"10.1145/2396761.2396812","https://www.scopus.com/inward/record.uri?eid=2-s2.0-84871096040&doi=10.1145%2f2396761.2396812&partnerID=40&md5=060bd38cf0528b58ba520d0ee096c1a5",Conference Paper,"Final","All Open Access, Green",Scopus,2-s2.0-84871096040
"Liu, S., Li, G., Feng, J.","55522564600;55800543300;7403884576;","Star-Join: Spatio-textual similarity join",2012,"ACM International Conference Proceeding Series",,,,"2194","2198",,17,"10.1145/2396761.2398600","https://www.scopus.com/inward/record.uri?eid=2-s2.0-84871062513&doi=10.1145%2f2396761.2398600&partnerID=40&md5=43afeca7247684b9b222e43dd563aad9",Conference Paper,"Final","",Scopus,2-s2.0-84871062513
"Li, G., Xu, J., Feng, J.","55800543300;7407003499;7403884576;","Keyword-based k-nearest neighbor search in spatial databases",2012,"ACM International Conference Proceeding Series",,,,"2144","2148",,11,"10.1145/2396761.2398590","https://www.scopus.com/inward/record.uri?eid=2-s2.0-84871053734&doi=10.1145%2f2396761.2398590&partnerID=40&md5=23f3c4ef22229c684aa08feca42ac9fa",Conference Paper,"Final","",Scopus,2-s2.0-84871053734
"Ni, J., Li, G., Zhang, J., Li, L., Feng, J.","55522197800;55800543300;23391507000;57149001300;7403884576;","Adapt: Adaptive database schema design for multi-tenant applications",2012,"ACM International Conference Proceeding Series",,,,"2199","2203",,7,"10.1145/2396761.2398601","https://www.scopus.com/inward/record.uri?eid=2-s2.0-84871052652&doi=10.1145%2f2396761.2398601&partnerID=40&md5=43e493734f58f6813524d1488493877b",Conference Paper,"Final","",Scopus,2-s2.0-84871052652
"Huang, W., Li, G., Tan, K.-L., Feng, J.","57221075922;55800543300;7403999714;7403884576;","Efficient safe-region construction for moving top-K spatial keyword queries",2012,"ACM International Conference Proceeding Series",,,,"932","941",,55,"10.1145/2396761.2396879","https://www.scopus.com/inward/record.uri?eid=2-s2.0-84871032996&doi=10.1145%2f2396761.2396879&partnerID=40&md5=2995377025f85b1decd7f94b3ea14239",Conference Paper,"Final","",Scopus,2-s2.0-84871032996
"Hu, J., Fan, J., Li, G.-L., Chen, S.-S.","57198193977;36157705800;55800543300;55311483500;","Top-k fuzzy spatial keyword search",2012,"Jisuanji Xuebao/Chinese Journal of Computers","35","11",,"2237","2246",,12,"10.3724/SP.J.1016.2012.02237","https://www.scopus.com/inward/record.uri?eid=2-s2.0-84869136330&doi=10.3724%2fSP.J.1016.2012.02237&partnerID=40&md5=5f2c5dcf28c8a80784556c6fb135ea04",Article,"Final","",Scopus,2-s2.0-84869136330
"Li, G., Wang, J., Li, C., Feng, J.","55800543300;38863309000;25928586200;7403884576;","Supporting efficient top-k queries in type-ahead search",2012,"SIGIR'12 - Proceedings of the International ACM SIGIR Conference on Research and Development in Information Retrieval",,,,"355","364",,25,"10.1145/2348283.2348333","https://www.scopus.com/inward/record.uri?eid=2-s2.0-84866606636&doi=10.1145%2f2348283.2348333&partnerID=40&md5=4bda5843543dff146fd77e20d2c9fcb5",Conference Paper,"Final","",Scopus,2-s2.0-84866606636
"Feng, J., Wang, J., Li, G.","7403884576;38863309000;55800543300;","Trie-join: A trie-based method for efficient string similarity joins",2012,"VLDB Journal","21","4",,"437","461",,54,"10.1007/s00778-011-0252-8","https://www.scopus.com/inward/record.uri?eid=2-s2.0-84864286297&doi=10.1007%2fs00778-011-0252-8&partnerID=40&md5=f901f88aca9ff8906a4e9a3c3dcc8484",Article,"Final","All Open Access, Green",Scopus,2-s2.0-84864286297
"Li, G., Feng, J., Xu, J.","55800543300;7403884576;7407003499;","DESKS: Direction-aware spatial keyword search",2012,"Proceedings - International Conference on Data Engineering",,,"6228107","474","485",,101,"10.1109/ICDE.2012.93","https://www.scopus.com/inward/record.uri?eid=2-s2.0-84864258923&doi=10.1109%2fICDE.2012.93&partnerID=40&md5=703ff4ff59a2702f8a719dfb944867ee",Conference Paper,"Final","All Open Access, Green",Scopus,2-s2.0-84864258923
"Deng, D., Li, G., Feng, J.","15046502500;55800543300;7403884576;","An efficient trie-based method for approximate entity extraction with edit-distance constraints",2012,"Proceedings - International Conference on Data Engineering",,,"6228131","762","773",,18,"10.1109/ICDE.2012.29","https://www.scopus.com/inward/record.uri?eid=2-s2.0-84864183929&doi=10.1109%2fICDE.2012.29&partnerID=40&md5=9a8e5bc52f3dfe1d5188c01c7d67b82a",Conference Paper,"Final","All Open Access, Green",Scopus,2-s2.0-84864183929
"Wang, J., Li, G., Feng, J.","38863309000;55800543300;7403884576;","Can we beat the prefix filtering? An adaptive framework for similarity join and search",2012,"Proceedings of the ACM SIGMOD International Conference on Management of Data",,,,"85","96",,175,"10.1145/2213836.2213847","https://www.scopus.com/inward/record.uri?eid=2-s2.0-84862702293&doi=10.1145%2f2213836.2213847&partnerID=40&md5=e7fc499a8ef30859fd528b592a08f5c5",Conference Paper,"Final","",Scopus,2-s2.0-84862702293
"Feng, J., Li, G.","7403884576;55800543300;","Efficient fuzzy type-ahead search in XML data",2012,"IEEE Transactions on Knowledge and Data Engineering","24","5","5677525","882","895",,21,"10.1109/TKDE.2010.264","https://www.scopus.com/inward/record.uri?eid=2-s2.0-84859722963&doi=10.1109%2fTKDE.2010.264&partnerID=40&md5=354182970b19ed0292c2d4b0f50bb13f",Article,"Final","All Open Access, Green",Scopus,2-s2.0-84859722963
"Wang, T., Li, G., Feng, J.","56537131900;55800543300;7403884576;","Efficient algorithms for top-k keyword queries on spatial databases",2011,"Proceedings - IEEE International Conference on Mobile Data Management","1",,"6068448","285","286",,6,"10.1109/MDM.2011.58","https://www.scopus.com/inward/record.uri?eid=2-s2.0-82055172321&doi=10.1109%2fMDM.2011.58&partnerID=40&md5=be56f3983529352fd40630d7daa141bf",Conference Paper,"Final","",Scopus,2-s2.0-82055172321
"Li, G., Feng, J., Wang, J., Zhou, L.","55800543300;7403884576;57208873256;7404126550;","KEMB: A keyword-based XML message broker",2011,"IEEE Transactions on Knowledge and Data Engineering","23","7","5567098","1035","1049",,4,"10.1109/TKDE.2010.159","https://www.scopus.com/inward/record.uri?eid=2-s2.0-80155136985&doi=10.1109%2fTKDE.2010.159&partnerID=40&md5=72e79af058155d57875fef19dd04e861",Article,"Final","",Scopus,2-s2.0-80155136985
"Feng, J., Li, G., Wang, J.","7403884576;55800543300;57208873256;","Finding top-k answers in keyword search over relational databases using tuple units",2011,"IEEE Transactions on Knowledge and Data Engineering","23","12","5728810","1781","1794",,31,"10.1109/TKDE.2011.61","https://www.scopus.com/inward/record.uri?eid=2-s2.0-80054917208&doi=10.1109%2fTKDE.2011.61&partnerID=40&md5=5e6e22f4b29edfd57c8ddc0133f50efa",Review,"Final","All Open Access, Green",Scopus,2-s2.0-80054917208
"Li, G., Fan, J., Wu, H., Wang, J., Feng, J.","55800543300;36157705800;13102899600;38863309000;7403884576;","DBease: Making databases user-friendly and easily accessible",2011,"CIDR 2011 - 5th Biennial Conference on Innovative Data Systems Research, Conference Proceedings",,,,"45","56",,7,,"https://www.scopus.com/inward/record.uri?eid=2-s2.0-80053550848&partnerID=40&md5=af2457e22d2c245ebd108847c5987c3b",Conference Paper,"Final","",Scopus,2-s2.0-80053550848
"Li, G., Ji, S., Li, C., Feng, J.","55800543300;22035096000;25928586200;7403884576;","Efficient fuzzy full-text type-ahead search",2011,"VLDB Journal","20","4",,"617","640",,42,"10.1007/s00778-011-0218-x","https://www.scopus.com/inward/record.uri?eid=2-s2.0-79960467518&doi=10.1007%2fs00778-011-0218-x&partnerID=40&md5=6e61ff0f1f4d6392a8dd2c4d67a02cfa",Article,"Final","All Open Access, Green",Scopus,2-s2.0-79960467518
"Ma, D., Feng, J., Li, G.","42262164800;7403884576;55800543300;","LazyFTL: A page-level flash translation layer optimized for NAND flash memory",2011,"Proceedings of the ACM SIGMOD International Conference on Management of Data",,,,"1","12",,74,"10.1145/1989323.1989325","https://www.scopus.com/inward/record.uri?eid=2-s2.0-79959929003&doi=10.1145%2f1989323.1989325&partnerID=40&md5=65e734378297d0551463be8b601df47b",Conference Paper,"Final","",Scopus,2-s2.0-79959929003
"Li, G., Deng, D., Feng, J.","55800543300;15046502500;7403884576;","Faerie: Efficient filtering algorithms for approximate dictionary-based entity extraction",2011,"Proceedings of the ACM SIGMOD International Conference on Management of Data",,,,"529","540",,34,"10.1145/1989323.1989379","https://www.scopus.com/inward/record.uri?eid=2-s2.0-79959922359&doi=10.1145%2f1989323.1989379&partnerID=40&md5=f808786a824d648432208fe3fba5d295",Conference Paper,"Final","",Scopus,2-s2.0-79959922359
"Fan, J., Li, G., Zhou, L.","36157705800;55800543300;7404126550;","Interactive SQL query suggestion: Making databases user-friendly",2011,"Proceedings - International Conference on Data Engineering",,,"5767843","351","362",,37,"10.1109/ICDE.2011.5767843","https://www.scopus.com/inward/record.uri?eid=2-s2.0-79957868733&doi=10.1109%2fICDE.2011.5767843&partnerID=40&md5=2f867cfeea2b681988b8008e5a554c8f",Conference Paper,"Final","All Open Access, Green",Scopus,2-s2.0-79957868733
"Wang, J., Li, G., Fe, J.","38863309000;55800543300;38861420300;","Fast-join: An efficient method for fuzzy token matching based string similarity join",2011,"Proceedings - International Conference on Data Engineering",,,"5767865","458","469",,105,"10.1109/ICDE.2011.5767865","https://www.scopus.com/inward/record.uri?eid=2-s2.0-79957824788&doi=10.1109%2fICDE.2011.5767865&partnerID=40&md5=78192880af5c851ae0bb7b75e14a415d",Conference Paper,"Final","All Open Access, Green",Scopus,2-s2.0-79957824788
"Fan, J., Li, G., Zhou, L.","36157705800;55800543300;7404126550;","An effective approach for searching closest sentence translations from the web",2011,"Lecture Notes in Computer Science (including subseries Lecture Notes in Artificial Intelligence and Lecture Notes in Bioinformatics)","6588 LNCS","PART 2",,"47","57",,,"10.1007/978-3-642-20152-3_4","https://www.scopus.com/inward/record.uri?eid=2-s2.0-79955097548&doi=10.1007%2f978-3-642-20152-3_4&partnerID=40&md5=0629af96e1358e4c8e94ef98336cd5e4",Conference Paper,"Final","",Scopus,2-s2.0-79955097548
"Li, G., Feng, J., Chin Ooi, B., Wang, J., Zhou, L.","55800543300;7403884576;55665418900;57208873256;7404126550;","An effective 3-in-1 keyword search method over heterogeneous data sources",2011,"Information Systems","36","2",,"248","266",,12,"10.1016/j.is.2008.08.001","https://www.scopus.com/inward/record.uri?eid=2-s2.0-78649458054&doi=10.1016%2fj.is.2008.08.001&partnerID=40&md5=c1ce802ed18312c3ec8eb1a55532cf9d",Article,"Final","",Scopus,2-s2.0-78649458054
"Li, G., Feng, J., Zhou, X., Wang, J.","55800543300;7403884576;8837009900;57208873256;","Providing built-in keyword search capabilities in RDBMS",2011,"VLDB Journal","20","1",,"1","19",,24,"10.1007/s00778-010-0188-4","https://www.scopus.com/inward/record.uri?eid=2-s2.0-78751582286&doi=10.1007%2fs00778-010-0188-4&partnerID=40&md5=692b2aebc1900bb167f298a5f5542f75",Article,"Final","",Scopus,2-s2.0-78751582286
"Wang, J., Cetindil, I., Ji, S., Li, C., Xie, X., Li, G., Feng, J., Bateman, A.","38863309000;36469868100;22035096000;25928586200;8311948600;55800543300;7403884576;7102456158;","Interactive and fuzzy search: A dynamic way to explore MEDLINE",2011,"Bioinformatics","27","13",,"2321","2327",,,"10.1093/bioinformatics/btq414","https://www.scopus.com/inward/record.uri?eid=2-s2.0-84983167651&doi=10.1093%2fbioinformatics%2fbtq414&partnerID=40&md5=8a9ed8a12a34313a7e0c416b3f9c789e",Conference Paper,"Final","All Open Access, Bronze, Green",Scopus,2-s2.0-84983167651
"Wang, J., Li, G., Yu, J.X., Feng, J.","38863309000;55800543300;57203435589;7403884576;","Entity matching: How similar is similar",2011,"Proceedings of the VLDB Endowment","4","10",,"622","633",,91,"10.14778/2021017.2021020","https://www.scopus.com/inward/record.uri?eid=2-s2.0-84863541462&doi=10.14778%2f2021017.2021020&partnerID=40&md5=5aaa75f36f62a46a6c5984f9f48d83ce",Article,"Final","",Scopus,2-s2.0-84863541462
"Li, G., Deng, D., Wang, J., Feng, J.","55800543300;15046502500;38863309000;7403884576;","Pass-Join: A partitionbased method for similarity joins",2011,"Proceedings of the VLDB Endowment","5","3",,"253","264",,153,"10.14778/2078331.2078340","https://www.scopus.com/inward/record.uri?eid=2-s2.0-84862671407&doi=10.14778%2f2078331.2078340&partnerID=40&md5=78d330e6ddb7603b36c7bd0fd130ccf9",Article,"Final","",Scopus,2-s2.0-84862671407
"Feng, J., Liu, L., Li, G., Li, J., Sun, Y.","7403884576;57199084527;55800543300;55720659600;24470200700;","An efficient parallel Pathstack algorithm for processing XML twig queries on multi-core systems",2010,"Lecture Notes in Computer Science (including subseries Lecture Notes in Artificial Intelligence and Lecture Notes in Bioinformatics)","5981 LNCS","PART 1",,"277","291",,7,"10.1007/978-3-642-12026-8_22","https://www.scopus.com/inward/record.uri?eid=2-s2.0-78650458521&doi=10.1007%2f978-3-642-12026-8_22&partnerID=40&md5=e63deec2237dc8b11e96afd035d555ae",Conference Paper,"Final","",Scopus,2-s2.0-78650458521
"Li, G., Deng, D., Feng, J.","55800543300;15046502500;7403884576;","Extending dictionary-based entity extraction to tolerate errors",2010,"International Conference on Information and Knowledge Management, Proceedings",,,,"1341","1344",,2,"10.1145/1871437.1871616","https://www.scopus.com/inward/record.uri?eid=2-s2.0-78651325679&doi=10.1145%2f1871437.1871616&partnerID=40&md5=80d30922c8ae7ce64459f7c7fda2634e",Conference Paper,"Final","All Open Access, Green",Scopus,2-s2.0-78651325679
"Wang, J., Cetindil, I., Ji, S., Li, C., Xie, X., Li, G., Feng, J.","38863309000;36469868100;22035096000;25928586200;8311948600;55800543300;7403884576;","Interactive and fuzzy search: A dynamic way to explore MEDLINE",2010,"Bioinformatics","26","18","btq414","2321","2327",,18,"10.1093/bioinformatics/btq414","https://www.scopus.com/inward/record.uri?eid=2-s2.0-77956553907&doi=10.1093%2fbioinformatics%2fbtq414&partnerID=40&md5=1186225e07a6391d5ef48164424a15d5",Article,"Final","All Open Access, Bronze, Green",Scopus,2-s2.0-77956553907
"Fan, J., Wu, H., Li, G., Zhou, L.","36157705800;13102899600;55800543300;7404126550;","Suggesting topic-based query terms as you type",2010,"Advances in Web Technologies and Applications - Proceedings of the 12th Asia-Pacific Web Conference, APWeb 2010",,,"5474152","61","67",,19,"10.1109/APWeb.2010.13","https://www.scopus.com/inward/record.uri?eid=2-s2.0-77954265746&doi=10.1109%2fAPWeb.2010.13&partnerID=40&md5=42ccc069b52e5f4ede802e484c06ac9d",Conference Paper,"Final","",Scopus,2-s2.0-77954265746
"Li, G., Ji, S., Li, C., Wang, J., Feng, J.","55800543300;22035096000;25928586200;38863309000;7403884576;","Efficient fuzzy type-ahead search in TASTIER",2010,"Proceedings - International Conference on Data Engineering",,,"5447804","1105","1108",,10,"10.1109/ICDE.2010.5447804","https://www.scopus.com/inward/record.uri?eid=2-s2.0-77952746572&doi=10.1109%2fICDE.2010.5447804&partnerID=40&md5=e241fde562cc28d91c6ed8a9ba4a860e",Conference Paper,"Final","All Open Access, Green",Scopus,2-s2.0-77952746572
"Feng, J., Li, G., Wang, J., Zhou, L.","7403884576;55800543300;57208873256;7404126550;","Finding and ranking compact connected trees for effective keyword proximity search in XML documents",2010,"Information Systems","35","2",,"186","203",,18,"10.1016/j.is.2009.05.004","https://www.scopus.com/inward/record.uri?eid=2-s2.0-70449707743&doi=10.1016%2fj.is.2009.05.004&partnerID=40&md5=df59b25367bd48772763b49108a02bcd",Article,"Final","",Scopus,2-s2.0-70449707743
"Li, G.-L., Feng, J.-H.","55800543300;7403884576;","An effective semantic cache for exploiting Xpath query/view answerability",2010,"Journal of Computer Science and Technology","25","2",,"347","361",,2,"10.1007/s11390-010-9328-y","https://www.scopus.com/inward/record.uri?eid=2-s2.0-77952157922&doi=10.1007%2fs11390-010-9328-y&partnerID=40&md5=f4241cb2d8c805e4ed7d0b11a299e981",Article,"Final","",Scopus,2-s2.0-77952157922
"Wu, H., Li, G., Li, C., Zhouz, L.","13102899600;55800543300;25928586200;55346960900;","Seaform: Search-as-you-type in forms",2010,"Proceedings of the VLDB Endowment","3","2",,"1565","1568",,10,"10.14778/1920841.1921040","https://www.scopus.com/inward/record.uri?eid=2-s2.0-80053487633&doi=10.14778%2f1920841.1921040&partnerID=40&md5=4069f082c79f180e18b3b2567de08c2f",Article,"Final","",Scopus,2-s2.0-80053487633
"Wang, J., Feng, J., Li, G.","38863309000;7403884576;55800543300;","Trie-join: Efficient triebased string similarity joins with editdistance constraints",2010,"Proceedings of the VLDB Endowment","3","1",,"1219","1230",,111,"10.14778/1920841.1920992","https://www.scopus.com/inward/record.uri?eid=2-s2.0-79957822983&doi=10.14778%2f1920841.1920992&partnerID=40&md5=2744082498eacc2666d4072f00ca0df1",Article,"Final","",Scopus,2-s2.0-79957822983
"Wang, J., Li, G., Feng, J., Li, C.","38863309000;55800543300;7403884576;25928586200;","Automatic URL completion and prediction using fuzzy type-ahead search",2009,"Proceedings - 32nd Annual International ACM SIGIR Conference on Research and Development in Information Retrieval, SIGIR 2009",,,,"634","635",,2,"10.1145/1571941.1572052","https://www.scopus.com/inward/record.uri?eid=2-s2.0-72449155122&doi=10.1145%2f1571941.1572052&partnerID=40&md5=06886174c407467903ecf9b6a7dfe4a0",Conference Paper,"Final","All Open Access, Green",Scopus,2-s2.0-72449155122
"Li, G., Ji, S., Li, C., Feng, J.","55800543300;22035096000;25928586200;7403884576;","Efficient type-ahead search on relational data: A TASTIER approach",2009,"SIGMOD-PODS'09 - Proceedings of the International Conference on Management of Data and 28th Symposium on Principles of Database Systems",,,,"695","706",,69,"10.1145/1559845.1559918","https://www.scopus.com/inward/record.uri?eid=2-s2.0-68349143394&doi=10.1145%2f1559845.1559918&partnerID=40&md5=45b9dc9650ee65880e455a6ba5cfe342",Conference Paper,"Final","",Scopus,2-s2.0-68349143394
"Ji, S., Li, G., Li, C., Feng, J.","22035096000;55800543300;25928586200;7403884576;","Efficient interactive fuzzy keyword search",2009,"WWW'09 - Proceedings of the 18th International World Wide Web Conference",,,,"371","380",,136,"10.1145/1526709.1526760","https://www.scopus.com/inward/record.uri?eid=2-s2.0-84865633750&doi=10.1145%2f1526709.1526760&partnerID=40&md5=a2ec68cc05cd82aa3ee17a389b09f53f",Conference Paper,"Final","All Open Access, Green",Scopus,2-s2.0-84865633750
"Li, G., Feng, J., Wang, J.","55800543300;7403884576;57208873256;","Structure-aware indexing for keyword search in databases",2009,"International Conference on Information and Knowledge Management, Proceedings",,,,"1453","1456",,4,"10.1145/1645953.1646143","https://www.scopus.com/inward/record.uri?eid=2-s2.0-74549201606&doi=10.1145%2f1645953.1646143&partnerID=40&md5=bc330e36a1ab51fdb32a26ea47028bf9",Conference Paper,"Final","",Scopus,2-s2.0-74549201606
"Li, G., Feng, J., Zhou, L.","55800543300;7403884576;7404126550;","Interactive search in XML data",2009,"WWW'09 - Proceedings of the 18th International World Wide Web Conference",,,,"1063","1064",,13,"10.1145/1526709.1526857","https://www.scopus.com/inward/record.uri?eid=2-s2.0-70849095150&doi=10.1145%2f1526709.1526857&partnerID=40&md5=fb9bc960453951e676114600b137f7f3",Conference Paper,"Final","",Scopus,2-s2.0-70849095150
"Li, G., Li, C., Feng, J., Zhou, L.","55800543300;25928586200;7403884576;7404126550;","SAIL: Structure-aware indexing for effective and progressive top-k keyword search over XML documents",2009,"Information Sciences","179","21",,"3745","3762",,27,"10.1016/j.ins.2009.06.025","https://www.scopus.com/inward/record.uri?eid=2-s2.0-68349157531&doi=10.1016%2fj.ins.2009.06.025&partnerID=40&md5=15eb3defabe5260e02bdf1d433b318cb",Article,"Final","",Scopus,2-s2.0-68349157531
"Song, X., Li, G., Feng, J., Zhou, L.","13410383900;55800543300;7403884576;7404126550;","Effective fuzzy keyword search over uncertain data",2009,"Lecture Notes in Computer Science (including subseries Lecture Notes in Artificial Intelligence and Lecture Notes in Bioinformatics)","5463",,,"66","70",,2,"10.1007/978-3-642-00887-0_6","https://www.scopus.com/inward/record.uri?eid=2-s2.0-67650149269&doi=10.1007%2f978-3-642-00887-0_6&partnerID=40&md5=bc12372c928e4590000d644d07b2dfa2",Conference Paper,"Final","",Scopus,2-s2.0-67650149269
"Li, G., Zhou, X., Feng, J., Wang, J.","55800543300;8837009900;7403884576;57208873256;","Progressive keyword search in relational databases",2009,"Proceedings - International Conference on Data Engineering",,,"4812496","1183","1186",,35,"10.1109/ICDE.2009.196","https://www.scopus.com/inward/record.uri?eid=2-s2.0-67649671761&doi=10.1109%2fICDE.2009.196&partnerID=40&md5=34df2578878d6541846a0e073a0e2dd9",Conference Paper,"Final","",Scopus,2-s2.0-67649671761
"Hui, M., Jiang, D., Li, G., Zhou, Y.","56236665200;36809260800;55800543300;56164103200;","Supporting database applications as a service",2009,"Proceedings - International Conference on Data Engineering",,,"4812458","832","843",,59,"10.1109/ICDE.2009.82","https://www.scopus.com/inward/record.uri?eid=2-s2.0-67649641447&doi=10.1109%2fICDE.2009.82&partnerID=40&md5=600386368f7b208207f3a06323acfe7b",Conference Paper,"Final","All Open Access, Green",Scopus,2-s2.0-67649641447
"Li, G., Feng, J., Wang, J., Zhou, L.","55800543300;7403884576;57208873256;7404126550;","Incremental sequence-based frequent query pattern mining from XML queries",2009,"Data Mining and Knowledge Discovery","18","3",,"472","516",,2,"10.1007/s10618-009-0126-5","https://www.scopus.com/inward/record.uri?eid=2-s2.0-65049086942&doi=10.1007%2fs10618-009-0126-5&partnerID=40&md5=d8233c717ce8fc80fa7bd108d3a0fcc2",Article,"Final","",Scopus,2-s2.0-65049086942
"Li, G., Feng, J., Zhou, L.","55800543300;7403884576;7404126550;","Keyword Searches in Data-Centric XML Documents Using Tree Partitioning",2009,"Tsinghua Science and Technology","14","1",,"7","18",,2,"10.1016/S1007-0214(09)70002-1","https://www.scopus.com/inward/record.uri?eid=2-s2.0-58649101119&doi=10.1016%2fS1007-0214%2809%2970002-1&partnerID=40&md5=0905be752b06adc1492ce908d23df9b7",Article,"Final","All Open Access, Bronze",Scopus,2-s2.0-58649101119
"Li, G., Feng, J., Wang, J., Lin, F., Zhou, L.","55800543300;7403884576;57208873256;26643159400;7404126550;","Efficient vectorial operators for processing XML twig queries",2008,"Proceeding of the 17th International Conference on World Wide Web 2008, WWW'08",,,,"1037","1038",,1,"10.1145/1367497.1367644","https://www.scopus.com/inward/record.uri?eid=2-s2.0-57349093401&doi=10.1145%2f1367497.1367644&partnerID=40&md5=99b26171dc626319fa0d4921f70565e8",Conference Paper,"Final","",Scopus,2-s2.0-57349093401
"Li, G., Feng, J., Wang, J., Yu, B., He, Y.","55800543300;7403884576;57208873256;55113806500;55498887700;","Race: Finding and ranking compact connected trees for keyword proximity search over xml documents",2008,"Proceeding of the 17th International Conference on World Wide Web 2008, WWW'08",,,,"1045","1046",,16,"10.1145/1367497.1367648","https://www.scopus.com/inward/record.uri?eid=2-s2.0-57349093400&doi=10.1145%2f1367497.1367648&partnerID=40&md5=553aae4ee5bb253c5c842a978710fa73",Conference Paper,"Final","",Scopus,2-s2.0-57349093400
"Li, G., Feng, J., Wang, J., Song, X., Zhou, L.","55800543300;7403884576;57208873256;13410383900;7404126550;","SAILER: An effective search engine for unified retrieval of heterogeneous XML and web documents",2008,"Proceeding of the 17th International Conference on World Wide Web 2008, WWW'08",,,,"1061","1062",,9,"10.1145/1367497.1367656","https://www.scopus.com/inward/record.uri?eid=2-s2.0-57349092085&doi=10.1145%2f1367497.1367656&partnerID=40&md5=fc719555591a01ab1acb8d991d8721a6",Conference Paper,"Final","",Scopus,2-s2.0-57349092085
"Li, G., Ooi, B.C., Feng, J., Wang, J., Zhou, L.","55800543300;55665418900;7403884576;57208873256;7404126550;","EASE: An effective 3-in-1 keyword search method for unstructured, semi-structured and structured data",2008,"Proceedings of the ACM SIGMOD International Conference on Management of Data",,,"1376706","903","914",,328,"10.1145/1376616.1376706","https://www.scopus.com/inward/record.uri?eid=2-s2.0-57149125295&doi=10.1145%2f1376616.1376706&partnerID=40&md5=0154651d8862b5de2d64f5df8076abda",Conference Paper,"Final","",Scopus,2-s2.0-57149125295
"Feng, J.-H., Li, G.-L., Ta, N.","7403884576;55800543300;56371256600;","A semantic cache framework for secure XML queries",2008,"Journal of Computer Science and Technology","23","6",,"988","997",,2,"10.1007/s11390-008-9187-y","https://www.scopus.com/inward/record.uri?eid=2-s2.0-57049135869&doi=10.1007%2fs11390-008-9187-y&partnerID=40&md5=28be6d931c5f3e4f3e58768f26cbf551",Article,"Final","",Scopus,2-s2.0-57049135869
