作者,作者 ID,标题,年份,来源出版物名称,卷,期,论文编号,起始页码,结束页码,页码计数,施引文献,DOI,链接,文献类型,出版阶段,开放获取,来源出版物,EID
"Hughes, T.J.R., Masud, A., Harari, I.","55911870000;7005768447;35587277400;","Numerical assessment of some membrane elements with drilling degrees of freedom",1995,"Computers and Structures","55","2",,"297","314",,32,"10.1016/0045-7949(94)00438-9","https://www.scopus.com/inward/record.uri?eid=2-s2.0-0029287699&doi=10.1016%2f0045-7949%2894%2900438-9&partnerID=40&md5=365bfe05098945d9b0de943f971bba15",Article,"Final","",Scopus,2-s2.0-0029287699
"Tezduyar, T.E., Kawahara, M., Hughes, T.J.R.","35554034900;7202688197;55911870000;","Preface",1995,"International Journal for Numerical Methods in Fluids","21","10",,"iii","iii",,,"10.1002/fld.1650211002","https://www.scopus.com/inward/record.uri?eid=2-s2.0-84984487297&doi=10.1002%2ffld.1650211002&partnerID=40&md5=3dffe2ff635d8b7dd96427058cccd5b3",Editorial,"Final","All Open Access, Bronze",Scopus,2-s2.0-84984487297
"Hughes, T.J.R.","55911870000;","Multiscale phenomena: Green's functions, the Dirichlet-to-Neumann formulation, subgrid scale models, bubbles and the origins of stabilized methods",1995,"Computer Methods in Applied Mechanics and Engineering","127","1-4",,"387","401",,1380,"10.1016/0045-7825(95)00844-9","https://www.scopus.com/inward/record.uri?eid=2-s2.0-0029405472&doi=10.1016%2f0045-7825%2895%2900844-9&partnerID=40&md5=3629dfcb681943c60249524b83f58377",Article,"Final","",Scopus,2-s2.0-0029405472
"Hughes, T.J.R., Masud, A., Harari, I.","55911870000;7005768447;35587277400;","Dynamic analysis and drilling degrees of freedom",1995,"International Journal for Numerical Methods in Engineering","38","19",,"3193","3210",,18,"10.1002/nme.1620381902","https://www.scopus.com/inward/record.uri?eid=2-s2.0-0029394279&doi=10.1002%2fnme.1620381902&partnerID=40&md5=06e3bbf0a46361a37479c166dc469c65",Article,"Final","",Scopus,2-s2.0-0029394279
"Johan, Z., Mathur, K.K., Johnsson, S.L., Hughes, T.J.R.","55886166000;7103223009;7005577253;55911870000;","A case study in parallel computation: Viscous flow around an ONERA M6 wing",1995,"International Journal for Numerical Methods in Fluids","21","10",,"877","884",,20,"10.1002/fld.1650211008","https://www.scopus.com/inward/record.uri?eid=2-s2.0-0029111232&doi=10.1002%2ffld.1650211008&partnerID=40&md5=1968badad2eaaf36c81b375f2c6b8ac8",Article,"Final","",Scopus,2-s2.0-0029111232
"Johan, Z., Mathur, K.K., Johnsson, S.L., Hughes, T.J.R.","55886166000;7103223009;7005577253;55911870000;","Mesh decomposition and communication procedures for finite element applications on the connection machine CM-5 system",1994,"Lecture Notes in Computer Science (including subseries Lecture Notes in Artificial Intelligence and Lecture Notes in Bioinformatics)","797 LNCS",,,"233","240",,3,"10.1007/3-540-57981-8_124","https://www.scopus.com/inward/record.uri?eid=2-s2.0-84914947624&doi=10.1007%2f3-540-57981-8_124&partnerID=40&md5=de0e8efbead31c7102632cc630ceae6a",Conference Paper,"Final","All Open Access, Green",Scopus,2-s2.0-84914947624
"Tezduyar, T.E., Mutsuto, K., Hughes, T.J.R.","35554034900;24285217500;55911870000;","Preface",1994,"Computer Methods in Applied Mechanics and Engineering","112","1-4",,"1","",,,"10.1016/0045-7825(94)90015-9","https://www.scopus.com/inward/record.uri?eid=2-s2.0-43949148557&doi=10.1016%2f0045-7825%2894%2990015-9&partnerID=40&md5=7a09f706888422f8751ca94a79cc80aa",Editorial,"Final","",Scopus,2-s2.0-43949148557
"Johan, Z., Mathur, K.K., Johnsson, S.L., Hughes, T.J.R.","55886166000;7103223009;7005577253;55911870000;","Scalability of finite element applications on distributed-memory parallel computers",1994,"Computer Methods in Applied Mechanics and Engineering","119","1-2",,"61","72",,18,"10.1016/0045-7825(94)00076-X","https://www.scopus.com/inward/record.uri?eid=2-s2.0-0028534256&doi=10.1016%2f0045-7825%2894%2900076-X&partnerID=40&md5=db3b992fb5f036119f79094a1eed1227",Article,"Final","All Open Access, Green",Scopus,2-s2.0-0028534256
"Harari, I., Hughes, T.J.R.","35587277400;55911870000;","Studies of domain‐based formulations for computing exterior problems of acoustics",1994,"International Journal for Numerical Methods in Engineering","37","17",,"2935","2950",,38,"10.1002/nme.1620371706","https://www.scopus.com/inward/record.uri?eid=2-s2.0-0028499154&doi=10.1002%2fnme.1620371706&partnerID=40&md5=90ee72ebffda06706be83e11ad3b3f40",Article,"Final","",Scopus,2-s2.0-0028499154
"Harari, I., Hughes, T.J.R.","35587277400;55911870000;","Stabilized finite element methods for steady advection-diffusion with production",1994,"Computer Methods in Applied Mechanics and Engineering","115","1-2 C",,"165","191",,79,"10.1016/0045-7825(94)90193-7","https://www.scopus.com/inward/record.uri?eid=2-s2.0-0028431239&doi=10.1016%2f0045-7825%2894%2990193-7&partnerID=40&md5=b920487a253466ca4407e05d9fa55c68",Article,"Final","",Scopus,2-s2.0-0028431239
"Johan, Z., Mathur, K.K., Johnsson, S.L., Hughes, T.J.R.","55886166000;7103223009;7005577253;55911870000;","An efficient communications strategy for finite element methods on the Connection Machine CM-5 system",1994,"Computer Methods in Applied Mechanics and Engineering","113","3-4",,"363","387",,28,"10.1016/0045-7825(94)90054-X","https://www.scopus.com/inward/record.uri?eid=2-s2.0-0028391926&doi=10.1016%2f0045-7825%2894%2990054-X&partnerID=40&md5=e5a87597707c045da54954012a5ef61a",Article,"Final","",Scopus,2-s2.0-0028391926
"Hauke, G., Hughes, T.J.R.","7004618829;55911870000;","A unified approach to compressible and incompressible flows",1994,"Computer Methods in Applied Mechanics and Engineering","113","3-4",,"389","395",,135,"10.1016/0045-7825(94)90055-8","https://www.scopus.com/inward/record.uri?eid=2-s2.0-0028389044&doi=10.1016%2f0045-7825%2894%2990055-8&partnerID=40&md5=823f3f2a135f967aa585634d9538e74f",Article,"Final","",Scopus,2-s2.0-0028389044
"Droux, J.-J., Hughes, T.J.R.","6603454857;55911870000;","A boundary integral modification of the Galerkin least squares formulation for the Stokes problem",1994,"Computer Methods in Applied Mechanics and Engineering","113","1-2",,"173","182",,33,"10.1016/0045-7825(94)90217-8","https://www.scopus.com/inward/record.uri?eid=2-s2.0-0028384960&doi=10.1016%2f0045-7825%2894%2990217-8&partnerID=40&md5=61af0db98fb549e79403f1ae24e2d345",Article,"Final","",Scopus,2-s2.0-0028384960
"Chalot, F., Hughes, T.J.R.","6603476265;55911870000;","A consistent equilibrium chemistry algorithm for hypersonic flows",1994,"Computer Methods in Applied Mechanics and Engineering","112","1-4",,"25","40",,29,"10.1016/0045-7825(94)90017-5","https://www.scopus.com/inward/record.uri?eid=2-s2.0-0028381687&doi=10.1016%2f0045-7825%2894%2990017-5&partnerID=40&md5=ef285753ff023f071cdeeed083b5bb61",Article,"Final","",Scopus,2-s2.0-0028381687
"Hughes, T.J.R.","55911870000;","Discussions of numerical methods. Finite Element Methods in Wind Engineering",1993,"Journal of Wind Engineering and Industrial Aerodynamics","46-47","C",,"401","405",,,"10.1016/0167-6105(93)90306-9","https://www.scopus.com/inward/record.uri?eid=2-s2.0-50749133097&doi=10.1016%2f0167-6105%2893%2990306-9&partnerID=40&md5=2c384609c2cd3c00bb559e207a40ad35",Note,"Final","",Scopus,2-s2.0-50749133097
"Hughes, T.J.R., Jansen, K.","55911870000;7202060182;","Finite element methods in wind engineering",1993,"Journal of Wind Engineering and Industrial Aerodynamics","46-47","C",,"297","313",,5,"10.1016/0167-6105(93)90296-Z","https://www.scopus.com/inward/record.uri?eid=2-s2.0-0027643276&doi=10.1016%2f0167-6105%2893%2990296-Z&partnerID=40&md5=b5e9755a52cc514a6f68d6ead235eba7",Article,"Final","",Scopus,2-s2.0-0027643276
"Franca, L.P., Hughes, T.J.R.","7006642406;55911870000;","Convergence analyses of Galerkin least-squares methods for symmetric advective-diffusive forms of the Stokes and incompressible Navier-Stokes equations",1993,"Computer Methods in Applied Mechanics and Engineering","105","2",,"285","298",,106,"10.1016/0045-7825(93)90126-I","https://www.scopus.com/inward/record.uri?eid=2-s2.0-0027611385&doi=10.1016%2f0045-7825%2893%2990126-I&partnerID=40&md5=c85396ae2aa2d775188d853895170dd1",Article,"Final","",Scopus,2-s2.0-0027611385
"Jansen, K., Johan, Z., Hughes, T.J.R.","7202060182;55886166000;55911870000;","Implementation of a one-equation turbulence model within a stabilized finite element formulation of a symmetric advective-diffusive system",1993,"Computer Methods in Applied Mechanics and Engineering","105","3",,"405","433",,26,"10.1016/0045-7825(93)90066-7","https://www.scopus.com/inward/record.uri?eid=2-s2.0-0027609167&doi=10.1016%2f0045-7825%2893%2990066-7&partnerID=40&md5=e8edf4e1eb47da931d081ffefa0943da",Article,"Final","",Scopus,2-s2.0-0027609167
"Barbosa, H.J.C., Hughes, T.J.R.","57202472885;55911870000;","Boundary Lagrange multipliers in finite element methods: Error analysis in natural norms",1992,"Numerische Mathematik","62","1",,"1","15",,65,"10.1007/BF01396217","https://www.scopus.com/inward/record.uri?eid=2-s2.0-0002423829&doi=10.1007%2fBF01396217&partnerID=40&md5=fbceef0acb5966c0f3ff110ede8efd89",Article,"Final","",Scopus,2-s2.0-0002423829
"Johan, Z., Hughes, T.J.R.","55886166000;55911870000;","An efficient implementation of the spectral partitioning algorithm on connection machine systems",1992,"Lecture Notes in Computer Science (including subseries Lecture Notes in Artificial Intelligence and Lecture Notes in Bioinformatics)","653 LNCS",,,"357","371",,1,"10.1007/3-540-56320-2_72","https://www.scopus.com/inward/record.uri?eid=2-s2.0-3543057854&doi=10.1007%2f3-540-56320-2_72&partnerID=40&md5=1a2f09bc9d9c38a3e92bfd333c1d8a28",Conference Paper,"Final","",Scopus,2-s2.0-3543057854
"Johan, Z., Hughes, T.J.R., Mathur, K.K., Johnsson, S.L.","55886166000;55911870000;7103223009;7005577253;","A data parallel finite element method for computational fluid dynamics on the Connection Machine system",1992,"Computer Methods in Applied Mechanics and Engineering","99","1",,"113","134",,56,"10.1016/0045-7825(92)90124-3","https://www.scopus.com/inward/record.uri?eid=2-s2.0-0026910144&doi=10.1016%2f0045-7825%2892%2990124-3&partnerID=40&md5=5977658f6690857c3dadc06616bbf747",Article,"Final","All Open Access, Green",Scopus,2-s2.0-0026910144
"Barbosa, H.J.C., Hughes, T.J.R.","57202472885;55911870000;","Circumventing the Babuška-Brezzi condition in mixed finite element approximations of elliptic variational inequalities",1992,"Computer Methods in Applied Mechanics and Engineering","97","2",,"193","210",,19,"10.1016/0045-7825(92)90163-E","https://www.scopus.com/inward/record.uri?eid=2-s2.0-0026876283&doi=10.1016%2f0045-7825%2892%2990163-E&partnerID=40&md5=20a29a402d0ef36f486a232fc729780c",Article,"Final","",Scopus,2-s2.0-0026876283
"Harari, I., Hughes, T.J.R.","35587277400;55911870000;","What are C and h?: Inequalities for the analysis and design of finite element methods",1992,"Computer Methods in Applied Mechanics and Engineering","97","2",,"157","192",,144,"10.1016/0045-7825(92)90162-D","https://www.scopus.com/inward/record.uri?eid=2-s2.0-0026872324&doi=10.1016%2f0045-7825%2892%2990162-D&partnerID=40&md5=3544b113ca3bd7baab3dd7d22d8ffae3",Article,"Final","",Scopus,2-s2.0-0026872324
"Harari, I., Hughes, T.J.R.","35587277400;55911870000;","A cost comparison of boundary element and finite element methods for problems of time-harmonic acoustics",1992,"Computer Methods in Applied Mechanics and Engineering","97","1",,"77","102",,117,"10.1016/0045-7825(92)90108-V","https://www.scopus.com/inward/record.uri?eid=2-s2.0-0026863111&doi=10.1016%2f0045-7825%2892%2990108-V&partnerID=40&md5=c3ae4d9b95bacda590721acf1344b129",Article,"Final","",Scopus,2-s2.0-0026863111
"Harari, I., Hughes, T.J.R.","35587277400;55911870000;","Analysis of continuous formulations underlying the computation of time-harmonic acoustics in exterior domains",1992,"Computer Methods in Applied Mechanics and Engineering","97","1",,"103","124",,110,"10.1016/0045-7825(92)90109-W","https://www.scopus.com/inward/record.uri?eid=2-s2.0-0026862372&doi=10.1016%2f0045-7825%2892%2990109-W&partnerID=40&md5=4d420d2df2897a98df1d175d26b493eb",Article,"Final","",Scopus,2-s2.0-0026862372
"Franca, L.P., Frey, S.L., Hughes, T.J.R.","7006642406;7102490542;55911870000;","Stabilized finite element methods: I. Application to the advective-diffusive model",1992,"Computer Methods in Applied Mechanics and Engineering","95","2",,"253","276",,516,"10.1016/0045-7825(92)90143-8","https://www.scopus.com/inward/record.uri?eid=2-s2.0-0026835579&doi=10.1016%2f0045-7825%2892%2990143-8&partnerID=40&md5=616eaf8825bd33473e82519137be75ce",Article,"Final","All Open Access, Green",Scopus,2-s2.0-0026835579
"Simo, J.C., Fox, D.D., Hughes, T.J.R.","24395219000;7402073956;55911870000;","Formulations of finite elasticity with independent rotations",1992,"Computer Methods in Applied Mechanics and Engineering","95","2",,"277","288",,57,"10.1016/0045-7825(92)90144-9","https://www.scopus.com/inward/record.uri?eid=2-s2.0-0026834721&doi=10.1016%2f0045-7825%2892%2990144-9&partnerID=40&md5=e11b100c9a2896fbf80694627473c111",Article,"Final","",Scopus,2-s2.0-0026834721
"Takashi, N., Hughes, T.J.R.","24323095400;55911870000;","An arbitrary Lagrangian-Eulerian finite element method for interaction of fluid and a rigid body",1992,"Computer Methods in Applied Mechanics and Engineering","95","1",,"115","138",,329,"10.1016/0045-7825(92)90085-X","https://www.scopus.com/inward/record.uri?eid=2-s2.0-0026813302&doi=10.1016%2f0045-7825%2892%2990085-X&partnerID=40&md5=aad7f81de25bbb1f0f2ec5defe4c33d6",Article,"Final","",Scopus,2-s2.0-0026813302
"Harari, I., Hughes, T.J.R.","35587277400;55911870000;","Galerkin/least-squares finite element methods for the reduced wave equation with non-reflecting boundary conditions in unbounded domains",1992,"Computer Methods in Applied Mechanics and Engineering","98","3",,"411","454",,224,"10.1016/0045-7825(92)90006-6","https://www.scopus.com/inward/record.uri?eid=2-s2.0-0000288806&doi=10.1016%2f0045-7825%2892%2990006-6&partnerID=40&md5=437e921ebeddc961c4e15870274a830b",Article,"Final","",Scopus,2-s2.0-0000288806
"Shakib, F., Hughes, T.J.R., Johan, Z.","7004645275;55911870000;55886166000;","A new finite element formulation for computational fluid dynamics: X. The compressible Euler and Navier-Stokes equations",1991,"Computer Methods in Applied Mechanics and Engineering","89","1-3",,"141","219",,410,"10.1016/0045-7825(91)90041-4","https://www.scopus.com/inward/record.uri?eid=2-s2.0-0026206734&doi=10.1016%2f0045-7825%2891%2990041-4&partnerID=40&md5=5b5c08345d45a03abb67f83eb01b0fe3",Article,"Final","",Scopus,2-s2.0-0026206734
"Johan, Z., Hughes, T.J.R.","55886166000;55911870000;","A globally convergent matrix-free algorithm for implicit time-marching schemes arising in finite element analysis in fluids",1991,"Computer Methods in Applied Mechanics and Engineering","87","2-3",,"281","304",,98,"10.1016/0045-7825(91)90009-U","https://www.scopus.com/inward/record.uri?eid=2-s2.0-0026169824&doi=10.1016%2f0045-7825%2891%2990009-U&partnerID=40&md5=aa0e4502717fd160dade28a019987872",Article,"Final","",Scopus,2-s2.0-0026169824
"Shakib, F., Hughes, T.J.R.","7004645275;55911870000;","A new finite element formulation for computational fluid dynamics: IX. Fourier analysis of space-time Galerkin/least-squares algorithms",1991,"Computer Methods in Applied Mechanics and Engineering","87","1",,"35","58",,115,"10.1016/0045-7825(91)90145-V","https://www.scopus.com/inward/record.uri?eid=2-s2.0-0026155973&doi=10.1016%2f0045-7825%2891%2990145-V&partnerID=40&md5=0560c89f6b8681c98cdf9643da0dfe0f",Article,"Final","",Scopus,2-s2.0-0026155973
"Harari, I., Hughes, T.J.R.","35587277400;55911870000;","Finite element methods for the helmholtz equation in an exterior domain: Model problems",1991,"Computer Methods in Applied Mechanics and Engineering","87","1",,"59","96",,166,"10.1016/0045-7825(91)90146-W","https://www.scopus.com/inward/record.uri?eid=2-s2.0-0026153971&doi=10.1016%2f0045-7825%2891%2990146-W&partnerID=40&md5=c2d9788c1c04aa08885e5b64ac5e5a24",Article,"Final","",Scopus,2-s2.0-0026153971
"Barbosa, H.J.C., Hughes, T.J.R.","57202472885;55911870000;","The finite element method with Lagrange multipliers on the boundary: circumventing the Babuška-Brezzi condition",1991,"Computer Methods in Applied Mechanics and Engineering","85","1",,"109","128",,140,"10.1016/0045-7825(91)90125-P","https://www.scopus.com/inward/record.uri?eid=2-s2.0-0025886026&doi=10.1016%2f0045-7825%2891%2990125-P&partnerID=40&md5=4ec4bcfea8c26c318e768180f8ac4070",Article,"Final","",Scopus,2-s2.0-0025886026
"Hughes, Thomas J.R., Hatt, Fritz","55911870000;6602392307;","Revolution fueled by fast computers",1990,"Machine Design","62","3",,"151","155",,,,"https://www.scopus.com/inward/record.uri?eid=2-s2.0-0025702753&partnerID=40&md5=2597b93e17c74c8f2d4b77a89d0098a7",Article,"Final","",Scopus,2-s2.0-0025702753
"Hughes, T.J.R., Tucker, A.","55911870000;57194991982;","Structural acoustics and fluid-structure interaction",1990,"Applied Mechanics Reviews","43","5",,"S353","",,1,"10.1115/1.3120839","https://www.scopus.com/inward/record.uri?eid=2-s2.0-85024642423&doi=10.1115%2f1.3120839&partnerID=40&md5=19343b661036d21793bf1654a8fc12e4",Note,"Final","All Open Access, Bronze",Scopus,2-s2.0-85024642423
"Harari, I., Hughes, T.J.R.","35587277400;55911870000;","Design and analysis of finite element methods for the helmholtz equation in exterior domains",1990,"Applied Mechanics Reviews","43","5",,"S366","S373",,13,"10.1115/1.3120842","https://www.scopus.com/inward/record.uri?eid=2-s2.0-85006760530&doi=10.1115%2f1.3120842&partnerID=40&md5=3bdacee8ed4d8fc61f01ae5d877a9bc4",Article,"Final","",Scopus,2-s2.0-85006760530
"Hulbert, G.M., Hughes, T.J.R.","7004480000;55911870000;","Space-time finite element methods for second-order hyperbolic equations",1990,"Computer Methods in Applied Mechanics and Engineering","84","3",,"327","348",,231,"10.1016/0045-7825(90)90082-W","https://www.scopus.com/inward/record.uri?eid=2-s2.0-0025693468&doi=10.1016%2f0045-7825%2890%2990082-W&partnerID=40&md5=bc58351c18b702f230d00d1de8e8075e",Article,"Final","All Open Access, Green",Scopus,2-s2.0-0025693468
"Chalot, F., Hughes, T.J.R., Shakib, F.","6603476265;55911870000;7004645275;","Symmetrization of conservation laws with entropy for high-temperature hypersonic computations",1990,"Computing Systems in Engineering","1","2-4",,"495","521",,48,"10.1016/0956-0521(90)90032-G","https://www.scopus.com/inward/record.uri?eid=2-s2.0-0001328952&doi=10.1016%2f0956-0521%2890%2990032-G&partnerID=40&md5=9f27fb892615928408101a9db6f32de8",Article,"Final","",Scopus,2-s2.0-0001328952
"Hughes, T.J.R.","55911870000;","New directions in computational mechanics",1989,"Nuclear Engineering and Design","114","2",,"197","210",,4,"10.1016/0029-5493(89)90191-X","https://www.scopus.com/inward/record.uri?eid=2-s2.0-38249023695&doi=10.1016%2f0029-5493%2889%2990191-X&partnerID=40&md5=381f525f3d1d296c1f9028d12cfd218b",Article,"Final","",Scopus,2-s2.0-38249023695
"Hughes, T.J.R.","55911870000;","Letter to the editor",1989,"International Journal for Numerical Methods in Engineering","28","6",,"1485","1485",,,"10.1002/nme.1620280621","https://www.scopus.com/inward/record.uri?eid=2-s2.0-84986938791&doi=10.1002%2fnme.1620280621&partnerID=40&md5=168366705d601e73b46098683ee60e4a",Letter,"Final","",Scopus,2-s2.0-84986938791
"Hughes, T.J.R., Franca, L.P., Hulbert, G.M.","55911870000;7006642406;7004480000;","A new finite element formulation for computational fluid dynamics: VIII. The galerkin/least-squares method for advective-diffusive equations",1989,"Computer Methods in Applied Mechanics and Engineering","73","2",,"173","189",,1145,"10.1016/0045-7825(89)90111-4","https://www.scopus.com/inward/record.uri?eid=2-s2.0-45149144830&doi=10.1016%2f0045-7825%2889%2990111-4&partnerID=40&md5=87c64159a3e8fb915ec5bb2e468ae95a",Article,"Final","",Scopus,2-s2.0-45149144830
"Hoff, C., Hughes, T.J.R., Hulbert, G., Pahl, P.J.","16197531900;55911870000;7004480000;6603553152;","Extended comparison of the Hilber-Hughes-Taylor α-method and the Θ1-method",1989,"Computer Methods in Applied Mechanics and Engineering","76","1",,"87","93",,30,"10.1016/0045-7825(89)90142-4","https://www.scopus.com/inward/record.uri?eid=2-s2.0-0024770393&doi=10.1016%2f0045-7825%2889%2990142-4&partnerID=40&md5=ad591edef842fee7ddc3dde202dca259",Article,"Final","",Scopus,2-s2.0-0024770393
"Shakib, F., Hughes, T.J.R., Johan, Z.","7004645275;55911870000;55886166000;","A multi-element group preconditioned GMRES algorithm for nonsymmetric systems arising in finite element analysis",1989,"Computer Methods in Applied Mechanics and Engineering","75","1-3",,"415","456",,114,"10.1016/0045-7825(89)90040-6","https://www.scopus.com/inward/record.uri?eid=2-s2.0-0024752479&doi=10.1016%2f0045-7825%2889%2990040-6&partnerID=40&md5=e9990096c17741f01754e1676470bcba",Article,"Final","",Scopus,2-s2.0-0024752479
"Loula, A.F.D., Miranda, I., Hughes, T.J.R., Franca, L.P.","6604099029;7004193615;55911870000;7006642406;","On mixed finite element methods for axisymmetric shell analysis",1989,"Computer Methods in Applied Mechanics and Engineering","72","2",,"201","231",,10,"10.1016/0045-7825(89)90161-8","https://www.scopus.com/inward/record.uri?eid=2-s2.0-0024607329&doi=10.1016%2f0045-7825%2889%2990161-8&partnerID=40&md5=5f119a45a0d2e6ae4098c50ffc82c4f4",Article,"Final","",Scopus,2-s2.0-0024607329
"Miranda, I., Ferencz, R.M., Hughes, T.J.R.","7004193615;6602458412;55911870000;","An improved implicit‐explicit time integration method for structural dynamics",1989,"Earthquake Engineering &amp; Structural Dynamics","18","5",,"643","653",,88,"10.1002/eqe.4290180505","https://www.scopus.com/inward/record.uri?eid=2-s2.0-0024475957&doi=10.1002%2feqe.4290180505&partnerID=40&md5=e4cae54e6d58a69daf35ac3158b5d850",Article,"Final","",Scopus,2-s2.0-0024475957
"Hughes, T.J.R., Brezzi, F.","55911870000;7003957912;","On drilling degrees of freedom",1989,"Computer Methods in Applied Mechanics and Engineering","72","1",,"105","121",,253,"10.1016/0045-7825(89)90124-2","https://www.scopus.com/inward/record.uri?eid=2-s2.0-0024304211&doi=10.1016%2f0045-7825%2889%2990124-2&partnerID=40&md5=40f7d2d5a9d4d043b76b890fda2478c7",Article,"Final","",Scopus,2-s2.0-0024304211
"Hughes, T.J.R., Franca, L.P., Hulbert, G.M., Johan, Z., Skakib, F.","55911870000;7006642406;7004480000;55886166000;6505635699;","Galerkin/least-squares method for advective-diffusive equations",1988,"American Society of Mechanical Engineers, Applied Mechanics Division, AMD","95",,,"75","99",,6,,"https://www.scopus.com/inward/record.uri?eid=2-s2.0-0024167057&partnerID=40&md5=2fd68e45347bcc5a3398b2eb7e7f6fa6",Article,"Final","",Scopus,2-s2.0-0024167057
"Franca, L.P., Hughes, T.J.R.","7006642406;55911870000;","Two classes of mixed finite element methods",1988,"Computer Methods in Applied Mechanics and Engineering","69","1",,"89","129",,208,"10.1016/0045-7825(88)90168-5","https://www.scopus.com/inward/record.uri?eid=2-s2.0-0024047885&doi=10.1016%2f0045-7825%2888%2990168-5&partnerID=40&md5=0d2bc627aef29e0ca9b09b0e88a7a8f5",Article,"Final","",Scopus,2-s2.0-0024047885
"Hughes, Thomas J.R., Franca, Leopoldo P.","55911870000;7006642406;","CONVERGENCE OF TRANSVERSE SHEAR STRESSES IN THE FINITE ELEMENT ANALYSIS OF PLATES.",1988,"Communications in Applied Numerical Methods","4","2",,"185","187",,10,"10.1002/cnm.1630040208","https://www.scopus.com/inward/record.uri?eid=2-s2.0-0023978648&doi=10.1002%2fcnm.1630040208&partnerID=40&md5=9b42b70bb996514c7d914687bb79428e",Article,"Final","",Scopus,2-s2.0-0023978648
"Hughes, T.J.R., Franca, L.P.","55911870000;7006642406;","A mixed finite element formulation for Reissner-mindlin plate theory: Uniform convergence of all higher-order spaces",1988,"Computer Methods in Applied Mechanics and Engineering","67","2",,"223","240",,66,"10.1016/0045-7825(88)90127-2","https://www.scopus.com/inward/record.uri?eid=2-s2.0-0023978526&doi=10.1016%2f0045-7825%2888%2990127-2&partnerID=40&md5=0128cf1a1d4dfed7370ad621fed312e1",Article,"Final","",Scopus,2-s2.0-0023978526
"Hughes, T.J.R., Hulbert, G.M.","55911870000;7004480000;","Space-time finite element methods for elastodynamics: Formulations and error estimates",1988,"Computer Methods in Applied Mechanics and Engineering","66","3",,"339","363",,417,"10.1016/0045-7825(88)90006-0","https://www.scopus.com/inward/record.uri?eid=2-s2.0-0023960856&doi=10.1016%2f0045-7825%2888%2990006-0&partnerID=40&md5=d39d69304fee808788e95fa5d23574b8",Article,"Final","",Scopus,2-s2.0-0023960856
"Franca, L.P., Hughes, T.J.R., Loula, A.F.D., Miranda, I.","7006642406;55911870000;6604099029;7004193615;","A new family of stable elements for nearly incompressible elasticity based on a mixed Petrov-Galerkin finite element formulation",1988,"Numerische Mathematik","53","1-2",,"123","141",,66,"10.1007/BF01395881","https://www.scopus.com/inward/record.uri?eid=2-s2.0-0000281608&doi=10.1007%2fBF01395881&partnerID=40&md5=858a627f5645d1d7463ceba082a17505",Article,"Final","",Scopus,2-s2.0-0000281608
"Simo, J.C., Kennedy, J.G., Govindjee, S., Hughes, T.J.R.","24395219000;7404197681;7003946967;55911870000;","UNCONDITIONALLY CONVERGENT ALGORITHMS FOR NON-SMOOTH MULTISURFACE PLASTICITY AMENABLE TO EXACT LINEARIZATION.",1987,"American Society of Mechanical Engineers, Applied Mechanics Division, AMD","88",,,"87","95",,8,,"https://www.scopus.com/inward/record.uri?eid=2-s2.0-0023592589&partnerID=40&md5=7a5e49ad99a30ce36b37595699fd8e74",Conference Paper,"Final","",Scopus,2-s2.0-0023592589
