作者,作者 ID,标题,年份,来源出版物名称,卷,期,论文编号,起始页码,结束页码,页码计数,施引文献,DOI,链接,文献类型,出版阶段,开放获取,来源出版物,EID
"Qiuye, S., Xinrui, L., Huaguang, Z.","15019590100;24922271100;56122851800;","Power distribution fault diagnosis based on rough-cloud sets",2009,"Asia-Pacific Power and Energy Engineering Conference, APPEEC",,,"4918602","","",,2,"10.1109/APPEEC.2009.4918602","https://www.scopus.com/inward/record.uri?eid=2-s2.0-84869984295&doi=10.1109%2fAPPEEC.2009.4918602&partnerID=40&md5=07daf0b005f467febf0f6709aea7adec",Conference Paper,"Final","",Scopus,2-s2.0-84869984295
"Hua-Guang, Z., Jie, F., Tie-Dong, M., Shao-Cheng, T.","56122851800;27967805000;57192894084;56496204400;","Robust stability analysis for Markovian jumping stochastic neural networks with mode-dependent time-varying interval delay and multiplicative noise",2009,"Chinese Physics B","18","8",,"3325","3336",,5,"10.1088/1674-1056/18/8/037","https://www.scopus.com/inward/record.uri?eid=2-s2.0-68949165684&doi=10.1088%2f1674-1056%2f18%2f8%2f037&partnerID=40&md5=d506dd2effd5f9b7ea8893a3c04f24d1",Article,"Final","",Scopus,2-s2.0-68949165684
"Zheng, C.-D., Zhang, H., Wang, Z.","35390466600;56122851800;54989199600;","Comments on ""Exponential stability analysis for uncertain neural networks with interval time varying delays"" and ""New delay-dependent robust stability criterion for uncertain neural networks with time-varying delays""",2009,"Applied Mathematics and Computation","214","2",,"648","",,,"10.1016/j.amc.2009.04.043","https://www.scopus.com/inward/record.uri?eid=2-s2.0-67649210263&doi=10.1016%2fj.amc.2009.04.043&partnerID=40&md5=7ebb13b3c288bd30de3e0d6779ed8a26",Note,"Final","",Scopus,2-s2.0-67649210263
"Zhang, H., Luo, Y., Liu, D.","56122851800;55571384900;55857948600;","Neural-network-based near-optimal control for a class of discrete-time affine nonlinear systems with control constraints",2009,"IEEE Transactions on Neural Networks","20","9",,"1490","1503",,515,"10.1109/TNN.2009.2027233","https://www.scopus.com/inward/record.uri?eid=2-s2.0-70349253929&doi=10.1109%2fTNN.2009.2027233&partnerID=40&md5=e510fff4ca3911650c68e6c32d4ece49",Article,"Final","",Scopus,2-s2.0-70349253929
"Hua-Guang, Z., Jie, F., Tie-Dong, M., Shao-Cheng, T.","56122851800;27967805000;57192894084;56496204400;","An improved impulsive control approach to nonlinear systems with time-varying delays",2009,"Chinese Physics B","18","3",,"969","974",,13,"10.1088/1674-1056/18/3/021","https://www.scopus.com/inward/record.uri?eid=2-s2.0-67650739983&doi=10.1088%2f1674-1056%2f18%2f3%2f021&partnerID=40&md5=7e7c782d62f6e7686d53d595fd6b68ed",Article,"Final","",Scopus,2-s2.0-67650739983
"Zhang, X., Zhang, H., Liu, D., Kim, Y.","55969078300;56122851800;55857948600;56066778100;","Neural-network-based reinforcement learning controller for nonlinear systems with non-symmetric dead-zone inputs",2009,"2009 IEEE Symposium on Adaptive Dynamic Programming and Reinforcement Learning, ADPRL 2009 - Proceedings",,,"4927535","124","129",,25,"10.1109/ADPRL.2009.4927535","https://www.scopus.com/inward/record.uri?eid=2-s2.0-67650505312&doi=10.1109%2fADPRL.2009.4927535&partnerID=40&md5=91a0ebcc031c3edb5aa80abeb22d4595",Conference Paper,"Final","",Scopus,2-s2.0-67650505312
"Cui, L., Zhang, H., Liu, D., Kim, Y.","35787018500;56122851800;55857948600;56066778100;","Constrained optimal control of affine nonlinear discrete-time systems using ghjb method",2009,"2009 IEEE Symposium on Adaptive Dynamic Programming and Reinforcement Learning, ADPRL 2009 - Proceedings",,,"4927520","16","21",,12,"10.1109/ADPRL.2009.4927520","https://www.scopus.com/inward/record.uri?eid=2-s2.0-67650490299&doi=10.1109%2fADPRL.2009.4927520&partnerID=40&md5=90bbe6a1a43731dc5ff0ce4618984317",Conference Paper,"Final","",Scopus,2-s2.0-67650490299
"Chu, E.-H., Yu, W.-M., Cheng, H.-B., Guan, S.-W., Zhang, H.-G.","25622912000;35320746500;55474415900;36111030200;56122851800;","Zero-voltage and zero-current transition chopper circuit",2009,"Dianji yu Kongzhi Xuebao/Electric Machines and Control","13","4",,"477","482",,6,,"https://www.scopus.com/inward/record.uri?eid=2-s2.0-68549117122&partnerID=40&md5=c7bb4d22755a8b13ddf9ceb0a0a27748",Article,"Final","",Scopus,2-s2.0-68549117122
"Wang, Q., Zhang, H.-G., Chu, E.-H., Liu, X.-C., Hou, L.-M.","57206919314;56122851800;25622912000;23097535400;15052101600;","A novel three-phase passive soft-switching inverter",2009,"Zhongguo Dianji Gongcheng Xuebao/Proceedings of the Chinese Society of Electrical Engineering","29","18",,"33","40",,11,,"https://www.scopus.com/inward/record.uri?eid=2-s2.0-67650248451&partnerID=40&md5=589611e99bbf6208307bc564c6577d51",Article,"Final","",Scopus,2-s2.0-67650248451
"Yang, J., Zhang, H.-G., Yang, D.-S.","57206003333;56122851800;57206705036;","Design of non-fragile controller based on fuzzy hyperbolic model and simulation",2009,"Xitong Fangzhen Xuebao / Journal of System Simulation","21","12",,"3790","3793",,1,,"https://www.scopus.com/inward/record.uri?eid=2-s2.0-67650236288&partnerID=40&md5=b7b5f07fa2387eca8c7e8fbbf9f5ab06",Article,"Final","",Scopus,2-s2.0-67650236288
"Chu, E., Zhang, H., Liu, X., Chen, C.","25622912000;56122851800;23097535400;56155302600;","Research on novel active auxiliary resonant pole inverter",2009,"Yi Qi Yi Biao Xue Bao/Chinese Journal of Scientific Instrument","30","6",,"1324","1329",,5,,"https://www.scopus.com/inward/record.uri?eid=2-s2.0-67651148256&partnerID=40&md5=ef684401e35cde1b9a8a6ef4d8009c1b",Article,"Final","",Scopus,2-s2.0-67651148256
"Yin, Z.-Y., Zhang, H.-G.","9232988700;56122851800;","Robust tolerant control for nonlinear systems with uncertainties and time delays based on fuzzy models",2009,"Kongzhi Lilun Yu Yingyong/Control Theory and Applications","26","6",,"683","686",,8,,"https://www.scopus.com/inward/record.uri?eid=2-s2.0-67651012583&partnerID=40&md5=04cc0c51eb6663d848d9ea40eeedfd40",Article,"Final","",Scopus,2-s2.0-67651012583
"Wei, Q.-L., Zhang, H.-G., Cui, L.-L.","23092563300;56122851800;35787018500;","Data-based optimal control for discrete-time zero-sum games of 2-D systems using adaptive critic designs",2009,"Zidonghua Xuebao/ Acta Automatica Sinica","35","6",,"682","692",,35,"10.3724/SP.J.1004.2009.00682","https://www.scopus.com/inward/record.uri?eid=2-s2.0-67650567581&doi=10.3724%2fSP.J.1004.2009.00682&partnerID=40&md5=796f5ab0c26242a610feeb508337da07",Article,"Final","",Scopus,2-s2.0-67650567581
"Yin, Z.-Y., Zhang, H.-G.","9232988700;56122851800;","H∞ robust tolerant control for a class of nonlinear systems based on fuzzy T-S model",2009,"Kongzhi yu Juece/Control and Decision","24","6",,"813","818",,2,,"https://www.scopus.com/inward/record.uri?eid=2-s2.0-67649438652&partnerID=40&md5=66e44cdac77467b37cd71831bf1b35a6",Article,"Final","",Scopus,2-s2.0-67649438652
"Wang, Q., Zhang, H.-G., Chu, E.-H., Liu, X.-C., Hou, L.-M.","57206919314;56122851800;25622912000;23097535400;15052101600;","Analysis on topology and efficiency of soft-switching inverter",2009,"Dianji yu Kongzhi Xuebao/Electric Machines and Control","13","3",,"342","348",,3,,"https://www.scopus.com/inward/record.uri?eid=2-s2.0-67549144686&partnerID=40&md5=eba85d5f57e8d065855c06778d8d9c03",Article,"Final","",Scopus,2-s2.0-67549144686
"Wang, F.-Y., Zhang, H., Liu, D.","57211758869;56122851800;55857948600;","Adaptive dynamic programming: An introduction",2009,"IEEE Computational Intelligence Magazine","4","2","4840325","39","47",,662,"10.1109/MCI.2009.932261","https://www.scopus.com/inward/record.uri?eid=2-s2.0-66449130966&doi=10.1109%2fMCI.2009.932261&partnerID=40&md5=9f1c3cafb3719dd4482a0e6790fc8952",Article,"Final","",Scopus,2-s2.0-66449130966
"Xie, X.-P., Song, Y., Zhang, H.-G.","26032736600;55494084700;56122851800;","Approach to quadratic stabilization for continuous-time T-S fuzzy systems",2009,"Kongzhi yu Juece/Control and Decision","24","5",,"658","662",,,,"https://www.scopus.com/inward/record.uri?eid=2-s2.0-66349130828&partnerID=40&md5=5a39438fd5a8bd2327eb55ea85bed0d0",Article,"Final","",Scopus,2-s2.0-66349130828
"Ma, T., Zhang, H., Fu, J.","57192894084;56122851800;35242310800;","Robust impulsive synchronization for uncertain unified chaotic systems with channel time-delay",2009,"Dynamics of Continuous, Discrete and Impulsive Systems Series B: Applications and Algorithms","16","2",,"215","222",,7,,"https://www.scopus.com/inward/record.uri?eid=2-s2.0-70449721869&partnerID=40&md5=c7f869b7615ce26f78c55a94b97530ac",Article,"Final","",Scopus,2-s2.0-70449721869
"Hou, L., Zhang, H., Liu, X., Chu, E., Wang, Q.","15052101600;56122851800;23097535400;25622912000;57206919314;","Study of sensorless optimal torque control system for PMSM",2009,"Yi Qi Yi Biao Xue Bao/Chinese Journal of Scientific Instrument","30","4",,"706","710",,6,,"https://www.scopus.com/inward/record.uri?eid=2-s2.0-65649137673&partnerID=40&md5=69a63390a0a1743728fc8f7761176cbb",Article,"Final","",Scopus,2-s2.0-65649137673
"Fu, J., Zhang, H.-G., Wang, Y.-C.","35242310800;56122851800;55733933500;","Tracking control of a class of delay stochastic distribution system",2009,"Dongbei Daxue Xuebao/Journal of Northeastern University","30","4",,"479","483",,2,,"https://www.scopus.com/inward/record.uri?eid=2-s2.0-65349123017&partnerID=40&md5=ad223e273d16f9653cebe1bea18a2035",Article,"Final","",Scopus,2-s2.0-65349123017
"Liu, Z.-B., Zhang, H.-G., Yang, D.-S.","55936939300;56122851800;57206705036;","Adaptive synchronization of a class of chaotic neural networks with mixed time-varying delays",2009,"Dongbei Daxue Xuebao/Journal of Northeastern University","30","4",,"475","478",,4,,"https://www.scopus.com/inward/record.uri?eid=2-s2.0-65349115384&partnerID=40&md5=9144addae0217d2bf7066a22c2d599dc",Article,"Final","",Scopus,2-s2.0-65349115384
"Liu, Z.-W., Zhang, H.-G., Tong, S.-C.","35201546200;56122851800;56496204400;","Delay-dependent exponential stability of fuzzy cellular neural networks with time-varying delay",2009,"Tien Tzu Hsueh Pao/Acta Electronica Sinica","37","3",,"513","518",,,,"https://www.scopus.com/inward/record.uri?eid=2-s2.0-65249113226&partnerID=40&md5=71b2a457ab9559a4cbc5f34b6400c215",Article,"Final","",Scopus,2-s2.0-65249113226
"Liu, Z.-W., Zhang, H.-G., Zhang, Q.-L.","35201546200;56122851800;7406719568;","Robust stability for a class of Cohen-Grossberg neural networks by dividing delay interval",2009,"Kongzhi yu Juece/Control and Decision","24","3",,"342","346",,,,"https://www.scopus.com/inward/record.uri?eid=2-s2.0-64249148245&partnerID=40&md5=a8ceacbae271b15ac6d0cafcaf09e442",Article,"Final","",Scopus,2-s2.0-64249148245
"Xie, Z., Liang, Z., Zhang, H.","24922410100;22954459400;56122851800;","Passivity-based nonlinear hybrid control of ASVG based on Euler-Lagrangian model",2009,"Dianli Zidonghua Shebei / Electric Power Automation Equipment","29","3",,"61","64",,3,,"https://www.scopus.com/inward/record.uri?eid=2-s2.0-63049111277&partnerID=40&md5=5e2a50d7f06b0cf90ce79e85e7747345",Article,"Final","",Scopus,2-s2.0-63049111277
"Liu, J.-H., Zhang, H.-G., Feng, J.","25921523900;56122851800;55350596800;","On-line leak-detection method for pressure time series of oil pipeline",2009,"Dongbei Daxue Xuebao/Journal of Northeastern University","30","3",,"321","324",,6,,"https://www.scopus.com/inward/record.uri?eid=2-s2.0-63049099152&partnerID=40&md5=233fd32b343dfa2be66a2332ca57ca5a",Article,"Final","",Scopus,2-s2.0-63049099152
"Wei, Q., Zhang, H., Dai, J.","23092563300;56122851800;35304642700;","Model-free multiobjective approximate dynamic programming for discrete-time nonlinear systems with general performance index functions",2009,"Neurocomputing","72","7-9",,"1839","1848",,92,"10.1016/j.neucom.2008.05.012","https://www.scopus.com/inward/record.uri?eid=2-s2.0-61849184281&doi=10.1016%2fj.neucom.2008.05.012&partnerID=40&md5=ce84d17e4edde31300d11e2c294be30e",Article,"Final","",Scopus,2-s2.0-61849184281
"Zheng, C.-D., Zhang, H., Wang, Z.","35390466600;56122851800;54989199600;","Novel delay-dependent criteria for global robust exponential stability of delayed cellular neural networks with norm-bounded uncertainties",2009,"Neurocomputing","72","7-9",,"1744","1754",,35,"10.1016/j.neucom.2008.08.017","https://www.scopus.com/inward/record.uri?eid=2-s2.0-61849152961&doi=10.1016%2fj.neucom.2008.08.017&partnerID=40&md5=e4667237afb57e60d26867dc3342a287",Article,"Final","",Scopus,2-s2.0-61849152961
"Dong, M., Zhang, H., Wang, Y.","35932048000;56122851800;55733933500;","Dynamics analysis of impulsive stochastic Cohen-Grossberg neural networks with Markovian jumping and mixed time delays",2009,"Neurocomputing","72","7-9",,"1999","2004",,54,"10.1016/j.neucom.2008.12.007","https://www.scopus.com/inward/record.uri?eid=2-s2.0-61849133380&doi=10.1016%2fj.neucom.2008.12.007&partnerID=40&md5=7ab50b2c3a86ffde0bedeebab950f752",Article,"Final","",Scopus,2-s2.0-61849133380
"Wang, Z., Zhang, H.","54989199600;56122851800;","Delay dependent stability criteria for recurrent neural networks with time varying delays",2009,"Journal of Control Theory and Applications","7","1",,"9","13",,2,"10.1007/s11768-009-7134-2","https://www.scopus.com/inward/record.uri?eid=2-s2.0-61349118673&doi=10.1007%2fs11768-009-7134-2&partnerID=40&md5=bd7d85899ab973e1ea5defc71efc5f5c",Article,"Final","",Scopus,2-s2.0-61349118673
"Xie, X.-P., Zhang, H.-G.","26032736600;56122851800;","Fuzzy hyperbolic H∞ filter for a class of nonlinear stochastic systems",2009,"Dongbei Daxue Xuebao/Journal of Northeastern University","30","2",,"158","161",,1,,"https://www.scopus.com/inward/record.uri?eid=2-s2.0-60949086200&partnerID=40&md5=9bee33a9084af03b24c9b47a957201c3",Article,"Final","",Scopus,2-s2.0-60949086200
"Zhang, H., Li, M., Yang, J., Yang, D.","56122851800;56926994300;57206003333;57226015555;","Fuzzy model-based robust networked control for a class of nonlinear systems",2009,"IEEE Transactions on Systems, Man, and Cybernetics Part A:Systems and Humans","39","2",,"437","447",,131,"10.1109/TSMCA.2008.2010787","https://www.scopus.com/inward/record.uri?eid=2-s2.0-62149135885&doi=10.1109%2fTSMCA.2008.2010787&partnerID=40&md5=8d800c961eb9d031147a5218f3032d36",Article,"Final","",Scopus,2-s2.0-62149135885
"Luo, Y.-H., Zhang, H.-G., Yang, D.-S.","55571384900;56122851800;57206705036;","Neural network controller design and simulation based on saturation compensator",2009,"Xitong Fangzhen Xuebao / Journal of System Simulation","21","1",,"184","188",,5,,"https://www.scopus.com/inward/record.uri?eid=2-s2.0-60649118745&partnerID=40&md5=e126aaeb52ee1c5684070610c1fe9424",Article,"Final","",Scopus,2-s2.0-60649118745
"Zhang, H., Wang, Z., Liu, D.","56122851800;55912910200;55857948600;","Preface",2009,"Communications and Control Engineering",,"9781848825222",,"ix","xiv",,,,"https://www.scopus.com/inward/record.uri?eid=2-s2.0-85049891947&partnerID=40&md5=97f41bdd90af25db0b91bc5885dcee64",Editorial,"Final","",Scopus,2-s2.0-85049891947
"Liu, Z., Wang, Z., Zhang, H., Luo, Y.","35201546200;55912910200;56122851800;55571384900;","H∞ control for T-S fuzzy neutral systems with time-varying delays and actuator saturation",2009,"Proceedings of the IEEE Conference on Decision and Control",,,"5399558","3093","3098",,1,"10.1109/CDC.2009.5399558","https://www.scopus.com/inward/record.uri?eid=2-s2.0-77950809433&doi=10.1109%2fCDC.2009.5399558&partnerID=40&md5=9e7673f9da0aede1d0461f4ff3b7d0b0",Conference Paper,"Final","",Scopus,2-s2.0-77950809433
"Ma, T., Zhang, H., Liu, D., Wang, Z.","57192894084;56122851800;55857948600;55912910200;","A novel LMI approach to global impulsive exponential synchronization of chaotic delayed neural networks",2009,"Proceedings of the IEEE Conference on Decision and Control",,,"5400055","626","631",,2,"10.1109/CDC.2009.5400055","https://www.scopus.com/inward/record.uri?eid=2-s2.0-77950808396&doi=10.1109%2fCDC.2009.5400055&partnerID=40&md5=34d9f01518bfc3baf08126d7d7d3544e",Conference Paper,"Final","",Scopus,2-s2.0-77950808396
"Fu, J., Zhang, H., Ma, T.","35242310800;56122851800;57192894084;","Delay-probability-distribution-dependent robust stability analysis for stochastic neural networks with time-varying delay",2009,"Progress in Natural Science","19","10",,"1333","1340",,26,"10.1016/j.pnsc.2008.11.012","https://www.scopus.com/inward/record.uri?eid=2-s2.0-70350622439&doi=10.1016%2fj.pnsc.2008.11.012&partnerID=40&md5=5e21a99cd1d9a12e14df4ed9fa061eb5",Article,"Final","All Open Access, Gold",Scopus,2-s2.0-70350622439
"Zheng, C.-D., Zhang, H., Wang, Z.","35390466600;56122851800;54989199600;","Delay-dependent globally exponential stability criteria for static neural networks: An LMI approach",2009,"IEEE Transactions on Circuits and Systems II: Express Briefs","56","7",,"605","609",,49,"10.1109/TCSII.2009.2023278","https://www.scopus.com/inward/record.uri?eid=2-s2.0-68249140322&doi=10.1109%2fTCSII.2009.2023278&partnerID=40&md5=2d172c057e131ca3814a19d01ecc8a26",Article,"Final","",Scopus,2-s2.0-68249140322
"Liu, X.-C., Zhang, H.-G., Chu, E.-H., Yan, S.-J.","23097535400;56122851800;25622912000;15835960400;","Power control scheme for three-phase voltage-type PWM rectifiers",2009,"Dianji yu Kongzhi Xuebao/Electric Machines and Control","13","1",,"47","51+56",,17,,"https://www.scopus.com/inward/record.uri?eid=2-s2.0-65549126874&partnerID=40&md5=c8857930bc2d929fcc188b92c0be4a6a",Article,"Final","",Scopus,2-s2.0-65549126874
"Zheng, C.-D., Zhang, H., Wang, Z.","35390466600;56122851800;54989199600;","New delay-dependent global exponential stability criterion for cellular-type neural networks with time-varying delays",2009,"IEEE Transactions on Circuits and Systems II: Express Briefs","56","3",,"250","254",,39,"10.1109/TCSII.2008.2011594","https://www.scopus.com/inward/record.uri?eid=2-s2.0-64049101538&doi=10.1109%2fTCSII.2008.2011594&partnerID=40&md5=c009d4c8758e891bf63a0003c6dd1b79",Article,"Final","",Scopus,2-s2.0-64049101538
"Zhang, H., Wang, Z., Liu, D.","56122851800;54989199600;55857948600;","Global asymptotic stability and robust stability of a class of Cohen-Grossberg neural networks with mixed delays",2009,"IEEE Transactions on Circuits and Systems I: Regular Papers","56","3",,"616","629",,98,"10.1109/TCSI.2008.2002556","https://www.scopus.com/inward/record.uri?eid=2-s2.0-63449122906&doi=10.1109%2fTCSI.2008.2002556&partnerID=40&md5=db5c0f5125f2271da0900c818a792e4d",Article,"Final","",Scopus,2-s2.0-63449122906
"Wang, Z., Zhang, H., Yu, W.","54989199600;56122851800;55993706000;","Robust stability of Cohen-Grossberg neural networks via state transmission matrix",2009,"IEEE Transactions on Neural Networks","20","1",,"169","174",,51,"10.1109/TNN.2008.2009119","https://www.scopus.com/inward/record.uri?eid=2-s2.0-58649104456&doi=10.1109%2fTNN.2008.2009119&partnerID=40&md5=40c7c245747cdcafb1c9ace3d7dfc1b3",Article,"Final","",Scopus,2-s2.0-58649104456
"Liu, Z., Zhang, H., Wang, Z.","35201546200;56122851800;54989199600;","Novel stability criterions of a new fuzzy cellular neural networks with time-varying delays",2009,"Neurocomputing","72","4-6",,"1056","1064",,82,"10.1016/j.neucom.2008.04.001","https://www.scopus.com/inward/record.uri?eid=2-s2.0-58149470844&doi=10.1016%2fj.neucom.2008.04.001&partnerID=40&md5=b88a570256e8d52cab53511aef8894c4",Article,"Final","",Scopus,2-s2.0-58149470844
"Wang, Z., Zhang, H., Yu, W.","54989199600;56122851800;55993706000;","Robust stability criteria for interval Cohen-Grossberg neural networks with time varying delay",2009,"Neurocomputing","72","4-6",,"1105","1110",,50,"10.1016/j.neucom.2008.03.001","https://www.scopus.com/inward/record.uri?eid=2-s2.0-58149464540&doi=10.1016%2fj.neucom.2008.03.001&partnerID=40&md5=9bb3313643eab3ed6fac68d4a942b1a1",Article,"Final","",Scopus,2-s2.0-58149464540
"Yin, Z.-Y., Zhang, H.-G.","9232988700;56122851800;","H∞ robust tolerant control for a class of nonlinear systems with time delay based on fuzzy models",2008,"Xitong Fangzhen Xuebao / Journal of System Simulation","20","24",,"6783","6786+6790",,2,,"https://www.scopus.com/inward/record.uri?eid=2-s2.0-58149316137&partnerID=40&md5=494ebf52dcecfc784c5892df5418cd4a",Article,"Final","",Scopus,2-s2.0-58149316137
"Yang, D., Zhang, H.","57226015555;56122851800;","Networked control for T-S fuzzy systems with time delay",2008,"Networked Control Systems: Theory and Applications",,,,"197","232",,2,"10.1007/978-1-84800-215-9_7","https://www.scopus.com/inward/record.uri?eid=2-s2.0-84892011756&doi=10.1007%2f978-1-84800-215-9_7&partnerID=40&md5=b77e7883251c006c6f4bfce015cc2241",Book Chapter,"Final","",Scopus,2-s2.0-84892011756
"Ma, T., Zhang, H., Liu, D.","57192894084;56122851800;55857948600;","Robust impulsive synchronization for a class of unified chaotic systems with parameter uncertainty",2008,"IFAC Proceedings Volumes (IFAC-PapersOnline)","17","1 PART 1",,"","",,2,"10.3182/20080706-5-KR-1001.0296","https://www.scopus.com/inward/record.uri?eid=2-s2.0-79961020097&doi=10.3182%2f20080706-5-KR-1001.0296&partnerID=40&md5=c38d5e6283706d76045d638a751359dc",Conference Paper,"Final","",Scopus,2-s2.0-79961020097
"Liu, Z., Zhang, H., Liu, D.","35201546200;56122851800;55857948600;","Novel delay-dependent exponential stability of a class of fuzzy cellular neural networks with time-V",2008,"IFAC Proceedings Volumes (IFAC-PapersOnline)","17","1 PART 1",,"","",,,"10.3182/20080706-5-KR-1001.0293","https://www.scopus.com/inward/record.uri?eid=2-s2.0-79961018749&doi=10.3182%2f20080706-5-KR-1001.0293&partnerID=40&md5=3c3e9899a63759d3fa02d3c29638ea0b",Conference Paper,"Final","",Scopus,2-s2.0-79961018749
"Geng, J., Zhang, H., Liu, X., Tong, Y.","22953711100;56122851800;23097535400;35977046000;","The development of high speed permanence magnetic motor/generator",2008,"2008 World Automation Congress, WAC 2008",,,"4699245","","",,1,,"https://www.scopus.com/inward/record.uri?eid=2-s2.0-77950821573&partnerID=40&md5=12ef512aa414852b9433d4e1051dc551",Conference Paper,"Final","",Scopus,2-s2.0-77950821573
"Xie, X., Zhang, H., Feng, J.","26032736600;56122851800;55350596800;","A new approach to relaxed quadratic stabilization for stochastic T S fuzzy systems",2008,"Conference Proceedings - IEEE International Conference on Systems, Man and Cybernetics",,,"4811338","571","576",,,"10.1109/ICSMC.2008.4811338","https://www.scopus.com/inward/record.uri?eid=2-s2.0-69949187211&doi=10.1109%2fICSMC.2008.4811338&partnerID=40&md5=7a1cb81fcbacb4bf1757c2769860d13f",Conference Paper,"Final","",Scopus,2-s2.0-69949187211
"Fu, J., Feng, J., Zhang, H.","35242310800;55350596800;56122851800;","Robust stability of markovian jumping stochastic neural networks with interval time-varying delay",2008,"Conference Proceedings - IEEE International Conference on Systems, Man and Cybernetics",,,"4811862","3630","3635",,,"10.1109/ICSMC.2008.4811862","https://www.scopus.com/inward/record.uri?eid=2-s2.0-69949152302&doi=10.1109%2fICSMC.2008.4811862&partnerID=40&md5=8ae7cec2e3acf3273bd4d157305a7a9c",Conference Paper,"Final","",Scopus,2-s2.0-69949152302
"Zhang, H.-G., Zhao, Y., Yu, W., Yang, D.-S.","56122851800;56258250600;55993706000;57206705036;","A unified approach to fuzzy modelling and robust synchronization of different hyperchaotic systems",2008,"Chinese Physics B","17","11",,"4056","4066",,35,"10.1088/1674-1056/17/11/019","https://www.scopus.com/inward/record.uri?eid=2-s2.0-62649140873&doi=10.1088%2f1674-1056%2f17%2f11%2f019&partnerID=40&md5=95f547baafa9cc82848421e7481f1f48",Article,"Final","",Scopus,2-s2.0-62649140873
"Ma, T.-D., Zhang, H.-G., Fu, J.","57192894084;56122851800;35242310800;","Exponential synchronization of stochastic impulsive perturbed chaotic Lur'e systems with time-varying delay and parametric uncertainty",2008,"Chinese Physics B","17","12",,"4407","4417",,54,"10.1088/1674-1056/17/12/013","https://www.scopus.com/inward/record.uri?eid=2-s2.0-62649107638&doi=10.1088%2f1674-1056%2f17%2f12%2f013&partnerID=40&md5=c831332a78c2141c7491c18851ce5df9",Article,"Final","",Scopus,2-s2.0-62649107638
"Zhang, H., Wang, Z., Liu, D.","56122851800;54989199600;55857948600;","Robust stability analysis for interval Cohen-Grossberg neural networks with unknown time-varying delays",2008,"IEEE Transactions on Neural Networks","19","11",,"1942","1955",,107,"10.1109/TNN.2008.2006337","https://www.scopus.com/inward/record.uri?eid=2-s2.0-56449125534&doi=10.1109%2fTNN.2008.2006337&partnerID=40&md5=2c1107d9b9eccf5171c35163fd568048",Article,"Final","All Open Access, Green",Scopus,2-s2.0-56449125534
"Wang, Z.-S., Zhang, H.-G., Yu, W., Zhang, Q.-L.","54989199600;56122851800;55993706000;7406719568;","LMI approach to robust stability analysis of Cohen-Grossberg neural networks with time varying delay",2008,"Tien Tzu Hsueh Pao/Acta Electronica Sinica","36","11",,"2220","2223",,3,,"https://www.scopus.com/inward/record.uri?eid=2-s2.0-57749116033&partnerID=40&md5=c1503378eca15c98ea7c42887385e3d2",Article,"Final","",Scopus,2-s2.0-57749116033
"Luo, Y.-H., Zhang, H.-G., Zhang, Q.-L.","55571384900;56122851800;7406719568;","Neural network adaptive controller design for a class of affine nonlinear system with unknown nonsymmetric actuator dead-zone",2008,"Tien Tzu Hsueh Pao/Acta Electronica Sinica","36","11",,"2113","2119",,3,,"https://www.scopus.com/inward/record.uri?eid=2-s2.0-57749099231&partnerID=40&md5=840ee871a9c37d3030fd11511b04a644",Article,"Final","",Scopus,2-s2.0-57749099231
"Liu, J.-H., Zhang, H.-G., Feng, J.","25921523900;56122851800;55350596800;","Investigation of chaotic behavior for press time series of oil pipeline",2008,"Wuli Xuebao/Acta Physica Sinica","57","11",,"6868","6877",,19,,"https://www.scopus.com/inward/record.uri?eid=2-s2.0-57449090333&partnerID=40&md5=6bd53294f76350a3b521f5b825fc9597",Article,"Final","",Scopus,2-s2.0-57449090333
