作者,作者 ID,标题,年份,来源出版物名称,卷,期,论文编号,起始页码,结束页码,页码计数,施引文献,DOI,链接,文献类型,出版阶段,开放获取,来源出版物,EID
"Han, J., Zhang, H., Wang, Y., Liu, Y.","56967267400;56122851800;55733933500;57216668566;","Disturbance observer based fault estimation and dynamic output feedback fault tolerant control for fuzzy systems with local nonlinear models",2015,"ISA Transactions","59",,,"114","124",,54,"10.1016/j.isatra.2015.08.015","https://www.scopus.com/inward/record.uri?eid=2-s2.0-84947583766&doi=10.1016%2fj.isatra.2015.08.015&partnerID=40&md5=5b67336c2d6fe1b63b0995d0757ef0d1",Article,"Final","",Scopus,2-s2.0-84947583766
"Zhang, H., Wang, J., Wang, Z., Liang, H.","56122851800;57211089822;54989199600;18437702000;","Mode-Dependent Stochastic Synchronization for Markovian Coupled Neural Networks With Time-Varying Mode-Delays",2015,"IEEE Transactions on Neural Networks and Learning Systems","26","11","7015580","2621","2634",,63,"10.1109/TNNLS.2014.2387885","https://www.scopus.com/inward/record.uri?eid=2-s2.0-84945957378&doi=10.1109%2fTNNLS.2014.2387885&partnerID=40&md5=452fa20b06811f6ecaa666f25fca39db",Article,"Final","",Scopus,2-s2.0-84945957378
"Wang, J., Zhang, H., Wang, Z.","57211089822;56122851800;54989199600;","Sampled-data synchronization for complex networks based on discontinuous LKF and mixed convex combination",2015,"Journal of the Franklin Institute","352","11",,"4741","4757",,30,"10.1016/j.jfranklin.2015.07.007","https://www.scopus.com/inward/record.uri?eid=2-s2.0-84945906459&doi=10.1016%2fj.jfranklin.2015.07.007&partnerID=40&md5=7632f6183da553a26c856ce9e36b4e95",Article,"Final","",Scopus,2-s2.0-84945906459
"Zhang, H., Zhang, Z., Wang, Z., Shan, Q.","56122851800;55721829600;55912910200;53880779400;","New results on stability and stabilization of networked control systems with short time-varying delay",2015,"IEEE Transactions on Cybernetics","46","10","2489563","2772","2781",,45,"10.1109/TCYB.2015.2489563","https://www.scopus.com/inward/record.uri?eid=2-s2.0-84945918584&doi=10.1109%2fTCYB.2015.2489563&partnerID=40&md5=31c4f701c0772038fa91dc71034acba2",Article,"Final","",Scopus,2-s2.0-84945918584
"Yang, Z., Zhang, H.","57198699305;56122851800;","Prediction of melt rate of vibrating-electrode Electroslag Remelting process using artificial neural network",2015,"2015 5th International Conference on Information Science and Technology, ICIST 2015",,,"7288933","20","24",,,"10.1109/ICIST.2015.7288933","https://www.scopus.com/inward/record.uri?eid=2-s2.0-84961589334&doi=10.1109%2fICIST.2015.7288933&partnerID=40&md5=7d1f25d912db93861fd1526a217af1e1",Conference Paper,"Final","",Scopus,2-s2.0-84961589334
"Wang, Z., Liu, L., Shan, Q.-H., Zhang, H.","54989199600;57201199341;53880779400;56122851800;","Stability Criteria for Recurrent Neural Networks with Time-Varying Delay Based on Secondary Delay Partitioning Method",2015,"IEEE Transactions on Neural Networks and Learning Systems","26","10","7010942","2589","2595",,122,"10.1109/TNNLS.2014.2387434","https://www.scopus.com/inward/record.uri?eid=2-s2.0-84943780198&doi=10.1109%2fTNNLS.2014.2387434&partnerID=40&md5=5d90ce806fe14c2fe06e1a922458a958",Article,"Final","",Scopus,2-s2.0-84943780198
"Sun, Q., Zhou, J., Guerrero, J.M., Zhang, H.","15019590100;40561998000;35588010400;56122851800;","Hybrid Three-Phase/Single-Phase Microgrid Architecture With Power Management Capabilities",2015,"IEEE Transactions on Power Electronics","30","10",,"5964","5977",,118,"10.1109/TPEL.2014.2379925","https://www.scopus.com/inward/record.uri?eid=2-s2.0-84930645788&doi=10.1109%2fTPEL.2014.2379925&partnerID=40&md5=6dc0f856b01bdbf5b718bf9b6421d194",Article,"Final","All Open Access, Green",Scopus,2-s2.0-84930645788
"Xiao, G., Zhang, H., Luo, Y.","55840371000;56122851800;55571384900;","Online optimal control of unknown discrete-time nonlinear systems by using time-based adaptive dynamic programming",2015,"Neurocomputing","165",,,"163","170",,33,"10.1016/j.neucom.2015.03.006","https://www.scopus.com/inward/record.uri?eid=2-s2.0-84929958391&doi=10.1016%2fj.neucom.2015.03.006&partnerID=40&md5=eecf50d283f417a69da804da7af55bf2",Article,"Final","",Scopus,2-s2.0-84929958391
"Cui, Y., Zhang, H., Wang, Y., Zhang, Z.","56580948100;56122851800;55733933500;55721829600;","Adaptive neural dynamic surface control for a class of uncertain nonlinear systems with disturbances",2015,"Neurocomputing","165",,,"152","158",,21,"10.1016/j.neucom.2015.03.004","https://www.scopus.com/inward/record.uri?eid=2-s2.0-84929952876&doi=10.1016%2fj.neucom.2015.03.004&partnerID=40&md5=4fcfa31addd77413dfa3f62e4a9d8dc2",Article,"Final","",Scopus,2-s2.0-84929952876
"Wang, L., Peng, J., Liu, X., Zhang, H.","56383919900;56383374300;55717309300;56122851800;","Further study on local stabilization of continuous-time nonlinear systems presented as Takagi-Sugeno fuzzy model",2015,"Journal of Intelligent and Fuzzy Systems","29","1",,"283","292",,6,"10.3233/IFS-151594","https://www.scopus.com/inward/record.uri?eid=2-s2.0-84944057820&doi=10.3233%2fIFS-151594&partnerID=40&md5=cacf3589e6ed5f2ea6adfffe2e14f5cb",Article,"Final","",Scopus,2-s2.0-84944057820
"Sun, X., Zhang, H., Wang, Y.","57194577801;56122851800;55733933500;","Stabilization algorithm for interval type-2 TSK fuzzy logic control systems with bounded time-varying delay",2015,"Chinese Control Conference, CCC","2015-September",,"7259657","321","325",,4,"10.1109/ChiCC.2015.7259657","https://www.scopus.com/inward/record.uri?eid=2-s2.0-84946563311&doi=10.1109%2fChiCC.2015.7259657&partnerID=40&md5=cb69ad059127efe044e73125a8db1ad1",Conference Paper,"Final","",Scopus,2-s2.0-84946563311
"Wang, Y., Sun, X., Hui, G., Zhang, H.","55733933500;57194577801;36022477400;56122851800;","Distributed adaptive static output feedback consensus of multi-agent systems",2015,"Chinese Control Conference, CCC","2015-September",,"7260849","7622","7626",,2,"10.1109/ChiCC.2015.7260849","https://www.scopus.com/inward/record.uri?eid=2-s2.0-84946561147&doi=10.1109%2fChiCC.2015.7260849&partnerID=40&md5=11f50ef1d5693d5907c060b5b3fcd605",Conference Paper,"Final","",Scopus,2-s2.0-84946561147
"Wang, T., Zhang, H.-G.","56158679100;56122851800;","Stochastic linear quadratic optimal control for continuous-time systems based on policy iteration",2015,"Kongzhi yu Juece/Control and Decision","30","9",,"1674","1678",,1,"10.13195/j.kzyjc.2014.0856","https://www.scopus.com/inward/record.uri?eid=2-s2.0-84946226925&doi=10.13195%2fj.kzyjc.2014.0856&partnerID=40&md5=b7a56e238f7bb41dfcdfd4ae8c82f0a7",Article,"Final","",Scopus,2-s2.0-84946226925
"Liang, H., Zhang, H., Wang, Z., Wang, J.","18437702000;56122851800;54989199600;57211089822;","Cooperative robust output regulation for heterogeneous second-order discrete-time multi-agent systems",2015,"Neurocomputing","162",,,"41","47",,18,"10.1016/j.neucom.2015.04.009","https://www.scopus.com/inward/record.uri?eid=2-s2.0-84929284987&doi=10.1016%2fj.neucom.2015.04.009&partnerID=40&md5=7d6b72f9c04d519a8e8a6aa004ece790",Article,"Final","",Scopus,2-s2.0-84929284987
"Chu, E., Huang, L., Zhang, H., Feng, J.","25622912000;56818167700;56122851800;55350596800;","Study on a double auxiliary resonant commutated pole three-phase soft-switching inverter",2015,"Zhongguo Dianji Gongcheng Xuebao/Proceedings of the Chinese Society of Electrical Engineering","35","15",,"3912","3920",,8,"10.13334/j.0258-8013.pcsee.2015.15.021","https://www.scopus.com/inward/record.uri?eid=2-s2.0-84940862773&doi=10.13334%2fj.0258-8013.pcsee.2015.15.021&partnerID=40&md5=7059a9462898c6a0f4eafcde6ddfc6dd",Article,"Final","",Scopus,2-s2.0-84940862773
"Dong, J., Yang, G.-H., Zhang, H.","16027721400;7405751358;56122851800;","Stability Analysis of T-S Fuzzy Control Systems by Using Set Theory",2015,"IEEE Transactions on Fuzzy Systems","23","4","6824788","827","841",,67,"10.1109/TFUZZ.2014.2328016","https://www.scopus.com/inward/record.uri?eid=2-s2.0-84937815957&doi=10.1109%2fTFUZZ.2014.2328016&partnerID=40&md5=bdc12ff17d1cb47fee6ab59d52d6afc9",Article,"Final","",Scopus,2-s2.0-84937815957
"Sun, Q., Teng, F., Zhang, H., Ma, D.","15019590100;57216398534;56122851800;57208604953;","Construction of dynamic coordinated optimization control system for energy internet",2015,"Zhongguo Dianji Gongcheng Xuebao/Proceedings of the Chinese Society of Electrical Engineering","35","14",,"3667","3677",,78,"10.13334/j.0258-8013.pcsee.2015.14.022","https://www.scopus.com/inward/record.uri?eid=2-s2.0-84938818683&doi=10.13334%2fj.0258-8013.pcsee.2015.14.022&partnerID=40&md5=842767748c47f7be84bc86086483b368",Article,"Final","",Scopus,2-s2.0-84938818683
"Cui, Y., Zhang, H., Qu, Q., Yu, R.","56580948100;56122851800;56927738100;56927379100;","Fuzzy adaptive dynamic surface control approach for strict-feedback nonlinear systems with disturbances",2015,"Proceedings of the 2015 27th Chinese Control and Decision Conference, CCDC 2015",,,"7161733","442","447",,,"10.1109/CCDC.2015.7161733","https://www.scopus.com/inward/record.uri?eid=2-s2.0-84945588276&doi=10.1109%2fCCDC.2015.7161733&partnerID=40&md5=0f1bed3d7423f348318c63f6d2852f2e",Conference Paper,"Final","",Scopus,2-s2.0-84945588276
"Zhang, H., Feng, T., Yang, G.-H., Liang, H.","56122851800;57203905583;7405751358;18437702000;","Distributed Cooperative Optimal Control for Multiagent Systems on Directed Graphs: An Inverse Optimal Approach",2015,"IEEE Transactions on Cybernetics","45","7","6894574","1315","1326",,206,"10.1109/TCYB.2014.2350511","https://www.scopus.com/inward/record.uri?eid=2-s2.0-85028229548&doi=10.1109%2fTCYB.2014.2350511&partnerID=40&md5=8b1dfd463a6f7feb359b52552d24a7ed",Article,"Final","",Scopus,2-s2.0-85028229548
"Zhao, J.-R., Wang, Z.-S., Wang, J.-D., Zhang, H.-G.","56746671800;54989199600;36716826500;56122851800;","Fault characteristics of microgrid and protection strategies",2015,"Shanghai Jiaotong Daxue Xuebao/Journal of Shanghai Jiaotong University","49","6",,"913","922",,4,"10.16183/j.cnki.jsjtu.2015.06.029","https://www.scopus.com/inward/record.uri?eid=2-s2.0-84938364430&doi=10.16183%2fj.cnki.jsjtu.2015.06.029&partnerID=40&md5=db4173f59f92501cd197053b5bb6c800",Article,"Final","",Scopus,2-s2.0-84938364430
"Song, R., Lewis, F., Wei, Q., Zhang, H.-G., Jiang, Z.-P., Levine, D.","36096195700;24729085600;23092563300;56122851800;7404279463;35461937000;","Multiple Actor-Critic Structures for Continuous-Time Optimal Control Using Input-Output Data",2015,"IEEE Transactions on Neural Networks and Learning Systems","26","4","7050362","851","865",,104,"10.1109/TNNLS.2015.2399020","https://www.scopus.com/inward/record.uri?eid=2-s2.0-85027929469&doi=10.1109%2fTNNLS.2015.2399020&partnerID=40&md5=5155795fa3dc495940a7306b2818f1b2",Article,"Final","All Open Access, Bronze",Scopus,2-s2.0-85027929469
"Liu, L., Wang, Z., Zhang, H.","57201199341;54989199600;56122851800;","Adaptive NN fault-tolerant control for discrete-time systems in triangular forms with actuator fault",2015,"Neurocomputing","152",,,"209","221",,43,"10.1016/j.neucom.2014.10.076","https://www.scopus.com/inward/record.uri?eid=2-s2.0-84921029436&doi=10.1016%2fj.neucom.2014.10.076&partnerID=40&md5=baf7e3eada2979be0e34c80ccb6ecd18",Article,"Final","",Scopus,2-s2.0-84921029436
"Zhang, H., Cai, T., Wang, Y.","56122851800;52563165300;55733933500;","On τ-decomposition frequency-sweeping strategy to rational-order fractional systems with commensurate delays",2015,"IET Control Theory and Applications","9","5",,"723","728",,1,"10.1049/iet-cta.2014.0852","https://www.scopus.com/inward/record.uri?eid=2-s2.0-84926028934&doi=10.1049%2fiet-cta.2014.0852&partnerID=40&md5=88a3c703383de165f0e33ed2cd3e6285",Article,"Final","",Scopus,2-s2.0-84926028934
"Zhang, Z., Zhang, H., Wang, Z., Feng, J.","55721829600;56122851800;55912910200;55350596800;","Optimal robust non-fragile H∞ control for networked control systems with uncertain time-delays",2015,"Proceedings of the World Congress on Intelligent Control and Automation (WCICA)","2015-March","March","7053398","4076","4081",,8,"10.1109/WCICA.2014.7053398","https://www.scopus.com/inward/record.uri?eid=2-s2.0-84932181347&doi=10.1109%2fWCICA.2014.7053398&partnerID=40&md5=0d6653a5ee24a9a4524338424678506f",Conference Paper,"Final","",Scopus,2-s2.0-84932181347
"Wang, Y., Zhang, H., Zhang, J., Wang, Y.","55969167500;56122851800;56401383600;55733933500;","An SOS-Based Observer Design for Discrete-Time Polynomial Fuzzy Systems",2015,"International Journal of Fuzzy Systems","17","1",,"94","104",,23,"10.1007/s40815-015-0003-x","https://www.scopus.com/inward/record.uri?eid=2-s2.0-84947555353&doi=10.1007%2fs40815-015-0003-x&partnerID=40&md5=0084bd4e19943ce797d9460fce349e6c",Article,"Final","",Scopus,2-s2.0-84947555353
"Zhang, Y., Zhang, H., Gao, W.","57193153911;56122851800;7402758471;","Multiple Wada basins with common boundaries in nonlinear driven oscillators",2015,"Nonlinear Dynamics","79","4",,"2667","2674",,11,"10.1007/s11071-014-1839-6","https://www.scopus.com/inward/record.uri?eid=2-s2.0-84925504408&doi=10.1007%2fs11071-014-1839-6&partnerID=40&md5=6d55c3eb991900fb56998e89e76a0fa8",Article,"Final","",Scopus,2-s2.0-84925504408
"Zhang, Y., Zhang, H.","57193153911;56122851800;","Metamorphoses of basin boundaries with complex topology in an archetypal oscillator",2015,"Nonlinear Dynamics","79","4",,"2309","2323",,8,"10.1007/s11071-014-1813-3","https://www.scopus.com/inward/record.uri?eid=2-s2.0-84925483336&doi=10.1007%2fs11071-014-1813-3&partnerID=40&md5=89ffb632b72f3771d011fe3972d2fd0f",Article,"Final","",Scopus,2-s2.0-84925483336
"Wang, J., Zhang, H., Wang, Z., Liang, H.","57211089822;56122851800;54989199600;18437702000;","Stochastic synchronization for Markovian coupled neural networks with partial information on transition probabilities",2015,"Neurocomputing","149","PB",,"983","992",,25,"10.1016/j.neucom.2014.07.035","https://www.scopus.com/inward/record.uri?eid=2-s2.0-84922484076&doi=10.1016%2fj.neucom.2014.07.035&partnerID=40&md5=5d4acec8d33598353049d090bf44deb5",Article,"Final","",Scopus,2-s2.0-84922484076
"Zhong, X., He, H., Zhang, H., Wang, Z.","55365239400;24802077000;56122851800;54989199600;","A neural network based online learning and control approach for Markov jump systems",2015,"Neurocomputing","149","Part A",,"116","123",,29,"10.1016/j.neucom.2014.01.060","https://www.scopus.com/inward/record.uri?eid=2-s2.0-84922019551&doi=10.1016%2fj.neucom.2014.01.060&partnerID=40&md5=824c5f024fe6099341c39f45a80bb69a",Article,"Final","",Scopus,2-s2.0-84922019551
"Feng, T., Zhang, H., Luo, Y., Zhang, J.","57203905583;56122851800;55571384900;55338770700;","Stability analysis of heuristic dynamic programming algorithm for nonlinear systems",2015,"Neurocomputing","149","PC",,"1461","1468",,9,"10.1016/j.neucom.2014.08.046","https://www.scopus.com/inward/record.uri?eid=2-s2.0-84912095277&doi=10.1016%2fj.neucom.2014.08.046&partnerID=40&md5=919848048d809979895b65534bf85d1e",Article,"Final","",Scopus,2-s2.0-84912095277
"Zhang, H., Zhang, J., Yang, G.-H., Luo, Y.","56122851800;55338770700;7405751358;55571384900;","Leader-based optimal coordination control for the consensus problem of multiagent differential games via fuzzy adaptive dynamic programming",2015,"IEEE Transactions on Fuzzy Systems","23","1","6762934","152","163",,335,"10.1109/TFUZZ.2014.2310238","https://www.scopus.com/inward/record.uri?eid=2-s2.0-84961378056&doi=10.1109%2fTFUZZ.2014.2310238&partnerID=40&md5=6120a44e8457429e8cd2bfae1d2a8078",Article,"Final","All Open Access, Green",Scopus,2-s2.0-84961378056
"Zhang, H., Zhang, Y., Luo, G.","56122851800;57193153911;55635048300;","Basins of coexisting multi-dimensional tori in a vibro-impact system",2015,"Nonlinear Dynamics","79","3",,"2177","2185",,11,"10.1007/s11071-014-1803-5","https://www.scopus.com/inward/record.uri?eid=2-s2.0-84925493522&doi=10.1007%2fs11071-014-1803-5&partnerID=40&md5=44eeb257a450ae437ddb7514f9a32182",Article,"Final","",Scopus,2-s2.0-84925493522
"Chen, W., Hua, S., Zhang, H.","55650681800;55648087100;56122851800;","Consensus-based distributed cooperative learning from closed-loop neural control systems",2015,"IEEE Transactions on Neural Networks and Learning Systems","26","2","6810164","331","345",,62,"10.1109/TNNLS.2014.2315535","https://www.scopus.com/inward/record.uri?eid=2-s2.0-84921486723&doi=10.1109%2fTNNLS.2014.2315535&partnerID=40&md5=3a62266e016fc9606d7f86f69ecf470d",Article,"Final","",Scopus,2-s2.0-84921486723
"Qin, C., Wang, Y., Luo, Y., Zhang, H.","55445054400;55733933500;55571384900;56122851800;","Neural network-based near-optimal control for nonlinear discrete-time zero-sum differential games associated with the H∞ control problem",2015,"5th International Conference on Intelligent Control and Information Processing, ICICIP 2014 - Proceedings",,,"7010275","341","347",,1,"10.1109/ICICIP.2014.7010275","https://www.scopus.com/inward/record.uri?eid=2-s2.0-84925340671&doi=10.1109%2fICICIP.2014.7010275&partnerID=40&md5=13bc90a4e4491e33c28be8863303fb0b",Conference Paper,"Final","",Scopus,2-s2.0-84925340671
"Li, Y.-S., Ma, D.-Z., Zhang, H.-G., Sun, Q.-Y.","56123408700;57208604953;56122851800;15019590100;","Critical nodes identification of power systems based on controllability of complex networks",2015,"Applied Sciences (Switzerland)","5","3",,"622","636",,23,"10.3390/app5030622","https://www.scopus.com/inward/record.uri?eid=2-s2.0-84973595193&doi=10.3390%2fapp5030622&partnerID=40&md5=4128d2870e26426cc2c2f3dc8979d51b",Article,"Final","All Open Access, Gold, Green",Scopus,2-s2.0-84973595193
"Zhang, J., Zhang, H., Liu, Z., Wang, Y.","55338770700;56122851800;35201546200;55733933500;","Model-free optimal controller design for continuous-time nonlinear systems by adaptive dynamic programming based on a precompensator",2015,"ISA Transactions","57",,,"63","70",,16,"10.1016/j.isatra.2014.08.018","https://www.scopus.com/inward/record.uri?eid=2-s2.0-84959858837&doi=10.1016%2fj.isatra.2014.08.018&partnerID=40&md5=083d8cf8ea71bd06191448b4d45c49fc",Article,"Final","",Scopus,2-s2.0-84959858837
"Wang, J., Zhang, H., Wang, Z., Liang, H.","57211089822;56122851800;54989199600;18437702000;","Local stochastic synchronization for Markovian neutral-type complex networks with partial information on transition probabilities",2015,"Neurocomputing","167",,,"474","487",,11,"10.1016/j.neucom.2015.04.046","https://www.scopus.com/inward/record.uri?eid=2-s2.0-84949659506&doi=10.1016%2fj.neucom.2015.04.046&partnerID=40&md5=cb2e23c53a00c914fd89e136696a2b8d",Article,"Final","",Scopus,2-s2.0-84949659506
"Liu, Z.W., Zhang, H.G., Sun, Q.Y.","35201546200;56122851800;15019590100;","Static output feedback stabilization for systems with time-varying delay based on a matrix transformation method",2015,"Science China Information Sciences","58","1",,"1","13",,14,"10.1007/s11432-014-5205-6","https://www.scopus.com/inward/record.uri?eid=2-s2.0-84925513742&doi=10.1007%2fs11432-014-5205-6&partnerID=40&md5=92732a4af2d6eeaf56a408dc7b7ef96d",Article,"Final","",Scopus,2-s2.0-84925513742
"Yang, J., Zhang, R., Sun, Q., Zhang, H.","57206003333;54947068500;15019590100;56122851800;","Optimal wind turbines micrositing in onshore wind farms using fuzzy genetic algorithm",2015,"Mathematical Problems in Engineering","2015",,"324203","","",,8,"10.1155/2015/324203","https://www.scopus.com/inward/record.uri?eid=2-s2.0-84925324948&doi=10.1155%2f2015%2f324203&partnerID=40&md5=f5c9e29bae523e4bae410e0e1404c267",Article,"Final","All Open Access, Gold, Green",Scopus,2-s2.0-84925324948
"Huang, B., Zhang, H., Gong, D., Wang, J.","41261545400;56122851800;42261584900;57211089822;","Synchronization analysis for static neural networks with hybrid couplings and time delays",2015,"Neurocomputing","148",,,"288","293",,30,"10.1016/j.neucom.2013.11.053","https://www.scopus.com/inward/record.uri?eid=2-s2.0-84908077421&doi=10.1016%2fj.neucom.2013.11.053&partnerID=40&md5=6abb43a38d68de0cdc53150401b77cc3",Article,"Final","",Scopus,2-s2.0-84908077421
"Luo, Y., Sun, Q., Zhang, H., Cui, L.","55571384900;15019590100;56122851800;35787018500;","Adaptive critic design-based robust neural network control for nonlinear distributed parameter systems with unknown dynamics",2015,"Neurocomputing","148",,,"200","208",,35,"10.1016/j.neucom.2013.08.049","https://www.scopus.com/inward/record.uri?eid=2-s2.0-84908068577&doi=10.1016%2fj.neucom.2013.08.049&partnerID=40&md5=cdd963702ea8ba7eee52606609fdaca9",Article,"Final","",Scopus,2-s2.0-84908068577
"Zhong, X., He, H., Zhang, H., Wang, Z.","55365239400;24802077000;56122851800;54989199600;","Optimal control for unknown discrete-time nonlinear markov jump systems using adaptive dynamic programming",2014,"IEEE Transactions on Neural Networks and Learning Systems","25","12","6755493","2141","2155",,101,"10.1109/TNNLS.2014.2305841","https://www.scopus.com/inward/record.uri?eid=2-s2.0-84913546840&doi=10.1109%2fTNNLS.2014.2305841&partnerID=40&md5=ba2018bbe480e71a0e9a947079d37efa",Article,"Final","",Scopus,2-s2.0-84913546840
"Zhang, H., Qin, C., Jiang, B., Luo, Y.","56122851800;55445054400;36047336900;55571384900;","Online adaptive policy learning algorithm for H∞ state feedback control of unknown affine nonlinear discrete-time systems",2014,"IEEE Transactions on Cybernetics","44","12","6866861","2706","2718",,171,"10.1109/TCYB.2014.2313915","https://www.scopus.com/inward/record.uri?eid=2-s2.0-84912048350&doi=10.1109%2fTCYB.2014.2313915&partnerID=40&md5=8ddc9d07842ce0ee5e102e467a196ffb",Article,"Final","",Scopus,2-s2.0-84912048350
"Zhao, M., Zhang, H., Wang, Z., Liang, H.","36485882000;56122851800;55912910200;18437702000;","Synchronization between two general complex networks with time-delay by adaptive periodically intermittent pinning control",2014,"Neurocomputing","144",,,"215","221",,36,"10.1016/j.neucom.2014.04.052","https://www.scopus.com/inward/record.uri?eid=2-s2.0-84906046053&doi=10.1016%2fj.neucom.2014.04.052&partnerID=40&md5=ff786c679e63813e12b1f4efd584b5d7",Article,"Final","",Scopus,2-s2.0-84906046053
"Yang, F., Zhang, H., Jiang, B., Liu, X.","35783610600;56122851800;36047336900;55717309300;","Adaptive reconfigurable control of systems with time-varying delay against unknown actuator faults",2014,"International Journal of Adaptive Control and Signal Processing","28","11",,"1206","1226",,17,"10.1002/acs.2439","https://www.scopus.com/inward/record.uri?eid=2-s2.0-84939471233&doi=10.1002%2facs.2439&partnerID=40&md5=681050b221027510c263124326acf600",Article,"Final","",Scopus,2-s2.0-84939471233
"Wang, Z., Li, T., Zhang, H.","54989199600;8446636200;56122851800;","Fault tolerant synchronization for a class of complex interconnected neural networks with delay",2014,"International Journal of Adaptive Control and Signal Processing","28","10",,"859","881",,36,"10.1002/acs.2399","https://www.scopus.com/inward/record.uri?eid=2-s2.0-84907941064&doi=10.1002%2facs.2399&partnerID=40&md5=3487f55abcf56e00cab83144204ec39f",Article,"Final","",Scopus,2-s2.0-84907941064
"Wang, Y., Zhang, H., Zhang, J., Wang, Y.","55969167500;56122851800;56401383600;55733933500;","Discrete-time polynomial fuzzy observer designs via a sum of squares approach",2014,"Proceedings of the International Joint Conference on Neural Networks",,,"6889413","3826","3830",,3,"10.1109/IJCNN.2014.6889413","https://www.scopus.com/inward/record.uri?eid=2-s2.0-84908494980&doi=10.1109%2fIJCNN.2014.6889413&partnerID=40&md5=5d593acbd377c1c5dd309c2d860f269c",Conference Paper,"Final","",Scopus,2-s2.0-84908494980
"Feng, T., Zhang, H., Luo, Y., Wang, Y.","57203905583;56122851800;55571384900;55733933500;","Distributed LQR design for multi-agent systems on directed graph topologies",2014,"Proceedings of the International Joint Conference on Neural Networks",,,"6889679","2732","2737",,3,"10.1109/IJCNN.2014.6889679","https://www.scopus.com/inward/record.uri?eid=2-s2.0-84908491533&doi=10.1109%2fIJCNN.2014.6889679&partnerID=40&md5=ccea604e318c208f6d1e207b995c016e",Conference Paper,"Final","",Scopus,2-s2.0-84908491533
"Qin, C., Zhang, H., Luo, Y.","55445054400;56122851800;55571384900;","Model-free adaptive dynamic programming for online optimal solution of the unknown nonlinear zero-sum differential game",2014,"Proceedings of the International Joint Conference on Neural Networks",,,"6889376","3815","3820",,3,"10.1109/IJCNN.2014.6889376","https://www.scopus.com/inward/record.uri?eid=2-s2.0-84908491423&doi=10.1109%2fIJCNN.2014.6889376&partnerID=40&md5=0406b58285005ece97fd52d9fdd6f265",Conference Paper,"Final","",Scopus,2-s2.0-84908491423
"Liang, H., Wang, Y., Wang, Z., Zhang, H.","18437702000;55733933500;54989199600;56122851800;","Distributed control for second-order leader-following multi-agent systems with heterogeneous leader",2014,"Proceedings of the International Joint Conference on Neural Networks",,,"6889616","1334","1338",,,"10.1109/IJCNN.2014.6889616","https://www.scopus.com/inward/record.uri?eid=2-s2.0-84908480761&doi=10.1109%2fIJCNN.2014.6889616&partnerID=40&md5=392883815a97d16617c00568a397231f",Conference Paper,"Final","",Scopus,2-s2.0-84908480761
"Wang, S., Feng, J., Zhang, H.","48662854400;55350596800;56122851800;","Robust fault tolerant control for a class of networked control systems with state delay and stochastic actuator failures",2014,"International Journal of Adaptive Control and Signal Processing","28","9",,"798","811",,29,"10.1002/acs.2372","https://www.scopus.com/inward/record.uri?eid=2-s2.0-84937518501&doi=10.1002%2facs.2372&partnerID=40&md5=d0bfc920cc06be6e4634a59e39a69be9",Article,"Final","",Scopus,2-s2.0-84937518501
