作者,作者 ID,标题,年份,来源出版物名称,卷,期,论文编号,起始页码,结束页码,页码计数,施引文献,DOI,链接,文献类型,出版阶段,开放获取,来源出版物,EID
"Song, W., Feng, J., Zhang, H., Hu, X.","57219624994;55350596800;56122851800;57552629600;","Event-based formation control of heterogeneous multiagent systems with leader agent of nonzero input",2022,"Information Sciences","598",,,"157","181",,,"10.1016/j.ins.2022.03.057","https://www.scopus.com/inward/record.uri?eid=2-s2.0-85127118541&doi=10.1016%2fj.ins.2022.03.057&partnerID=40&md5=e9769767711f09ffb1d929e256ecdd0d",Article,"Final","",Scopus,2-s2.0-85127118541
"Zhai, M., Sun, Q., Wang, B., Wang, R., Liu, Z., Zhang, H.","57413501400;15019590100;56918782300;57192997079;35201546200;56122851800;","Distributed secondary voltage control of microgrids with actuators bias faults and directed communication topologies: Event-triggered approaches",2022,"International Journal of Robust and Nonlinear Control","32","7",,"4422","4437",,,"10.1002/rnc.6040","https://www.scopus.com/inward/record.uri?eid=2-s2.0-85124569791&doi=10.1002%2frnc.6040&partnerID=40&md5=dc1f328da95bb0c8bd19f39cd88ff353",Article,"Final","",Scopus,2-s2.0-85124569791
"Wang, Y., Yan, W., Zhang, H., Xie, X.","55733933500;57394255700;56122851800;26032736600;","Observer-based dynamic event-triggered H∞ LFC for power systems under actuator saturation and deception attack",2022,"Applied Mathematics and Computation","420",,"126896","","",,,"10.1016/j.amc.2021.126896","https://www.scopus.com/inward/record.uri?eid=2-s2.0-85122149332&doi=10.1016%2fj.amc.2021.126896&partnerID=40&md5=268eba372ce4eee6450889e842886045",Article,"Final","",Scopus,2-s2.0-85122149332
"Wang, W., Zhang, H., Song, W., Feng, J.","57233564200;56122851800;57219624994;55350596800;","Distributed Cooperative Output Regulation of Linear Heterogeneous Multiagent Systems",2022,"IEEE Transactions on Circuits and Systems II: Express Briefs","69","4",,"2226","2230",,,"10.1109/TCSII.2021.3126857","https://www.scopus.com/inward/record.uri?eid=2-s2.0-85127563728&doi=10.1109%2fTCSII.2021.3126857&partnerID=40&md5=1ab34942d0f726ef055b5f255731f03e",Article,"Final","",Scopus,2-s2.0-85127563728
"Li, W., Zhang, H., Ming, Z., Wang, Y.","57217106706;56122851800;57255808900;55733933500;","Fully Distributed Event-Triggered Bipartite Formation Tracking Control for Heterogeneous Multi-Agent Systems on Signed Digraph",2022,"IEEE Transactions on Circuits and Systems II: Express Briefs","69","4",,"2181","2185",,,"10.1109/TCSII.2021.3129852","https://www.scopus.com/inward/record.uri?eid=2-s2.0-85127549756&doi=10.1109%2fTCSII.2021.3129852&partnerID=40&md5=a124e7eb6fa3d12f492dcc66ee406f30",Article,"Final","",Scopus,2-s2.0-85127549756
"Zhang, H., Xi, R., Wang, Y., Sun, S., Sun, J.","56122851800;57215204001;55733933500;57202576744;57203041963;","Event-Triggered Adaptive Tracking Control for Random Systems With Coexisting Parametric Uncertainties and Severe Nonlinearities",2022,"IEEE Transactions on Automatic Control","67","4",,"2011","2018",,5,"10.1109/TAC.2021.3079279","https://www.scopus.com/inward/record.uri?eid=2-s2.0-85105875984&doi=10.1109%2fTAC.2021.3079279&partnerID=40&md5=3a3c8272f58df05358530c0d5a824adc",Article,"Final","",Scopus,2-s2.0-85105875984
"Zhu, B., Wang, Y., Zhang, H., Xie, X.","57219360486;55733933500;56122851800;26032736600;","Fuzzy Functional Observer-Based Finite-Time Adaptive Sliding-Mode Control for Nonlinear Systems With Matched Uncertainties",2022,"IEEE Transactions on Fuzzy Systems","30","4",,"918","932",,2,"10.1109/TFUZZ.2021.3050846","https://www.scopus.com/inward/record.uri?eid=2-s2.0-85099606552&doi=10.1109%2fTFUZZ.2021.3050846&partnerID=40&md5=0a5aedc17ac9367faa91df58b190b9ec",Article,"Final","",Scopus,2-s2.0-85099606552
"Zhang, J., Zhang, H., Luo, Y., Liu, Y.","57210997596;56122851800;55571384900;57216668566;","Adaptive Event-Triggered Leader-Follower Consensus of Linear Multiagent Systems under Directed Graph with Nonzero Leader Input",2022,"IEEE Transactions on Circuits and Systems II: Express Briefs","69","3",,"1442","1446",,1,"10.1109/TCSII.2021.3115487","https://www.scopus.com/inward/record.uri?eid=2-s2.0-85127866045&doi=10.1109%2fTCSII.2021.3115487&partnerID=40&md5=f6935133b15ebe75f443add2261d48ce",Article,"Final","",Scopus,2-s2.0-85127866045
"Mu, Y., Zhang, H., Gao, Z., Sun, S.","57204544198;56122851800;57195507740;57202576744;","Fault Estimation for Discrete-Time T-S Fuzzy Systems with Unmeasurable Premise Variables Based on Fuzzy Lyapunov Functions",2022,"IEEE Transactions on Circuits and Systems II: Express Briefs","69","3",,"1297","1301",,1,"10.1109/TCSII.2021.3103856","https://www.scopus.com/inward/record.uri?eid=2-s2.0-85127546055&doi=10.1109%2fTCSII.2021.3103856&partnerID=40&md5=2c5bf0ba5a530da7f2be4ebeed04cdc4",Article,"Final","",Scopus,2-s2.0-85127546055
"Yan, Y., Zhang, H., Ming, Z., Wang, Y.","57218629675;56122851800;57255808900;55733933500;","Observer-based adaptive control and faults estimation for T-S fuzzy singular fractional order systems",2022,"Neural Computing and Applications","34","6",,"4265","4275",,,"10.1007/s00521-021-06527-0","https://www.scopus.com/inward/record.uri?eid=2-s2.0-85123118377&doi=10.1007%2fs00521-021-06527-0&partnerID=40&md5=efb86a5e18c4e938e26a39d31c2b28ed",Article,"Final","",Scopus,2-s2.0-85123118377
"Xiao, Q., Feng, J., Lu, S., Liu, S., Zhang, H.","57205582540;57222403331;55579792900;57211639359;56122851800;","Accurate Identification for 3-D Position of Hybrid Defects in Ferromagnetic Pipe Using External Remote Field Eddy Current Testing",2022,"IEEE Transactions on Magnetics","58","3",,"","",,,"10.1109/TMAG.2022.3141233","https://www.scopus.com/inward/record.uri?eid=2-s2.0-85122569877&doi=10.1109%2fTMAG.2022.3141233&partnerID=40&md5=f7451e206590210870fa8a57ed0485e7",Article,"Final","",Scopus,2-s2.0-85122569877
"Zhang, J., Zhang, H., Gao, Z., Sun, S.","57210997596;56122851800;57195507740;57202576744;","Time-varying formation control with general linear multi-agent systems by distributed event-triggered mechanisms under fixed and switching topologies",2022,"Neural Computing and Applications","34","6",,"4277","4294",,,"10.1007/s00521-021-06539-w","https://www.scopus.com/inward/record.uri?eid=2-s2.0-85122253121&doi=10.1007%2fs00521-021-06539-w&partnerID=40&md5=f3eb7c7618270eb6d456cae4682cc827",Article,"Final","",Scopus,2-s2.0-85122253121
"Zhang, H., Yan, Y., Ming, Z., Wang, Y.","56122851800;57255460300;57255808900;55733933500;","Cooperative Fault Diagnosis of Fuzzy Fractional Order Time-Varying Multi-Agent System with Directed Networks",2022,"IEEE Transactions on Circuits and Systems II: Express Briefs","69","3",,"1447","1451",,,"10.1109/TCSII.2021.3111653","https://www.scopus.com/inward/record.uri?eid=2-s2.0-85114729581&doi=10.1109%2fTCSII.2021.3111653&partnerID=40&md5=cd1920d23a0b23629e9ec93704d07be6",Article,"Final","",Scopus,2-s2.0-85114729581
"Liu, C., Zhang, H., Luo, Y., Su, H.","57219730848;56122851800;55571384900;57190878085;","Dual Heuristic Programming for Optimal Control of Continuous-Time Nonlinear Systems Using Single Echo State Network",2022,"IEEE Transactions on Cybernetics","52","3",,"1701","1712",,2,"10.1109/TCYB.2020.2984952","https://www.scopus.com/inward/record.uri?eid=2-s2.0-85107671338&doi=10.1109%2fTCYB.2020.2984952&partnerID=40&md5=c28862baff4ec70bd21030eaf3ce8ecb",Article,"Final","",Scopus,2-s2.0-85107671338
"Xi, R., Zhang, H., Wang, Y., Sun, S.","57215204001;56122851800;55733933500;57202576744;","Event-triggered control for a class of nonlinear random systems involving time-varying delay and exogenous disturbances",2022,"Asian Journal of Control","24","2",,"973","984",,1,"10.1002/asjc.2503","https://www.scopus.com/inward/record.uri?eid=2-s2.0-85105786602&doi=10.1002%2fasjc.2503&partnerID=40&md5=37e4a3b03dceae58cc59b224d779e314",Article,"Final","",Scopus,2-s2.0-85105786602
"Xiao, Q., Feng, J., Xu, Z., Zhang, H.","57205582540;57222403331;55761388300;56122851800;","Receiver Signal Analysis on Geometry and Excitation Parameters of Remote Field Eddy Current Probe",2022,"IEEE Transactions on Industrial Electronics","69","3",,"3088","3098",,2,"10.1109/TIE.2021.3063958","https://www.scopus.com/inward/record.uri?eid=2-s2.0-85102614838&doi=10.1109%2fTIE.2021.3063958&partnerID=40&md5=17f986745ad734d4651fd6a410c3d34e",Article,"Final","",Scopus,2-s2.0-85102614838
"Wang, R., Sun, Q.-Y., Zhang, H.-G.","57192997079;15019590100;56122851800;","Research on Current Sharing/Voltage Recovery Based Adaptive Dynamic Programming Control Strategy of Microgrids [微电网的电流均衡/电压恢复自适应动态规划策略研究]",2022,"Zidonghua Xuebao/Acta Automatica Sinica","48","2",,"479","491",,,"10.16383/j.aas.c210015","https://www.scopus.com/inward/record.uri?eid=2-s2.0-85126064061&doi=10.16383%2fj.aas.c210015&partnerID=40&md5=bccad020953b46b1ac325413c0bba2d7",Article,"Final","",Scopus,2-s2.0-85126064061
"Feng, J., Song, W., Zhang, H., Wang, W.","55350596800;57219624994;56122851800;57233564200;","Data-Driven Robust Iterative Learning Consensus Tracking Control for MIMO Multiagent Systems Under Fixed and Iteration-Switching Topologies",2022,"IEEE Transactions on Systems, Man, and Cybernetics: Systems","52","2",,"1331","1344",,,"10.1109/TSMC.2020.3017289","https://www.scopus.com/inward/record.uri?eid=2-s2.0-85123714969&doi=10.1109%2fTSMC.2020.3017289&partnerID=40&md5=9d1ff8c419af995e91f7cc805fd42a52",Article,"Final","",Scopus,2-s2.0-85123714969
"Wang, R., Sun, Q., Zhang, H., Liu, L., Gui, Y., Wang, P.","57192997079;15019590100;56122851800;57201199341;55268646100;56896364000;","Stability-Oriented Minimum Switching/Sampling Frequency for Cyber-Physical Systems: Grid-Connected Inverters Under Weak Grid",2022,"IEEE Transactions on Circuits and Systems I: Regular Papers","69","2",,"946","955",,,"10.1109/TCSI.2021.3113772","https://www.scopus.com/inward/record.uri?eid=2-s2.0-85119620412&doi=10.1109%2fTCSI.2021.3113772&partnerID=40&md5=c08e9761983ae01858509681b4d3af40",Article,"Final","",Scopus,2-s2.0-85119620412
"Li, W., Zhang, H., Wang, W., Cao, Z.","57217106706;56122851800;57233564200;57201502429;","Fully distributed event-triggered time-varying formation control of multi-agent systems subject to mode-switching denial-of-service attacks",2022,"Applied Mathematics and Computation","414",,"126645","","",,,"10.1016/j.amc.2021.126645","https://www.scopus.com/inward/record.uri?eid=2-s2.0-85115891474&doi=10.1016%2fj.amc.2021.126645&partnerID=40&md5=537d2bca2df004fd2faef6a773feae24",Article,"Final","",Scopus,2-s2.0-85115891474
"Huang, B., Li, Y., Zhan, F., Sun, Q., Zhang, H.","41261545400;56123408700;57220038951;15019590100;56122851800;","A Distributed Robust Economic Dispatch Strategy for Integrated Energy System Considering Cyber-Attacks",2022,"IEEE Transactions on Industrial Informatics","18","2",,"880","890",,4,"10.1109/TII.2021.3077509","https://www.scopus.com/inward/record.uri?eid=2-s2.0-85105865322&doi=10.1109%2fTII.2021.3077509&partnerID=40&md5=5b8130f9303c34b19f441da40cdeffc8",Article,"Final","",Scopus,2-s2.0-85105865322
"Sun, J., Zhang, H., Wang, Y., Sun, S.","57203041963;56122851800;55733933500;57202576744;","Fault-Tolerant Control for Stochastic Switched IT2 Fuzzy Uncertain Time-Delayed Nonlinear Systems",2022,"IEEE Transactions on Cybernetics","52","2",,"","",,15,"10.1109/TCYB.2020.2997348","https://www.scopus.com/inward/record.uri?eid=2-s2.0-85100485038&doi=10.1109%2fTCYB.2020.2997348&partnerID=40&md5=3779c40a454e86c3f53823c06acff822",Article,"Final","",Scopus,2-s2.0-85100485038
"Sun, S., Zhang, H., Zhang, J., Yu, L., Sun, J.","57202576744;56122851800;57210997596;57192381229;57203041963;","Multiple Delay-Dependent Robust H∞ Finite-Time Filtering for Uncertain Itô Stochastic Takagi–Sugeno Fuzzy Semi-Markovian Jump Systems With State Constraints",2022,"IEEE Transactions on Fuzzy Systems","30","2",,"321","331",,5,"10.1109/TFUZZ.2020.3037959","https://www.scopus.com/inward/record.uri?eid=2-s2.0-85098798189&doi=10.1109%2fTFUZZ.2020.3037959&partnerID=40&md5=948a666775de4e29ed8e629b62846e6f",Article,"Final","",Scopus,2-s2.0-85098798189
"Zhang, J., Feng, T., Zhang, H., Wang, X.","55338770700;57203905583;56122851800;36519970000;","The Decoupling Cooperative Control With Dominant Poles Assignment",2022,"IEEE Transactions on Systems, Man, and Cybernetics: Systems","52","2",,"1205","1213",,10,"10.1109/TSMC.2020.3011142","https://www.scopus.com/inward/record.uri?eid=2-s2.0-85098452517&doi=10.1109%2fTSMC.2020.3011142&partnerID=40&md5=0f68a73e35d173a9d8853b7d458bff8b",Article,"Final","",Scopus,2-s2.0-85098452517
"Liu, J., Liu, X., Qu, F., Zhang, H., Zhang, L.","25921523900;57221422233;36920277200;56122851800;57670295000;","A Defect Recognition Method for Low-quality Weld Image Based on Consistent Multi-scale Feature Mapping",2022,"IEEE Transactions on Instrumentation and Measurement",,,,"","",,,"10.1109/TIM.2022.3171609","https://www.scopus.com/inward/record.uri?eid=2-s2.0-85129665597&doi=10.1109%2fTIM.2022.3171609&partnerID=40&md5=1815e992e277678ebd7c0554ce308044",Article,"Article in Press","",Scopus,2-s2.0-85129665597
"Xi, R., Zhang, H., Wang, Y., Sun, S.","57215204001;56122851800;55733933500;57202576744;","Overview of the recent research progress for stability and control on random nonlinear systems",2022,"Annual Reviews in Control",,,,"","",,,"10.1016/j.arcontrol.2022.03.005","https://www.scopus.com/inward/record.uri?eid=2-s2.0-85129061405&doi=10.1016%2fj.arcontrol.2022.03.005&partnerID=40&md5=d72030172b3c1dc6ac48e212bde05329",Review,"Article in Press","",Scopus,2-s2.0-85129061405
"Ming, Z., Zhang, H., Yan, Y., Zhang, J.","57255808900;56122851800;57255460300;57609650700;","Tracking Control of Discrete-Time System With Dynamic Event-Based Adaptive Dynamic Programming",2022,"IEEE Transactions on Circuits and Systems II: Express Briefs",,,,"","",,,"10.1109/TCSII.2022.3168428","https://www.scopus.com/inward/record.uri?eid=2-s2.0-85128638836&doi=10.1109%2fTCSII.2022.3168428&partnerID=40&md5=95d11df001f383fd7020cc45e631e127",Article,"Article in Press","",Scopus,2-s2.0-85128638836
"Zhang, J., Zhang, H., Ming, Z., Mu, Y.","57609650700;56122851800;57255808900;57204544198;","Adaptive Event-Triggered Time-Varying Output Bipartite Formation Containment of Multiagent Systems Under Directed Graphs",2022,"IEEE Transactions on Neural Networks and Learning Systems",,,,"","",,,"10.1109/TNNLS.2022.3154028","https://www.scopus.com/inward/record.uri?eid=2-s2.0-85128590674&doi=10.1109%2fTNNLS.2022.3154028&partnerID=40&md5=be73edbe7114319c2205374ab5aa4297",Article,"Article in Press","",Scopus,2-s2.0-85128590674
"Zheng, C.-D., Zhang, Z., Lu, Y., Zhang, H.","35390466600;57561167900;57562139800;56122851800;","Stochastic stability for delayed semi-Markovian genetic regulatory networks with partly unknown transition rates by employing new integral inequalities",2022,"Neural Computing and Applications",,,,"","",,,"10.1007/s00521-022-07177-6","https://www.scopus.com/inward/record.uri?eid=2-s2.0-85127615136&doi=10.1007%2fs00521-022-07177-6&partnerID=40&md5=1181bd67a1fd193794f63f2d60aaa382",Article,"Article in Press","",Scopus,2-s2.0-85127615136
"Xi, R., Zhang, H., Sun, S., Wang, Y.","57215204001;56122851800;57202576744;55733933500;","Reduced-Order High-Gain Observer (ROHGO)-Based Neural Tracking Control for Random Nonlinear Systems With Output Delay",2022,"IEEE Transactions on Systems, Man, and Cybernetics: Systems",,,,"","",,1,"10.1109/TSMC.2022.3159547","https://www.scopus.com/inward/record.uri?eid=2-s2.0-85127496148&doi=10.1109%2fTSMC.2022.3159547&partnerID=40&md5=d653414a3bf6370d88c64db30d09e5df",Article,"Article in Press","",Scopus,2-s2.0-85127496148
"Li, Y., Li, T., Zhang, H., Xie, X., Sun, Q.","56123408700;57203551112;56122851800;26032736600;15019590100;","Distributed Resilient Double-Gradient-Descent Based Energy Management Strategy for Multi-Energy System under DoS Attacks",2022,"IEEE Transactions on Network Science and Engineering",,,,"","",,,"10.1109/TNSE.2022.3162669","https://www.scopus.com/inward/record.uri?eid=2-s2.0-85127479544&doi=10.1109%2fTNSE.2022.3162669&partnerID=40&md5=4f3cedb30513a73e7cd41dc50fac47e7",Article,"Article in Press","",Scopus,2-s2.0-85127479544
"Liu, G., Sun, Q., Wang, R., Zhang, H.","57208144903;15019590100;57192997079;56122851800;","Event-Based Fuzzy Adaptive Consensus FTC for Microgrids With Nonlinear Item via Prescribed Fixed-Time Performance",2022,"IEEE Transactions on Circuits and Systems I: Regular Papers",,,,"","",,,"10.1109/TCSI.2022.3161685","https://www.scopus.com/inward/record.uri?eid=2-s2.0-85127471676&doi=10.1109%2fTCSI.2022.3161685&partnerID=40&md5=2c514cda728b7f7ba9b25c86c22d3c65",Article,"Article in Press","",Scopus,2-s2.0-85127471676
"Ren, Y., Liu, J., Wang, Q., Zhang, H.","57212312090;25921523900;57549578400;56122851800;","HSELL-Net: A Heterogeneous Sample Enhancement Network With Lifelong Learning Under Industrial Small Samples",2022,"IEEE Transactions on Cybernetics",,,,"","",,,"10.1109/TCYB.2022.3158697","https://www.scopus.com/inward/record.uri?eid=2-s2.0-85127034564&doi=10.1109%2fTCYB.2022.3158697&partnerID=40&md5=4298dc995c97f18b54d4b2f79af45613",Article,"Article in Press","",Scopus,2-s2.0-85127034564
"Sun, S., Zhang, H., Wang, Y., Zhang, J.","57202576744;56122851800;55733933500;57210997596;","Dissipativity-Based Intermittent Fault Detection and Fault-Tolerant Control for Uncertain Switched Random Nonlinear Systems With Multiple Delays",2022,"IEEE Transactions on Systems, Man, and Cybernetics: Systems",,,,"","",,,"10.1109/TSMC.2022.3157937","https://www.scopus.com/inward/record.uri?eid=2-s2.0-85126646235&doi=10.1109%2fTSMC.2022.3157937&partnerID=40&md5=45fb724f3a8d7eb258d2b62235cd635a",Article,"Article in Press","",Scopus,2-s2.0-85126646235
"Zhang, J., Zhang, H.","57210997596;56122851800;","Adaptive Event-Triggered Consensus of Linear Multiagent Systems With Resilience to Communication Link Faults for Digraphs",2022,"IEEE Transactions on Circuits and Systems II: Express Briefs",,,,"","",,,"10.1109/TCSII.2022.3159846","https://www.scopus.com/inward/record.uri?eid=2-s2.0-85126546059&doi=10.1109%2fTCSII.2022.3159846&partnerID=40&md5=bbcfce424769e73ea476f51509ccbcdc",Article,"Article in Press","",Scopus,2-s2.0-85126546059
"Liu, S., Sun, J., Zhang, H., Zhai, M.","57468077800;57203041963;56122851800;57413501400;","Fully Distributed Event-Driven Adaptive Consensus of Unknown Linear Systems",2022,"IEEE Transactions on Neural Networks and Learning Systems",,,,"","",,,"10.1109/TNNLS.2022.3148824","https://www.scopus.com/inward/record.uri?eid=2-s2.0-85125356315&doi=10.1109%2fTNNLS.2022.3148824&partnerID=40&md5=348a0d1717c4cc26a9909d7edd801780",Article,"Article in Press","",Scopus,2-s2.0-85125356315
"Zhang, H., Wang, L., Wang, J., Zuo, F., Wang, J., Liu, J.","56122851800;57215075026;57154348400;57468694300;57468385600;25921523900;","A Pipeline Defect Inversion Method with Erratic MFL Signals Based on Cascading Abstract Features",2022,"IEEE Transactions on Instrumentation and Measurement","71",,,"","",,,"10.1109/TIM.2022.3152243","https://www.scopus.com/inward/record.uri?eid=2-s2.0-85125347551&doi=10.1109%2fTIM.2022.3152243&partnerID=40&md5=e600f27e52b5800ea084b9104f9514af",Article,"Final","",Scopus,2-s2.0-85125347551
"Li, W., Zhang, H., Gao, Z., Wang, Y., Sun, J.","57217106706;56122851800;57226519422;55733933500;57203041963;","Fully Distributed Event/Self-Triggered Bipartite Output Formation-Containment Tracking Control for Heterogeneous Multiagent Systems",2022,"IEEE Transactions on Neural Networks and Learning Systems",,,,"","",,,"10.1109/TNNLS.2022.3146814","https://www.scopus.com/inward/record.uri?eid=2-s2.0-85125297823&doi=10.1109%2fTNNLS.2022.3146814&partnerID=40&md5=9d5dbdf5e5b67e8b83091c24a65c45a5",Article,"Article in Press","",Scopus,2-s2.0-85125297823
"Ming, Z., Zhang, H., Li, W., Luo, Y.","57255808900;56122851800;57217106706;55571384900;","Neurodynamic Programming and Tracking Control for Nonlinear Stochastic Systems by PI Algorithm",2022,"IEEE Transactions on Circuits and Systems II: Express Briefs",,,,"","",,,"10.1109/TCSII.2022.3150351","https://www.scopus.com/inward/record.uri?eid=2-s2.0-85124769842&doi=10.1109%2fTCSII.2022.3150351&partnerID=40&md5=fea32ba2f781f51b5f5fc7660e36113b",Article,"Article in Press","",Scopus,2-s2.0-85124769842
"Hu, X., Ma, D., Song, Q., Chen, G., Wang, R., Zhang, H.","57190884944;57208604953;57455787900;57456264500;57192997079;56122851800;","Negative Pressure Wave-Based Method for Abnormal Signal Location in Energy Transportation System",2022,"IEEE Transactions on Instrumentation and Measurement","71",,,"","",,,"10.1109/TIM.2022.3150891","https://www.scopus.com/inward/record.uri?eid=2-s2.0-85124763477&doi=10.1109%2fTIM.2022.3150891&partnerID=40&md5=2146da7f37d30730b2ef12a8ec368e33",Article,"Final","",Scopus,2-s2.0-85124763477
"Zhang, H., Li, W., Zhang, J., Wang, Y., Sun, J.","56122851800;57217106706;57210997596;55733933500;57203041963;","Fully Distributed Dynamic Event-Triggered Bipartite Formation Tracking for Multiagent Systems With Multiple Nonautonomous Leaders",2022,"IEEE Transactions on Neural Networks and Learning Systems",,,,"","",,,"10.1109/TNNLS.2022.3143867","https://www.scopus.com/inward/record.uri?eid=2-s2.0-85124234933&doi=10.1109%2fTNNLS.2022.3143867&partnerID=40&md5=d1400ea9c46fb98efd01c6d17df2a723",Article,"Article in Press","",Scopus,2-s2.0-85124234933
"Liu, Y., Zhang, H., Shi, Z., Gao, Z.","57216668566;56122851800;57202371897;57226519422;","Neural-Network-Based Finite-Time Bipartite Containment Control for Fractional-Order Multi-Agent Systems",2022,"IEEE Transactions on Neural Networks and Learning Systems",,,,"","",,1,"10.1109/TNNLS.2022.3143494","https://www.scopus.com/inward/record.uri?eid=2-s2.0-85124215581&doi=10.1109%2fTNNLS.2022.3143494&partnerID=40&md5=2859d6fa51959b630bbdb27736e692d6",Article,"Article in Press","",Scopus,2-s2.0-85124215581
"Feng, J., Li, K., Zhang, H., Zhang, X., Yao, Y.","57444356200;57443392400;56122851800;57444356300;57444165900;","Multi-Channel Spatio-Temporal Feature Fusion Method for NILM",2022,"IEEE Transactions on Industrial Informatics",,,,"","",,1,"10.1109/TII.2022.3148297","https://www.scopus.com/inward/record.uri?eid=2-s2.0-85124195341&doi=10.1109%2fTII.2022.3148297&partnerID=40&md5=fce7cca2c8ea4df745057380b9b07e3f",Article,"Article in Press","",Scopus,2-s2.0-85124195341
"Li, W., Zhang, H., Zhou, Y., Wang, Y.","57217106706;56122851800;57200498025;55733933500;","Bipartite Formation Tracking for Multi-Agent Systems using Fully Distributed Dynamic Edge-Event-Triggered Protocol",2022,"IEEE/CAA Journal of Automatica Sinica","PP","99",,"","",,1,"10.1109/JAS.2021.1004377","https://www.scopus.com/inward/record.uri?eid=2-s2.0-85124164910&doi=10.1109%2fJAS.2021.1004377&partnerID=40&md5=887b89c4f4c28e0bbd6b9b025aa8bf35",Article,"Final","",Scopus,2-s2.0-85124164910
"Jiang, L., Zhang, H., Liu, J., Shen, X., Xu, H.","57195426613;56122851800;25921523900;57220860246;57440683900;","A Multi-Sensor Cycle-Supervised Convolutional Neural Networks for Anomaly Detection on Magnetic Flux Leakage Signals",2022,"IEEE Transactions on Industrial Informatics",,,,"","",,,"10.1109/TII.2022.3146152","https://www.scopus.com/inward/record.uri?eid=2-s2.0-85124099340&doi=10.1109%2fTII.2022.3146152&partnerID=40&md5=ad1395f685309f01b7bac44e9ad176ed",Article,"Article in Press","",Scopus,2-s2.0-85124099340
"Wang, J., Zhang, H., Fu, J., Liang, H., Meng, Q.","57211089822;56122851800;57688770500;18437702000;7202535582;","Dissipativity-Based Consensus Tracking Control of Nonlinear Multiagent Systems With Generally Uncertain Markovian Switching Topologies and Event-Triggered Strategy",2022,"IEEE Transactions on Cybernetics",,,,"","",,,"10.1109/TCYB.2022.3141599","https://www.scopus.com/inward/record.uri?eid=2-s2.0-85123754782&doi=10.1109%2fTCYB.2022.3141599&partnerID=40&md5=7225a0e6dc00d677df8d9218248fe1aa",Article,"Article in Press","All Open Access, Green",Scopus,2-s2.0-85123754782
"Ren, Y., Liu, J., Zhang, H., Wang, J.","57212312090;25921523900;56122851800;57424465900;","TBDA-Net: A Task-based Bias Domain Adaptation Network under Industrial Small Samples",2022,"IEEE Transactions on Industrial Informatics",,,,"","",,,"10.1109/TII.2022.3141771","https://www.scopus.com/inward/record.uri?eid=2-s2.0-85123366877&doi=10.1109%2fTII.2022.3141771&partnerID=40&md5=a0e030b3209ba33b997becbb15d88769",Article,"Article in Press","",Scopus,2-s2.0-85123366877
"Cai, Y., Zhang, H., Gao, Z., Yang, L., He, Q.","57189490226;56122851800;57226519422;57279836500;57193014262;","Adaptive Bipartite Event-Triggered Time-Varying Output Formation Tracking of Heterogeneous Linear Multi-Agent Systems Under Signed Directed Graph",2022,"IEEE Transactions on Neural Networks and Learning Systems",,,,"","",,,"10.1109/TNNLS.2021.3137393","https://www.scopus.com/inward/record.uri?eid=2-s2.0-85123365237&doi=10.1109%2fTNNLS.2021.3137393&partnerID=40&md5=c17b261a62afbfccd7184ea6c08ae878",Article,"Article in Press","",Scopus,2-s2.0-85123365237
"Zhang, J., Zhang, H., Sun, J., Wang, Y.","57210997596;56122851800;57203041963;55733933500;","Cooperative Output Regulation Problem for Multiagent System Under Directed Topology Using Dynamic Triggering Strategy",2022,"IEEE Transactions on Circuits and Systems II: Express Briefs",,,,"","",,,"10.1109/TCSII.2022.3144097","https://www.scopus.com/inward/record.uri?eid=2-s2.0-85123355001&doi=10.1109%2fTCSII.2022.3144097&partnerID=40&md5=58076cf7045410bba0de38fec06444a1",Article,"Article in Press","",Scopus,2-s2.0-85123355001
