作者,作者 ID,标题,年份,来源出版物名称,卷,期,论文编号,起始页码,结束页码,页码计数,施引文献,DOI,链接,文献类型,出版阶段,开放获取,来源出版物,EID
"Naghipoor, J., Jafary, N., Rabczuk, T.","56162835400;57201258578;56502462200;","Mathematical and computational modeling of drug release from an ocular iontophoretic drug delivery device",2018,"International Journal of Heat and Mass Transfer","123",,,"1035","1049",,9,"10.1016/j.ijheatmasstransfer.2018.03.021","https://www.scopus.com/inward/record.uri?eid=2-s2.0-85044024707&doi=10.1016%2fj.ijheatmasstransfer.2018.03.021&partnerID=40&md5=3c28995a2296592d6b53668f5e844202",Article,"Final","",Scopus,2-s2.0-85044024707
"Mauludin, L.M., Zhuang, X., Rabczuk, T.","57201685556;24485610900;56502462200;","Computational modeling of fracture in encapsulation-based self-healing concrete using cohesive elements",2018,"Composite Structures","196",,,"63","75",,31,"10.1016/j.compstruct.2018.04.066","https://www.scopus.com/inward/record.uri?eid=2-s2.0-85046667836&doi=10.1016%2fj.compstruct.2018.04.066&partnerID=40&md5=d3d3106219386e55832083bbd62c5de7",Article,"Final","All Open Access, Green",Scopus,2-s2.0-85046667836
"Hasanian, M., Mortazavi, B., Ostadhossein, A., Rabczuk, T., van Duin, A.C.T.","56928280300;24399312200;35190944900;56502462200;7004035944;","Hydrogenation and defect formation control the strength and ductility of MoS2 nanosheets: Reactive molecular dynamics simulation",2018,"Extreme Mechanics Letters","22",,,"157","164",,15,"10.1016/j.eml.2018.05.008","https://www.scopus.com/inward/record.uri?eid=2-s2.0-85049071564&doi=10.1016%2fj.eml.2018.05.008&partnerID=40&md5=051793095127b63b30498c118af1be11",Article,"Final","All Open Access, Bronze, Green",Scopus,2-s2.0-85049071564
"Oucif, C., Voyiadjis, G.Z., Kattan, P.I., Rabczuk, T.","57195409970;7006803189;6602199577;56502462200;","Nonlinear superhealing and contribution to the design of a new strengthening theory",2018,"Journal of Engineering Mechanics","144","7","04018055","","",,9,"10.1061/(ASCE)EM.1943-7889.0001484","https://www.scopus.com/inward/record.uri?eid=2-s2.0-85047003949&doi=10.1061%2f%28ASCE%29EM.1943-7889.0001484&partnerID=40&md5=bb22778b1b405f4db03a9b27bcded4ae",Article,"Final","",Scopus,2-s2.0-85047003949
"Thai, C.H., Ferreira, A.J.M., Rabczuk, T., Nguyen-Xuan, H.","55023724300;7402999780;56502462200;24503383800;","A naturally stabilized nodal integration meshfree formulation for carbon nanotube-reinforced composite plate analysis",2018,"Engineering Analysis with Boundary Elements","92",,,"136","155",,33,"10.1016/j.enganabound.2017.10.018","https://www.scopus.com/inward/record.uri?eid=2-s2.0-85035335792&doi=10.1016%2fj.enganabound.2017.10.018&partnerID=40&md5=5ba89f2fd9d5994a1eed11c8c8ba01d3",Article,"Final","",Scopus,2-s2.0-85035335792
"Khudari Bek, Y., Hamdia, K.M., Rabczuk, T., Könke, C.","57201548747;56565417600;56502462200;6505868321;","Micromechanical model for polymeric nano-composites material based on SBFEM",2018,"Composite Structures","194",,,"516","526",,21,"10.1016/j.compstruct.2018.03.064","https://www.scopus.com/inward/record.uri?eid=2-s2.0-85045245720&doi=10.1016%2fj.compstruct.2018.03.064&partnerID=40&md5=90f2bde2e293b183fe095b3c40c7faf4",Article,"Final","",Scopus,2-s2.0-85045245720
"Salavati, M., Ghasemi, H., Rabczuk, T.","55775272700;57218802972;56502462200;","Electromechanical properties of Boron Nitride Nanotube: Atomistic bond potential and equivalent mechanical energy approach",2018,"Computational Materials Science","149",,,"460","465",,14,"10.1016/j.commatsci.2018.03.037","https://www.scopus.com/inward/record.uri?eid=2-s2.0-85045112336&doi=10.1016%2fj.commatsci.2018.03.037&partnerID=40&md5=1e69980a2a5fb5d4b6a4607c8a72a7d3",Article,"Final","",Scopus,2-s2.0-85045112336
"Zhou, S., Zhuang, X., Rabczuk, T.","55951420500;24485610900;56502462200;","A phase-field modeling approach of fracture propagation in poroelastic media",2018,"Engineering Geology","240",,,"189","203",,194,"10.1016/j.enggeo.2018.04.008","https://www.scopus.com/inward/record.uri?eid=2-s2.0-85046694739&doi=10.1016%2fj.enggeo.2018.04.008&partnerID=40&md5=abbbbbca215571c0ea52599268cf31c8",Article,"Final","All Open Access, Green",Scopus,2-s2.0-85046694739
"Bao, Y., Feng, D., Ma, N., Zhu, H., Rabczuk, T.","22950245000;57661932000;57212537948;57210818384;56502462200;","Experimental and numerical study on structural performance of reinforced concrete box sewer with localized extreme defect",2018,"Underground Space (China)","3","2",,"166","179",,5,"10.1016/j.undsp.2018.04.001","https://www.scopus.com/inward/record.uri?eid=2-s2.0-85077005117&doi=10.1016%2fj.undsp.2018.04.001&partnerID=40&md5=9da6232f05cff3b6208747955e591f6f",Article,"Final","All Open Access, Gold",Scopus,2-s2.0-85077005117
"Mortazavi, B., Rabczuk, T.","24399312200;56502462200;","Boron monochalcogenides; stable and strong two-dimensional wide band-gap semiconductors",2018,"Energies","11","6","1573","","",,26,"10.3390/en11061573","https://www.scopus.com/inward/record.uri?eid=2-s2.0-85049327998&doi=10.3390%2fen11061573&partnerID=40&md5=5b2c2c8c9fe8062a857c4e333b43c0ad",Article,"Final","All Open Access, Gold, Green",Scopus,2-s2.0-85049327998
"Rabczuk, T., Azadi Kakavand, M.R., Uma, R.P., Shirazi, A.H.N., Makaremi, M.","56502462200;57189497767;57190251291;57189499115;56369348900;","Thermal conductance along hexagonal boron nitride and graphene grain boundaries",2018,"Energies","11","6","1553","","",,5,"10.3390/en11061553","https://www.scopus.com/inward/record.uri?eid=2-s2.0-85049245361&doi=10.3390%2fen11061553&partnerID=40&md5=c5f3d635fa4c99b14ae3ccd497905157",Article,"Final","All Open Access, Gold",Scopus,2-s2.0-85049245361
"Cai, Y., Sun, P., Zhu, H., Rabczuk, T.","7401750730;57195384496;7404663867;56502462200;","A mixed cover meshless method for elasticity and fracture problems",2018,"Theoretical and Applied Fracture Mechanics","95",,,"73","103",,15,"10.1016/j.tafmec.2018.01.011","https://www.scopus.com/inward/record.uri?eid=2-s2.0-85044362156&doi=10.1016%2fj.tafmec.2018.01.011&partnerID=40&md5=582e4f62e6de098a302ea2cb5e23f9f3",Article,"Final","",Scopus,2-s2.0-85044362156
"Xu, G., Jin, Y., Xiao, Z., Wu, Q., Mourrain, B., Rabczuk, T.","55935631700;56984771400;55174966700;57199303484;7003436036;56502462200;","Exact conversion from Bézier tetrahedra to Bézier hexahedra",2018,"Computer Aided Geometric Design","62",,,"154","165",,4,"10.1016/j.cagd.2018.03.022","https://www.scopus.com/inward/record.uri?eid=2-s2.0-85047238973&doi=10.1016%2fj.cagd.2018.03.022&partnerID=40&md5=d4b71e31f5abc0ec79d767b429e31704",Article,"Final","All Open Access, Green",Scopus,2-s2.0-85047238973
"Chan, C.L., Anitescu, C., Rabczuk, T.","57143191300;36083903500;56502462200;","Isogeometric analysis with strong multipatch C1-coupling",2018,"Computer Aided Geometric Design","62",,,"294","310",,30,"10.1016/j.cagd.2018.03.025","https://www.scopus.com/inward/record.uri?eid=2-s2.0-85045581039&doi=10.1016%2fj.cagd.2018.03.025&partnerID=40&md5=6c726cefc44c89e1e9b2a07148e93db9",Article,"Final","",Scopus,2-s2.0-85045581039
"Shirazi, A.H.N., Abadi, R., Izadifar, M., Alajlan, N., Rabczuk, T.","57189499115;56226982100;56225677300;23134518500;56502462200;","Mechanical responses of pristine and defective C3N nanosheets studied by molecular dynamics simulations",2018,"Computational Materials Science","147",,,"316","321",,60,"10.1016/j.commatsci.2018.01.058","https://www.scopus.com/inward/record.uri?eid=2-s2.0-85042201011&doi=10.1016%2fj.commatsci.2018.01.058&partnerID=40&md5=f299830fe33599e544bff401fe6e36cd",Article,"Final","",Scopus,2-s2.0-85042201011
"Izadifar, M., Abadi, R., Nezhad Shirazi, A.H., Alajlan, N., Rabczuk, T.","56225677300;56226982100;57200519443;23134518500;56502462200;","Nanopores creation in boron and nitrogen doped polycrystalline graphene: A molecular dynamics study",2018,"Physica E: Low-Dimensional Systems and Nanostructures","99",,,"24","36",,10,"10.1016/j.physe.2017.12.036","https://www.scopus.com/inward/record.uri?eid=2-s2.0-85041460680&doi=10.1016%2fj.physe.2017.12.036&partnerID=40&md5=8406c91e2d440195d4f66fb63692ab09",Article,"Final","",Scopus,2-s2.0-85041460680
"Sahmani, S., Aghdam, M.M., Rabczuk, T.","36791255400;6603250102;56502462200;","A unified nonlocal strain gradient plate model for nonlinear axial instability of functionally graded porous micro/nano-plates reinforced with graphene platelets",2018,"Materials Research Express","5","4","045048","","",,85,"10.1088/2053-1591/aabdbb","https://www.scopus.com/inward/record.uri?eid=2-s2.0-85047166978&doi=10.1088%2f2053-1591%2faabdbb&partnerID=40&md5=9d1e62e7d7a4990b8d79395d23f6aa88",Article,"Final","",Scopus,2-s2.0-85047166978
"Ghasemi, H., Park, H.S., Rabczuk, T.","57218802972;10045002000;56502462200;","A multi-material level set-based topology optimization of flexoelectric composites",2018,"Computer Methods in Applied Mechanics and Engineering","332",,,"47","62",,174,"10.1016/j.cma.2017.12.005","https://www.scopus.com/inward/record.uri?eid=2-s2.0-85039853750&doi=10.1016%2fj.cma.2017.12.005&partnerID=40&md5=d171502ff5f368ac545683daba79096d",Article,"Final","All Open Access, Green",Scopus,2-s2.0-85039853750
"Jia, Y., Anitesuc, C., Zhang, Y.J., Xu, G., Li, C., Rabczuk, T.","55589517400;57203526703;55739765100;55935631700;57193523179;56502462200;","PHT-Spline-Based Enhanced Isogeometric Collocation Method [基于PHT-样条加强等几何分析配置方法]",2018,"Jisuanji Fuzhu Sheji Yu Tuxingxue Xuebao/Journal of Computer-Aided Design and Computer Graphics","30","4",,"702","706 and 718",,1,"10.3724/SP.J.1089.2018.16454","https://www.scopus.com/inward/record.uri?eid=2-s2.0-85052102688&doi=10.3724%2fSP.J.1089.2018.16454&partnerID=40&md5=9426cffffe146ccbd0a04bf200da0310",Article,"Final","",Scopus,2-s2.0-85052102688
"Najafi, B., Ardabili, S.F., Mosavi, A., Shamshirband, S., Rabczuk, T.","57188693029;57189099323;57191408081;57221738247;56502462200;","An intelligent artificial neural network-response surface methodology method for accessing the optimum biodiesel and diesel fuel blending conditions in a diesel engine from the viewpoint of exergy and energy analysis",2018,"Energies","11","4","860","","",,60,"10.3390/en11040860","https://www.scopus.com/inward/record.uri?eid=2-s2.0-85045297280&doi=10.3390%2fen11040860&partnerID=40&md5=3f1360bbba9c34153319928457a64ad0",Article,"Final","All Open Access, Gold, Green",Scopus,2-s2.0-85045297280
"Abadi, R., Nezhad Shirazi, A.H., Izadifar, M., Sepahi, M., Rabczuk, T.","56226982100;57200519443;56225677300;57201199414;56502462200;","Fabrication of nanopores in polycrystalline boron-nitride nanosheet by using Si, SiC and diamond clusters bombardment",2018,"Computational Materials Science","145",,,"280","290",,13,"10.1016/j.commatsci.2017.12.022","https://www.scopus.com/inward/record.uri?eid=2-s2.0-85042200956&doi=10.1016%2fj.commatsci.2017.12.022&partnerID=40&md5=786867fced0b888778a6b6bf8207e1f6",Article,"Final","",Scopus,2-s2.0-85042200956
"Areias, P., Natal Jorge, R., César de Sá, J., Rabczuk, T., Reinoso, J.","55959928000;9633789100;55988088800;56502462200;26644306500;","General constitutive updating for finite strain formulations based on assumed strains and the Jacobian",2018,"Finite Elements in Analysis and Design","143",,,"32","45",,2,"10.1016/j.finel.2018.01.006","https://www.scopus.com/inward/record.uri?eid=2-s2.0-85042180892&doi=10.1016%2fj.finel.2018.01.006&partnerID=40&md5=4d3be2d94275f0e0fb461c4b1274c1fb",Article,"Final","",Scopus,2-s2.0-85042180892
"Mortazavi, B., Berdiyorov, G.R., Makaremi, M., Rabczuk, T.","24399312200;6506568004;56369348900;56502462200;","Mechanical responses of two-dimensional MoTe2; pristine 2H, 1T and 1T′ and 1T′/2H heterostructure",2018,"Extreme Mechanics Letters","20",,,"65","72",,23,"10.1016/j.eml.2018.01.005","https://www.scopus.com/inward/record.uri?eid=2-s2.0-85041407479&doi=10.1016%2fj.eml.2018.01.005&partnerID=40&md5=51242c4a3e5bf9c37bd6a31331ce9618",Article,"Final","All Open Access, Green",Scopus,2-s2.0-85041407479
"Vu-Bac, N., Duong, T.X., Lahmer, T., Zhuang, X., Sauer, R.A., Park, H.S., Rabczuk, T.","43861917200;55991508500;15765564800;24485610900;15844112700;10045002000;56502462200;","A NURBS-based inverse analysis for reconstruction of nonlinear deformations of thin shell structures",2018,"Computer Methods in Applied Mechanics and Engineering","331",,,"427","455",,100,"10.1016/j.cma.2017.09.034","https://www.scopus.com/inward/record.uri?eid=2-s2.0-85038360024&doi=10.1016%2fj.cma.2017.09.034&partnerID=40&md5=8f9e072f4c1435682f4b68be0781055c",Article,"Final","All Open Access, Green",Scopus,2-s2.0-85038360024
"Mortazavi, B., Berdiyorov, G.R., Shahrokhi, M., Rabczuk, T.","24399312200;6506568004;54893045900;56502462200;","Mechanical, optoelectronic and transport properties of single-layer Ca2N and Sr2N electrides",2018,"Journal of Alloys and Compounds","739",,,"643","652",,9,"10.1016/j.jallcom.2017.12.276","https://www.scopus.com/inward/record.uri?eid=2-s2.0-85039989410&doi=10.1016%2fj.jallcom.2017.12.276&partnerID=40&md5=b101d67f0941ef51381e615012f8fd6f",Article,"Final","All Open Access, Green",Scopus,2-s2.0-85039989410
"Zhang, C., Zhao, J., Rabczuk, T.","56896399900;36612630100;56502462200;","The interface strength and delamination of fiber-reinforced composites using a continuum modeling approach",2018,"Composites Part B: Engineering","137",,,"225","234",,18,"10.1016/j.compositesb.2017.11.007","https://www.scopus.com/inward/record.uri?eid=2-s2.0-85034662896&doi=10.1016%2fj.compositesb.2017.11.007&partnerID=40&md5=a41028d0fca2b27d1afe8029743692fb",Article,"Final","",Scopus,2-s2.0-85034662896
"Karimi, M., Rabczuk, T., Kavyani, M.","38561630300;56502462200;56642836400;","Evaluation of the efficiency of the Chêneau brace on scoliosis deformity: A systematic review of the literature [Untersuchung der Wirksamkeit des Chêneau-Korsetts bezüglich der skoliotischen Deformität: Eine systematische Übersicht der Literatur]",2018,"Orthopade","47","3",,"198","204",,4,"10.1007/s00132-018-3529-4","https://www.scopus.com/inward/record.uri?eid=2-s2.0-85044157757&doi=10.1007%2fs00132-018-3529-4&partnerID=40&md5=6ceec826e87dacbbc2e49858fd93ea37",Review,"Final","",Scopus,2-s2.0-85044157757
"Areias, P., Vu-Bac, N., Rabczuk, T.","55959928000;43861917200;56502462200;","A multisurface constitutive model for highly cross-linked polymers with yield data obtained from molecular dynamics simulations",2018,"International Journal of Mechanics and Materials in Design","14","1",,"21","36",,6,"10.1007/s10999-016-9358-x","https://www.scopus.com/inward/record.uri?eid=2-s2.0-85000692355&doi=10.1007%2fs10999-016-9358-x&partnerID=40&md5=a37f279510583420ffa5768efa1758a6",Article,"Final","",Scopus,2-s2.0-85000692355
"Mortazavi, B., Makaremi, M., Shahrokhi, M., Raeisi, M., Singh, C.V., Rabczuk, T., Pereira, L.F.C.","24399312200;56369348900;54893045900;57200915237;55578703800;56502462200;55639140000;","Borophene hydride: A stiff 2D material with high thermal conductivity and attractive optical and electronic properties",2018,"Nanoscale","10","8",,"3759","3768",,79,"10.1039/c7nr08725j","https://www.scopus.com/inward/record.uri?eid=2-s2.0-85042610265&doi=10.1039%2fc7nr08725j&partnerID=40&md5=36f95f227ee94477a4a69eb9cdd1a9aa",Article,"Final","All Open Access, Green",Scopus,2-s2.0-85042610265
"Sahmani, S., Aghdam, M.M., Rabczuk, T.","36791255400;6603250102;56502462200;","Nonlinear bending of functionally graded porous micro/nano-beams reinforced with graphene platelets based upon nonlocal strain gradient theory",2018,"Composite Structures","186",,,"68","78",,197,"10.1016/j.compstruct.2017.11.082","https://www.scopus.com/inward/record.uri?eid=2-s2.0-85036468974&doi=10.1016%2fj.compstruct.2017.11.082&partnerID=40&md5=5c1f29ed0871ccdbd8a9c64092c3eeff",Article,"Final","",Scopus,2-s2.0-85036468974
"Areias, P., Reinoso, J., Camanho, P.P., César de Sá, J., Rabczuk, T.","55959928000;26644306500;6602809907;55988088800;56502462200;","Effective 2D and 3D crack propagation with local mesh refinement and the screened Poisson equation",2018,"Engineering Fracture Mechanics","189",,,"339","360",,142,"10.1016/j.engfracmech.2017.11.017","https://www.scopus.com/inward/record.uri?eid=2-s2.0-85035064943&doi=10.1016%2fj.engfracmech.2017.11.017&partnerID=40&md5=2a7b944672fe9c850347ee7a6800f764",Article,"Final","",Scopus,2-s2.0-85035064943
"Msekh, M.A., Cuong, N.H., Zi, G., Areias, P., Zhuang, X., Rabczuk, T.","55274114200;57205784526;6701704145;55959928000;24485610900;56502462200;","Fracture properties prediction of clay/epoxy nanocomposites with interphase zones using a phase field model",2018,"Engineering Fracture Mechanics","188",,,"287","299",,190,"10.1016/j.engfracmech.2017.08.002","https://www.scopus.com/inward/record.uri?eid=2-s2.0-85028526633&doi=10.1016%2fj.engfracmech.2017.08.002&partnerID=40&md5=0c4d814ff27d323d68da1e1ed45abe3a",Article,"Final","",Scopus,2-s2.0-85028526633
"Jamshidian, M., Dehghani, A., Talaei, M.S., Rabczuk, T.","55967834200;57194101746;57190967706;56502462200;","Size dependent surface energy of nanoplates: Molecular dynamics and nanoscale continuum theory correlations",2018,"Physics Letters, Section A: General, Atomic and Solid State Physics","382","2-3",,"61","65",,5,"10.1016/j.physleta.2017.10.047","https://www.scopus.com/inward/record.uri?eid=2-s2.0-85033233926&doi=10.1016%2fj.physleta.2017.10.047&partnerID=40&md5=86bc64f9cdfed868a745c7d6d309c35c",Article,"Final","",Scopus,2-s2.0-85033233926
"Akmar, A.B.I., Kramer, O., Rabczuk, T.","56286265400;34875208500;56502462200;","Probabilistic multi-scale optimization of hybrid laminated composites",2018,"Composite Structures","184",,,"1111","1125",,13,"10.1016/j.compstruct.2017.10.032","https://www.scopus.com/inward/record.uri?eid=2-s2.0-85033466278&doi=10.1016%2fj.compstruct.2017.10.032&partnerID=40&md5=b1fafe8a6d3821d6d34689d42edc350d",Review,"Final","",Scopus,2-s2.0-85033466278
"Amin, R.U., Inayat, I., Aijun, L., Shamshirband, S., Rabczuk, T.","55752995400;55248320500;55751458600;57221738247;56502462200;","A bio-inspired global finite time tracking control of four-rotor test bench system",2018,"Computers, Materials and Continua","57","3",,"365","388",,3,"10.32604/cmc.2018.03757","https://www.scopus.com/inward/record.uri?eid=2-s2.0-85061864034&doi=10.32604%2fcmc.2018.03757&partnerID=40&md5=0664ccf098f12726ff3b48135f65ee53",Article,"Final","All Open Access, Bronze",Scopus,2-s2.0-85061864034
"Maghsoodi, A.I., Maghsoodi, A.I., Mosavi, A., Rabczuk, T., Zavadskas, E.K.","57200325286;57209880544;57191408081;56502462200;6602254601;","Renewable energy technology selection problem using integrated H-SWARA-MULTIMOORA approach",2018,"Sustainability (Switzerland)","10","12","4481","","",,34,"10.3390/su10024481","https://www.scopus.com/inward/record.uri?eid=2-s2.0-85061116175&doi=10.3390%2fsu10024481&partnerID=40&md5=f7ce57db181085f279e1499042180373",Article,"Final","",Scopus,2-s2.0-85061116175
"Yang, L., Fan, J., Vu-Bac, N., Rabczuk, T.","57193901292;56215402100;43861917200;56502462200;","A nanoscale study of the negative strain rate dependency of the strength of metallic glasses by molecular dynamics simulations",2018,"Physical Chemistry Chemical Physics","20","41",,"26552","26557",,4,"10.1039/c8cp05557b","https://www.scopus.com/inward/record.uri?eid=2-s2.0-85055603889&doi=10.1039%2fc8cp05557b&partnerID=40&md5=cbfd744e51ba1c3c010284f8ebf2b1e0",Article,"Final","",Scopus,2-s2.0-85055603889
"Silani, M., Rabczuk, T., Zhuang, X.","34868602300;56502462200;24485610900;","Computational multiscale modeling of carbon nanotube-reinforced polymers",2018,"Carbon Nanotube-Reinforced Polymers: From Nanoscale to Macroscale",,,,"465","477",,,"10.1016/B978-0-323-48221-9.00018-2","https://www.scopus.com/inward/record.uri?eid=2-s2.0-85054888367&doi=10.1016%2fB978-0-323-48221-9.00018-2&partnerID=40&md5=9c012854c34ae0a3195c158a02c05d74",Book Chapter,"Final","",Scopus,2-s2.0-85054888367
"Najafi, B., Faizollahzadeh Ardabili, S., Shamshirband, S., Chau, K.-W., Rabczuk, T.","57188693029;57189099323;57221738247;7202674661;56502462200;","Application of anns, anfis and rsm to estimating and optimizing the parameters that affect the yield and cost of biodiesel production",2018,"Engineering Applications of Computational Fluid Mechanics","12","1",,"611","624",,91,"10.1080/19942060.2018.1502688","https://www.scopus.com/inward/record.uri?eid=2-s2.0-85054789629&doi=10.1080%2f19942060.2018.1502688&partnerID=40&md5=d8fdb05171d894fe2841e7f31ae0e773",Article,"Final","All Open Access, Gold",Scopus,2-s2.0-85054789629
"Vu-Bac, N., Rabczuk, T., Zhuang, X.","43861917200;56502462200;24485610900;","Continuum/finite element modeling of carbon nanotube-reinforced polymers",2018,"Carbon Nanotube-Reinforced Polymers: From Nanoscale to Macroscale",,,,"385","409",,4,"10.1016/B978-0-323-48221-9.00015-7","https://www.scopus.com/inward/record.uri?eid=2-s2.0-85051776115&doi=10.1016%2fB978-0-323-48221-9.00015-7&partnerID=40&md5=645aca643d6868859aa7c0a990d01feb",Book Chapter,"Final","",Scopus,2-s2.0-85051776115
"Fardad, K., Najafi, B., Ardabili, S.F., Mosavi, A., Shamshirband, S., Rabczuk, T.","57202738257;57188693029;57189099323;57191408081;57221738247;56502462200;","Biodegradation of medicinal plants waste in an anaerobic digestion reactor for biogas production",2018,"Computers, Materials and Continua","55","3",,"318","392",,15,"10.3970/cmc.2018.01803","https://www.scopus.com/inward/record.uri?eid=2-s2.0-85049172058&doi=10.3970%2fcmc.2018.01803&partnerID=40&md5=a9239302abbb3f5b74e61ebec282a8d0",Article,"Final","",Scopus,2-s2.0-85049172058
"Mortazavi, B., Rabczuk, T.","24399312200;56502462200;","Application of 2D materials as anode electrodes for advanced Na or Li ion-batteries",2018,"Chemistry and Materials for Lead-Based Batteries Symposium 2018, Held at AABC Europe 2018",,,,"371","",,,,"https://www.scopus.com/inward/record.uri?eid=2-s2.0-85048751904&partnerID=40&md5=baf35d1c35ec024b424ff65996462a80",Conference Paper,"Final","",Scopus,2-s2.0-85048751904
"Rabczuk, T., Mortazavi, B.","56502462200;24399312200;","Application of 2d materials as anode electrodes for advanced na or li ion-batteries",2018,"Lithium Battery Chemistry Symposium 2018, Held at AABC Europe 2018",,,,"283","",,,,"https://www.scopus.com/inward/record.uri?eid=2-s2.0-85048653086&partnerID=40&md5=cc4f6346c7712392f035e499403d98f2",Conference Paper,"Final","",Scopus,2-s2.0-85048653086
"Mortazavi, B., Rabczuk, T.","24399312200;56502462200;","Application of 2D materials as anode electrodes for advanced Na or Li ion-batteries",2018,"Global Battery Raw Materials Symposium 2018, Held at AABC Europe 2018",,,,"299","",,,,"https://www.scopus.com/inward/record.uri?eid=2-s2.0-85048641694&partnerID=40&md5=0f7fca633e72efb4f9a9af0c5f73d86a",Conference Paper,"Final","",Scopus,2-s2.0-85048641694
"Mortazavi, B., Shahrokhi, M., Zhuang, X., Rabczuk, T.","24399312200;54893045900;24485610900;56502462200;","Boron-graphdiyne: A superstretchable semiconductor with low thermal conductivity and ultrahigh capacity for Li, Na and Ca ion storage",2018,"Journal of Materials Chemistry A","6","23",,"11022","11036",,79,"10.1039/c8ta02627k","https://www.scopus.com/inward/record.uri?eid=2-s2.0-85048509353&doi=10.1039%2fc8ta02627k&partnerID=40&md5=9860b49854085c72e6725f171a4d4430",Article,"Final","All Open Access, Green",Scopus,2-s2.0-85048509353
"Karimi, M., Rabczuk, T.","38561630300;56502462200;","Scoliosis conservative treatment: A review of literature",2018,"Journal of Craniovertebral Junction and Spine","9","1",,"3","8",,7,"10.4103/jcvjs.JCVJS_39_17","https://www.scopus.com/inward/record.uri?eid=2-s2.0-85046080449&doi=10.4103%2fjcvjs.JCVJS_39_17&partnerID=40&md5=0dcdea8fc3749ef45da412dd2235d8e1",Review,"Final","",Scopus,2-s2.0-85046080449
"Pawar, A., Zhang, Y.J., Anitescu, C., Jia, Y., Rabczuk, T.","57209063681;57214940409;36083903500;55589517400;56502462200;","DTHB3D_Reg: Dynamic truncated hierarchical B-Spline based 3D nonrigid image registration",2018,"Communications in Computational Physics","23","3",,"877","898",,8,"10.4208/CICP.OA-2017-0141","https://www.scopus.com/inward/record.uri?eid=2-s2.0-85044158751&doi=10.4208%2fCICP.OA-2017-0141&partnerID=40&md5=84e4d437c0da94739238ad091adab319",Article,"Final","",Scopus,2-s2.0-85044158751
"Khademi Zahedi, R., Alimouri, P., Nguyen-Xuan, H., Rabczuk, T.","57201009694;55842760600;24503383800;56502462200;","Crack detection in a beam on elastic foundation using differential quadrature method and the bees algorithm optimization",2018,"Lecture Notes in Mechanical Engineering","PartF3",,,"439","460",,4,"10.1007/978-981-10-7149-2_30","https://www.scopus.com/inward/record.uri?eid=2-s2.0-85042876161&doi=10.1007%2f978-981-10-7149-2_30&partnerID=40&md5=797355dfd297aa5c58255c9eb39d23df",Book Chapter,"Final","",Scopus,2-s2.0-85042876161
"Nguyen-Xuan, H., Phung-Van, P., Rabczuk, T.","24503383800;55181714100;56502462200;","Preface",2018,"Lecture Notes in Mechanical Engineering","PartF3",,,"v","",,,,"https://www.scopus.com/inward/record.uri?eid=2-s2.0-85042871379&partnerID=40&md5=7795c9f918f910dfbfeb3d22da5c57ed",Editorial,"Final","",Scopus,2-s2.0-85042871379
"Anitescu, C., Hossain, M.N., Rabczuk, T.","36083903500;57196403426;56502462200;","Recovery-based error estimation and adaptivity using high-order splines over hierarchical T-meshes",2018,"Computer Methods in Applied Mechanics and Engineering","328",,,"638","662",,57,"10.1016/j.cma.2017.08.032","https://www.scopus.com/inward/record.uri?eid=2-s2.0-85032879540&doi=10.1016%2fj.cma.2017.08.032&partnerID=40&md5=e45ccacbe1069ff5db0113a09946c879",Article,"Final","",Scopus,2-s2.0-85032879540
