作者,作者 ID,标题,年份,来源出版物名称,卷,期,论文编号,起始页码,结束页码,页码计数,施引文献,DOI,链接,文献类型,出版阶段,开放获取,来源出版物,EID
"Zhuang, X., Nguyen, B.H., Nanthakumar, S.S., Tran, T.Q., Alajlan, N., Rabczuk, T.","24485610900;57188966444;55889120800;57188664795;23134518500;56502462200;","Computational modeling of flexoelectricity-A review",2020,"Energies","16","3","1326","","",,18,"10.3390/en13061326","https://www.scopus.com/inward/record.uri?eid=2-s2.0-85081786387&doi=10.3390%2fen13061326&partnerID=40&md5=3a3843db91c4e40cbde9fee2796e6f8d",Review,"Final","All Open Access, Gold",Scopus,2-s2.0-85081786387
"Wu, Y., Ma, C., Chen, Y., Mortazavi, B., Lu, Z., Zhang, X., Xu, K., Zhang, H., Liu, W., Rabczuk, T., Zhu, H., Fang, Z., Zhang, R.","57209736779;57209738598;57221457216;24399312200;57209737909;57215375182;57201889898;57155493400;56145401900;56502462200;7404663434;56302402400;7404864740;","New group V graphyne: two-dimensional direct semiconductors with remarkable carrier mobilities, thermoelectric performance, and thermal stability",2020,"Materials Today Physics","12",,"100164","","",,12,"10.1016/j.mtphys.2019.100164","https://www.scopus.com/inward/record.uri?eid=2-s2.0-85077973077&doi=10.1016%2fj.mtphys.2019.100164&partnerID=40&md5=8b7e0d3dc53c8a4b44402555f6515245",Article,"Final","",Scopus,2-s2.0-85077973077
"Liu, B., Vu-Bac, N., Zhuang, X., Rabczuk, T.","57212450310;43861917200;24485610900;56502462200;","Stochastic multiscale modeling of heat conductivity of Polymeric clay nanocomposites",2020,"Mechanics of Materials","142",,"103280","","",,14,"10.1016/j.mechmat.2019.103280","https://www.scopus.com/inward/record.uri?eid=2-s2.0-85076682008&doi=10.1016%2fj.mechmat.2019.103280&partnerID=40&md5=93713f8e27639a4a8ac52257c954c658",Article,"Final","",Scopus,2-s2.0-85076682008
"Nguyen-Thanh, V.M., Zhuang, X., Rabczuk, T.","57203101363;24485610900;56502462200;","A deep energy method for finite deformation hyperelasticity",2020,"European Journal of Mechanics, A/Solids","80",,"103874","","",,43,"10.1016/j.euromechsol.2019.103874","https://www.scopus.com/inward/record.uri?eid=2-s2.0-85076246280&doi=10.1016%2fj.euromechsol.2019.103874&partnerID=40&md5=09ef84799d62a353eaa9e9d09488da21",Article,"Final","",Scopus,2-s2.0-85076246280
"Phung-Van, P., Thai, C.H., Ferreira, A.J.M., Rabczuk, T.","55181714100;55023724300;7402999780;56502462200;","Isogeometric nonlinear transient analysis of porous FGM plates subjected to hygro-thermo-mechanical loads",2020,"Thin-Walled Structures","148",,"106497","","",,38,"10.1016/j.tws.2019.106497","https://www.scopus.com/inward/record.uri?eid=2-s2.0-85075867234&doi=10.1016%2fj.tws.2019.106497&partnerID=40&md5=9746a19ddf93b7e3b668e5e76868abfa",Article,"Final","",Scopus,2-s2.0-85075867234
"Yaghoubi, V., Silani, M., Zolfaghari, H., Jamshidian, M., Rabczuk, T.","36599699000;34868602300;57492041900;55967834200;56502462200;","Nonlinear interphase effects on plastic hardening of nylon 6/clay nanocomposites: A computational stochastic analysis",2020,"Journal of Composite Materials","54","6",,"753","763",,1,"10.1177/0021998319868523","https://www.scopus.com/inward/record.uri?eid=2-s2.0-85071444554&doi=10.1177%2f0021998319868523&partnerID=40&md5=8c68de6f70592a0ef7041c044e311a0c",Article,"Final","",Scopus,2-s2.0-85071444554
"Mortazavi, B., Shojaei, F., Azizi, M., Rabczuk, T., Zhuang, X.","24399312200;6602685980;57195560896;56502462200;24485610900;","As2S3, As2Se3 and As2Te3 nanosheets: Superstretchable semiconductors with anisotropic carrier mobilities and optical properties",2020,"Journal of Materials Chemistry C","8","7",,"2400","2410",,29,"10.1039/c9tc05904k","https://www.scopus.com/inward/record.uri?eid=2-s2.0-85081051591&doi=10.1039%2fc9tc05904k&partnerID=40&md5=96741942b41bc251875a0db6df3442fe",Article,"Final","All Open Access, Green",Scopus,2-s2.0-85081051591
"Safarpour, M., Rahimi, A., Arani, O.N., Rabczuk, T.","57211436676;57213089251;57215435930;56502462200;","Frequency characteristics of multiscale hybrid nanocomposite annular plate based on a halpin-tsai homogenization model with the aid of GDQM",2020,"Applied Sciences (Switzerland)","10","4","1412","","",,15,"10.3390/app10041412","https://www.scopus.com/inward/record.uri?eid=2-s2.0-85080900441&doi=10.3390%2fapp10041412&partnerID=40&md5=70b7234f3ad73417621278e706b97dd1",Article,"Final","All Open Access, Gold",Scopus,2-s2.0-85080900441
"Karami, B., Janghorban, M., Rabczuk, T.","57194240097;39061563300;56502462200;","Dynamics of two-dimensional functionally graded tapered Timoshenko nanobeam in thermal environment using nonlocal strain gradient theory",2020,"Composites Part B: Engineering","182",,"107622","","",,63,"10.1016/j.compositesb.2019.107622","https://www.scopus.com/inward/record.uri?eid=2-s2.0-85075900531&doi=10.1016%2fj.compositesb.2019.107622&partnerID=40&md5=f386ea9e2ea239a0364b4b6c10581329",Article,"Final","",Scopus,2-s2.0-85075900531
"Rabizadeh, E., Bagherzadeh, A.S., Anitescu, C., Alajlan, N., Rabczuk, T.","56531835300;56068327500;36083903500;23134518500;56502462200;","Pointwise dual weighted residual based goal-oriented a posteriori error estimation and adaptive mesh refinement in 2D/3D thermo-mechanical multifield problems",2020,"Computer Methods in Applied Mechanics and Engineering","359",,"112666","","",,4,"10.1016/j.cma.2019.112666","https://www.scopus.com/inward/record.uri?eid=2-s2.0-85073829636&doi=10.1016%2fj.cma.2019.112666&partnerID=40&md5=f5e378511fa152a8e2194c91bf743c01",Article,"Final","",Scopus,2-s2.0-85073829636
"Faroughi, S., Shafei, E., Rabczuk, T.","36715819000;35321494400;56502462200;","Anisotropic solid-like shells modeled with NURBS-based isogeometric approach: Vibration, buckling, and divergence analyses",2020,"Computer Methods in Applied Mechanics and Engineering","359",,"112668","","",,5,"10.1016/j.cma.2019.112668","https://www.scopus.com/inward/record.uri?eid=2-s2.0-85073815256&doi=10.1016%2fj.cma.2019.112668&partnerID=40&md5=9efea25b4586c5b8ae753fdc64591092",Article,"Final","",Scopus,2-s2.0-85073815256
"Ghasemi, H., Park, H.S., Alajlan, N., Rabczuk, T.","57218802972;10045002000;23134518500;56502462200;","A Computational Framework for Design and Optimization of Flexoelectric Materials",2020,"International Journal of Computational Methods","17","1","1850097","","",,8,"10.1142/S0219876218500974","https://www.scopus.com/inward/record.uri?eid=2-s2.0-85044097092&doi=10.1142%2fS0219876218500974&partnerID=40&md5=40494971d70af4b0e48e2a341395e0f3",Article,"Final","",Scopus,2-s2.0-85044097092
"Ardabili, S.F., Mosavi, A., Ghamisi, P., Ferdinand, F., Varkonyi-Koczy, A.R., Reuter, U., Rabczuk, T., Atkinson, P.M.","57189099323;57191408081;53663404300;24080069300;7004130277;7006635270;56502462200;7201906181;","COVID-19 outbreak prediction with machine learning",2020,"Algorithms","13","10","249","","",,138,"10.3390/a13100249","https://www.scopus.com/inward/record.uri?eid=2-s2.0-85099545833&doi=10.3390%2fa13100249&partnerID=40&md5=5f6c128a695cf86c2d113fe265e92540",Article,"Final","All Open Access, Gold, Green",Scopus,2-s2.0-85099545833
"Karimi, M.T., Rabczuk, T.","38561630300;56502462200;","Evaluation of the efficiency of Boston brace on scoliotic curve control: A review of literature",2020,"Journal of Spinal Cord Medicine","43","6",,"824","831",,3,"10.1080/10790268.2019.1578104","https://www.scopus.com/inward/record.uri?eid=2-s2.0-85098740171&doi=10.1080%2f10790268.2019.1578104&partnerID=40&md5=2fde58fa11e729a3bc5e76f06150e4e8",Review,"Final","All Open Access, Green",Scopus,2-s2.0-85098740171
"Noori, H., Mortazavi, B., Pierro, A.D., Jomehzadeh, E., Zhuang, X., Goangseup, Z., Sang-Hyun, K., Rabczuk, T.","57219237939;24399312200;57195741195;56183188400;24485610900;6701704145;57510052900;56502462200;","A systematic molecular dynamics investigation on the graphene polymer nanocomposites for bulletproofing",2020,"Computers, Materials and Continua","65","3",,"2009","2032",,3,"10.32604/cmc.2020.011256","https://www.scopus.com/inward/record.uri?eid=2-s2.0-85091861068&doi=10.32604%2fcmc.2020.011256&partnerID=40&md5=2ed8be8552a410c4eb7e5f22acb08967",Article,"Final","All Open Access, Gold",Scopus,2-s2.0-85091861068
"Karimi, M.T., Rabczuk, T., Luthfi, M.","38561630300;56502462200;57211299864;","Evaluation of the effects of various force configurations and magnitudes on scoliotic curve correction by use of finite element analysis: A case study",2020,"Current Orthopaedic Practice","31","5",,"457","462",,1,"10.1097/BCO.0000000000000903","https://www.scopus.com/inward/record.uri?eid=2-s2.0-85091514496&doi=10.1097%2fBCO.0000000000000903&partnerID=40&md5=6d81a1a0cebbc9cdeafc0d3f3653f30b",Article,"Final","",Scopus,2-s2.0-85091514496
"Bisheh, H., Luo, Y., Rabczuk, T.","57200758456;55660793100;56502462200;","Hip Fracture Risk Assessment Based on Different Failure Criteria Using QCT-Based Finite Element Modeling",2020,"Computers, Materials and Continua","63","2",,"567","591",,3,"10.32604/cmc.2020.09393","https://www.scopus.com/inward/record.uri?eid=2-s2.0-85091136198&doi=10.32604%2fcmc.2020.09393&partnerID=40&md5=b76975806aa737a503a250539021c3f9",Article,"Final","",Scopus,2-s2.0-85091136198
"Ghasemi, H., Park, H.S., Zhuang, X., Rabczuk, T.","57218802972;10045002000;24485610900;56502462200;","Three-dimensional isogeometric analysis of flexoelectricity with MATLAB implementation",2020,"Computers, Materials and Continua","65","2",,"1157","1179",,9,"10.32604/cmc.2020.08358","https://www.scopus.com/inward/record.uri?eid=2-s2.0-85090947321&doi=10.32604%2fcmc.2020.08358&partnerID=40&md5=8517b2123f85a57d6c1481161a194a2f",Article,"Final","All Open Access, Gold",Scopus,2-s2.0-85090947321
"Shamshirband, S., Mosavi, A., Rabczuk, T., Nabipour, N., Chau, K.-W.","57221738247;57191408081;56502462200;57209908854;7202674661;","Prediction of significant wave height; comparison between nested grid numerical model, and machine learning models of artificial neural networks, extreme learning and support vector machines",2020,"Engineering Applications of Computational Fluid Mechanics","14","1",,"805","817",,28,"10.1080/19942060.2020.1773932","https://www.scopus.com/inward/record.uri?eid=2-s2.0-85087401793&doi=10.1080%2f19942060.2020.1773932&partnerID=40&md5=336953d842b2551f2c1f118560739830",Article,"Final","All Open Access, Gold, Green",Scopus,2-s2.0-85087401793
"Arefi, M., Mohammadi, M., Tabatabaeian, A., Rabczuk, T.","35180902500;57202909313;57202683755;56502462200;","Free vibration analysis of FG-CNTRC cylindrical pressure vessels resting on Pasternak foundation with various boundary conditions",2020,"Computers, Materials and Continua","62","3",,"1001","1023",,2,"10.32604/cmc.2020.08052","https://www.scopus.com/inward/record.uri?eid=2-s2.0-85082176482&doi=10.32604%2fcmc.2020.08052&partnerID=40&md5=c632ca89eba50106c75b795e58a6f8f6",Article,"Final","All Open Access, Gold",Scopus,2-s2.0-85082176482
"Karami, B., Janghorban, M., Rabczuk, T.","57194240097;39061563300;56502462200;","Forced vibration analysis of functionally graded anisotropic nanoplates resting on Winkler/Pasternak-foundation",2020,"Computers, Materials and Continua","62","2",,"607","629",,20,"10.32604/cmc.2020.08032","https://www.scopus.com/inward/record.uri?eid=2-s2.0-85079087887&doi=10.32604%2fcmc.2020.08032&partnerID=40&md5=0e5cccd0f0eea9cda1429847c64cf18e",Article,"Final","All Open Access, Bronze",Scopus,2-s2.0-85079087887
"Ren, H., Zhuang, X., Rabczuk, T.","57190407212;24485610900;56502462200;","A nonlocal operator method for solving partial differential equations",2020,"Computer Methods in Applied Mechanics and Engineering","358",,"112621","","",,63,"10.1016/j.cma.2019.112621","https://www.scopus.com/inward/record.uri?eid=2-s2.0-85072928234&doi=10.1016%2fj.cma.2019.112621&partnerID=40&md5=81f7cc41dfa5cd5820d97492ba06aff8",Article,"Final","All Open Access, Green",Scopus,2-s2.0-85072928234
"Dineva, A., Mosavi, A., Gyimesi, M., Vajda, I., Nabipour, N., Rabczuk, T.","55635385900;57191408081;57212531696;7005938974;57209908854;56502462200;","Fault diagnosis of rotating electrical machines using multi-label classification",2019,"Applied Sciences (Switzerland)","9","23","5086","","",,24,"10.3390/app9235086","https://www.scopus.com/inward/record.uri?eid=2-s2.0-85077005423&doi=10.3390%2fapp9235086&partnerID=40&md5=b47f66a332f4e4aaa04be5141980a30f",Article,"Final","All Open Access, Gold",Scopus,2-s2.0-85077005423
"Mirakhory, M., Khatibi, M.M., Rabczuk, T.","57203058186;26423014800;56502462200;","Attenuation of nanoparticle mass detection by single layer graphene sheets via mono-vacancy and plate geometry",2019,"Diamond and Related Materials","100",,"107559","","",,1,"10.1016/j.diamond.2019.107559","https://www.scopus.com/inward/record.uri?eid=2-s2.0-85073991711&doi=10.1016%2fj.diamond.2019.107559&partnerID=40&md5=9989500daa9ac462561574d4b51843b3",Article,"Final","",Scopus,2-s2.0-85073991711
"Qi, G., Rabczuk, T.","57211020957;56502462200;","Ab initio investigation of lithium adsorption on short carbon nanotubes considering effects of the tube length",2019,"Carbon","155",,,"727","733",,9,"10.1016/j.carbon.2019.08.027","https://www.scopus.com/inward/record.uri?eid=2-s2.0-85072272803&doi=10.1016%2fj.carbon.2019.08.027&partnerID=40&md5=8de357e6f9254484177ce2573e56f960",Article,"Final","",Scopus,2-s2.0-85072272803
"Areias, P., Pinto da Costa, A., Rabczuk, T., César de Sá, J.","55959928000;6506200356;56502462200;55988088800;","A simple and robust Coulomb frictional algorithm based on 3 additional degrees-of-freedom and smoothing",2019,"Finite Elements in Analysis and Design","167",,"103321","","",,3,"10.1016/j.finel.2019.103321","https://www.scopus.com/inward/record.uri?eid=2-s2.0-85072168279&doi=10.1016%2fj.finel.2019.103321&partnerID=40&md5=5a57319666e8eb9e7317b8ca23e3c8e6",Article,"Final","",Scopus,2-s2.0-85072168279
"Chan, C.L., Anitescu, C., Rabczuk, T.","57143191300;36083903500;56502462200;","Strong multipatch C1-coupling for isogeometric analysis on 2D and 3D domains",2019,"Computer Methods in Applied Mechanics and Engineering","357",,"112599","","",,13,"10.1016/j.cma.2019.112599","https://www.scopus.com/inward/record.uri?eid=2-s2.0-85071242698&doi=10.1016%2fj.cma.2019.112599&partnerID=40&md5=7583a4489c6f503de1b29d8f4a15cd0b",Article,"Final","",Scopus,2-s2.0-85071242698
"Pan, Q., Rabczuk, T., Xu, G., Chen, C.","35311937000;56502462200;55935631700;35728279700;","Isogeometric analysis for surface PDEs with extended Loop subdivision",2019,"Journal of Computational Physics","398",,"108892","","",,5,"10.1016/j.jcp.2019.108892","https://www.scopus.com/inward/record.uri?eid=2-s2.0-85071013185&doi=10.1016%2fj.jcp.2019.108892&partnerID=40&md5=6ee5657b4fde85297533f1d2ed8e68a9",Article,"Final","All Open Access, Green",Scopus,2-s2.0-85071013185
"Liaghat, F., Hematiyan, M.R., Khosravifard, A., Rabczuk, T.","56175195700;6506608244;27967837800;56502462200;","A robust meshfree method for analysis of cohesive crack propagation problems",2019,"Theoretical and Applied Fracture Mechanics","104",,"102328","","",,10,"10.1016/j.tafmec.2019.102328","https://www.scopus.com/inward/record.uri?eid=2-s2.0-85070932975&doi=10.1016%2fj.tafmec.2019.102328&partnerID=40&md5=a2ef75b6259f5fb7e0a371b37de06e8b",Article,"Final","",Scopus,2-s2.0-85070932975
"Majidi, R., Rabczuk, T.","23028293200;56502462200;","Structural and electronic properties of BN co-doped and BN analogue of twin graphene sheets: A density functional theory study",2019,"Journal of Physics and Chemistry of Solids","135",,"109115","","",,17,"10.1016/j.jpcs.2019.109115","https://www.scopus.com/inward/record.uri?eid=2-s2.0-85069638330&doi=10.1016%2fj.jpcs.2019.109115&partnerID=40&md5=4594ae840f8d639cee1dc8efabbb69ba",Article,"Final","",Scopus,2-s2.0-85069638330
"Pawar, A., Zhang, Y.J., Anitescu, C., Rabczuk, T.","57209063681;55739765100;36083903500;56502462200;","Joint image segmentation and registration based on a dynamic level set approach using truncated hierarchical B-splines",2019,"Computers and Mathematics with Applications","78","10",,"3250","3267",,6,"10.1016/j.camwa.2019.04.026","https://www.scopus.com/inward/record.uri?eid=2-s2.0-85065432878&doi=10.1016%2fj.camwa.2019.04.026&partnerID=40&md5=a412493ef9f4cfb8269e91c8443b7b4b",Article,"Final","All Open Access, Bronze",Scopus,2-s2.0-85065432878
"Vu-Bac, N., Zhuang, X., Rabczuk, T.","43861917200;24485610900;56502462200;","Uncertainty quantification for mechanical properties of polyethylene based on fully atomistic model",2019,"Materials","12","21","3613","","",,9,"10.3390/ma12213613","https://www.scopus.com/inward/record.uri?eid=2-s2.0-85074667736&doi=10.3390%2fma12213613&partnerID=40&md5=6eb550bbd4a2a7eacdcb78b5c41cca6a",Article,"Final","All Open Access, Gold, Green",Scopus,2-s2.0-85074667736
"Arefi, M., Mohammadi, M., Amir-Ahmadi, S., Rabczuk, T.","35180902500;57202909313;57209408701;56502462200;","FSDT electro-elastic analysis of FG-CNTRC cylindrical three-layered pressure vessels with piezoelectric face-sheets",2019,"Thin-Walled Structures","144",,"106320","","",,10,"10.1016/j.tws.2019.106320","https://www.scopus.com/inward/record.uri?eid=2-s2.0-85073646982&doi=10.1016%2fj.tws.2019.106320&partnerID=40&md5=fefea1b886ec8e48fab3ec7f372ef714",Article,"Final","",Scopus,2-s2.0-85073646982
"Ren, H., Zhuang, X., Rabczuk, T., Zhu, H.","57190407212;24485610900;56502462200;57210818384;","Dual-support smoothed particle hydrodynamics in solid: variational principle and implicit formulation",2019,"Engineering Analysis with Boundary Elements","108",,,"15","29",,26,"10.1016/j.enganabound.2019.05.024","https://www.scopus.com/inward/record.uri?eid=2-s2.0-85071571188&doi=10.1016%2fj.enganabound.2019.05.024&partnerID=40&md5=5bd966c9cca0a6eae229696e403e8750",Article,"Final","All Open Access, Green",Scopus,2-s2.0-85071571188
"Areias, P., Rabczuk, T., Carapau, F., Lopes, J.C.","55959928000;56502462200;10840288300;55697722900;","A continuous-stress tetrahedron for finite strain problems",2019,"Finite Elements in Analysis and Design","165",,,"52","64",,2,"10.1016/j.finel.2019.07.003","https://www.scopus.com/inward/record.uri?eid=2-s2.0-85070892394&doi=10.1016%2fj.finel.2019.07.003&partnerID=40&md5=d9a41533e4bb2ae5a9d7a584b6773474",Article,"Final","All Open Access, Green",Scopus,2-s2.0-85070892394
"Hamdia, K.M., Ghasemi, H., Bazi, Y., AlHichri, H., Alajlan, N., Rabczuk, T.","56565417600;57218802972;8213665300;6506519446;23134518500;56502462200;","A novel deep learning based method for the computational material design of flexoelectric nanostructures with topology optimization",2019,"Finite Elements in Analysis and Design","165",,,"21","30",,35,"10.1016/j.finel.2019.07.001","https://www.scopus.com/inward/record.uri?eid=2-s2.0-85070798257&doi=10.1016%2fj.finel.2019.07.001&partnerID=40&md5=4314cfa4de3f87caa31bbfa354eaf9cb",Article,"Final","",Scopus,2-s2.0-85070798257
"Karami, B., Janghorban, M., Rabczuk, T.","57194240097;39061563300;56502462200;","Static analysis of functionally graded anisotropic nanoplates using nonlocal strain gradient theory",2019,"Composite Structures","227",,"111249","","",,41,"10.1016/j.compstruct.2019.111249","https://www.scopus.com/inward/record.uri?eid=2-s2.0-85070542106&doi=10.1016%2fj.compstruct.2019.111249&partnerID=40&md5=5e8a2c20e5b564a6b00f0008ec40fa49",Article,"Final","",Scopus,2-s2.0-85070542106
"Karami, B., Janghorban, M., Rabczuk, T.","57194240097;39061563300;56502462200;","Analysis of elastic bulk waves in functionally graded triclinic nanoplates using a quasi-3D bi-Helmholtz nonlocal strain gradient model",2019,"European Journal of Mechanics, A/Solids","78",,"103822","","",,18,"10.1016/j.euromechsol.2019.103822","https://www.scopus.com/inward/record.uri?eid=2-s2.0-85069887224&doi=10.1016%2fj.euromechsol.2019.103822&partnerID=40&md5=601b9394ca35cc5a688b92ee11c1727d",Article,"Final","",Scopus,2-s2.0-85069887224
"Salavati, M., Rabczuk, T.","55775272700;56502462200;","First-principles investigation of N-triphenylene-graphdiyne nanosheets as an anode material for Na, K, Mg and Ca storage",2019,"Computational Materials Science","169",,"109093","","",,10,"10.1016/j.commatsci.2019.109093","https://www.scopus.com/inward/record.uri?eid=2-s2.0-85067869523&doi=10.1016%2fj.commatsci.2019.109093&partnerID=40&md5=2c0e602e5dc88e8708be74d89667f413",Article,"Final","",Scopus,2-s2.0-85067869523
"Xi, Q., Fu, Z.-J., Rabczuk, T.","57192911013;35072646900;56502462200;","An efficient boundary collocation scheme for transient thermal analysis in large-size-ratio functionally graded materials under heat source load",2019,"Computational Mechanics","64","5",,"1221","1235",,30,"10.1007/s00466-019-01701-7","https://www.scopus.com/inward/record.uri?eid=2-s2.0-85066290837&doi=10.1007%2fs00466-019-01701-7&partnerID=40&md5=6de6808b6fc05ef4be27cf87f7ea8af5",Article,"Final","",Scopus,2-s2.0-85066290837
"Goswami, S., Chakraborty, S., Chowdhury, R., Rabczuk, T.","7102060904;56242780800;10046255200;56502462200;","Threshold shift method for reliability-based design optimization",2019,"Structural and Multidisciplinary Optimization","60","5",,"2053","2072",,11,"10.1007/s00158-019-02310-x","https://www.scopus.com/inward/record.uri?eid=2-s2.0-85066144471&doi=10.1007%2fs00158-019-02310-x&partnerID=40&md5=00d601af8bba3d06065013c0570af9e5",Article,"Final","All Open Access, Green",Scopus,2-s2.0-85066144471
"Zhou, S., Zhuang, X., Rabczuk, T.","55951420500;24485610900;56502462200;","Phase field modeling of brittle compressive-shear fractures in rock-like materials: A new driving force and a hybrid formulation",2019,"Computer Methods in Applied Mechanics and Engineering","355",,,"729","752",,102,"10.1016/j.cma.2019.06.021","https://www.scopus.com/inward/record.uri?eid=2-s2.0-85068561409&doi=10.1016%2fj.cma.2019.06.021&partnerID=40&md5=cd6281f7857563ff83814800b3ba6923",Article,"Final","",Scopus,2-s2.0-85068561409
"Izadifar, M., Thissen, P., Abadi, R., Jam, A.N., Gohari, S., Burvill, C., Rabczuk, T.","56225677300;25650854000;56226982100;57195414422;53663366400;6507239941;56502462200;","Fracture toughness of various percentage of doping of boron atoms on the mechanical properties of polycrystalline graphene: A molecular dynamics study",2019,"Physica E: Low-Dimensional Systems and Nanostructures","114",,"113614","","",,6,"10.1016/j.physe.2019.113614","https://www.scopus.com/inward/record.uri?eid=2-s2.0-85068260015&doi=10.1016%2fj.physe.2019.113614&partnerID=40&md5=64b97d92a4f905f547265e477d08cb0a",Article,"Final","",Scopus,2-s2.0-85068260015
"Arefi, M., Mohammadi, M., Rabczuk, T.","35180902500;57202909313;56502462200;","Effect of characteristics and distribution of porosity on electro-elastic analysis of laminated vessels with piezoelectric face-sheets based on higher-order modeling",2019,"Composite Structures","225",,"111085","","",,7,"10.1016/j.compstruct.2019.111085","https://www.scopus.com/inward/record.uri?eid=2-s2.0-85067071150&doi=10.1016%2fj.compstruct.2019.111085&partnerID=40&md5=d5b12045f2ad3381fff67e2a86af27ed",Article,"Final","",Scopus,2-s2.0-85067071150
"Zahedi, R.K., Shirazi, A.H.N., Alimouri, P., Alajlan, N., Rabczuk, T.","57209050710;57189499115;55842760600;23134518500;56502462200;","Mechanical properties of graphene-like BC3; a molecular dynamics study",2019,"Computational Materials Science","168",,,"1","10",,25,"10.1016/j.commatsci.2019.05.053","https://www.scopus.com/inward/record.uri?eid=2-s2.0-85066407240&doi=10.1016%2fj.commatsci.2019.05.053&partnerID=40&md5=0edd87e1398efdbb4bafc9f9a42b7d23",Article,"Final","",Scopus,2-s2.0-85066407240
"Fang, J., Wu, C., Rabczuk, T., Wu, C., Ma, C., Sun, G., Li, Q.","55303506400;55655692100;56502462200;57194157944;37023378300;15129334300;56384510800;","Phase field fracture in elasto-plastic solids: Abaqus implementation and case studies",2019,"Theoretical and Applied Fracture Mechanics","103",,"102252","","",,35,"10.1016/j.tafmec.2019.102252","https://www.scopus.com/inward/record.uri?eid=2-s2.0-85066396642&doi=10.1016%2fj.tafmec.2019.102252&partnerID=40&md5=c417516f0232b9ddeb8284aa385d4cdb",Article,"Final","",Scopus,2-s2.0-85066396642
"Areias, P., Pires, M., Bac, N.V., Rabczuk, T.","55959928000;16302036200;43861917200;56502462200;","An objective and path-independent 3D finite-strain beam with least-squares assumed-strain formulation",2019,"Computational Mechanics","64","4",,"1115","1131",,1,"10.1007/s00466-019-01696-1","https://www.scopus.com/inward/record.uri?eid=2-s2.0-85064257016&doi=10.1007%2fs00466-019-01696-1&partnerID=40&md5=a7cc7311ea18668ccd4ac6db839b7305",Article,"Final","",Scopus,2-s2.0-85064257016
"Ebrahimi, F., Nouraei, M., Dabbagh, A., Rabczuk, T.","35253257600;57208385230;57207612920;56502462200;","Thermal buckling analysis of embedded graphene-oxide powder-reinforced nanocomposite plates",2019,"Advances in Nano Research","7","5",,"293","310",,19,"10.12989/anr.2019.7.5.293","https://www.scopus.com/inward/record.uri?eid=2-s2.0-85073244286&doi=10.12989%2fanr.2019.7.5.293&partnerID=40&md5=3f715121306983f400ed338d0132a1e9",Article,"Final","",Scopus,2-s2.0-85073244286
"Rabczuk, T.","56502462200;","Special issue ""computational methods for fracture""",2019,"Applied Sciences (Switzerland)","9","17","3455","","",,,"10.3390/app9173455","https://www.scopus.com/inward/record.uri?eid=2-s2.0-85072243886&doi=10.3390%2fapp9173455&partnerID=40&md5=c56de543c4aa3ce8531aa41af5df0357",Editorial,"Final","All Open Access, Gold, Green",Scopus,2-s2.0-85072243886
"Goswami, S., Anitescu, C., Rabczuk, T.","7102060904;36083903500;56502462200;","Adaptive phase field analysis with dual hierarchical meshes for brittle fracture",2019,"Engineering Fracture Mechanics","218",,"106608","","",,14,"10.1016/j.engfracmech.2019.106608","https://www.scopus.com/inward/record.uri?eid=2-s2.0-85070723194&doi=10.1016%2fj.engfracmech.2019.106608&partnerID=40&md5=c543d4e77844bacf0b8347056b5adf85",Article,"Final","",Scopus,2-s2.0-85070723194
