作者,作者 ID,标题,年份,来源出版物名称,卷,期,论文编号,起始页码,结束页码,页码计数,施引文献,DOI,链接,文献类型,出版阶段,开放获取,来源出版物,EID
"Rabczuk, T., Zhuang, X., Nguyen-Thoi, T.","56502462200;24485610900;24171745600;","Computational Methods for Fracture 2015",2015,"Mathematical Problems in Engineering","2015",,"890890","","",,,"10.1155/2015/890890","https://www.scopus.com/inward/record.uri?eid=2-s2.0-84946944947&doi=10.1155%2f2015%2f890890&partnerID=40&md5=347c54c3a5a6165201bfc886660bcc2c",Editorial,"Final","All Open Access, Gold, Green",Scopus,2-s2.0-84946944947
"Hamdia, K.M., Lahmer, T., Nguyen-Thoi, T., Rabczuk, T.","56565417600;15765564800;24171745600;56502462200;","Predicting the fracture toughness of PNCs: A stochastic approach based on ANN and ANFIS",2015,"Computational Materials Science","102",,,"304","313",,79,"10.1016/j.commatsci.2015.02.045","https://www.scopus.com/inward/record.uri?eid=2-s2.0-84925307428&doi=10.1016%2fj.commatsci.2015.02.045&partnerID=40&md5=bf2302a8df1d5eeeab73ba388a62b3b3",Article,"Final","",Scopus,2-s2.0-84925307428
"Ghasemi, H., Brighenti, R., Zhuang, X., Muthu, J., Rabczuk, T.","57218802972;6603794567;24485610900;6506681477;56502462200;","Optimal fiber content and distribution in fiber-reinforced solids using a reliability and NURBS based sequential optimization approach",2015,"Structural and Multidisciplinary Optimization","51","1",,"99","112",,66,"10.1007/s00158-014-1114-y","https://www.scopus.com/inward/record.uri?eid=2-s2.0-84924223217&doi=10.1007%2fs00158-014-1114-y&partnerID=40&md5=98514c1b6ac8a1f7b62ab9dd814ab438",Article,"Final","",Scopus,2-s2.0-84924223217
"Rabizadeh, E., Saboor Bagherzadeh, A., Rabczuk, T.","56531835300;56068327500;56502462200;","Adaptive thermo-mechanical finite element formulation based on goal-oriented error estimation",2015,"Computational Materials Science","102",,,"27","44",,10,"10.1016/j.commatsci.2015.01.044","https://www.scopus.com/inward/record.uri?eid=2-s2.0-84923816889&doi=10.1016%2fj.commatsci.2015.01.044&partnerID=40&md5=5dfafaf170f72846952966727a176dbc",Article,"Final","",Scopus,2-s2.0-84923816889
"Areias, P., Rabczuk, T., César De Sá, J.M., Garção, J.E.","55959928000;56502462200;55988088800;7801489596;","Finite strain quadrilateral shell using least-squares fit of relative Lagrangian in-plane strains",2015,"Finite Elements in Analysis and Design","98",,,"26","40",,6,"10.1016/j.finel.2015.01.004","https://www.scopus.com/inward/record.uri?eid=2-s2.0-84923322347&doi=10.1016%2fj.finel.2015.01.004&partnerID=40&md5=f547d04efd71a82d39db61384f35fed5",Article,"Final","All Open Access, Green",Scopus,2-s2.0-84923322347
"Kumar, S., Singh, I.V., Mishra, B.K., Rabczuk, T.","57218172988;57204061377;55578538300;56502462200;","Modeling and simulation of kinked cracks by virtual node XFEM",2015,"Computer Methods in Applied Mechanics and Engineering","283",,,"1425","1466",,66,"10.1016/j.cma.2014.10.019","https://www.scopus.com/inward/record.uri?eid=2-s2.0-84922277354&doi=10.1016%2fj.cma.2014.10.019&partnerID=40&md5=363cc31c5a0d910a3f87b684132f84e7",Article,"Final","",Scopus,2-s2.0-84922277354
"Mortazavi, B., Cuniberti, G., Rabczuk, T.","24399312200;56273831400;56502462200;","Mechanical properties and thermal conductivity of graphitic carbon nitride: A molecular dynamics study",2015,"Computational Materials Science","99",,,"285","289",,88,"10.1016/j.commatsci.2014.12.036","https://www.scopus.com/inward/record.uri?eid=2-s2.0-84921510086&doi=10.1016%2fj.commatsci.2014.12.036&partnerID=40&md5=a9c4f42fe36d06dd8998824bdac2872c",Article,"Final","All Open Access, Green",Scopus,2-s2.0-84921510086
"Msekh, M.A., Sargado, J.M., Jamshidian, M., Areias, P.M., Rabczuk, T.","55274114200;55958077500;55967834200;55959928000;56502462200;","Abaqus implementation of phase-field model for brittle fracture",2015,"Computational Materials Science","96","PB",,"472","484",,143,"10.1016/j.commatsci.2014.05.071","https://www.scopus.com/inward/record.uri?eid=2-s2.0-84908702198&doi=10.1016%2fj.commatsci.2014.05.071&partnerID=40&md5=a948a2b370bfd9860f62c486ed8f67af",Article,"Final","",Scopus,2-s2.0-84908702198
"Zhao, J., Lu, L., Zhang, Z., Guo, W., Rabczuk, T.","36612630100;12240676100;57211549514;55777912500;56502462200;","Continuum modeling of the cohesive energy for the interfaces between films, spheres, coats and substrates",2015,"Computational Materials Science","96","PB",,"432","438",,19,"10.1016/j.commatsci.2014.06.050","https://www.scopus.com/inward/record.uri?eid=2-s2.0-84908693456&doi=10.1016%2fj.commatsci.2014.06.050&partnerID=40&md5=55ec4519355205ee479788cd3ed58537",Article,"Final","",Scopus,2-s2.0-84908693456
"Zhao, J., Lu, L., Rabczuk, T.","36612630100;12240676100;56502462200;","The tensile and shear failure behavior dependence on chain length and temperature in amorphous polymers",2015,"Computational Materials Science","96","PB",,"567","572",,12,"10.1016/j.commatsci.2014.03.071","https://www.scopus.com/inward/record.uri?eid=2-s2.0-84908686911&doi=10.1016%2fj.commatsci.2014.03.071&partnerID=40&md5=57d1b0bd4ea69ccbfc272639fcc6dcc3",Article,"Final","All Open Access, Green",Scopus,2-s2.0-84908686911
"Yang, S.-W., Budarapu, P.R., Mahapatra, D.R., Bordas, S.P.A., Zi, G., Rabczuk, T.","56405806800;55938567600;7005748101;23033088300;6701704145;56502462200;","A meshless adaptive multiscale method for fracture",2015,"Computational Materials Science","96","PB",,"382","395",,62,"10.1016/j.commatsci.2014.08.054","https://www.scopus.com/inward/record.uri?eid=2-s2.0-84908679396&doi=10.1016%2fj.commatsci.2014.08.054&partnerID=40&md5=8612ee8fc9a123aa13d1d8367867fe93",Article,"Final","",Scopus,2-s2.0-84908679396
"Vu-Bac, N., Silani, M., Lahmer, T., Zhuang, X., Rabczuk, T.","43861917200;34868602300;15765564800;24485610900;56502462200;","A unified framework for stochastic predictions of mechanical properties of polymeric nanocomposites",2015,"Computational Materials Science","96","PB",,"520","535",,114,"10.1016/j.commatsci.2014.04.066","https://www.scopus.com/inward/record.uri?eid=2-s2.0-84908668303&doi=10.1016%2fj.commatsci.2014.04.066&partnerID=40&md5=b7439789c9fa1faf1a16bd8e08e52398",Article,"Final","",Scopus,2-s2.0-84908668303
"Budarapu, P.R., Narayana, T.S.S., Rammohan, B., Rabczuk, T.","55938567600;57605560400;36024485700;56502462200;","Directionality of sound radiation from rectangular panels",2015,"Applied Acoustics","89",,,"128","140",,25,"10.1016/j.apacoust.2014.09.006","https://www.scopus.com/inward/record.uri?eid=2-s2.0-84908190471&doi=10.1016%2fj.apacoust.2014.09.006&partnerID=40&md5=be7bb911579f6de1a7af07c802646dc1",Article,"Final","",Scopus,2-s2.0-84908190471
"Vu-Bac, N., Rafiee, R., Zhuang, X., Lahmer, T., Rabczuk, T.","43861917200;15830176500;24485610900;15765564800;56502462200;","Uncertainty quantification for multiscale modeling of polymer nanocomposites with correlated parameters",2015,"Composites Part B: Engineering","68",,,"446","464",,157,"10.1016/j.compositesb.2014.09.008","https://www.scopus.com/inward/record.uri?eid=2-s2.0-84908023015&doi=10.1016%2fj.compositesb.2014.09.008&partnerID=40&md5=25f425ac106bf7d0bd0335235bffce09",Article,"Final","",Scopus,2-s2.0-84908023015
"Silani, M., Talebi, H., Ziaei-Rad, S., Kerfriden, P., Bordas, S.P.A., Rabczuk, T.","34868602300;53985317200;8598196200;26032580300;23033088300;56502462200;","Stochastic modelling of clay/epoxy nanocomposites",2014,"Composite Structures","118",,,"241","249",,58,"10.1016/j.compstruct.2014.07.009","https://www.scopus.com/inward/record.uri?eid=2-s2.0-84925307117&doi=10.1016%2fj.compstruct.2014.07.009&partnerID=40&md5=8fd7e6e60d06f442178f2a8aed4bc6ba",Article,"Final","",Scopus,2-s2.0-84925307117
"Xu, G., Mourrain, B., Galligo, A., Rabczuk, T.","55935631700;7003436036;6602841964;56502462200;","High-quality construction of analysis-suitable trivariate NURBS solids by reparameterization methods",2014,"Computational Mechanics","54","5",,"1303","1313",,36,"10.1007/s00466-014-1060-y","https://www.scopus.com/inward/record.uri?eid=2-s2.0-84919439794&doi=10.1007%2fs00466-014-1060-y&partnerID=40&md5=ee2bd80566c1d0684493ce4a7c15473a",Article,"Final","All Open Access, Green",Scopus,2-s2.0-84919439794
"De Almeida Areias, P.M., Rabczuk, T., Barbosa, J.I.","55959928000;56502462200;7202435183;","The extended unsymmetric frontal solution for multiple-point constraints",2014,"Engineering Computations (Swansea, Wales)","31","7",,"1582","1607",,7,"10.1108/EC-10-2013-0263","https://www.scopus.com/inward/record.uri?eid=2-s2.0-84923372525&doi=10.1108%2fEC-10-2013-0263&partnerID=40&md5=7872a639f66bc059164616c7f85f1f41",Article,"Final","All Open Access, Green",Scopus,2-s2.0-84923372525
"Chen, L., Nguyen-Thanh, N., Nguyen-Xuan, H., Rabczuk, T., Bordas, S.P.A., Limbert, G.","57192610956;25230361800;24503383800;56502462200;23033088300;6603149391;","Explicit finite deformation analysis of isogeometric membranes",2014,"Computer Methods in Applied Mechanics and Engineering","277",,,"104","130",,45,"10.1016/j.cma.2014.04.015","https://www.scopus.com/inward/record.uri?eid=2-s2.0-84900494411&doi=10.1016%2fj.cma.2014.04.015&partnerID=40&md5=e6fef8439fee5e8dd3283e93503b95b0",Article,"Final","All Open Access, Green",Scopus,2-s2.0-84900494411
"Zhao, J., Kou, L., Jiang, J.-W., Rabczuk, T.","36612630100;26666134600;56152347100;56502462200;","Tension-induced phase transition of single-layer molybdenum disulphide (MoS2) at low temperatures",2014,"Nanotechnology","25","29","295701","","",,39,"10.1088/0957-4484/25/29/295701","https://www.scopus.com/inward/record.uri?eid=2-s2.0-84903954617&doi=10.1088%2f0957-4484%2f25%2f29%2f295701&partnerID=40&md5=61ac86b594a7780ef7cd54ef9dba5db3",Article,"Final","",Scopus,2-s2.0-84903954617
"Ghorashi, S.Sh., Amani, J., Bagherzadeh, A.S., Rabczuk, T.","37664777200;36805452900;56068327500;56502462200;","Goal-oriented error estimation and mesh adaptivity in three-dimentional elasticity problems",2014,"11th World Congress on Computational Mechanics, WCCM 2014, 5th European Conference on Computational Mechanics, ECCM 2014 and 6th European Conference on Computational Fluid Dynamics, ECFD 2014",,,,"734","745",,1,,"https://www.scopus.com/inward/record.uri?eid=2-s2.0-84923950795&partnerID=40&md5=adc32cc541ea1aa7d9117a51b8dd52da",Conference Paper,"Final","",Scopus,2-s2.0-84923950795
"Beex, L.A.A., Kerfriden, P., Rabczuk, T., Bordas, S.P.A.","35101441400;26032580300;56502462200;23033088300;","Quasicontinuum-based multiscale approaches for plate-like beam lattices experiencing in-plane and out-of-plane deformation",2014,"Computer Methods in Applied Mechanics and Engineering","279",,,"348","378",,27,"10.1016/j.cma.2014.06.018","https://www.scopus.com/inward/record.uri?eid=2-s2.0-84904286652&doi=10.1016%2fj.cma.2014.06.018&partnerID=40&md5=5c193c076c724a3a588a320faadcc695",Article,"Final","All Open Access, Green",Scopus,2-s2.0-84904286652
"Nanthakumar, S.S., Lahmer, T., Rabczuk, T.","55889120800;15765564800;56502462200;","Detection of multiple flaws in piezoelectric structures using XFEM and level sets",2014,"Computer Methods in Applied Mechanics and Engineering","275",,,"98","112",,68,"10.1016/j.cma.2014.03.001","https://www.scopus.com/inward/record.uri?eid=2-s2.0-84897497704&doi=10.1016%2fj.cma.2014.03.001&partnerID=40&md5=71c98707432fd419a666b8ea00510aaf",Article,"Final","",Scopus,2-s2.0-84897497704
"Zhao, J., Lu, L., Rabczuk, T.","36612630100;12240676100;56502462200;","Binding energy and mechanical stability of single- and multi-walled carbon nanotube serpentines",2014,"Journal of Chemical Physics","140","20","204704","","",,15,"10.1063/1.4878115","https://www.scopus.com/inward/record.uri?eid=2-s2.0-84901799089&doi=10.1063%2f1.4878115&partnerID=40&md5=9e0c994b978475b9e351f91ca3001126",Article,"Final","",Scopus,2-s2.0-84901799089
"Jiang, J.-W., Park, H.S., Rabczuk, T.","56152347100;10045002000;56502462200;","MoS2 nanoresonators: Intrinsically better than graphene?",2014,"Nanoscale","6","7",,"3618","3625",,59,"10.1039/c3nr05991j","https://www.scopus.com/inward/record.uri?eid=2-s2.0-84896322099&doi=10.1039%2fc3nr05991j&partnerID=40&md5=67640f607aec66d700f2841e08f4056b",Article,"Final","All Open Access, Green",Scopus,2-s2.0-84896322099
"Areias, P., Pinto Da Costa, A., Rabczuk, T., Queirós De Melo, F.J.M., Dias-Da-Costa, D., Bezzeghoud, M.","55959928000;6506200356;56502462200;6701386189;55932515200;6603342933;","An alternative formulation for quasi-static frictional and cohesive contact problems",2014,"Computational Mechanics","53","4",,"807","824",,7,"10.1007/s00466-013-0932-x","https://www.scopus.com/inward/record.uri?eid=2-s2.0-84899450995&doi=10.1007%2fs00466-013-0932-x&partnerID=40&md5=f359f1705b24110ab1d76c36eadafad3",Article,"Final","",Scopus,2-s2.0-84899450995
"Ghasemi, H., Rafiee, R., Zhuang, X., Muthu, J., Rabczuk, T.","57218802972;15830176500;24485610900;6506681477;56502462200;","Uncertainties propagation in metamodel-based probabilistic optimization of CNT/polymer composite structure using stochastic multi-scale modeling",2014,"Computational Materials Science","85",,,"295","305",,82,"10.1016/j.commatsci.2014.01.020","https://www.scopus.com/inward/record.uri?eid=2-s2.0-84893334964&doi=10.1016%2fj.commatsci.2014.01.020&partnerID=40&md5=2370583e45e2c43e865f0a58eb7e111c",Article,"Final","",Scopus,2-s2.0-84893334964
"Jamshidian, M., Rabczuk, T.","55967834200;56502462200;","Phase field modelling of stressed grain growth: Analytical study and the effect of microstructural length scale",2014,"Journal of Computational Physics","261",,,"23","35",,25,"10.1016/j.jcp.2013.12.022","https://www.scopus.com/inward/record.uri?eid=2-s2.0-84892470265&doi=10.1016%2fj.jcp.2013.12.022&partnerID=40&md5=59dc72b5fd4a75d70f52c056026709bc",Article,"Final","",Scopus,2-s2.0-84892470265
"Jiang, J.-W., Wang, B.-S., Rabczuk, T.","56152347100;7405916133;56502462200;","Phonon modes in single-walled molybdenum disulphide nanotubes: Lattice dynamics calculation and molecular dynamics simulation",2014,"Nanotechnology","25","10","105706","","",,14,"10.1088/0957-4484/25/10/105706","https://www.scopus.com/inward/record.uri?eid=2-s2.0-84894144111&doi=10.1088%2f0957-4484%2f25%2f10%2f105706&partnerID=40&md5=ae75281323b901b949b5acf763d5eb36",Article,"Final","All Open Access, Green",Scopus,2-s2.0-84894144111
"Vu-Bac, N., Lahmer, T., Zhang, Y., Zhuang, X., Rabczuk, T.","43861917200;15765564800;55739765100;24485610900;56502462200;","Stochastic predictions of interfacial characteristic of polymeric nanocomposites (PNCs)",2014,"Composites Part B: Engineering","59",,,"80","95",,112,"10.1016/j.compositesb.2013.11.014","https://www.scopus.com/inward/record.uri?eid=2-s2.0-84890447496&doi=10.1016%2fj.compositesb.2013.11.014&partnerID=40&md5=c303fcc0f3a9b7e4035a62715902dbd4",Article,"Final","",Scopus,2-s2.0-84890447496
"Zhuang, X., Huang, R., Liang, C., Rabczuk, T.","24485610900;55835407700;56033338700;56502462200;","A coupled thermo-hydro-mechanical model of jointed hard rock for compressed air energy storage",2014,"Mathematical Problems in Engineering","2014",,"179169","","",,89,"10.1155/2014/179169","https://www.scopus.com/inward/record.uri?eid=2-s2.0-84893825113&doi=10.1155%2f2014%2f179169&partnerID=40&md5=0379c6fd653b6247214308c2cff1e64a",Article,"Final","All Open Access, Gold, Green",Scopus,2-s2.0-84893825113
"Ghasemi, H., Brighenti, R., Zhuang, X., Muthu, J., Rabczuk, T.","57218802972;6603794567;24485610900;6506681477;56502462200;","Optimization of fiber distribution in fiber reinforced composite by using NURBS functions",2014,"Computational Materials Science","83",,,"463","473",,44,"10.1016/j.commatsci.2013.11.032","https://www.scopus.com/inward/record.uri?eid=2-s2.0-84890815467&doi=10.1016%2fj.commatsci.2013.11.032&partnerID=40&md5=c2156876de440bf6b626848c320fb0c1",Article,"Final","",Scopus,2-s2.0-84890815467
"Amiri, F., Millán, D., Shen, Y., Rabczuk, T., Arroyo, M.","57197617296;57204264447;23480265700;56502462200;10039824600;","Phase-field modeling of fracture in linear thin shells",2014,"Theoretical and Applied Fracture Mechanics","69",,,"102","109",,231,"10.1016/j.tafmec.2013.12.002","https://www.scopus.com/inward/record.uri?eid=2-s2.0-84896729253&doi=10.1016%2fj.tafmec.2013.12.002&partnerID=40&md5=9333c242c3588b1239ee33c24cdd43a9",Article,"Final","All Open Access, Green",Scopus,2-s2.0-84896729253
"Budarapu, P.R., Gracie, R., Yang, S.-W., Zhuang, X., Rabczuk, T.","55938567600;15759642400;56405806800;24485610900;56502462200;","Efficient coarse graining in multiscale modeling of fracture",2014,"Theoretical and Applied Fracture Mechanics","69",,,"126","143",,185,"10.1016/j.tafmec.2013.12.004","https://www.scopus.com/inward/record.uri?eid=2-s2.0-84896725117&doi=10.1016%2fj.tafmec.2013.12.004&partnerID=40&md5=f5f9fce670d4e5b30467178520eff1b7",Article,"Final","",Scopus,2-s2.0-84896725117
"Jiang, J.-W., Wang, B.-S., Park, H.S., Rabczuk, T.","56152347100;7405916133;10045002000;56502462200;","Adsorbate migration effects on continuous and discontinuous temperature-dependent transitions in the quality factors of graphene nanoresonators",2014,"Nanotechnology","25","2","025501","","",,14,"10.1088/0957-4484/25/2/025501","https://www.scopus.com/inward/record.uri?eid=2-s2.0-84890771882&doi=10.1088%2f0957-4484%2f25%2f2%2f025501&partnerID=40&md5=1c3f9c6cf6746f9fe819ad40c9400d11",Article,"Final","All Open Access, Green",Scopus,2-s2.0-84890771882
"Rabczuk, T., Bordas, S.P.A., Zi, G.","56502462200;23033088300;6701704145;","Computational Methods for Fracture",2014,"Mathematical Problems in Engineering","2014",,"593041","","",,2,"10.1155/2014/593041","https://www.scopus.com/inward/record.uri?eid=2-s2.0-84934959041&doi=10.1155%2f2014%2f593041&partnerID=40&md5=f2e060422e328a09c51b56c9c3d40e7c",Editorial,"Final","All Open Access, Gold, Green",Scopus,2-s2.0-84934959041
"Zhuang, X., Rabczuk, T.","24485610900;56502462200;","Editorial - Multiscale modeling of material failure",2014,"Theoretical and Applied Fracture Mechanics","72","1",,"1","",,,"10.1016/j.tafmec.2014.07.009","https://www.scopus.com/inward/record.uri?eid=2-s2.0-84922400337&doi=10.1016%2fj.tafmec.2014.07.009&partnerID=40&md5=23f594637d111e78d53670d205492c3e",Editorial,"Final","",Scopus,2-s2.0-84922400337
"Nguyen-Thoi, T., Rabczuk, T., Lam-Phat, T., Ho-Huu, V., Phung-Van, P.","24171745600;56502462200;56060903600;56060876200;55181714100;","Free vibration analysis of cracked Mindlin plate using an extended cell-based smoothed discrete shear gap method (XCS-DSG3)",2014,"Theoretical and Applied Fracture Mechanics","72","1",,"150","163",,55,"10.1016/j.tafmec.2014.02.004","https://www.scopus.com/inward/record.uri?eid=2-s2.0-84922338365&doi=10.1016%2fj.tafmec.2014.02.004&partnerID=40&md5=b83e9e3cd4f7d580f49990652e8d4f07",Article,"Final","",Scopus,2-s2.0-84922338365
"Silani, M., Ziaei-Rad, S., Talebi, H., Rabczuk, T.","34868602300;8598196200;53985317200;56502462200;","A semi-concurrent multiscale approach for modeling damage in nanocomposites",2014,"Theoretical and Applied Fracture Mechanics","74","1",,"30","38",,72,"10.1016/j.tafmec.2014.06.009","https://www.scopus.com/inward/record.uri?eid=2-s2.0-84922338018&doi=10.1016%2fj.tafmec.2014.06.009&partnerID=40&md5=52a8267998dfacb81a067820527be999",Article,"Final","",Scopus,2-s2.0-84922338018
"Areias, P., Rabczuk, T., Camanho, P.P.","55959928000;56502462200;6602809907;","Finite strain fracture of 2D problems with injected anisotropic softening elements",2014,"Theoretical and Applied Fracture Mechanics","72","1",,"50","63",,149,"10.1016/j.tafmec.2014.06.006","https://www.scopus.com/inward/record.uri?eid=2-s2.0-84912574598&doi=10.1016%2fj.tafmec.2014.06.006&partnerID=40&md5=72f5b38681496f0949ec2f26a9f95cbb",Article,"Final","",Scopus,2-s2.0-84912574598
"Jamshidian, M., Zi, G., Rabczuk, T.","55967834200;6701704145;56502462200;","Phase field modeling of ideal grain growth in a distorted microstructure",2014,"Computational Materials Science","95",,,"663","671",,17,"10.1016/j.commatsci.2014.08.024","https://www.scopus.com/inward/record.uri?eid=2-s2.0-84910058593&doi=10.1016%2fj.commatsci.2014.08.024&partnerID=40&md5=8b00809aa996c8f10c4b545f2c18f797",Article,"Final","",Scopus,2-s2.0-84910058593
"Zhao, J., Jiang, J.-W., Wang, L., Guo, W., Rabczuk, T.","36612630100;56152347100;57196339600;55777912500;56502462200;","Coarse-grained potentials of single-walled carbon nanotubes",2014,"Journal of the Mechanics and Physics of Solids","71","1",,"197","218",,56,"10.1016/j.jmps.2014.06.011","https://www.scopus.com/inward/record.uri?eid=2-s2.0-84908363331&doi=10.1016%2fj.jmps.2014.06.011&partnerID=40&md5=b4ac75b735ced6c0915820e4adad36cd",Article,"Final","",Scopus,2-s2.0-84908363331
"Nguyen-Thanh, N., Nguyen-Xuan, H., Bordas, S.P.A., Rabczuk, T.","25230361800;24503383800;23033088300;56502462200;","Isogeometric finite element analysis using polynomial splines over hierarchical T-meshes",2014,"IOP Conference Series: Materials Science and Engineering","10","1","012238","","",,4,"10.1088/1757-899X/10/1/012238","https://www.scopus.com/inward/record.uri?eid=2-s2.0-84907701700&doi=10.1088%2f1757-899X%2f10%2f1%2f012238&partnerID=40&md5=b4ce6f48cbbd50be4f1d8d33e5158018",Conference Paper,"Final","",Scopus,2-s2.0-84907701700
"Ben, S., Zhao, J., Rabczuk, T.","56326165500;36612630100;56502462200;","A theoretical analysis of interface debonding for coated sphere with functionally graded interphase",2014,"Composite Structures","117","1",,"288","297",,17,"10.1016/j.compstruct.2014.07.004","https://www.scopus.com/inward/record.uri?eid=2-s2.0-84906057342&doi=10.1016%2fj.compstruct.2014.07.004&partnerID=40&md5=974d827773b7fe04c329b4627146e523",Article,"Final","",Scopus,2-s2.0-84906057342
"Ilyani Akmar, A.B., Lahmer, T., Bordas, S.P.A., Beex, L.A.A., Rabczuk, T.","56286265400;15765564800;23033088300;35101441400;56502462200;","Uncertainty quantification of dry woven fabrics: A sensitivity analysis on material properties",2014,"Composite Structures","116","1",,"1","17",,27,"10.1016/j.compstruct.2014.04.014","https://www.scopus.com/inward/record.uri?eid=2-s2.0-84904567562&doi=10.1016%2fj.compstruct.2014.04.014&partnerID=40&md5=d6fa7bd53cb8de880655fcc03e80ec1a",Article,"Final","",Scopus,2-s2.0-84904567562
"Nguyen, V.P., Kerfriden, P., Bordas, S.P.A., Rabczuk, T.","36632907500;26032580300;23033088300;56502462200;","Isogeometric analysis suitable trivariate NURBS representation of composite panels with a new offset algorithm",2014,"CAD Computer Aided Design","55",,,"49","63",,28,"10.1016/j.cad.2014.05.004","https://www.scopus.com/inward/record.uri?eid=2-s2.0-84903212274&doi=10.1016%2fj.cad.2014.05.004&partnerID=40&md5=bc2541d542d8b9ede8b41c856556797f",Article,"Final","All Open Access, Green",Scopus,2-s2.0-84903212274
"Budarapu, P.R., Gracie, R., Bordas, S.P.A., Rabczuk, T.","55938567600;15759642400;23033088300;56502462200;","An adaptive multiscale method for quasi-static crack growth",2014,"Computational Mechanics","53","6",,"1129","1148",,173,"10.1007/s00466-013-0952-6","https://www.scopus.com/inward/record.uri?eid=2-s2.0-84901191590&doi=10.1007%2fs00466-013-0952-6&partnerID=40&md5=8a31c019e40138c9ea5a4e95602c9fee",Review,"Final","All Open Access, Green",Scopus,2-s2.0-84901191590
"Zhang, Y., Zhuang, X., Muthu, J., Mabrouki, T., Fontaine, M., Gong, Y., Rabczuk, T.","55545862689;24485610900;6506681477;35233897200;35894893300;7402475215;56502462200;","Load transfer of graphene/carbon nanotube/polyethylene hybrid nanocomposite by molecular dynamics simulation",2014,"Composites Part B: Engineering","63",,,"27","33",,87,"10.1016/j.compositesb.2014.03.009","https://www.scopus.com/inward/record.uri?eid=2-s2.0-84898994301&doi=10.1016%2fj.compositesb.2014.03.009&partnerID=40&md5=907a836f1980d9bae85e2d4ac3e9747f",Article,"Final","",Scopus,2-s2.0-84898994301
"Talebi, H., Silani, M., Bordas, S.P.A., Kerfriden, P., Rabczuk, T.","53985317200;34868602300;23033088300;26032580300;56502462200;","A computational library for multiscale modeling of material failure",2014,"Computational Mechanics","53","5",,"1047","1071",,318,"10.1007/s00466-013-0948-2","https://www.scopus.com/inward/record.uri?eid=2-s2.0-84898049359&doi=10.1007%2fs00466-013-0948-2&partnerID=40&md5=535f664d1188e7c7359bec157ee00233",Article,"Final","All Open Access, Green",Scopus,2-s2.0-84898049359
"Amani, J., Saboor Bagherzadeh, A., Rabczuk, T.","36805452900;56068327500;56502462200;","Error estimate and adaptive refinement in mixed discrete least squares meshless method",2014,"Mathematical Problems in Engineering","2014",,"721240","","",,7,"10.1155/2014/721240","https://www.scopus.com/inward/record.uri?eid=2-s2.0-84896136068&doi=10.1155%2f2014%2f721240&partnerID=40&md5=708971d4b1f206b2a0dde99ebeea2761",Article,"Final","All Open Access, Gold, Green",Scopus,2-s2.0-84896136068
"Nguyen-Thanh, N., Muthu, J., Zhuang, X., Rabczuk, T.","25230361800;6506681477;24485610900;56502462200;","An adaptive three-dimensional RHT-splines formulation in linear elasto-statics and elasto-dynamics",2014,"Computational Mechanics","53","2",,"369","385",,53,"10.1007/s00466-013-0914-z","https://www.scopus.com/inward/record.uri?eid=2-s2.0-84893898822&doi=10.1007%2fs00466-013-0914-z&partnerID=40&md5=413d9affa4fd8e854d4d4e279f49fb32",Article,"Final","",Scopus,2-s2.0-84893898822
"Amiri, F., Anitescu, C., Arroyo, M., Bordas, S.P.A., Rabczuk, T.","57197617296;36083903500;10039824600;23033088300;56502462200;","XLME interpolants, a seamless bridge between XFEM and enriched meshless methods",2014,"Computational Mechanics","53","1",,"45","57",,160,"10.1007/s00466-013-0891-2","https://www.scopus.com/inward/record.uri?eid=2-s2.0-84892791078&doi=10.1007%2fs00466-013-0891-2&partnerID=40&md5=70bb739e5995358d3f74bd74d7a81c3a",Article,"Final","All Open Access, Green",Scopus,2-s2.0-84892791078
