作者,作者 ID,标题,年份,来源出版物名称,卷,期,论文编号,起始页码,结束页码,页码计数,施引文献,DOI,链接,文献类型,出版阶段,开放获取,来源出版物,EID
"Zochmann, E., Hofer, M., Lerch, M., Blumenstein, J., Sangodoyin, S., Groll, H., Pratschner, S., Caban, S., Löschenbr, D., Bernadó, L., Zemen, T., Prokes, A., Rupp, M., Mecklenbrauker, C.F., Molisch, A.F.","56811524200;55949595200;56225500800;35104285900;39161969600;57203969367;56811503600;15921965000;57204766245;24586703900;20435195500;56016930200;7101861707;6603338550;7006594890;","Statistical Evaluation of Delay and Doppler Spread in 60 GHz Vehicle-to-Vehicle Channels during Overtaking",2018,"Proceedings of the 2018 8th IEEE-APS Topical Conference on Antennas and Propagation in Wireless Communications, APWC 2018",,,"8503750","806","809",,12,"10.1109/APWC.2018.8503750","https://www.scopus.com/inward/record.uri?eid=2-s2.0-85057089934&doi=10.1109%2fAPWC.2018.8503750&partnerID=40&md5=e5859be42871b79f1a6d9400c709323d",Conference Paper,"Final","",Scopus,2-s2.0-85057089934
"Feng, H., Llorca, J., Tulino, A.M., Molisch, A.F.","55546570700;10243422900;6701582212;7006594890;","Optimal Dynamic Cloud Network Control",2018,"IEEE/ACM Transactions on Networking","26","5","8467495","2118","2131",,26,"10.1109/TNET.2018.2865171","https://www.scopus.com/inward/record.uri?eid=2-s2.0-85053609067&doi=10.1109%2fTNET.2018.2865171&partnerID=40&md5=ea803c3a685762c7e8f778349bf3d42e",Article,"Final","All Open Access, Bronze, Green",Scopus,2-s2.0-85053609067
"Burghal, D., Molisch, A.F.","42161014600;7006594890;","Rate and Outage Probability in Dual Band Systems with Prediction-Based Band Switching",2018,"IEEE Wireless Communications Letters","7","5","8355910","872","875",,5,"10.1109/LWC.2018.2833860","https://www.scopus.com/inward/record.uri?eid=2-s2.0-85046768642&doi=10.1109%2fLWC.2018.2833860&partnerID=40&md5=1bcf4d05705b222b4cdeb1f284dcc59f",Article,"Final","All Open Access, Bronze",Scopus,2-s2.0-85046768642
"Sangodoyin, S., Molisch, A.F.","39161969600;7006594890;","Impact of body mass index on ultrawideband MIMO BAN channels - Measurements and statistical model",2018,"IEEE Transactions on Wireless Communications","17","9","8412237","6067","6081",,8,"10.1109/TWC.2018.2854582","https://www.scopus.com/inward/record.uri?eid=2-s2.0-85050225513&doi=10.1109%2fTWC.2018.2854582&partnerID=40&md5=113675e403b535e6f3afe1403ab6b295",Article,"Final","",Scopus,2-s2.0-85050225513
"Pang, K., Song, H., Zhao, Z., Zhang, R., Soing, H., Xie, G., Li, L., Liu, C., Du, J., Molisch, A.F., Tur, M., Willner, A.E.","57193201448;57193204233;55627092800;57193204917;57203663493;55811556800;55816285100;57089259400;56010181100;7006594890;7005189122;36050889800;","Experimental Demonstration of 400-Gbit/s Free-Space Mode-Division-Multiplexing by Varying Both Indices when using Four Laguerre-Gaussian Modes or Four Hermite-Gaussian Modes",2018,"2018 Conference on Lasers and Electro-Optics, CLEO 2018 - Proceedings",,,"8427673","","",,,,"https://www.scopus.com/inward/record.uri?eid=2-s2.0-85052566028&partnerID=40&md5=dad80921940016baabe82b5d65a38b93",Conference Paper,"Final","",Scopus,2-s2.0-85052566028
"Pang, K., Song, H., Zhao, Z., Zhang, R., Song, H., Xie, G., Li, L., Liu, C., Du, J., Molisch, A.F., Tur, M., Willner, A.E.","57193201448;57193204233;55627092800;57193204917;57209854832;55811556800;55816285100;57089259400;56010181100;7006594890;7005189122;36050889800;","400-Gbit/s QPSK free-space optical communication link based on four-fold multiplexing of Hermite–Gaussian or Laguerre–Gaussian modes by varying both modal indices",2018,"Optics Letters","43","16",,"3889","3892",,34,"10.1364/OL.43.003889","https://www.scopus.com/inward/record.uri?eid=2-s2.0-85056474666&doi=10.1364%2fOL.43.003889&partnerID=40&md5=5ecfa35c09f7f72dec87b20032cd451e",Article,"Final","All Open Access, Bronze",Scopus,2-s2.0-85056474666
"Sangodoyin, S., Kristem, V., Bas, C.U., Kaske, M., Lee, J., Schneider, C., Sommerkorn, G., Zhang, C.J., Thoma, R., Molisch, A.F.","39161969600;35148130700;55322783800;36948767900;57191669798;36088030300;6602948048;55973381400;7006664708;7006594890;","Cluster characterization of 3-D MIMO propagation channel in an urban macrocellular environment",2018,"IEEE Transactions on Wireless Communications","17","8","8363068","5076","5091",,17,"10.1109/TWC.2018.2837088","https://www.scopus.com/inward/record.uri?eid=2-s2.0-85047627976&doi=10.1109%2fTWC.2018.2837088&partnerID=40&md5=88002deeb4dcf63b84b8e4b9e4f2f5fe",Article,"Final","All Open Access, Bronze",Scopus,2-s2.0-85047627976
"Ratnam, V.V., Molisch, A.F., Bursalioglu, O.Y., Papadopoulos, H.C.","57044555700;7006594890;14827786600;7003379289;","Hybrid beamforming with selection for multiuser massive MIMO systems",2018,"IEEE Transactions on Signal Processing","66","15",,"4105","4120",,29,"10.1109/TSP.2018.2838557","https://www.scopus.com/inward/record.uri?eid=2-s2.0-85047614632&doi=10.1109%2fTSP.2018.2838557&partnerID=40&md5=3ccaa6f370eab79d153593e319b27456",Article,"Final","All Open Access, Green",Scopus,2-s2.0-85047614632
"Wang, Y., Venugopal, K., Molisch, A.F., Heath, R.W.","56493209600;57188592244;7006594890;55934670700;","MmWave Vehicle-to-Infrastructure Communication: Analysis of Urban Microcellular Networks",2018,"IEEE Transactions on Vehicular Technology","67","8","8338071","7086","7100",,54,"10.1109/TVT.2018.2827259","https://www.scopus.com/inward/record.uri?eid=2-s2.0-85045630495&doi=10.1109%2fTVT.2018.2827259&partnerID=40&md5=f0d824b785c9235d6295e1f47c9a9c6f",Article,"Final","All Open Access, Green",Scopus,2-s2.0-85045630495
"Lee, M.-C., Molisch, A.F.","56021799900;7006594890;","On the Caching Policy and Cooperation Distance Design in Base Station Assisted Wireless D2D Networks",2018,"IEEE International Conference on Communications","2018-May",,"8422589","","",,1,"10.1109/ICC.2018.8422589","https://www.scopus.com/inward/record.uri?eid=2-s2.0-85051438525&doi=10.1109%2fICC.2018.8422589&partnerID=40&md5=000ce48704ed44943f90b129c4060da0",Conference Paper,"Final","",Scopus,2-s2.0-85051438525
"Tataria, H., Smith, P.J., Molisch, A.F., Sangodoyin, S., Matthaiou, M., Dmochowski, P.A., Zhang, J., Thomae, R.S.","57219523783;7406996870;7006594890;39161969600;23051214500;55906527600;55973381400;7006664708;","Spatial Correlation Variability in Multiuser Systems",2018,"IEEE International Conference on Communications","2018-May",,"8422818","","",,6,"10.1109/ICC.2018.8422818","https://www.scopus.com/inward/record.uri?eid=2-s2.0-85051429898&doi=10.1109%2fICC.2018.8422818&partnerID=40&md5=bdd3f841dbeb369f40751f32397f3a55",Conference Paper,"Final","All Open Access, Green",Scopus,2-s2.0-85051429898
"Bas, C.U., Wang, R., Choi, T., Hur, S., Whang, K., Park, J., Zhang, J., Molisch, A.F.","55322783800;57205203725;57203369842;57203052811;57193645157;55716932900;55376513800;7006594890;","Outdoor to Indoor Penetration Loss at 28 GHz for Fixed Wireless Access",2018,"IEEE International Conference on Communications","2018-May",,"8422819","","",,9,"10.1109/ICC.2018.8422819","https://www.scopus.com/inward/record.uri?eid=2-s2.0-85051429464&doi=10.1109%2fICC.2018.8422819&partnerID=40&md5=2721619fbec7a886865cb8f6bb754008",Conference Paper,"Final","All Open Access, Green",Scopus,2-s2.0-85051429464
"Wang, R., Renaudin, O., Bas, C.U., Sangodyin, S., Molisch, A.F.","57205203725;24528813000;55322783800;57203369836;7006594890;","Antenna Switching Sequence Design for Channel Sounding in a Fast Time-Varying Channel",2018,"IEEE International Conference on Communications","2018-May",,"8422542","","",,3,"10.1109/ICC.2018.8422542","https://www.scopus.com/inward/record.uri?eid=2-s2.0-85051428861&doi=10.1109%2fICC.2018.8422542&partnerID=40&md5=10897fd395edffc56ed6e8d05065f89d",Conference Paper,"Final","All Open Access, Green",Scopus,2-s2.0-85051428861
"Sangodoyin, S., Molisch, A.F.","39161969600;7006594890;","Experimental Characterization of the Dependence of UWB Personal Area Networks Channels on Body Mass Index",2018,"IEEE International Conference on Communications","2018-May",,"8422815","","",,3,"10.1109/ICC.2018.8422815","https://www.scopus.com/inward/record.uri?eid=2-s2.0-85051419313&doi=10.1109%2fICC.2018.8422815&partnerID=40&md5=4e1e670f9440f69aab98af12a08f2cdd",Conference Paper,"Final","",Scopus,2-s2.0-85051419313
"Ratnam, V.V., Molisch, A.F.","57044555700;7006594890;","Reference tone aided transmission for massive MIMO: Analog beamforming without CSI",2018,"IEEE International Conference on Communications","2018-May",,"8422261","","",,4,"10.1109/ICC.2018.8422261","https://www.scopus.com/inward/record.uri?eid=2-s2.0-85049416844&doi=10.1109%2fICC.2018.8422261&partnerID=40&md5=7683f465c23b5cf68725d87d606d32bb",Conference Paper,"Final","",Scopus,2-s2.0-85049416844
"Sangodoyin, S., Molisch, A.F.","39161969600;7006594890;","Experimental Investigation of the Impact of BMI on Ultrawideband MIMO Body-to-Body Networks",2018,"IEEE Vehicular Technology Conference","2018-June",,,"1","5",,,"10.1109/VTCSpring.2018.8417478","https://www.scopus.com/inward/record.uri?eid=2-s2.0-85050982871&doi=10.1109%2fVTCSpring.2018.8417478&partnerID=40&md5=78ca353934bce5c182ab434de9e9d6a3",Conference Paper,"Final","",Scopus,2-s2.0-85050982871
"Bas, C.U., Wang, R., Sangodoyin, S., Hur, S., Whang, K., Park, J., Zhang, J., Molisch, A.F.","55322783800;57205203725;39161969600;57203052811;57193645157;55716932900;55376513800;7006594890;","Dynamic Double Directional Propagation Channel Measurements at 28 GHz - Invited Paper",2018,"IEEE Vehicular Technology Conference","2018-June",,,"1","6",,12,"10.1109/VTCSpring.2018.8417472","https://www.scopus.com/inward/record.uri?eid=2-s2.0-85050958215&doi=10.1109%2fVTCSpring.2018.8417472&partnerID=40&md5=fe2325954bc938b904cf128f6b39efd6",Conference Paper,"Final","",Scopus,2-s2.0-85050958215
"Patil, R.S., Aditya, S., Molisch, A.F., Behairy, H.","57203014774;56511501700;7006594890;6506033988;","An experimental investigation of the Bayesian passive multi-target localization algorithm",2018,"2018 IEEE International Conference on Communications Workshops, ICC Workshops 2018 - Proceedings",,,,"1","6",,,"10.1109/ICCW.2018.8403692","https://www.scopus.com/inward/record.uri?eid=2-s2.0-85050306973&doi=10.1109%2fICCW.2018.8403692&partnerID=40&md5=bc8a140a06d14007f76bf7936bea1eac",Conference Paper,"Final","",Scopus,2-s2.0-85050306973
"Parida, P., Dhillon, H.S., Molisch, A.F.","56028711100;35956099500;7006594890;","Downlink Performance Analysis of Cell-Free Massive MIMO with Finite Fronthaul Capacity",2018,"IEEE Vehicular Technology Conference","2018-August",,"8690797","","",,9,"10.1109/VTCFall.2018.8690797","https://www.scopus.com/inward/record.uri?eid=2-s2.0-85064902305&doi=10.1109%2fVTCFall.2018.8690797&partnerID=40&md5=0a29bd0d22e93e3b958c4faae583d3c0",Conference Paper,"Final","",Scopus,2-s2.0-85064902305
"Hur, S., Yu, H., Park, J., Roh, W., Bas, C.U., Wang, R., Molisch, A.F.","57203052811;56430087400;55716932900;55970235700;55322783800;57205203725;7006594890;","Feasibility of mobility for millimeter-wave systems based on channel measurements",2018,"IEEE Communications Magazine","56","7","8419179","56","63",,10,"10.1109/MCOM.2018.1701017","https://www.scopus.com/inward/record.uri?eid=2-s2.0-85051069864&doi=10.1109%2fMCOM.2018.1701017&partnerID=40&md5=f0a9a1da38dde9a874ee29bfa949ae17",Article,"Final","",Scopus,2-s2.0-85051069864
"Aditya, S., Molisch, A.F., Behairy, H.M.","56511501700;7006594890;6506033988;","A Survey on the Impact of Multipath on Wideband Time-of-Arrival Based Localization",2018,"Proceedings of the IEEE","106","7",,"1183","1203",,41,"10.1109/JPROC.2018.2819638","https://www.scopus.com/inward/record.uri?eid=2-s2.0-85046489147&doi=10.1109%2fJPROC.2018.2819638&partnerID=40&md5=ada6fc14d867d5a12ec922e38ddeba1c",Article,"Final","",Scopus,2-s2.0-85046489147
"Kristem, V., Bas, C.U., Wang, R., Molisch, A.F.","35148130700;55322783800;57205203725;7006594890;","Outdoor wideband channel measurements and modeling in the 3-18 GHz band",2018,"IEEE Transactions on Wireless Communications","17","7",,"4620","4633",,20,"10.1109/TWC.2018.2828001","https://www.scopus.com/inward/record.uri?eid=2-s2.0-85046367510&doi=10.1109%2fTWC.2018.2828001&partnerID=40&md5=4c60dd18a73317773bd4b2d5d2258943",Article,"Final","All Open Access, Bronze",Scopus,2-s2.0-85046367510
"Kristem, V., Molisch, A.F., Christen, L.","35148130700;7006594890;8560610800;","Jammer Sensing and Performance Analysis of MC-CDMA Ultrawideband Systems in the Presence of a Wideband Jammer",2018,"IEEE Transactions on Wireless Communications","17","6",,"3807","3821",,5,"10.1109/TWC.2018.2816641","https://www.scopus.com/inward/record.uri?eid=2-s2.0-85044739542&doi=10.1109%2fTWC.2018.2816641&partnerID=40&md5=6f20fa0a6452ef773a09c1f06cb4550c",Article,"Final","All Open Access, Bronze",Scopus,2-s2.0-85044739542
"Li, Z., Han, S., Sangodoyin, S., Wang, R., Molisch, A.F.","55263612700;35210142000;39161969600;56298124100;7006594890;","Joint Optimization of Hybrid Beamforming for Multi-User Massive MIMO Downlink",2018,"IEEE Transactions on Wireless Communications","17","6",,"3600","3614",,23,"10.1109/TWC.2018.2808523","https://www.scopus.com/inward/record.uri?eid=2-s2.0-85042846231&doi=10.1109%2fTWC.2018.2808523&partnerID=40&md5=eb5201f0ad80b5044379c2f988ba133c",Conference Paper,"Final","All Open Access, Bronze",Scopus,2-s2.0-85042846231
"Bas, C.U., Wang, R., Sangodoyin, S., Hur, S., Whang, K., Park, J., Zhang, J., Molisch, A.F.","55322783800;57205203725;39161969600;57203052811;57193645157;55716932900;55973381400;7006594890;","28 GHz propagation channel measurements for 5G microcellular environments",2018,"2018 International Applied Computational Electromagnetics Society Symposium in Denver, ACES-Denver 2018",,,,"","",,2,"10.23919/ROPACES.2018.8364139","https://www.scopus.com/inward/record.uri?eid=2-s2.0-85048350141&doi=10.23919%2fROPACES.2018.8364139&partnerID=40&md5=2184501fc93c3bf4b07cda01d2a29489",Conference Paper,"Final","",Scopus,2-s2.0-85048350141
"Zhou, L., Yang, Z., Luan, F., Molisch, A.F., Tufvesson, F., Zhou, S.","56399631900;57198698521;41761765300;7006594890;6603113243;7404165116;","Dynamic Channel Model with Overhead Line Poles for High-Speed Railway Communications",2018,"IEEE Antennas and Wireless Propagation Letters","17","5",,"903","906",,12,"10.1109/LAWP.2018.2822399","https://www.scopus.com/inward/record.uri?eid=2-s2.0-85044768519&doi=10.1109%2fLAWP.2018.2822399&partnerID=40&md5=1027701f7f870a777f6fd110c7789620",Article,"Final","All Open Access, Bronze",Scopus,2-s2.0-85044768519
"He, R., Ai, B., Molisch, A.F., Stüber, G.L., Li, Q., Zhong, Z., Yu, J.","36195429200;7005327119;7006594890;7007142135;56111060800;7402336411;7405525088;","Clustering Enabled Wireless Channel Modeling Using Big Data Algorithms",2018,"IEEE Communications Magazine","56","5",,"177","183",,60,"10.1109/MCOM.2018.1700701","https://www.scopus.com/inward/record.uri?eid=2-s2.0-85041553839&doi=10.1109%2fMCOM.2018.1700701&partnerID=40&md5=39a657808b9a5c6cc5549e1bfb08a601",Article,"Final","",Scopus,2-s2.0-85041553839
"Feng, H., Llorca, J., Tulino, A.M., Molisch, A.F.","55546570700;10243422900;6701582212;7006594890;","Impact of channel state information on wireless computing network control",2018,"Conference Record of 51st Asilomar Conference on Signals, Systems and Computers, ACSSC 2017","2017-October",,"8335394","519","525",,,"10.1109/ACSSC.2017.8335394","https://www.scopus.com/inward/record.uri?eid=2-s2.0-85051038836&doi=10.1109%2fACSSC.2017.8335394&partnerID=40&md5=a19738ef5584de763b318e197495febc",Conference Paper,"Final","",Scopus,2-s2.0-85051038836
"Wang, R., Renaudin, O., Bas, C.U., Sangodoyin, S., Molisch, A.F.","57205203725;24528813000;55322783800;39161969600;7006594890;","Vehicle-to-vehicle propagation channel for truck-to-truck and mixed passenger freight convoy",2018,"IEEE International Symposium on Personal, Indoor and Mobile Radio Communications, PIMRC","2017-October",,,"1","5",,4,"10.1109/PIMRC.2017.8292782","https://www.scopus.com/inward/record.uri?eid=2-s2.0-85045267244&doi=10.1109%2fPIMRC.2017.8292782&partnerID=40&md5=2ceaaed3ce696502f9be134ccc348a67",Conference Paper,"Final","",Scopus,2-s2.0-85045267244
"Burghal, D., Tehrani, A.S., Molisch, A.F.","42161014600;36705292200;7006594890;","Base station assisted neighbor discovery in device to device systems",2018,"IEEE International Symposium on Personal, Indoor and Mobile Radio Communications, PIMRC","2017-October",,,"1","7",,2,"10.1109/PIMRC.2017.8292563","https://www.scopus.com/inward/record.uri?eid=2-s2.0-85045232634&doi=10.1109%2fPIMRC.2017.8292563&partnerID=40&md5=955be2bf5d5c98e694655c8bd63067f5",Conference Paper,"Final","",Scopus,2-s2.0-85045232634
"Sangodoyin, S., Molisch, A.F.","39161969600;7006594890;","Body mass index effect on ultrawideband MIMO BAN channel characterization",2018,"IEEE Vehicular Technology Conference","2017-September",,,"1","5",,4,"10.1109/VTCFall.2017.8287898","https://www.scopus.com/inward/record.uri?eid=2-s2.0-85045281961&doi=10.1109%2fVTCFall.2017.8287898&partnerID=40&md5=9b367b00ade7435a4cda9babc36e0e95",Conference Paper,"Final","",Scopus,2-s2.0-85045281961
"Wang, R., Renaudin, O., Bas, C.U., Sangodoyin, S., Molisch, A.F.","57205203725;24528813000;55322783800;39161969600;7006594890;","Double-directional channel characterization of truck-to-truck communication in urban environment",2018,"IEEE Vehicular Technology Conference","2017-September",,,"1","5",,,"10.1109/VTCFall.2017.8287890","https://www.scopus.com/inward/record.uri?eid=2-s2.0-85045264841&doi=10.1109%2fVTCFall.2017.8287890&partnerID=40&md5=ea667c9ff58e497bef99111fe6ed688b",Conference Paper,"Final","",Scopus,2-s2.0-85045264841
"Bas, C.U., Wang, R., Psychoudakis, D., Henige, T., Monroe, R., Park, J., Zhang, J., Molisch, A.F.","55322783800;57205203725;6506648219;40661319200;57193349852;55716932900;55376513800;7006594890;","A real-time millimeter-wave phased array MIMO channel sounder",2018,"IEEE Vehicular Technology Conference","2017-September",,,"1","6",,18,"10.1109/VTCFall.2017.8287875","https://www.scopus.com/inward/record.uri?eid=2-s2.0-85045249974&doi=10.1109%2fVTCFall.2017.8287875&partnerID=40&md5=7e81b2cbe48bca4439ac222cd1d13790",Conference Paper,"Final","All Open Access, Green",Scopus,2-s2.0-85045249974
"Kristem, V., Bas, C.U., Wang, R., Molisch, A.F.","35148130700;55322783800;57205203725;7006594890;","Outdoor macro-cellular channel measurements and modeling in the 3-18 GHz band",2018,"2017 IEEE Globecom Workshops, GC Wkshps 2017 - Proceedings","2018-January",,,"1","7",,2,"10.1109/GLOCOMW.2017.8269032","https://www.scopus.com/inward/record.uri?eid=2-s2.0-85050073390&doi=10.1109%2fGLOCOMW.2017.8269032&partnerID=40&md5=f79fac5a9bbd13e15b5a642f12b93f6e",Conference Paper,"Final","",Scopus,2-s2.0-85050073390
"Choi, T., Bas, C.U., Wang, R., Hur, S., Park, J., Zhang, J., Molisch, A.F.","57203369842;55322783800;57205203725;57203052811;55716932900;55973381400;7006594890;","Measurement Based Directional Modeling of Dynamic Human Body Shadowing at 28 GHz",2018,"2018 IEEE Global Communications Conference, GLOBECOM 2018 - Proceedings",,,"8647873","","",,2,"10.1109/GLOCOM.2018.8647873","https://www.scopus.com/inward/record.uri?eid=2-s2.0-85063477573&doi=10.1109%2fGLOCOM.2018.8647873&partnerID=40&md5=633181bd1d1476d174ed7264534b7188",Conference Paper,"Final","",Scopus,2-s2.0-85063477573
"Jiang, Z., He, Z., Chen, S., Molisch, A.F., Zhou, S., Niu, Z.","55694946000;57194505038;57200415790;7006594890;35747627900;7101688946;","Inferring Remote Channel State Information: Crame r-Rae Lower Bound and Deep Learning Implementation",2018,"2018 IEEE Global Communications Conference, GLOBECOM 2018 - Proceedings",,,"8648140","","",,10,"10.1109/GLOCOM.2018.8648140","https://www.scopus.com/inward/record.uri?eid=2-s2.0-85063347692&doi=10.1109%2fGLOCOM.2018.8648140&partnerID=40&md5=1fded7e968758a44aa2ba415aab38640",Conference Paper,"Final","",Scopus,2-s2.0-85063347692
"Ratnam, V.V., Molisch, A.F.","57044555700;7006594890;","Multi-Antenna FSR Receivers: Low Complexity, Non-Coherent, Massive Antenna Receivers",2018,"2018 IEEE Global Communications Conference, GLOBECOM 2018 - Proceedings",,,"8647339","","",,4,"10.1109/GLOCOM.2018.8647339","https://www.scopus.com/inward/record.uri?eid=2-s2.0-85062954815&doi=10.1109%2fGLOCOM.2018.8647339&partnerID=40&md5=2fd43eb6339e75cec87ba856701d0f68",Conference Paper,"Final","",Scopus,2-s2.0-85062954815
"Bas, C.U., Wang, R., Sangodoyin, S., Hur, S., Whang, K., Park, J., Zhang, J., Molisch, A.F.","55322783800;57205203725;39161969600;57203052811;57193645157;55716932900;55973381400;7006594890;","28 GHz Foliage Propagation Channel Measurements",2018,"2018 IEEE Global Communications Conference, GLOBECOM 2018 - Proceedings",,,"8647674","","",,8,"10.1109/GLOCOM.2018.8647674","https://www.scopus.com/inward/record.uri?eid=2-s2.0-85062949588&doi=10.1109%2fGLOCOM.2018.8647674&partnerID=40&md5=36b0ab77e01d10bf563269febf3f6e76",Conference Paper,"Final","",Scopus,2-s2.0-85062949588
"Zöchmann, E., Mecklenbräuker, C.F., Lerch, M., Pratschner, S., Hofer, M., Löschenbrand, D., Blumenstein, J., Sangodoyin, S., Artner, G., Caban, S., Zemen, T., Prokeš, A., Rupp, M., Molisch, A.F.","56811524200;6603338550;56225500800;56811503600;55949595200;56407169000;35104285900;39161969600;56226176000;15921965000;20435195500;56016930200;7101861707;7006594890;","Measured delay and Doppler profiles of overtaking vehicles at 60 GHz",2018,"IET Conference Publications","2018","CP741",,"","",,13,"10.1049/cp.2018.0470","https://www.scopus.com/inward/record.uri?eid=2-s2.0-85053454407&doi=10.1049%2fcp.2018.0470&partnerID=40&md5=11b5d1be2a24f0708f04bf92a2962661",Conference Paper,"Final","",Scopus,2-s2.0-85053454407
"Pang, K., Song, H., Zhao, Z., Zhang, R., Song, H., Xie, G., Li, L., Liu, C., Du, J., Molisch, A.F., Tur, M., Willner, A.E.","57193201448;57193204233;55627092800;57193204917;57209854832;55811556800;55816285100;57089259400;56010181100;7006594890;7005189122;36050889800;","Experimental demonstration of 400-Gbit/s free-space mode- division-multiplexing by varying both indices when using four Laguerre-Gaussian modes or four Hermite-Gaussian modes",2018,"Optics InfoBase Conference Papers","Part F94-CLEO_SI 2018",,,"","",2,,"10.1364/CLEO_SI.2018.SM3C.4","https://www.scopus.com/inward/record.uri?eid=2-s2.0-85048970926&doi=10.1364%2fCLEO_SI.2018.SM3C.4&partnerID=40&md5=bc569d756ad6cdb866149b969f46fa01",Conference Paper,"Final","",Scopus,2-s2.0-85048970926
"Aditya, S., Molisch, A.F., Rabeah, N., Behairy, H.M.","56511501700;7006594890;57192675719;6506033988;","Localization of Multiple Targets with Identical Radar Signatures in Multipath Environments with Correlated Blocking",2018,"IEEE Transactions on Wireless Communications","17","1","8094946","606","618",,13,"10.1109/TWC.2017.2768429","https://www.scopus.com/inward/record.uri?eid=2-s2.0-85033706797&doi=10.1109%2fTWC.2017.2768429&partnerID=40&md5=f1b1d4c68afc047edec770204646f387",Conference Paper,"Final","All Open Access, Green",Scopus,2-s2.0-85033706797
"Li, Z., Han, S., Molisch, A.F.","55263612700;35210142000;7006594890;","User-Centric Virtual Sectorization for Millimeter-Wave Massive MIMO Downlink",2018,"IEEE Transactions on Wireless Communications","17","1","8095001","445","460",,1,"10.1109/TWC.2017.2767580","https://www.scopus.com/inward/record.uri?eid=2-s2.0-85033685211&doi=10.1109%2fTWC.2017.2767580&partnerID=40&md5=5bef033df6cceb670b5bbf81553e13fc",Article,"Final","All Open Access, Bronze",Scopus,2-s2.0-85033685211
"Burghal, D., Tehrani, A.S., Molisch, A.F.","42161014600;36705292200;7006594890;","On Expected Neighbor Discovery Time with Prior Information: Modeling, Bounds and Optimization",2018,"IEEE Transactions on Wireless Communications","17","1","8086217","339","351",,16,"10.1109/TWC.2017.2766219","https://www.scopus.com/inward/record.uri?eid=2-s2.0-85032740860&doi=10.1109%2fTWC.2017.2766219&partnerID=40&md5=8f236652665c9ed8901f59279824a43f",Article,"Final","All Open Access, Bronze",Scopus,2-s2.0-85032740860
"Bas, C.U., Kristem, V., Wang, R., Molisch, A.F.","55322783800;35148130700;57205203725;7006594890;","Real-time ultra-wideband frequency sweeping channel sounder for 3-18 GHz",2017,"Proceedings - IEEE Military Communications Conference MILCOM","2017-October",,,"775","781",,4,"10.1109/MILCOM.2017.8170721","https://www.scopus.com/inward/record.uri?eid=2-s2.0-85042354229&doi=10.1109%2fMILCOM.2017.8170721&partnerID=40&md5=43aeadafda3aa29657a4567318c7e5ea",Conference Paper,"Final","",Scopus,2-s2.0-85042354229
"Wang, R., Bas, C.U., Sangodoyin, S., Hur, S., Park, J., Zhang, J., Molisch, A.F.","57205203725;55322783800;39161969600;57203052811;55716932900;55376513800;7006594890;","Stationarity region of Mm-Wave channel based on outdoor microcellular measurements at 28 GHz",2017,"Proceedings - IEEE Military Communications Conference MILCOM","2017-October",,,"782","787",,15,"10.1109/MILCOM.2017.8170816","https://www.scopus.com/inward/record.uri?eid=2-s2.0-85038621018&doi=10.1109%2fMILCOM.2017.8170816&partnerID=40&md5=e4afd1232465ab209f2ba396d544e787",Conference Paper,"Final","All Open Access, Green",Scopus,2-s2.0-85038621018
"Rappaport, T.S., Xing, Y., MacCartney, G.R., Molisch, A.F., Mellios, E., Zhang, J.","7006091503;57195491431;56023405500;7006594890;36782554300;55999375100;","Overview of Millimeter Wave Communications for Fifth-Generation (5G) Wireless Networks-With a Focus on Propagation Models",2017,"IEEE Transactions on Antennas and Propagation","65","12","7999294","6213","6230",,692,"10.1109/TAP.2017.2734243","https://www.scopus.com/inward/record.uri?eid=2-s2.0-85028451584&doi=10.1109%2fTAP.2017.2734243&partnerID=40&md5=ab012b364526db5dfa788dbbf4b1207e",Review,"Final","All Open Access, Green",Scopus,2-s2.0-85028451584
