作者,作者 ID,标题,年份,来源出版物名称,卷,期,论文编号,起始页码,结束页码,页码计数,施引文献,DOI,链接,文献类型,出版阶段,开放获取,来源出版物,EID
"Zhao, Z., Ren, Y., Xie, G., Yan, Y., Li, L., Huang, H., Bao, C., Ahmed, N., Lavery, M.P., Zhang, C., Ashrafi, N., Ashrafi, S., Talwar, S., Sajuyigbe, S., Tur, M., Molisch, A.F., Willner, A.E.","55627092800;55193018800;55811556800;55716545200;55816285100;55507948000;55925426200;55929142400;36537174200;15125101700;56585701700;56585615900;57216999310;22941924000;7005189122;7006594890;36050889800;","Experimental demonstration of 16-Gbit/s millimeter-wave communications link using thin metamaterial plates to generate data-carrying orbital-angular-momentum beams",2015,"IEEE International Conference on Communications","2015-September",,"7248518","1392","1397",,22,"10.1109/ICC.2015.7248518","https://www.scopus.com/inward/record.uri?eid=2-s2.0-84953715558&doi=10.1109%2fICC.2015.7248518&partnerID=40&md5=eb6be4a6b804c8319eda45e3f2ca21bb",Conference Paper,"Final","",Scopus,2-s2.0-84953715558
"Sangodoyin, S., He, R., Molisch, A.F., Kristem, V., Tufvesson, F.","39161969600;36195429200;7006594890;35148130700;6603113243;","Ultrawideband MIMO Channel Measurements and Modeling in a Warehouse Environment",2015,"IEEE International Conference on Communications","2015-September",,"7248664","2277","2282",,14,"10.1109/ICC.2015.7248664","https://www.scopus.com/inward/record.uri?eid=2-s2.0-84953706606&doi=10.1109%2fICC.2015.7248664&partnerID=40&md5=f12d3d7204465075e59ce2db741431cc",Conference Paper,"Final","All Open Access, Green",Scopus,2-s2.0-84953706606
"Zhu, M., Vieira, J., Kuang, Y., Åström, K., Molisch, A.F., Tufvesson, F.","55459581700;56542612800;37057649800;7102583119;7006594890;6603113243;","Tracking and positioning using phase information from estimated multi-path components",2015,"2015 IEEE International Conference on Communication Workshop, ICCW 2015",,,"7247265","712","717",,21,"10.1109/ICCW.2015.7247265","https://www.scopus.com/inward/record.uri?eid=2-s2.0-84947785323&doi=10.1109%2fICCW.2015.7247265&partnerID=40&md5=2c08b0c18f145d0006da39a3059ce98d",Conference Paper,"Final","All Open Access, Green",Scopus,2-s2.0-84947785323
"Qin, C., Song, L., Zhang, T., Shen, Y., Molisch, A.F., Zhang, Q.","57213524071;56717046300;57201899263;35485418600;7006594890;35308438500;","Joint power and spectrum optimization in wireless localization networks",2015,"2015 IEEE International Conference on Communication Workshop, ICCW 2015",,,"7247283","859","864",,5,"10.1109/ICCW.2015.7247283","https://www.scopus.com/inward/record.uri?eid=2-s2.0-84947768430&doi=10.1109%2fICCW.2015.7247283&partnerID=40&md5=884e9e343bb59926466d139565819380",Conference Paper,"Final","",Scopus,2-s2.0-84947768430
"Aditya, S., Molisch, A.F., Behairy, H.","56511501700;7006594890;6506033988;","Bayesian multi-target localization using blocking statistics in multipath environments",2015,"2015 IEEE International Conference on Communication Workshop, ICCW 2015",,,"7247271","748","753",,3,"10.1109/ICCW.2015.7247271","https://www.scopus.com/inward/record.uri?eid=2-s2.0-84947728683&doi=10.1109%2fICCW.2015.7247271&partnerID=40&md5=632d4782f44335c0fe9dcef3d466cbe2",Conference Paper,"Final","",Scopus,2-s2.0-84947728683
"Hur, S., Cho, Y.-J., Kim, T., Park, J., Molisch, A.F., Haneda, K., Peter, M.","57203052811;55956823500;57194728758;55716932900;7006594890;7007182576;35086763300;","Wideband spatial channel model in an urban cellular environments at 28 GHz",2015,"2015 9th European Conference on Antennas and Propagation, EuCAP 2015",,,"7228936","","",,53,,"https://www.scopus.com/inward/record.uri?eid=2-s2.0-84949662069&partnerID=40&md5=a4b773d3f89d2f379a08f8371cd8e1da",Conference Paper,"Final","",Scopus,2-s2.0-84949662069
"Hur, S., Baek, S., Kim, B., Park, J., Molisch, A.F., Haneda, K., Peter, M.","57203052811;27067591900;57199939709;55716932900;7006594890;7007182576;35086763300;","28 GHz channel modeling using 3D ray-tracing in urban environments",2015,"2015 9th European Conference on Antennas and Propagation, EuCAP 2015",,,"7228937","","",,36,,"https://www.scopus.com/inward/record.uri?eid=2-s2.0-84949633724&partnerID=40&md5=8a36310be7f3bc1a9a69495bbd37eb6c",Conference Paper,"Final","",Scopus,2-s2.0-84949633724
"Luan, F., Molisch, A.F., Xiao, L., Tufvesson, F., Zhou, S.","41761765300;7006594890;55546363800;6603113243;7404165116;","Geometrical cluster-based scatterer detection method with the movement of mobile terminal",2015,"IEEE Vehicular Technology Conference","2015",,"7145852","","",,8,"10.1109/VTCSpring.2015.7145852","https://www.scopus.com/inward/record.uri?eid=2-s2.0-84940416725&doi=10.1109%2fVTCSpring.2015.7145852&partnerID=40&md5=40a2940acdeeda6528f0ec9eabf4b4fd",Conference Paper,"Final","",Scopus,2-s2.0-84940416725
"He, R., Ai, B., Zhong, Z., Molisch, A.F., Chen, R., Yang, Y.","36195429200;7005327119;7402336411;7006594890;48361088600;56022339200;","A measurement-based stochastic model for high-speed railway channels",2015,"IEEE Transactions on Intelligent Transportation Systems","16","3","6858019","1120","1135",,21,"10.1109/TITS.2014.2328493","https://www.scopus.com/inward/record.uri?eid=2-s2.0-84930934483&doi=10.1109%2fTITS.2014.2328493&partnerID=40&md5=76cef07613738baceb688c58ed3d7ce7",Article,"Final","",Scopus,2-s2.0-84930934483
"Jiang, Z., Molisch, A.F., Caire, G., Niu, Z.","55694946000;7006594890;7004399543;7101688946;","Achievable rates of FDD massive MIMO systems with spatial channel correlation",2015,"IEEE Transactions on Wireless Communications","14","5","7018998","2868","2882",,152,"10.1109/TWC.2015.2396058","https://www.scopus.com/inward/record.uri?eid=2-s2.0-84929307506&doi=10.1109%2fTWC.2015.2396058&partnerID=40&md5=9172638c08174bbc2e0781462985344f",Article,"Final","All Open Access, Green",Scopus,2-s2.0-84929307506
"Bernado, L., Zemen, T., Tufvesson, F., Molisch, A.F., Mecklenbräuker, C.F.","24586703900;20435195500;6603113243;7006594890;6603338550;","Time- and Frequency-Varying K-Factor of Non-Stationary Vehicular Channels for Safety-Relevant Scenarios",2015,"IEEE Transactions on Intelligent Transportation Systems","16","2","6899647","1007","1017",,64,"10.1109/TITS.2014.2349364","https://www.scopus.com/inward/record.uri?eid=2-s2.0-85027929609&doi=10.1109%2fTITS.2014.2349364&partnerID=40&md5=38c74ad40c7ce914af28451f9ddfbe3f",Article,"Final","All Open Access, Bronze, Green",Scopus,2-s2.0-85027929609
"Willner, A.E., Huang, H., Yan, Y., Ren, Y., Ahmed, N., Xie, G., Bao, C., Li, L., Cao, Y., Zhao, Z., Wang, J., Lavery, M.P.J., Tur, M., Ramachandran, S., Molisch, A.F., Ashrafi, N., Ashrafi, S.","36050889800;55507948000;55716545200;55193018800;55929142400;55811556800;55925426200;55816285100;56115020300;55627092800;55968398900;36537174200;7005189122;57203034243;7006594890;56585701700;56585615900;","Optical communications using orbital angular momentum beams",2015,"Advances in Optics and Photonics","7","1",,"66","106",,1054,"10.1364/AOP.7.000066","https://www.scopus.com/inward/record.uri?eid=2-s2.0-84964237540&doi=10.1364%2fAOP.7.000066&partnerID=40&md5=0132b3f75cea35d575b347e79a1b5bee",Article,"Final","",Scopus,2-s2.0-84964237540
"Li, W., Zhang, T., Shen, Y., Molisch, A.F., Zhang, Q.","56511885900;57201899263;35485418600;7006594890;35308438500;","Robust resource allocation in wireless localization networks",2015,"2014 IEEE/CIC International Conference on Communications in China, ICCC 2014",,,"7008318","442","447",,9,"10.1109/ICCChina.2014.7008318","https://www.scopus.com/inward/record.uri?eid=2-s2.0-84922572411&doi=10.1109%2fICCChina.2014.7008318&partnerID=40&md5=27d23693e12c149f73e538e901d4fb20",Conference Paper,"Final","",Scopus,2-s2.0-84922572411
"Aditya, S., Molisch, A.F.","56511501700;7006594890;","Multicast routing with mutual information accumulation",2015,"2014 IEEE/CIC International Conference on Communications in China, ICCC 2014",,,"7008382","780","785",,,"10.1109/ICCChina.2014.7008382","https://www.scopus.com/inward/record.uri?eid=2-s2.0-84922567914&doi=10.1109%2fICCChina.2014.7008382&partnerID=40&md5=d1cc924da4136843c5ad35f218a3139c",Conference Paper,"Final","",Scopus,2-s2.0-84922567914
"Jiang, Z., Molisch, A.F., Caire, G., Niu, Z.","55694946000;7006594890;7004399543;7101688946;","On the achievable rates of FDD massive MIMO systems with spatial channel correlation",2015,"2014 IEEE/CIC International Conference on Communications in China, ICCC 2014",,,"7008286","276","280",,6,"10.1109/ICCChina.2014.7008286","https://www.scopus.com/inward/record.uri?eid=2-s2.0-84922536834&doi=10.1109%2fICCChina.2014.7008286&partnerID=40&md5=74873ca7de7582ded3c6c2c34d8e2f32",Conference Paper,"Final","All Open Access, Green",Scopus,2-s2.0-84922536834
"Kristem, V., Sangodoyin, S., Bas, C.U., Kaske, M., Lee, J., Schneider, C., Sommerkorn, G., Zhang, J., Thoma, R., Molisch, A.F.","35148130700;39161969600;55322783800;36948767900;57191669798;36088030300;6602948048;55973381400;7006664708;7006594890;","3D MIMO outdoor to indoor macro/micro-cellular channel measurements and modeling",2015,"2015 IEEE Global Communications Conference, GLOBECOM 2015",,,"7417827","","",,13,"10.1109/GLOCOM.2014.7417827","https://www.scopus.com/inward/record.uri?eid=2-s2.0-84964854730&doi=10.1109%2fGLOCOM.2014.7417827&partnerID=40&md5=07bd3a4a183a9f4181d58fa493a67356",Conference Paper,"Final","",Scopus,2-s2.0-84964854730
"Kwon, S.-C., Molisch, A.F.","36246354500;7006594890;","Capacity maximization with polarization-agile antennas in the MIMO communication system",2015,"2015 IEEE Global Communications Conference, GLOBECOM 2015",,,"7417257","","",,7,"10.1109/GLOCOM.2014.7417257","https://www.scopus.com/inward/record.uri?eid=2-s2.0-84964841035&doi=10.1109%2fGLOCOM.2014.7417257&partnerID=40&md5=2cdd42558a8bd6f27c6e83887d0fd95f",Conference Paper,"Final","",Scopus,2-s2.0-84964841035
"Tehrani, A.S., Molisch, A.F., Caire, G.","36705292200;7006594890;7004399543;","Directional zigzag: neighbor discovery with directional antennas",2015,"2015 IEEE Global Communications Conference, GLOBECOM 2015",,,"7417813","","",,14,"10.1109/GLOCOM.2014.7417813","https://www.scopus.com/inward/record.uri?eid=2-s2.0-84964808987&doi=10.1109%2fGLOCOM.2014.7417813&partnerID=40&md5=85363b6ba9b43940e57ac33187c04854",Conference Paper,"Final","",Scopus,2-s2.0-84964808987
"Xie, G., Li, L., Ren, Y., Huang, H., Yan, Y., Ahmed, N., Zhao, Z., Lavery, M.P.J., Ashrafi, N., Ashrafi, S., Bock, R., Tur, M., Molisch, A.F., Willner, A.E.","55811556800;55816285100;55193018800;55507948000;55716545200;55929142400;55627092800;36537174200;56585701700;56585615900;56825175700;7005189122;7006594890;36050889800;","Performance metrics and design considerations for a free-space optical orbital-angular-momentum– multiplexed communication link",2015,"Optica","2","4",,"357","365",,116,"10.1364/OPTICA.2.000357","https://www.scopus.com/inward/record.uri?eid=2-s2.0-84940029083&doi=10.1364%2fOPTICA.2.000357&partnerID=40&md5=cf37fcdb8511cc73868c62f3a7237a6d",Article,"Final","All Open Access, Gold, Green",Scopus,2-s2.0-84940029083
"Molisch, A.F., Tufvesson, F.","7006594890;6603113243;","Propagation channel models for next-generation wireless communications systems",2014,"IEICE Transactions on Communications","E97B","10",,"2022","2034",,75,"10.1587/transcom.E97.B.2022","https://www.scopus.com/inward/record.uri?eid=2-s2.0-84924375368&doi=10.1587%2ftranscom.E97.B.2022&partnerID=40&md5=2a3057245e063923ed94dbff7f52be0c",Article,"Final","All Open Access, Bronze, Green",Scopus,2-s2.0-84924375368
"Kim, J., Molisch, A.F.","8866990900;7006594890;","Fast millimeter-wave beam training with receive beamforming",2014,"Journal of Communications and Networks","16","5",,"512","522",,65,"10.1109/JCN.2014.000090","https://www.scopus.com/inward/record.uri?eid=2-s2.0-84919635213&doi=10.1109%2fJCN.2014.000090&partnerID=40&md5=ad061321b1def95a476712f5ef336790",Article,"Final","",Scopus,2-s2.0-84919635213
"He, R., Molisch, A.F., Tufvesson, F., Zhong, Z., Ai, B., Zhang, T.","36195429200;7006594890;6603113243;7402336411;7005327119;57201899263;","Vehicle-to-vehicle propagation models with large vehicle obstructions",2014,"IEEE Transactions on Intelligent Transportation Systems","15","5","6805659","2237","2248",,146,"10.1109/TITS.2014.2311514","https://www.scopus.com/inward/record.uri?eid=2-s2.0-84907514926&doi=10.1109%2fTITS.2014.2311514&partnerID=40&md5=3b8f4f36ecfdb1a4bacea77cd3a4fd93",Article,"Final","",Scopus,2-s2.0-84907514926
"Meijerink, A., Molisch, A.F.","24463268600;7006594890;","On the physical interpretation of the Saleh-Valenzuela model and the definition of its power delay profiles",2014,"IEEE Transactions on Antennas and Propagation","62","9","6848765","4780","4793",,33,"10.1109/TAP.2014.2335812","https://www.scopus.com/inward/record.uri?eid=2-s2.0-84913528999&doi=10.1109%2fTAP.2014.2335812&partnerID=40&md5=4bb9e89740ef68db2c5cf4da158089aa",Article,"Final","",Scopus,2-s2.0-84913528999
"Xie, G., Li, L., Ren, Y., Huang, H., Yan, Y., Ahmed, N., Zhao, Z., Lavery, M.P.J., Ashrafi, N., Ashrafi, S., Tur, M., Molisch, A.F., Willner, A.E.","55811556800;55816285100;55193018800;55507948000;55716545200;55929142400;55627092800;36537174200;56585701700;56585615900;7005189122;7006594890;36050889800;","Performance metrics and design parameters for an FSO communications link based on multiplexing of multiple orbital-angular-momentum beams",2014,"2014 IEEE Globecom Workshops, GC Wkshps 2014",,,"7063478","481","486",,8,"10.1109/GLOCOMW.2014.7063478","https://www.scopus.com/inward/record.uri?eid=2-s2.0-84941113024&doi=10.1109%2fGLOCOMW.2014.7063478&partnerID=40&md5=9c6b95b9d669cf85d3e57a782b95762c",Conference Paper,"Final","",Scopus,2-s2.0-84941113024
"Ren, Y., Li, L., Xie, G., Yan, Y., Cao, Y., Huang, H., Ahemd, N., Lavery, M.J., Zhao, Z., Zhang, C., Tur, M., Padgett, M., Caire, G., Molisch, A.F., Willner, A.E.","55193018800;55816285100;55811556800;55716545200;56115020300;55507948000;56353107600;36537174200;55627092800;15125101700;7005189122;7006967190;7004399543;7006594890;36050889800;","Experimental demonstration of 16 Gbit/s millimeter-wave communications using MIMO processing of 2 OAM modes on each of two transmitter/receiver antenna apertures",2014,"2014 IEEE Global Communications Conference, GLOBECOM 2014",,,"7037403","3821","3826",,20,"10.1109/GLOCOM.2014.7037403","https://www.scopus.com/inward/record.uri?eid=2-s2.0-84988221546&doi=10.1109%2fGLOCOM.2014.7037403&partnerID=40&md5=5bf25fc81893f2bf0729e026936b8598",Conference Paper,"Final","",Scopus,2-s2.0-84988221546
"Han, S., Yang, C., Molisch, A.F.","35210142000;55583285600;7006594890;","Spectrum and energy efficient cooperative base station doze",2014,"IEEE Journal on Selected Areas in Communications","32","2","6514956","285","296",,38,"10.1109/JSAC.2014.141209","https://www.scopus.com/inward/record.uri?eid=2-s2.0-84895059241&doi=10.1109%2fJSAC.2014.141209&partnerID=40&md5=26da04db2c6aa72d52c71f405ffbe200",Article,"Final","",Scopus,2-s2.0-84895059241
"Lavery, M.P.J., Yan, Y., Xie, G., Huang, H., Tur, M., Molisch, A.F., Padgett, M.J., Willner, A.E.","36537174200;55716545200;55811556800;55507948000;7005189122;7006594890;7006967190;36050889800;","A Quasi-Optical tool for the demultiplexing of orbital angular momentum carried at millimeter-wave frequencies",2014,"Optics InfoBase Conference Papers",,,,"","",,,"10.1364/cleo_qels.2014.fth3d.8","https://www.scopus.com/inward/record.uri?eid=2-s2.0-85088755346&doi=10.1364%2fcleo_qels.2014.fth3d.8&partnerID=40&md5=4d2a0b9f3fefdcedeef37e0aefc495b4",Conference Paper,"Final","",Scopus,2-s2.0-85088755346
"Lavery, M.P.J., Yan, Y., Xie, G., Huang, H., Tur, M., Molisch, A.F., Padgett, M.J., Willner, A.E.","36537174200;55716545200;55811556800;55507948000;7005189122;7006594890;7006967190;36050889800;","A quasi-optical tool for the demultiplexing of orbital angular momentum carried at millimeter-wave frequencies",2014,"Conference on Lasers and Electro-Optics Europe - Technical Digest","2014-January",,"6988659","","",,,,"https://www.scopus.com/inward/record.uri?eid=2-s2.0-84944698673&partnerID=40&md5=707cc78beca01b660b3c83935182bdab",Conference Paper,"Final","",Scopus,2-s2.0-84944698673
"Wang, R., Sangodoyin, S., Molisch, A.F., Zhang, J., Nam, Y.-H., Lee, J.","57205203725;39161969600;7006594890;56717114900;36787619300;57191669798;","Elevation characteristics of outdoor-to-indoor macrocellular propagation channels",2014,"IEEE Vehicular Technology Conference","2015-January","January","7022902","","",,7,"10.1109/VTCSpring.2014.7022902","https://www.scopus.com/inward/record.uri?eid=2-s2.0-84936875008&doi=10.1109%2fVTCSpring.2014.7022902&partnerID=40&md5=9b3a6f056f9308e51fa71243207a948b",Conference Paper,"Final","",Scopus,2-s2.0-84936875008
"Yan, Y., Xie, G., Lavery, M.P.J., Huang, H., Ahmed, N., Bao, C., Ren, Y., Cao, Y., Li, L., Zhao, Z., Molisch, A.F., Tur, M., Padgett, M.J., Willner, A.E.","55716545200;55811556800;36537174200;55507948000;55929142400;55925426200;55193018800;56115020300;55816285100;55627092800;7006594890;7005189122;7006967190;36050889800;","High-capacity millimetre-wave communications with orbital angular momentum multiplexing",2014,"Nature Communications","5",,"4876","","",,754,"10.1038/ncomms5876","https://www.scopus.com/inward/record.uri?eid=2-s2.0-84923099960&doi=10.1038%2fncomms5876&partnerID=40&md5=a935660bf5689fb8e160fab83fea7bd0",Article,"Final","All Open Access, Hybrid Gold, Green",Scopus,2-s2.0-84923099960
"He, R., Molisch, A.F., Tufvesson, F., Zhong, Z., Ai, B., Zhang, T.","36195429200;7006594890;6603113243;7402336411;7005327119;57201899263;","Vehicle-to-vehicle channel models with large vehicle obstructions",2014,"2014 IEEE International Conference on Communications, ICC 2014",,,"6884221","5647","5652",,10,"10.1109/ICC.2014.6884221","https://www.scopus.com/inward/record.uri?eid=2-s2.0-84907000766&doi=10.1109%2fICC.2014.6884221&partnerID=40&md5=7cf825f7945c7fd7ba3b033e3dfb9ff7",Conference Paper,"Final","",Scopus,2-s2.0-84907000766
"Kristem, V., Niranjayan, S., Sangodoyin, S., Molisch, A.F.","35148130700;17435358500;39161969600;7006594890;","Experimental determination of UWB ranging errors in an outdoor environment",2014,"2014 IEEE International Conference on Communications, ICC 2014",,,"6884086","4838","4843",,13,"10.1109/ICC.2014.6884086","https://www.scopus.com/inward/record.uri?eid=2-s2.0-84907000436&doi=10.1109%2fICC.2014.6884086&partnerID=40&md5=b84eddcf1dbf89cbedc59e9ea585d53e",Conference Paper,"Final","",Scopus,2-s2.0-84907000436
"Yan, Y., Xie, G., Huang, H., Lavery, M.J., Ahemd, N., Bao, C., Ren, Y., Molisch, A.F., Tur, M., Padgett, M., Willner, A.E.","55716545200;55811556800;55507948000;36537174200;56353107600;55925426200;55193018800;7006594890;7005189122;7006967190;36050889800;","Demonstration of 8-mode 32-Gbit/s millimeter-wave free-space communication link using 4 orbital-angular-momentum modes on 2 polarizations",2014,"2014 IEEE International Conference on Communications, ICC 2014",,,"6884088","4850","4855",,11,"10.1109/ICC.2014.6884088","https://www.scopus.com/inward/record.uri?eid=2-s2.0-84906996439&doi=10.1109%2fICC.2014.6884088&partnerID=40&md5=1739efed0f478f04fc3b35e9cfec2074",Conference Paper,"Final","",Scopus,2-s2.0-84906996439
"Zhang, T., Molisch, A.F., Shen, Y., Zhang, Q., Win, M.Z.","57201899263;7006594890;35485418600;35308438500;7005052803;","Joint power and bandwidth allocation in cooperative wireless localization networks",2014,"2014 IEEE International Conference on Communications, ICC 2014",,,"6883717","2611","2616",,17,"10.1109/ICC.2014.6883717","https://www.scopus.com/inward/record.uri?eid=2-s2.0-84906995964&doi=10.1109%2fICC.2014.6883717&partnerID=40&md5=7bfc62f8edb05530cbc6e19dca83171f",Conference Paper,"Final","",Scopus,2-s2.0-84906995964
"Kim, J., Molisch, A.F.","8866990900;7006594890;","Quality-aware millimeter-wave device-to-device multi-hop routing for 5G cellular networks",2014,"2014 IEEE International Conference on Communications, ICC 2014",,,"6884155","5251","5256",,34,"10.1109/ICC.2014.6884155","https://www.scopus.com/inward/record.uri?eid=2-s2.0-84906991687&doi=10.1109%2fICC.2014.6884155&partnerID=40&md5=1fa5e9d7d3a9f093466cdd4d504db4aa",Conference Paper,"Final","",Scopus,2-s2.0-84906991687
"Kristem, V., Molisch, A.F., Niranjayan, S., Sangodoyin, S.","35148130700;7006594890;17435358500;39161969600;","Coherent UWB ranging in the presence of multiuser interference",2014,"IEEE Transactions on Wireless Communications","13","8","6799279","4424","4439",,17,"10.1109/TWC.2014.2317741","https://www.scopus.com/inward/record.uri?eid=2-s2.0-84906225719&doi=10.1109%2fTWC.2014.2317741&partnerID=40&md5=adf65f565cf3dbed2fda4d9fc8c5e2fa",Article,"Final","",Scopus,2-s2.0-84906225719
"Shen, J., Molisch, A.F.","24773933600;7006594890;","Estimating multiple target locations in multi-path environments",2014,"IEEE Transactions on Wireless Communications","13","8","6798668","4547","4559",,20,"10.1109/TWC.2014.2317471","https://www.scopus.com/inward/record.uri?eid=2-s2.0-84906213967&doi=10.1109%2fTWC.2014.2317471&partnerID=40&md5=fa69bb86d1105dd239502e225bc25cdc",Article,"Final","",Scopus,2-s2.0-84906213967
"Adhikary, A., Al Safadi, E., Samimi, M.K., Wang, R., Caire, G., Rappaport, T.S., Molisch, A.F.","37121469100;36025044000;55978663300;57205203725;7004399543;7006091503;7006594890;","Joint spatial division and multiplexing for mm-Wave channels",2014,"IEEE Journal on Selected Areas in Communications","32","6","6823686","1239","1255",,259,"10.1109/JSAC.2014.2328173","https://www.scopus.com/inward/record.uri?eid=2-s2.0-84905010677&doi=10.1109%2fJSAC.2014.2328173&partnerID=40&md5=a98cf3af6501e6db7737908f5913eaa9",Article,"Final","All Open Access, Green",Scopus,2-s2.0-84905010677
"Golrezaei, N., Mansourifard, P., Molisch, A.F., Dimakis, A.G.","48360936300;37081435500;7006594890;33367993200;","Base-station assisted device-to-device communications for high-throughput wireless video networks",2014,"IEEE Transactions on Wireless Communications","13","7","6787081","3665","3676",,336,"10.1109/TWC.2014.2316817","https://www.scopus.com/inward/record.uri?eid=2-s2.0-84904342896&doi=10.1109%2fTWC.2014.2316817&partnerID=40&md5=29b4c8f88f9f7454762c5f0cfa3a240e",Article,"Final","All Open Access, Green",Scopus,2-s2.0-84904342896
"Golrezaei, N., Dimakis, A.G., Molisch, A.F.","48360936300;33367993200;7006594890;","Scaling behavior for device-to-device communications with distributed caching",2014,"IEEE Transactions on Information Theory","60","7","6805204","4286","4298",,148,"10.1109/TIT.2014.2319312","https://www.scopus.com/inward/record.uri?eid=2-s2.0-84902971154&doi=10.1109%2fTIT.2014.2319312&partnerID=40&md5=b8f2b702b5d66702a8caee7e7a5cb9fc",Article,"Final","",Scopus,2-s2.0-84902971154
"Rogalin, R., Bursalioglu, O.Y., Papadopoulos, H., Caire, G., Molisch, A.F., Michaloliakos, A., Balan, V., Psounis, K.","37122760300;14827786600;7003379289;7004399543;7006594890;55395463900;57088520600;7801505571;","Scalable synchronization and reciprocity calibration for distributed multiuser MIMO",2014,"IEEE Transactions on Wireless Communications","13","4","6760595","1815","1831",,155,"10.1109/TWC.2014.030314.130474","https://www.scopus.com/inward/record.uri?eid=2-s2.0-84899941945&doi=10.1109%2fTWC.2014.030314.130474&partnerID=40&md5=33553a4afef835281345e01a83ebfcc0",Article,"Final","All Open Access, Green",Scopus,2-s2.0-84899941945
"Bernado, L., Zemen, T., Tufvesson, F., Molisch, A.F., Mecklenbrauker, C.F.","24586703900;20435195500;6603113243;7006594890;6603338550;","Delay and doppler spreads of nonstationary vehicular channels for safety-relevant scenarios",2014,"IEEE Transactions on Vehicular Technology","63","1","6553146","82","93",,122,"10.1109/TVT.2013.2271956","https://www.scopus.com/inward/record.uri?eid=2-s2.0-84893426746&doi=10.1109%2fTVT.2013.2271956&partnerID=40&md5=d9dbb8e8883def0d0b5c1c7e53b57c84",Article,"Final","All Open Access, Green",Scopus,2-s2.0-84893426746
"Ji, M., Caire, G., Molisch, A.F.","35932533000;7004399543;7006594890;","Optimal throughput-outage trade-off in wireless one-hop caching networks",2013,"IEEE International Symposium on Information Theory - Proceedings",,,"6620469","1461","1465",,50,"10.1109/ISIT.2013.6620469","https://www.scopus.com/inward/record.uri?eid=2-s2.0-84890409786&doi=10.1109%2fISIT.2013.6620469&partnerID=40&md5=1af3a7fa5416789aa60a1f59480f998d",Conference Paper,"Final","All Open Access, Green",Scopus,2-s2.0-84890409786
"Han, S., Yang, C., Molisch, A.F.","35210142000;55583285600;7006594890;","Traffic-aware base station doze in cooperative multicell systems",2013,"2013 IEEE China Summit and International Conference on Signal and Information Processing, ChinaSIP 2013 - Proceedings",,,"6625368","394","398",,2,"10.1109/ChinaSIP.2013.6625368","https://www.scopus.com/inward/record.uri?eid=2-s2.0-84889593919&doi=10.1109%2fChinaSIP.2013.6625368&partnerID=40&md5=6a65f4c11295224bcaad8f7ccda15258",Conference Paper,"Final","",Scopus,2-s2.0-84889593919
"Yang, K., Molisch, A.F., Ekman, T., Røste, T.","55478585400;7006594890;35608923500;6602308409;","A deterministic round earth loss model for open-sea radio propagation",2013,"IEEE Vehicular Technology Conference",,,"6691821","","",,27,"10.1109/VTCSpring.2013.6691821","https://www.scopus.com/inward/record.uri?eid=2-s2.0-84893543108&doi=10.1109%2fVTCSpring.2013.6691821&partnerID=40&md5=846154dc8016d40aa0667d50393c28a4",Conference Paper,"Final","",Scopus,2-s2.0-84893543108
"Ji, M., Caire, G., Molisch, A.F.","35932533000;7004399543;7006594890;","Fundamental limits of distributed caching in D2D wireless networks",2013,"2013 IEEE Information Theory Workshop, ITW 2013",,,"6691247","","",,58,"10.1109/ITW.2013.6691247","https://www.scopus.com/inward/record.uri?eid=2-s2.0-84893218567&doi=10.1109%2fITW.2013.6691247&partnerID=40&md5=a5da9282fe9841858165fc0a2453f246",Conference Paper,"Final","All Open Access, Green",Scopus,2-s2.0-84893218567
