作者,作者 ID,标题,年份,来源出版物名称,卷,期,论文编号,起始页码,结束页码,页码计数,施引文献,DOI,链接,文献类型,出版阶段,开放获取,来源出版物,EID
"Liu, H., Molisch, A.F., Zhao, S., Goeckel, D., Orlik, P.","57203772400;7006594890;56329954000;7003787279;7003976449;","Hybrid coherent and frequency-shifted-reference ultrawideband radio",2007,"GLOBECOM - IEEE Global Telecommunications Conference",,,"4411691","4106","4111",,6,"10.1109/GLOCOM.2007.781","https://www.scopus.com/inward/record.uri?eid=2-s2.0-39349100671&doi=10.1109%2fGLOCOM.2007.781&partnerID=40&md5=d7cba169f2b4a3d7062940b4b470c308",Conference Paper,"Final","All Open Access, Green",Scopus,2-s2.0-39349100671
"Wyne, S., Santos, T., Tufvesson, F., Molisch, A.F.","8866431200;24921884000;6603113243;7006594890;","Channel measurements of an indoor office scenario for wireless sensor applications",2007,"GLOBECOM - IEEE Global Telecommunications Conference",,,"4411638","3831","3836",,12,"10.1109/GLOCOM.2007.728","https://www.scopus.com/inward/record.uri?eid=2-s2.0-39349088880&doi=10.1109%2fGLOCOM.2007.728&partnerID=40&md5=fb85bea9fe0424e179dd1f5b9a9cc741",Conference Paper,"Final","",Scopus,2-s2.0-39349088880
"Zhang, H., Mehta, N.B., Molisch, A.F., Zhang, J., Dai, H.","8410560900;7201738618;7006594890;8343528300;7402206925;","On the fundamentally asynchronous nature of interference in cooperative base station systems",2007,"IEEE International Conference on Communications",,,"4289677","6073","6078",,17,"10.1109/ICC.2007.1006","https://www.scopus.com/inward/record.uri?eid=2-s2.0-38549141872&doi=10.1109%2fICC.2007.1006&partnerID=40&md5=cc8c0f8c763bbc09196d3c3ee12064d7",Conference Paper,"Final","",Scopus,2-s2.0-38549141872
"Wu, J., Mehta, N.B., Molisch, A.F., Zhang, J.","7409254389;7201738618;7006594890;8343528300;","Spectral efficiency of channel-aware schedulers in non-identical composite links with interference",2007,"IEEE International Conference on Communications",,,"4289534","5218","5223",,5,"10.1109/ICC.2007.863","https://www.scopus.com/inward/record.uri?eid=2-s2.0-38549095272&doi=10.1109%2fICC.2007.863&partnerID=40&md5=328d3c70e88125f2a7f50ac5bb3a8c53",Conference Paper,"Final","",Scopus,2-s2.0-38549095272
"Molisch, A.F., Mehta, N.B., Yedidia, J.S., Zhang, J.","7006594890;7201738618;6603097796;8343528300;","Performance of fountain codes in collaborative relay networks",2007,"IEEE Transactions on Wireless Communications","6","11",,"4108","4119",,169,"10.1109/TWC.2007.060232","https://www.scopus.com/inward/record.uri?eid=2-s2.0-36249012581&doi=10.1109%2fTWC.2007.060232&partnerID=40&md5=53317024f5aa171eda39ad6660d1cfbd",Article,"Final","",Scopus,2-s2.0-36249012581
"Almers, P., Santos, T., Tufvesson, F., Molisch, A.F., Karedal, J., Johansson, A.J.","6602935711;24921884000;6603113243;7006594890;8957710500;57214603150;","Antenna subset selection in measured indoor channels",2007,"IET Microwaves, Antennas and Propagation","1","5",,"1092","1100",,8,"10.1049/iet-map:20060306","https://www.scopus.com/inward/record.uri?eid=2-s2.0-35348943455&doi=10.1049%2fiet-map%3a20060306&partnerID=40&md5=c69afd4e50ad7077bd0585989512368d",Article,"Final","All Open Access, Green",Scopus,2-s2.0-35348943455
"Gezici, S., Molisch, A.F., Poor, H.V., Kobayashi, H.","6602727613;7006594890;55665272100;35395027300;","The tradeoff between processing gains of an impulse radio UWB system in the presence of timing jitter",2007,"IEEE Transactions on Communications","55","8",,"1504","1515",,18,"10.1109/TCOMM.2007.902536","https://www.scopus.com/inward/record.uri?eid=2-s2.0-34548202745&doi=10.1109%2fTCOMM.2007.902536&partnerID=40&md5=1620977df3cbb9c562573d71fb75293e",Article,"Final","All Open Access, Green",Scopus,2-s2.0-34548202745
"Karedal, J., Wyne, S., Almers, P., Tufvesson, F., Molisch, A.F.","8957710500;8866431200;6602935711;6603113243;7006594890;","A measurement-based statistical model for industrial ultra-wideband channels",2007,"IEEE Transactions on Wireless Communications","6","8",,"3028","3037",,152,"10.1109/TWC.2007.051050","https://www.scopus.com/inward/record.uri?eid=2-s2.0-34548072312&doi=10.1109%2fTWC.2007.051050&partnerID=40&md5=ac2b355b185a798023c392618d559773",Article,"Final","All Open Access, Green",Scopus,2-s2.0-34548072312
"Molisch, A.F., Toeltsch, M., Vermani, S.","7006594890;56636234300;18635849500;","Iterative methods for cancellation of intercarrier interference in OFDM systems",2007,"IEEE Transactions on Vehicular Technology","56","4 II",,"2158","2167",,107,"10.1109/TVT.2007.897628","https://www.scopus.com/inward/record.uri?eid=2-s2.0-34547895517&doi=10.1109%2fTVT.2007.897628&partnerID=40&md5=d524706a17f1f9a94e4e01a6f34a8619",Article,"Final","",Scopus,2-s2.0-34547895517
"Mehta, N.B., Wu, J., Molisch, A.F., Zhang, J.","7201738618;7409254389;7006594890;8343528300;","Approximating a sum of random variables with a lognormal",2007,"IEEE Transactions on Wireless Communications","6","7",,"2690","2699",,272,"10.1109/TWC.2007.051000","https://www.scopus.com/inward/record.uri?eid=2-s2.0-34547485292&doi=10.1109%2fTWC.2007.051000&partnerID=40&md5=495ef7cb164717a66bc9c952f3cf5832",Article,"Final","",Scopus,2-s2.0-34547485292
"Zhao, S., Orlik, P., Molisch, A.F., Liu, H., Zhang, J.","56329954000;7003976449;7006594890;57203772400;8343528300;","Hybrid ultrawideband modulations compatible for both coherent and transmit-reference receivers",2007,"IEEE Transactions on Wireless Communications","6","7",,"2551","2558",,16,"10.1109/TWC.2007.05892","https://www.scopus.com/inward/record.uri?eid=2-s2.0-34547394207&doi=10.1109%2fTWC.2007.05892&partnerID=40&md5=a39dd7b8fcf6cb6347b980da8e170aa4",Article,"Final","",Scopus,2-s2.0-34547394207
"Karedal, J., Singh, A.P., Tufvesson, F., Molisch, A.F.","8957710500;57199212206;6603113243;7006594890;","Characterization of a computer board-to-board ultra-wideband channel",2007,"IEEE Communications Letters","11","6",,"468","470",,24,"10.1109/LCOMM.2007.061661","https://www.scopus.com/inward/record.uri?eid=2-s2.0-34548038596&doi=10.1109%2fLCOMM.2007.061661&partnerID=40&md5=4e9a6f7468e4ad64498c37a047a42682",Article,"Final","All Open Access, Green",Scopus,2-s2.0-34548038596
"Cassioli, D., Win, M.Z., Vatalaro, F., Molisch, A.F.","6603090317;7005052803;56133438600;7006594890;","Low complexity Rake receivers in ultra-wideband channels",2007,"IEEE Transactions on Wireless Communications","6","4",,"1265","1274",,132,"10.1109/TWC.2007.348323","https://www.scopus.com/inward/record.uri?eid=2-s2.0-34247350779&doi=10.1109%2fTWC.2007.348323&partnerID=40&md5=5682487b8585de7207cedd6601db9704",Article,"Final","",Scopus,2-s2.0-34247350779
"Li, Y., Mehta, N.B., Molisch, A.F., Zhang, J.","56123330500;7201738618;7006594890;8343528300;","Optimal signaling and selection verification for single transmit-antenna selection",2007,"IEEE Transactions on Communications","55","4",,"778","789",,16,"10.1109/TCOMM.2007.892461","https://www.scopus.com/inward/record.uri?eid=2-s2.0-34247236591&doi=10.1109%2fTCOMM.2007.892461&partnerID=40&md5=bba23d37090c75a7563e4c82a71b78dc",Article,"Final","",Scopus,2-s2.0-34247236591
"Calcev, G., Chizhik, D., Göransson, B., Howard, S., Huang, H., Kogiantis, A., Molisch, A.F., Moustakas, A.L., Reed, D., Xu, H.","6601972616;35584953100;7004070823;57213711697;7405611201;6602516367;7006594890;35577484600;55085261300;55493772400;","A wideband spatial channel model for system-wide simulations",2007,"IEEE Transactions on Vehicular Technology","56","2",,"389","403",,166,"10.1109/TVT.2007.891463","https://www.scopus.com/inward/record.uri?eid=2-s2.0-34147188485&doi=10.1109%2fTVT.2007.891463&partnerID=40&md5=62543096076d07a9cee08b29a92382ae",Article,"Final","",Scopus,2-s2.0-34147188485
"Du, J., Li, Y., Gu, D., Molisch, A.F., Zhang, J.","7402575456;57195633181;55605106600;7006594890;8373641800;","Statistical rate allocation for layered space-time structure",2007,"IEEE Transactions on Communications","55","3",,"489","496",,5,"10.1109/TCOMM.2006.888891","https://www.scopus.com/inward/record.uri?eid=2-s2.0-34147182663&doi=10.1109%2fTCOMM.2006.888891&partnerID=40&md5=c711acde7f460f98da8e686a1e8ae555",Article,"Final","",Scopus,2-s2.0-34147182663
"Madan, R., Mehta, N.B., Molisch, A.F., Zhang, J.","8839902600;7201738618;7006594890;56813967300;","Energy-efficient decentralized routing with localized cooperation suitable for fast fadin",2007,"45th Annual Allerton Conference on Communication, Control, and Computing 2007","2",,,"1002","1008",,4,,"https://www.scopus.com/inward/record.uri?eid=2-s2.0-84940651381&partnerID=40&md5=28674fb023c6f684c69f1a9de3052ea1",Conference Paper,"Final","",Scopus,2-s2.0-84940651381
"Czink, N., Tian, R., Wyne, S., Tufvesson, F., Nuutinen, J.-P., Ylitalo, J., Bonek, E., Molisch, A.F.","55907185800;24282234400;8866431200;6603113243;11139305300;55894394800;7007067644;7006594890;","Tracking time-variant cluster parameters in MIMO channel measurements",2007,"Proceedings of the Second International Conference on Communications and Networking in China, ChinaCom 2007",,,"4469589","1147","1151",,57,"10.1109/CHINACOM.2007.4469589","https://www.scopus.com/inward/record.uri?eid=2-s2.0-43949132338&doi=10.1109%2fCHINACOM.2007.4469589&partnerID=40&md5=d8bce7e4f01785a48a9616fd85258178",Conference Paper,"Final","",Scopus,2-s2.0-43949132338
"Molisch, A.F., Latva-aho, M., Xiaodong, W.","7006594890;7003450405;55000636900;","ChinaCom 2007 - Messages from the TPC chairs",2007,"Proceedings of the Second International Conference on Communications and Networking in China, ChinaCom 2007",,,"4469311","5","",,,"10.1109/CHINACOM.2007.4469311","https://www.scopus.com/inward/record.uri?eid=2-s2.0-43949095165&doi=10.1109%2fCHINACOM.2007.4469311&partnerID=40&md5=a76b7ff9ecf87b519dea1780717385d9",Editorial,"Final","",Scopus,2-s2.0-43949095165
"Almers, P., Bonek, E., Burr, A., Czink, N., Debbah, M., Degli-Esposti, V., Hofstetter, H., Kyölsti, P., Laurenson, D., Matz, G., Molisch, A.F., Oestges, C., Ozcelik, H.","6602935711;7007067644;35566020000;55907185800;35588784300;6701720057;7006040045;8869709600;6603757437;7005181317;7006594890;7004104722;7003751593;","Survey of channel and radio propagation models for wireless MIMO systems",2007,"Eurasip Journal on Wireless Communications and Networking","2007",,"19070","","",,371,"10.1155/2007/19070","https://www.scopus.com/inward/record.uri?eid=2-s2.0-33947152907&doi=10.1155%2f2007%2f19070&partnerID=40&md5=15ec00713efd43bce03d92f54d7b05df",Article,"Final","All Open Access, Gold, Green",Scopus,2-s2.0-33947152907
"Bonek, E., Gil, J., Correia, L.M., Bultitude, R.J.C., Kuhnert, C., Oestges, C., Beach, M., Hunukumbure, M., Molisch, A., Hofstetter, H.","7007067644;23396343900;55829558200;6603668841;9037248600;7004104722;7102568206;6506881597;7006594890;7006040045;","MIMO channel modelling",2006,"Mobile Broadband Multimedia Networks",,,,"277","397",,,"10.1016/B978-012369422-5/50008-7","https://www.scopus.com/inward/record.uri?eid=2-s2.0-84882464967&doi=10.1016%2fB978-012369422-5%2f50008-7&partnerID=40&md5=a1fcd99b96c69dd8dc7fa9747f723838",Book Chapter,"Final","",Scopus,2-s2.0-84882464967
"Molisch, A.F., Kunisch, J., Qiu, R., Cassioli, D., Buehrer, M., Pendergrass, M., Kovács, I.Z., Pedersen, G.F., Eggers, P.C.F., Roy, S., Ramachandran, I.","7006594890;6602654260;34572523800;6603090317;7003954870;6701514593;7202438865;7102820003;7006236794;55476516600;8891385000;","UWB propagation channels",2006,"Eurasip Book Series on Signal Processing and Communications","5",,,"21","142",,,,"https://www.scopus.com/inward/record.uri?eid=2-s2.0-84873692936&partnerID=40&md5=0c046a0275f23623a4e91d8c93b09e6e",Article,"Final","",Scopus,2-s2.0-84873692936
"Di Benedetto, M.-G., Kaiser, T., Molisch, A.F., Oppermann, I., Politano, C., Porcino, D.","7006607429;35983476500;7006594890;56219588900;55587851000;6507021140;","Preface",2006,"Eurasip Book Series on Signal Processing and Communications","5",,,"vii","xiii",,4,,"https://www.scopus.com/inward/record.uri?eid=2-s2.0-84873676613&partnerID=40&md5=fd55c50419899d9f4cbc12e9944dd400",Editorial,"Final","",Scopus,2-s2.0-84873676613
"Karedal, J., Johansson, A.J., Tufvesson, F., Molisch, A.F.","8957710500;57214603150;6603113243;7006594890;","Characterization of MIMO channels for handheld devices in personal area networks at 5 GHz",2006,"European Signal Processing Conference",,,,"","",5,7,,"https://www.scopus.com/inward/record.uri?eid=2-s2.0-84862601980&partnerID=40&md5=918f8f0ce48e24689dff8c650d1cf013",Conference Paper,"Final","",Scopus,2-s2.0-84862601980
"Yim, R., Mehta, N., Molisch, A.F., Zhang, J.","17436523700;7201738618;7006594890;8343528300;","Progressive accumulative routing in wireless networks",2006,"GLOBECOM - IEEE Global Telecommunications Conference",,,"4151256","","",,10,"10.1109/GLOCOM.2006.626","https://www.scopus.com/inward/record.uri?eid=2-s2.0-50949126863&doi=10.1109%2fGLOCOM.2006.626&partnerID=40&md5=757554177a2d177f53727e8daa2a912d",Conference Paper,"Final","",Scopus,2-s2.0-50949126863
"Li, Y., Mehta, N.B., Molisch, A.F., Zhang, J.","56123330500;7201738618;7006594890;8343528300;","Optimal signaling for single transmit antenna selection with erroneous feedback",2006,"GLOBECOM - IEEE Global Telecommunications Conference",,,"4151426","","",,1,"10.1109/GLOCOM.2006.796","https://www.scopus.com/inward/record.uri?eid=2-s2.0-50949125694&doi=10.1109%2fGLOCOM.2006.796&partnerID=40&md5=a2b4a6071eec6ae605070cefd404f09d",Conference Paper,"Final","",Scopus,2-s2.0-50949125694
"Eriksson, G., Tufvesson, F., Molisch, A.F.","57190226289;6603113243;7006594890;","Propagation channel characteristics for peer-to-peer multiple antenna systems at 300 MHz",2006,"GLOBECOM - IEEE Global Telecommunications Conference",,,"4151305","","",,11,"10.1109/GLOCOM.2006.675","https://www.scopus.com/inward/record.uri?eid=2-s2.0-50949123973&doi=10.1109%2fGLOCOM.2006.675&partnerID=40&md5=d89d44620ff44a1f2ee1ab159a6cc06f",Conference Paper,"Final","",Scopus,2-s2.0-50949123973
"Molisch, A.F., Mehta, N.B., Yedidia, J.S., Zhang, J.","7006594890;7201738618;6603097796;8343528300;","Cooperative relay networks using fountain codes",2006,"GLOBECOM - IEEE Global Telecommunications Conference",,,"4151488","","",,31,"10.1109/GLOCOM.2006.858","https://www.scopus.com/inward/record.uri?eid=2-s2.0-50949118261&doi=10.1109%2fGLOCOM.2006.858&partnerID=40&md5=20247468f1d7712c51eb7ca0ebd4eae5",Conference Paper,"Final","",Scopus,2-s2.0-50949118261
"Madan, R., Mehta, N.B., Molisch, A.F., Zhang, J.","8839902600;7201738618;7006594890;8343528300;","Energy-efficient cooperative relaying over fading channels with simple relay selection",2006,"GLOBECOM - IEEE Global Telecommunications Conference",,,"4150760","","",,51,"10.1109/GLOCOM.2006.130","https://www.scopus.com/inward/record.uri?eid=2-s2.0-50949087021&doi=10.1109%2fGLOCOM.2006.130&partnerID=40&md5=7a88f8c9ec38a70329aaedfd5e605aa4",Conference Paper,"Final","",Scopus,2-s2.0-50949087021
"Molisch, A.F.","7006594890;","Ultrawideband propagation channels and their impact on system design",2006,"IEEE 2007 International Symposium on Microwave, Antenna, Propagation and EMC Technologies for Wireless Communications, MAPE",,,"4393806","K41","K45",,16,"10.1109/MAPE.2007.4393806","https://www.scopus.com/inward/record.uri?eid=2-s2.0-47649091131&doi=10.1109%2fMAPE.2007.4393806&partnerID=40&md5=318dfabb91f8ff57bf6be7ba4e8779f5",Conference Paper,"Final","",Scopus,2-s2.0-47649091131
"Lau, B.K., Andersen, J.B., Molisch, A.F., Kristensson, G.","7102223694;7403571081;7006594890;7004643438;","Antenna matching for capacity maximization in compact MIMO systems",2006,"3rd International Symposium on Wireless Communication Systems 2006, ISWCS'06",,,"4362298","253","257",,17,"10.1109/ISWCS.2006.4362298","https://www.scopus.com/inward/record.uri?eid=2-s2.0-47249089682&doi=10.1109%2fISWCS.2006.4362298&partnerID=40&md5=14145771b4aae276a609a13ace2cb864",Conference Paper,"Final","All Open Access, Green",Scopus,2-s2.0-47249089682
"Gezici, S., Molisch, A.F., Kobayashi, H., Poor, H.V.","6602727613;7006594890;35395027300;55665272100;","Low-complexity MMSE combining for linear impulse radio UWB receivers",2006,"IEEE International Conference on Communications","10",,"4024781","4706","4711",,4,"10.1109/ICC.2006.255383","https://www.scopus.com/inward/record.uri?eid=2-s2.0-42549140182&doi=10.1109%2fICC.2006.255383&partnerID=40&md5=ceeac564de99adc623a4a284506138d7",Conference Paper,"Final","",Scopus,2-s2.0-42549140182
"Shafi, M., Zhang, M., Smith, P.J., Moustakas, A.L., Molisch, A.F.","7005892251;55546195900;7406996870;35577484600;7006594890;","The impact of elevation angle on MIMO capacity",2006,"IEEE International Conference on Communications","9",,"4025134","4155","4160",,44,"10.1109/ICC.2006.255732","https://www.scopus.com/inward/record.uri?eid=2-s2.0-42549136057&doi=10.1109%2fICC.2006.255732&partnerID=40&md5=5e7f9dfedf81f6aad895a3b294cf9d5d",Conference Paper,"Final","All Open Access, Green",Scopus,2-s2.0-42549136057
"Almers, P., Santos, T., Tufvesson, F., Molisch, A.F., Karedal, J., Johansson, A.J.","6602935711;24921884000;6603113243;7006594890;8957710500;57214603150;","Measured diversity gains from MIMO antenna selection",2006,"IEEE Vehicular Technology Conference",,,"4109339","285","290",,5,"10.1109/VTCF.2006.74","https://www.scopus.com/inward/record.uri?eid=2-s2.0-34548863429&doi=10.1109%2fVTCF.2006.74&partnerID=40&md5=6430f73064ad3dad58e01d4df77bd554",Conference Paper,"Final","All Open Access, Green",Scopus,2-s2.0-34548863429
"Karedal, J., Johansson, A.J., Tufvesson, F., Molisch, A.F.","8957710500;57214603150;6603113243;7006594890;","Shadowing effects in MIMO channels for personal area networks",2006,"IEEE Vehicular Technology Conference",,,"4109312","173","177",,8,"10.1109/VTCF.2006.47","https://www.scopus.com/inward/record.uri?eid=2-s2.0-34548857402&doi=10.1109%2fVTCF.2006.47&partnerID=40&md5=26fa54e9cb911ffe0ec3dbd7cb1f4dd3",Conference Paper,"Final","All Open Access, Green",Scopus,2-s2.0-34548857402
"Wyne, S., Czink, N., Karedal, J., Almers, P., Tufvesson, F., Molisch, A.F.","8866431200;55907185800;8957710500;6602935711;6603113243;7006594890;","A cluster-based analysis of outdoor-to-indoor office MIMO measurements at 5.2 GHz",2006,"IEEE Vehicular Technology Conference",,,"4109280","22","26",,23,"10.1109/VTCF.2006.15","https://www.scopus.com/inward/record.uri?eid=2-s2.0-34548833081&doi=10.1109%2fVTCF.2006.15&partnerID=40&md5=f96e9cfd0f71415904b16bdc2b41b22c",Conference Paper,"Final","All Open Access, Green",Scopus,2-s2.0-34548833081
"Mehta, N.B., Molisch, A.F., Wu, J., Zhang, J.","7201738618;7006594890;7409254389;8343528300;","Approximating the sum of correlated lognormal or lognormal-rice random variables",2006,"IEEE International Conference on Communications","4",,"4024381","1605","1610",,36,"10.1109/ICC.2006.255040","https://www.scopus.com/inward/record.uri?eid=2-s2.0-34547770133&doi=10.1109%2fICC.2006.255040&partnerID=40&md5=85dd9f50343d71dd6d881078084ce8b9",Conference Paper,"Final","",Scopus,2-s2.0-34547770133
"Orlik, P., Zhao, S., Molisch, A.F.","7003976449;56329954000;7006594890;","A hybrid UWB modulation design compatible for both coherent and transmit-reference receivers",2006,"IEEE International Conference on Communications","10",,"4024787","4741","4745",,4,"10.1109/ICC.2006.255389","https://www.scopus.com/inward/record.uri?eid=2-s2.0-34547423501&doi=10.1109%2fICC.2006.255389&partnerID=40&md5=34757add9ef92ecf357a613e77a1448d",Conference Paper,"Final","All Open Access, Green",Scopus,2-s2.0-34547423501
"Boche, H., Bourdoux, A., Fonollosa, J.R., Kaiser, T., Molisch, A., Utschick, W.","7005126581;55882576600;7007085739;35983476500;7006594890;6701497651;","Smart antennas: State of the art",2006,"IEEE Vehicular Technology Magazine","1","1",,"8","17",,9,"10.1109/MVT.2006.1663946","https://www.scopus.com/inward/record.uri?eid=2-s2.0-34047266618&doi=10.1109%2fMVT.2006.1663946&partnerID=40&md5=dc5ed4eaed607923729c669b9201a2e0",Article,"Final","",Scopus,2-s2.0-34047266618
"Molisch, A.F., Asplund, H., Heddergott, R., Steinbauer, M., Zwick, T.","7006594890;6602301001;6506776269;56233820100;7003694193;","The COST259 directional channel model-part I: Overview and methodology",2006,"IEEE Transactions on Wireless Communications","5","12",,"3421","3433",,154,"10.1109/TWC.2006.256966","https://www.scopus.com/inward/record.uri?eid=2-s2.0-33845795331&doi=10.1109%2fTWC.2006.256966&partnerID=40&md5=c3d55a0bacdd17080845cac419a09659",Article,"Final","All Open Access, Green",Scopus,2-s2.0-33845795331
"Mehta, N.B., Molisch, A.F., Greenstein, L.J.","7201738618;7006594890;7004878411;","Macrocell-wide behavior of the orthogonality factor in WCDMA downlinks",2006,"IEEE Transactions on Wireless Communications","5","12",,"3394","3399",,5,"10.1109/TWC.2006.256962","https://www.scopus.com/inward/record.uri?eid=2-s2.0-33845653515&doi=10.1109%2fTWC.2006.256962&partnerID=40&md5=c257623e19d99c300254666e69b813ee",Article,"Final","",Scopus,2-s2.0-33845653515
"Sudarshan, P., Mehta, N.B., Molisch, A.F., Zhang, J.","8381566800;7201738618;7006594890;8343528300;","Channel statistics-based RF pre-processing with antenna selection",2006,"IEEE Transactions on Wireless Communications","5","12",,"3501","3510",,101,"10.1109/TWC.2006.256973","https://www.scopus.com/inward/record.uri?eid=2-s2.0-33845634685&doi=10.1109%2fTWC.2006.256973&partnerID=40&md5=aa6c09a05582567d4e920d89b217c592",Article,"Final","",Scopus,2-s2.0-33845634685
"Almers, P., Tufvesson, F., Molisch, A.F.","6602935711;6603113243;7006594890;","Keyhole effect in MIMO wireless channels: Measurements and theory",2006,"IEEE Transactions on Wireless Communications","5","12",,"3596","3604",,100,"10.1109/TWC.2006.256982","https://www.scopus.com/inward/record.uri?eid=2-s2.0-33845616650&doi=10.1109%2fTWC.2006.256982&partnerID=40&md5=addd1404f9255eee4b06ff841a1e91df",Article,"Final","",Scopus,2-s2.0-33845616650
"Asplund, H., Glazunov, A.A., Molisch, A.F., Pedersen, K.I., Steinbauer, M.","6602301001;56494615900;7006594890;7201733345;56233820100;","The COST 259 directional channel model-part II: Macrocells",2006,"IEEE Transactions on Wireless Communications","5","12",,"3434","3449",,138,"10.1109/TWC.2006.256967","https://www.scopus.com/inward/record.uri?eid=2-s2.0-33845607982&doi=10.1109%2fTWC.2006.256967&partnerID=40&md5=71b77823c772881e7a05ecacc42f5701",Article,"Final","All Open Access, Green",Scopus,2-s2.0-33845607982
"Zhang, H., Molisch, A.F., Zhang, J.","8410560900;7006594890;8343528300;","Applying antenna selection in WLANs for achieving broadband multimedia communications",2006,"IEEE Transactions on Broadcasting","52","4",,"475","482",,45,"10.1109/TBC.2006.884831","https://www.scopus.com/inward/record.uri?eid=2-s2.0-33845603462&doi=10.1109%2fTBC.2006.884831&partnerID=40&md5=159efeda6cfbc38d3a0dc22282122111",Article,"Final","",Scopus,2-s2.0-33845603462
"Molisch, A.F.","7006594890;","Introduction to UWB Signals and Systems",2006,"Ultra Wideband Antennas and Propagation for Communications, Radar and Imaging",,,,"1","17",,3,"10.1002/0470056843.ch1","https://www.scopus.com/inward/record.uri?eid=2-s2.0-84989306562&doi=10.1002%2f0470056843.ch1&partnerID=40&md5=35f7f6670c669e49e72c134aaebeede4",Book Chapter,"Final","",Scopus,2-s2.0-84989306562
"Molisch, A.F., Cassioli, D., Chong, C.-C., Emami, S., Fort, A., Kannan, B., Karedal, J., Kunisch, J., Schantz, H.G., Siwiak, K., Win, M.Z.","7006594890;6603090317;9044854500;7006130454;7005053492;7003932747;8957710500;6602654260;6603712788;6603619174;7005052803;","A comprehensive standardized model for ultrawideband propagation channels",2006,"IEEE Transactions on Antennas and Propagation","54","11","4012455","3151","3166",,615,"10.1109/TAP.2006.883983","https://www.scopus.com/inward/record.uri?eid=2-s2.0-84862848013&doi=10.1109%2fTAP.2006.883983&partnerID=40&md5=bc822f89d2e4783ef8db6bf9e9a61771",Article,"Final","All Open Access, Green",Scopus,2-s2.0-84862848013
"Tufvesson, F., Gezici, S., Molisch, A.F.","6603113243;6602727613;7006594890;","Ultra-wideband communications using hybrid matched filter correlation receivers",2006,"IEEE Transactions on Wireless Communications","5","11",,"3119","3129",,26,"10.1109/TWC.2006.04767","https://www.scopus.com/inward/record.uri?eid=2-s2.0-33846240910&doi=10.1109%2fTWC.2006.04767&partnerID=40&md5=74f3de85a7a7c479297ad6c5b55626f8",Article,"Final","All Open Access, Green",Scopus,2-s2.0-33846240910
"Malik, W.Q., Molisch, A.F.","23013048000;7006594890;","Ultrawideband antenna arrays and directional propagation channels",2006,"European Space Agency, (Special Publication) ESA SP","626 SP",,,"","",7,4,,"https://www.scopus.com/inward/record.uri?eid=2-s2.0-33847358798&partnerID=40&md5=836024ad3d626a47c5d7f648525eecbd",Conference Paper,"Final","",Scopus,2-s2.0-33847358798
"Li, Y., Molisch, A.F., Zhang, J.","57195633181;7006594890;8373641800;","Practical approaches to channel estimation and interference suppression for OFDM-based UWB communications",2006,"IEEE Transactions on Wireless Communications","5","9","1687750","2317","2320",,20,"10.1109/TWC.2006.1687750","https://www.scopus.com/inward/record.uri?eid=2-s2.0-33748612982&doi=10.1109%2fTWC.2006.1687750&partnerID=40&md5=1e56445f1fbfa752e8ef29f7aff97afd",Article,"Final","",Scopus,2-s2.0-33748612982
"Win, M.Z., Chrisikos, G., Molisch, A.F.","7005052803;6602376878;7006594890;","Wideband diversity in multipath channels with nonuniform power dispersion profiles",2006,"IEEE Transactions on Wireless Communications","5","5",,"1014","1021",,16,"10.1109/TWC.2006.1633354","https://www.scopus.com/inward/record.uri?eid=2-s2.0-33744747292&doi=10.1109%2fTWC.2006.1633354&partnerID=40&md5=8dc459432ce969467f5e7293c29478b1",Article,"Final","",Scopus,2-s2.0-33744747292
