作者,作者 ID,标题,年份,来源出版物名称,卷,期,论文编号,起始页码,结束页码,页码计数,施引文献,DOI,链接,文献类型,出版阶段,开放获取,来源出版物,EID
"Hitt, M.A., Ireland, R.D.","8092411400;56111740200;","RELATIONSHIPS AMONG CORPORATE LEVEL DISTINCTIVE COMPETENCIES, DIVERSIFICATION STRATEGY, CORPORATE STRUCTURE AND PERFORMANCE",1986,"Journal of Management Studies","23","4",,"401","416",,120,"10.1111/j.1467-6486.1986.tb00425.x","https://www.scopus.com/inward/record.uri?eid=2-s2.0-84980279618&doi=10.1111%2fj.1467-6486.1986.tb00425.x&partnerID=40&md5=5bfb74f8b0ad48c7107391386497d4c5",Article,"Final","",Scopus,2-s2.0-84980279618
"Hitt, M.A., Ireland, R.D.","8092411400;56111740200;","Corporate distinctive competence, strategy, industry and performance",1985,"Strategic Management Journal","6","3",,"273","293",,322,"10.1002/smj.4250060307","https://www.scopus.com/inward/record.uri?eid=2-s2.0-84989065000&doi=10.1002%2fsmj.4250060307&partnerID=40&md5=5d797aa16901d27c9bc2e9e273dbbb2b",Article,"Final","",Scopus,2-s2.0-84989065000
"VanAuken, P.M., Ireland, R.D.","57190729445;56111740200;","TRUE SMALL BUSINESS SOCIAL RESPONSIBILITY",1985,"Policy Studies Journal","13","4",,"776","779",,2,"10.1111/j.1541-0072.1985.tb01617.x","https://www.scopus.com/inward/record.uri?eid=2-s2.0-84982718937&doi=10.1111%2fj.1541-0072.1985.tb01617.x&partnerID=40&md5=8252f8dcbae67f955afd06687c2948ab",Article,"Final","",Scopus,2-s2.0-84982718937
"Hitt, M.A., Ireland, R.D.","8092411400;56111740200;","Strategy, Contextual Factors, and Performance",1985,"Human Relations","38","8",,"793","812",,17,"10.1177/001872678503800807","https://www.scopus.com/inward/record.uri?eid=2-s2.0-84973848065&doi=10.1177%2f001872678503800807&partnerID=40&md5=cbc5e0d3156e40f1f48e44bf802793ff",Article,"Final","",Scopus,2-s2.0-84973848065
"Hitt, M.A., Ireland, R.D.","8092411400;56111740200;","CORPORATE DISTINCTIVE COMPETENCE AND PERFORMANCE: EFFECTS OF PERCEIVED ENVIRONMENTAL UNCERTAINTY (PEU), SIZE, AND TECHNOLOGY",1984,"Decision Sciences","15","3",,"324","349",,7,"10.1111/j.1540-5915.1984.tb01222.x","https://www.scopus.com/inward/record.uri?eid=2-s2.0-84985761626&doi=10.1111%2fj.1540-5915.1984.tb01222.x&partnerID=40&md5=ea2733d3a9ba4a1a20c4ac629182bb34",Article,"Final","",Scopus,2-s2.0-84985761626
"Hitt, M.A., Ireland, R.D., Keats, B.W., Vianna, A.","8092411400;56111740200;8450798900;57191385864;","MEASURING SUBUNIT EFFECTIVENESS",1983,"Decision Sciences","14","1",,"87","102",,14,"10.1111/j.1540-5915.1983.tb00171.x","https://www.scopus.com/inward/record.uri?eid=2-s2.0-0041172869&doi=10.1111%2fj.1540-5915.1983.tb00171.x&partnerID=40&md5=e0dc458f161feadcb1012a53074889cc",Article,"Final","",Scopus,2-s2.0-0041172869
"Hitt, Michael A., Ireland, R.Duane","8092411400;56111740200;","STRATEGY, INDUSTRY, STRUCTURE AND PERFORMANCE.",1982,"Proceedings - Annual Meeting of the American Institute for Decision Sciences","2",,,"26","28",,,,"https://www.scopus.com/inward/record.uri?eid=2-s2.0-0020305935&partnerID=40&md5=693bacec7e055dbf100f325f7e9241d5",Conference Paper,"Final","",Scopus,2-s2.0-0020305935
"Hitt, M.A., Ireland, R.D., Stadter, G.","8092411400;56111740200;57191353573;","Functional importance and company performance: Moderating effects of grand strategy and industry type",1982,"Strategic Management Journal","3","4",,"315","330",,57,"10.1002/smj.4250030404","https://www.scopus.com/inward/record.uri?eid=2-s2.0-84989103179&doi=10.1002%2fsmj.4250030404&partnerID=40&md5=ba7a2cc965d0b902b6630b33b6cb31ba",Article,"Final","",Scopus,2-s2.0-84989103179
