作者,作者 ID,标题,年份,来源出版物名称,卷,期,论文编号,起始页码,结束页码,页码计数,施引文献,DOI,链接,文献类型,出版阶段,开放获取,来源出版物,EID
"Seuring, S.","6602271726;","Integrated chain management and supply chain management comparative analysis and illustrative cases",2004,"Journal of Cleaner Production","12","8-10",,"1059","1071",,156,"10.1016/j.jclepro.2004.02.006","https://www.scopus.com/inward/record.uri?eid=2-s2.0-2442513944&doi=10.1016%2fj.jclepro.2004.02.006&partnerID=40&md5=b350a2c67f4e027fc68047e8a827ff1e",Article,"Final","",Scopus,2-s2.0-2442513944
"Seuring, S.","6602271726;","Industrial ecology, life cycles, supply chains: Differences and interrelations",2004,"Business Strategy and the Environment","13","5",,"306","319",,162,"10.1002/bse.418","https://www.scopus.com/inward/record.uri?eid=2-s2.0-4544285984&doi=10.1002%2fbse.418&partnerID=40&md5=e5f704e9b392d7e4bfa1f2617cdfccb6",Article,"Final","All Open Access, Green",Scopus,2-s2.0-4544285984
"Seuring, S., Goldbach, M., Koplin, J.","6602271726;7004212610;16032920800;","Managing time and complexity in supply chains: two cases from the textile industry",2004,"International Journal of Integrated Supply Management","1","2",,"180","198",,33,"10.1504/IJISM.2004.004864","https://www.scopus.com/inward/record.uri?eid=2-s2.0-2442562788&doi=10.1504%2fIJISM.2004.004864&partnerID=40&md5=ace7bada323c9d4d9fcc8afc00abecb8",Article,"Final","",Scopus,2-s2.0-2442562788
"Seuring, S.","6602271726;","Emerging issues in life-cycle management",2004,"Greener Management International",,"45",,"3","8",,3,"10.9774/GLEAF.3062.2004.sp.00002","https://www.scopus.com/inward/record.uri?eid=2-s2.0-23844451745&doi=10.9774%2fGLEAF.3062.2004.sp.00002&partnerID=40&md5=6e80701ef80821a41c6ebbd85ce84416",Editorial,"Final","",Scopus,2-s2.0-23844451745
"Seuring, S.A., Koplin, J., Behrens, T., Schneidewind, U.","6602271726;16032920800;57534798600;6603436613;","Sustainability assessment in the German detergent industry: From stakeholder involvement to sustainability indicators",2003,"Sustainable Development","11","4",,"199","212",,34,"10.1002/sd.216","https://www.scopus.com/inward/record.uri?eid=2-s2.0-0344256547&doi=10.1002%2fsd.216&partnerID=40&md5=94e2574dcca8c45f459218462fafd9db",Article,"Final","",Scopus,2-s2.0-0344256547
"Seuring, S.A.","6602271726;","An exploratory analysis of facility operators in the German chemical industry",2003,"International Journal of Operations and Production Management","23","10",,"1207","1223",,9,"10.1108/01443570310496634","https://www.scopus.com/inward/record.uri?eid=2-s2.0-0141942101&doi=10.1108%2f01443570310496634&partnerID=40&md5=8bef6a743ed8169f79651e17f9aa1674",Article,"Final","",Scopus,2-s2.0-0141942101
"Goldbach, M., Seuring, S., Back, S.","7004212610;6602271726;55209453800;","Co-ordinating sustainable cotton chains for the mass market: The case of the German mail-order business OTTO",2003,"Greener Management International",,"43",,"65","78",,60,"10.9774/GLEAF.3062.2003.au.00008","https://www.scopus.com/inward/record.uri?eid=2-s2.0-4544351459&doi=10.9774%2fGLEAF.3062.2003.au.00008&partnerID=40&md5=17baea3b5370e67e1b3f0e8032c4e1d0",Article,"Final","",Scopus,2-s2.0-4544351459
"Rebitzer, G., Seuring, S.","6701457400;6602271726;","Methodology and application of life cycle costing",2003,"International Journal of Life Cycle Assessment","8","2",,"110","111",,36,"10.1007/BF02978436","https://www.scopus.com/inward/record.uri?eid=2-s2.0-0037243102&doi=10.1007%2fBF02978436&partnerID=40&md5=2363c9562f53668b7087b8330e3f23dc",Short Survey,"Final","All Open Access, Green",Scopus,2-s2.0-0037243102
"Seuring, S., Marx, H.","6602271726;57216814296;","On-site services in the chemical industry [Standortdienstleistungen in der chemischen industrie]",2001,"Nachrichten aus der Chemie","49","7-8",,"928","929",,,"10.1002/nadc.20010490717","https://www.scopus.com/inward/record.uri?eid=2-s2.0-0035412973&doi=10.1002%2fnadc.20010490717&partnerID=40&md5=c23446580de6cda1b40f10ca69ee6a21",Article,"Final","",Scopus,2-s2.0-0035412973
"Seuring, S.A.","6602271726;","Green supply chain costing: Joint cost management in the polyester linings supply chain",2001,"Greener Management International",,"33",,"71","80",,47,"10.9774/GLEAF.3062.2001.sp.00008","https://www.scopus.com/inward/record.uri?eid=2-s2.0-0035210694&doi=10.9774%2fGLEAF.3062.2001.sp.00008&partnerID=40&md5=896c0017af34042707d3c0274887e1b6",Article,"Final","",Scopus,2-s2.0-0035210694
"Derwent, R.G., Simmonds, P.G., Seuring, S., Dimmer, C.","7006385747;7102204006;6602271726;6701355992;","Observation and interpretation of the seasonal cycles in the surface concentrations of ozone and carbon monoxide at Mace Head, Ireland from 1990 to 1994",1998,"Atmospheric Environment","32","2",,"145","157",,141,"10.1016/S1352-2310(97)00338-5","https://www.scopus.com/inward/record.uri?eid=2-s2.0-0031986457&doi=10.1016%2fS1352-2310%2897%2900338-5&partnerID=40&md5=d5a4e506fda62bf46b2181c7faa8308a",Article,"Final","",Scopus,2-s2.0-0031986457
"Simmonds, P.G., Seuring, S., Nickless, G., Derwent, R.G.","7102204006;6602271726;7006804907;7006385747;","Segregation and interpretation of ozone and carbon monoxide measurements by air mass origin at the TOR station Mace Head, Ireland from 1987 to 1995",1997,"Journal of Atmospheric Chemistry","28","1-3",,"45","59",,70,"10.1023/A:1005817916497","https://www.scopus.com/inward/record.uri?eid=2-s2.0-0030779254&doi=10.1023%2fA%3a1005817916497&partnerID=40&md5=f03d2e586a0f45fae91562ea15e5f764",Conference Paper,"Final","",Scopus,2-s2.0-0030779254
