作者,作者 ID,标题,年份,来源出版物名称,卷,期,论文编号,起始页码,结束页码,页码计数,施引文献,DOI,链接,文献类型,出版阶段,开放获取,来源出版物,EID
"Huang, Y.A., Lenzen, M., Weber, C.L., Murray, J., Matthews, H.S.","24824600900;7003767895;14017121300;15840058700;7202534265;","The role of input-output analysis for the screening of corporate carbon footprints",2009,"Economic Systems Research","21","3",,"217","242",,124,"10.1080/09535310903541348","https://www.scopus.com/inward/record.uri?eid=2-s2.0-77949342469&doi=10.1080%2f09535310903541348&partnerID=40&md5=9da4605d39b36c9edbcbc296f37b2a9e",Article,"Final","",Scopus,2-s2.0-77949342469
"Lenzen, M.","7003767895;","Understanding virtual water flows: A multiregion input-output case study of Victoria",2009,"Water Resources Research","45","9","W09416","","",,110,"10.1029/2008WR007649","https://www.scopus.com/inward/record.uri?eid=2-s2.0-72149113054&doi=10.1029%2f2008WR007649&partnerID=40&md5=b1b83ef972fa468ad4df371ebb31fee0",Article,"Final","All Open Access, Bronze",Scopus,2-s2.0-72149113054
"Lenzen, M., Los, B.","7003767895;6603362875;","Editorial",2009,"Economic Systems Research","21","1",,"1","2",,,"10.1080/09535310802688646","https://www.scopus.com/inward/record.uri?eid=2-s2.0-67650331093&doi=10.1080%2f09535310802688646&partnerID=40&md5=9dc178117abf0f5344a381917dcac273",Editorial,"Final","",Scopus,2-s2.0-67650331093
"Lenzen, M., Gallego, B., Wood, R.","7003767895;36641868100;57196060442;","Matrix balancing under conflicting information",2009,"Economic Systems Research","21","1",,"23","44",,90,"10.1080/09535310802688661","https://www.scopus.com/inward/record.uri?eid=2-s2.0-67650281739&doi=10.1080%2f09535310802688661&partnerID=40&md5=218ed846e6be969f5e84367e0288e8d5",Article,"Final","",Scopus,2-s2.0-67650281739
"Wiedmann, T.O., Lenzen, M., Barrett, J.R.","11940678500;7003767895;7403498603;","Companies on the scale comparing and benchmarking the sustainability performance of businesses",2009,"Journal of Industrial Ecology","13","3",,"361","383",,131,"10.1111/j.1530-9290.2009.00125.x","https://www.scopus.com/inward/record.uri?eid=2-s2.0-67649987708&doi=10.1111%2fj.1530-9290.2009.00125.x&partnerID=40&md5=240f2489c58a700669d1d8850e824c67",Article,"Final","",Scopus,2-s2.0-67649987708
"Kitzes, J., Galli, A., Bagliani, M., Barrett, J., Dige, G., Ede, S., Erb, K., Giljum, S., Haberl, H., Hails, C., Jolia-Ferrier, L., Jungwirth, S., Lenzen, M., Lewis, K., Loh, J., Marchettini, N., Messinger, H., Milne, K., Moles, R., Monfreda, C., Moran, D., Nakano, K., Pyhälä, A., Rees, W., Simmons, C., Wackernagel, M., Wada, Y., Walsh, C., Wiedmann, T.","12801961000;55658056278;23501343500;7403498603;24724279100;24724166600;7007026767;6603215164;7004619776;6602963429;24724484400;24724568200;7003767895;7201596884;7005450508;56206691600;57212351367;24725041800;6602863024;6506140196;12801754000;36900977300;17135654100;7103262929;7103173893;6603917467;24726529300;33568426300;11940678500;","A research agenda for improving national Ecological Footprint accounts",2009,"Ecological Economics","68","7",,"1991","2007",,199,"10.1016/j.ecolecon.2008.06.022","https://www.scopus.com/inward/record.uri?eid=2-s2.0-67349159785&doi=10.1016%2fj.ecolecon.2008.06.022&partnerID=40&md5=7ffdc82eb39ba1aee62068449dba2ab0",Article,"Final","",Scopus,2-s2.0-67349159785
"Wood, R., Lenzen, M.","57196060442;7003767895;","Structural path decomposition",2009,"Energy Economics","31","3",,"335","341",,97,"10.1016/j.eneco.2008.11.003","https://www.scopus.com/inward/record.uri?eid=2-s2.0-63149143222&doi=10.1016%2fj.eneco.2008.11.003&partnerID=40&md5=4ccd1947a0b849728a8089e81c1e6f4a",Article,"Final","",Scopus,2-s2.0-63149143222
"Wood, R., Lenzen, M.","57196060442;7003767895;","Aggregate measures of complex economic structure and evolution a review and case study",2009,"Journal of Industrial Ecology","13","2",,"264","283",,19,"10.1111/j.1530-9290.2009.00113.x","https://www.scopus.com/inward/record.uri?eid=2-s2.0-67049115533&doi=10.1111%2fj.1530-9290.2009.00113.x&partnerID=40&md5=8722e64733949bc4a25baf0fb70bec3b",Article,"Final","",Scopus,2-s2.0-67049115533
"Lenzen, M., Lane, A., Widmer-Cooper, A., Williams, M.","7003767895;12808292400;6508002938;8570577200;","Effects of land use on threatened species [Efectos del uso de suelo sobre especies amenazadas]",2009,"Conservation Biology","23","2",,"294","306",,38,"10.1111/j.1523-1739.2008.01126.x","https://www.scopus.com/inward/record.uri?eid=2-s2.0-62549147052&doi=10.1111%2fj.1523-1739.2008.01126.x&partnerID=40&md5=780e8bb7a27ed4977c2a7e6ffaef2364",Article,"Final","",Scopus,2-s2.0-62549147052
"Wachsmann, U., Wood, R., Lenzen, M., Schaeffer, R.","6701715269;57196060442;7003767895;57204785123;","Structural decomposition of energy use in Brazil from 1970 to 1996",2009,"Applied Energy","86","4",,"578","587",,138,"10.1016/j.apenergy.2008.08.003","https://www.scopus.com/inward/record.uri?eid=2-s2.0-58149139104&doi=10.1016%2fj.apenergy.2008.08.003&partnerID=40&md5=5dbf24904fa84f452e57ce15798ffefd",Review,"Final","",Scopus,2-s2.0-58149139104
"Lenzen, M., Wood, R., Foran, B.","7003767895;57196060442;7003364802;","Direct versus Embodied Energy - The Need for Urban Lifestyle Transitions",2008,"Urban Energy Transition",,,,"91","120",,46,"10.1016/B978-0-08-045341-5.00004-9","https://www.scopus.com/inward/record.uri?eid=2-s2.0-73849089637&doi=10.1016%2fB978-0-08-045341-5.00004-9&partnerID=40&md5=d7733f2906b641dc299b9d43e34ecf15",Book Chapter,"Final","",Scopus,2-s2.0-73849089637
"Lenzen, M.","7003767895;","Sustainable island businesses: a case study of Norfolk Island",2008,"Journal of Cleaner Production","16","18",,"2018","2035",,21,"10.1016/j.jclepro.2008.02.006","https://www.scopus.com/inward/record.uri?eid=2-s2.0-50549085218&doi=10.1016%2fj.jclepro.2008.02.006&partnerID=40&md5=895b7af6ad210048150e3898ed5c76c7",Article,"Final","",Scopus,2-s2.0-50549085218
"Lenzen, M.","7003767895;","Life cycle energy and greenhouse gas emissions of nuclear energy: A review",2008,"Energy Conversion and Management","49","8",,"2178","2199",,273,"10.1016/j.enconman.2008.01.033","https://www.scopus.com/inward/record.uri?eid=2-s2.0-44249121928&doi=10.1016%2fj.enconman.2008.01.033&partnerID=40&md5=9229effb0798afc93032b2c4925fcf5b",Article,"Final","",Scopus,2-s2.0-44249121928
"Lenzen, M.","7003767895;","Consumer and producer environmental responsibility: A reply",2008,"Ecological Economics","66","2-3",,"547","550",,24,"10.1016/j.ecolecon.2008.03.012","https://www.scopus.com/inward/record.uri?eid=2-s2.0-44649114466&doi=10.1016%2fj.ecolecon.2008.03.012&partnerID=40&md5=70e85853ccf0091f16fb0fd4142bdb09",Note,"Final","",Scopus,2-s2.0-44649114466
"Lenzen, M.","7003767895;","Double-counting in life cycle calculations",2008,"Journal of Industrial Ecology","12","4",,"583","599",,49,"10.1111/j.1530-9290.2008.00067.x","https://www.scopus.com/inward/record.uri?eid=2-s2.0-56749182274&doi=10.1111%2fj.1530-9290.2008.00067.x&partnerID=40&md5=6331c83dbcc446172fdd6a745a47001f",Article,"Final","",Scopus,2-s2.0-56749182274
"Peters, G.M., Sack, F., Lenzen, M., Lundie, S., Gallego, B.","57221770779;7005684825;7003767895;56107451300;36641868100;","Towards a deeper and broader ecological footprint",2008,"Proceedings of the Institution of Civil Engineers: Engineering Sustainability","161","1",,"31","37",,6,"10.1680/ensu.2008.161.1.31","https://www.scopus.com/inward/record.uri?eid=2-s2.0-42449089495&doi=10.1680%2fensu.2008.161.1.31&partnerID=40&md5=0f3b7aa544d8a88120766917570f9c03",Article,"Final","",Scopus,2-s2.0-42449089495
"Lenzen, M., Wood, R., Gallego, B.","7003767895;57196060442;36641868100;","Some comments on the GRAS method",2007,"Economic Systems Research","19","4",,"461","465",,49,"10.1080/09535310701698613","https://www.scopus.com/inward/record.uri?eid=2-s2.0-37549007141&doi=10.1080%2f09535310701698613&partnerID=40&md5=0ccf3495587e929feb95a284dfc3ef8f",Article,"Final","",Scopus,2-s2.0-37549007141
"Lenzen, M.","7003767895;","Aggregation (in-)variance of shared responsibility: A case study of Australia",2007,"Ecological Economics","64","1",,"19","24",,30,"10.1016/j.ecolecon.2007.06.025","https://www.scopus.com/inward/record.uri?eid=2-s2.0-34548835216&doi=10.1016%2fj.ecolecon.2007.06.025&partnerID=40&md5=d8d808159bb462798d2a881e90ad58bf",Note,"Final","",Scopus,2-s2.0-34548835216
"Turner, K., Lenzen, M., Wiedmann, T., Barrett, J.","9334515000;7003767895;11940678500;7403498603;","Examining the global environmental impact of regional consumption activities - Part 1: A technical note on combining input-output and ecological footprint analysis",2007,"Ecological Economics","62","1",,"37","44",,196,"10.1016/j.ecolecon.2006.12.002","https://www.scopus.com/inward/record.uri?eid=2-s2.0-33947498458&doi=10.1016%2fj.ecolecon.2006.12.002&partnerID=40&md5=8a4b0686d61164376588c31060947616",Article,"Final","All Open Access, Green",Scopus,2-s2.0-33947498458
"Vardon, M., Lenzen, M., Peevor, S., Creaser, M.","6603248019;7003767895;16040173700;6504669172;","Water accounting in Australia",2007,"Ecological Economics","61","4",,"650","659",,57,"10.1016/j.ecolecon.2006.07.033","https://www.scopus.com/inward/record.uri?eid=2-s2.0-33947159207&doi=10.1016%2fj.ecolecon.2006.07.033&partnerID=40&md5=62bf523edab7b3ea122eae80c32992ea",Article,"Final","",Scopus,2-s2.0-33947159207
"Wiedmann, T., Lenzen, M., Turner, K., Barrett, J.","11940678500;7003767895;9334515000;7403498603;","Examining the global environmental impact of regional consumption activities - Part 2: Review of input-output models for the assessment of environmental impacts embodied in trade",2007,"Ecological Economics","61","1",,"15","26",,489,"10.1016/j.ecolecon.2006.12.003","https://www.scopus.com/inward/record.uri?eid=2-s2.0-33846892930&doi=10.1016%2fj.ecolecon.2006.12.003&partnerID=40&md5=00058229fd58b6d06685a7f456f96b13",Short Survey,"Final","",Scopus,2-s2.0-33846892930
"Lenzen, M., Murray, J., Sack, F., Wiedmann, T.","7003767895;15840058700;7005684825;11940678500;","Shared producer and consumer responsibility - Theory and practice",2007,"Ecological Economics","61","1",,"27","42",,425,"10.1016/j.ecolecon.2006.05.018","https://www.scopus.com/inward/record.uri?eid=2-s2.0-33846781706&doi=10.1016%2fj.ecolecon.2006.05.018&partnerID=40&md5=823cfa60ee301ea2c36cf1799afdfbd2",Article,"Final","",Scopus,2-s2.0-33846781706
"Lenzen, M.","7003767895;","Structural path analysis of ecosystem networks",2007,"Ecological Modelling","200","3-4",,"334","342",,125,"10.1016/j.ecolmodel.2006.07.041","https://www.scopus.com/inward/record.uri?eid=2-s2.0-33845458670&doi=10.1016%2fj.ecolmodel.2006.07.041&partnerID=40&md5=646079f6ab2bf8c0181312921bf115ff",Article,"Final","",Scopus,2-s2.0-33845458670
"Lenzen, M., Schaeffer, R., Matsuhashi, R.","7003767895;57204785123;7003665748;","Selecting and assessing sustainable CDM projects using multi-criteria methods",2007,"Climate Policy","7","2",,"121","138",,13,"10.1080/14693062.2007.9685642","https://www.scopus.com/inward/record.uri?eid=2-s2.0-37349126242&doi=10.1080%2f14693062.2007.9685642&partnerID=40&md5=000a6e46d6b04728a227596ed81706a6",Article,"Final","",Scopus,2-s2.0-37349126242
"Wood, R., Lenzen, M., Dey, C., Lundie, S.","57196060442;7003767895;7006153442;56107451300;","A comparative study of some environmental impacts of conventional and organic farming in Australia",2006,"Agricultural Systems","89","2-3",,"324","348",,149,"10.1016/j.agsy.2005.09.007","https://www.scopus.com/inward/record.uri?eid=2-s2.0-33645223717&doi=10.1016%2fj.agsy.2005.09.007&partnerID=40&md5=46431c4b12f4d126b93b50d98e2ef32c",Article,"Final","",Scopus,2-s2.0-33645223717
"Lenzen, M.","7003767895;","Uncertainty in impact and externality assessments: Implications for decision-making",2006,"International Journal of Life Cycle Assessment","11","3",,"189","199",,42,"10.1065/lca2005.04.201","https://www.scopus.com/inward/record.uri?eid=2-s2.0-33744929366&doi=10.1065%2flca2005.04.201&partnerID=40&md5=17856f79b399dbc44340234c33f8517b",Review,"Final","",Scopus,2-s2.0-33744929366
"Lenzen, M., Maganov, P.","7003767895;22985707900;","How many light globes does it take to change a footprint?",2006,"WIT Transactions on Ecology and the Environment","93",,,"229","238",,,"10.2495/SC060221","https://www.scopus.com/inward/record.uri?eid=2-s2.0-36148934483&doi=10.2495%2fSC060221&partnerID=40&md5=c8e4d0eebf908272e4ddabca51ca3717",Article,"Final","All Open Access, Bronze",Scopus,2-s2.0-36148934483
"Wood, R., Lenzen, M.","57196060442;7003767895;","Zero-value problems of the logarithmic mean divisia index decomposition method",2006,"Energy Policy","34","12",,"1326","1331",,78,"10.1016/j.enpol.2004.11.010","https://www.scopus.com/inward/record.uri?eid=2-s2.0-33645067889&doi=10.1016%2fj.enpol.2004.11.010&partnerID=40&md5=9603d66c6363a000685138d3a5b8e4c4",Article,"Final","",Scopus,2-s2.0-33645067889
"Lenzen, M.","7003767895;","Decomposition analysis and the mean-rate-of-change index",2006,"Applied Energy","83","3",,"185","198",,48,"10.1016/j.apenergy.2005.02.005","https://www.scopus.com/inward/record.uri?eid=2-s2.0-28144449547&doi=10.1016%2fj.apenergy.2005.02.005&partnerID=40&md5=456a769ac56535a9cfdea96b86b760a2",Article,"Final","",Scopus,2-s2.0-28144449547
"Lenzen, M., Wier, M., Cohen, C., Hayami, H., Pachauri, S., Schaeffer, R.","7003767895;7004875353;8695774400;8716382200;7006691383;57204785123;","A comparative multivariate analysis of household energy requirements in Australia, Brazil, Denmark, India and Japan",2006,"Energy","31","2-3",,"181","207",,316,"10.1016/j.energy.2005.01.009","https://www.scopus.com/inward/record.uri?eid=2-s2.0-23244436702&doi=10.1016%2fj.energy.2005.01.009&partnerID=40&md5=1224a696b457567f80217b195b7bbadf",Article,"Final","",Scopus,2-s2.0-23244436702
"Gallego, B., Lenzen, M.","36641868100;7003767895;","A consistent input-output formulation of shared producer and consumer responsibility",2005,"Economic Systems Research","17","4",,"365","391",,176,"10.1080/09535310500283492","https://www.scopus.com/inward/record.uri?eid=2-s2.0-31344469352&doi=10.1080%2f09535310500283492&partnerID=40&md5=72a1dd67543d16b73067661a6a1b0643",Article,"Final","",Scopus,2-s2.0-31344469352
"Munksgaard, J., Wier, M., Lenzen, M., Dey, C.","6603088866;7004875353;7003767895;7006153442;","Using input-output analysis to measure the environmental pressure of consumption at different spatial levels",2005,"Journal of Industrial Ecology","9","1-2",,"169","185",,129,"10.1162/1088198054084699","https://www.scopus.com/inward/record.uri?eid=2-s2.0-21244500940&doi=10.1162%2f1088198054084699&partnerID=40&md5=20cddcc84d164f2fb1f3a482bab88702",Conference Paper,"Final","All Open Access, Bronze",Scopus,2-s2.0-21244500940
"Cohen, C., Lenzen, M., Schaeffer, R.","8695774400;7003767895;57204785123;","Energy requirements of households in Brazil",2005,"Energy Policy","33","4",,"555","562",,143,"10.1016/j.enpol.2003.08.021","https://www.scopus.com/inward/record.uri?eid=2-s2.0-4143070176&doi=10.1016%2fj.enpol.2003.08.021&partnerID=40&md5=913a44886f42ca5788df695624c82721",Article,"Final","",Scopus,2-s2.0-4143070176
"Lenzen, M., Collins, R.E., Prince, K.","7003767895;7403350627;7004854463;","Method of measuring depth profile of hydrogen in soda-lime glass",2005,"Journal of Non-Crystalline Solids","351","4",,"317","322",,8,"10.1016/j.jnoncrysol.2004.11.018","https://www.scopus.com/inward/record.uri?eid=2-s2.0-12344314308&doi=10.1016%2fj.jnoncrysol.2004.11.018&partnerID=40&md5=b7920e8f10a65eeba6af9cff43c9979a",Article,"Final","",Scopus,2-s2.0-12344314308
"Foran, B., Lenzen, M., Dey, C., Bilek, M.","7003364802;7003767895;7006153442;7005304079;","Integrating sustainable chain management with triple bottom line accounting",2005,"Ecological Economics","52","2",,"143","157",,132,"10.1016/j.ecolecon.2004.06.024","https://www.scopus.com/inward/record.uri?eid=2-s2.0-13244286655&doi=10.1016%2fj.ecolecon.2004.06.024&partnerID=40&md5=099fa18ae1805ce836b8fa286c039130",Article,"Final","",Scopus,2-s2.0-13244286655
"Munksgaard, J., Pade, L.-L., Minx, J., Lenzen, M.","6603088866;6507948684;8513127600;7003767895;","Influence of trade on national CO2 emissions",2005,"International Journal of Global Energy Issues","23","4",,"324","336",,36,"10.1504/IJGEI.2005.006950","https://www.scopus.com/inward/record.uri?eid=2-s2.0-20144385652&doi=10.1504%2fIJGEI.2005.006950&partnerID=40&md5=35f0dd2faa67be8ec275d5d987f14fe1",Article,"Final","",Scopus,2-s2.0-20144385652
"Munksgaard, J., Lenzen, M., Jensen, T.C., Pade, L.-L.","6603088866;7003767895;8400483100;6507948684;","Erratum: Transport energy embodied in consumer goods: A hybrid life-cycle analysis (Energy &amp; Environment vol. 16 (1) (27-45))",2005,"Energy and Environment","16","2",,"","",,,,"https://www.scopus.com/inward/record.uri?eid=2-s2.0-18344375284&partnerID=40&md5=a9a58090c378c05011ef9fec587a678d",Erratum,"Final","",Scopus,2-s2.0-18344375284
"Munksgaard, J., Lenzen, M., Jensen, T.C., Pade, L.-L.","6603088866;7003767895;8400483100;6507948684;","Transport energy embodied in consumer goods: A hybrid life-cycle analysis",2005,"Energy and Environment","16","2",,"283","302",,4,"10.1260/0958305053749480","https://www.scopus.com/inward/record.uri?eid=2-s2.0-18344374199&doi=10.1260%2f0958305053749480&partnerID=40&md5=bbfebc1cb04968e6354d05d48e27af78",Article,"Final","",Scopus,2-s2.0-18344374199
"Munksgaard, J., Lenzen, M., Jensen, T.C., Pade, L.-L.","6603088866;7003767895;8400483100;6507948684;","Transport energy embodied in consumer goods: A hybrid life-cycle analysis",2005,"Energy and Environment","16","1",,"27","45",,1,"10.1260/0958305053516280","https://www.scopus.com/inward/record.uri?eid=2-s2.0-13944269904&doi=10.1260%2f0958305053516280&partnerID=40&md5=219e9cd58105f475418730e2b409f790",Article,"Final","",Scopus,2-s2.0-13944269904
"Lenzen, M., Dey, C.J., Murray, S.A.","7003767895;7006153442;7402406272;","Historical accountability and cumulative impacts: The treatment of time in corporate sustainability reporting",2004,"Ecological Economics","51","3-4",,"237","250",,32,"10.1016/j.ecolecon.2004.06.008","https://www.scopus.com/inward/record.uri?eid=2-s2.0-9444229435&doi=10.1016%2fj.ecolecon.2004.06.008&partnerID=40&md5=be28cf7908e165ac57bee63add67e82a",Article,"Final","",Scopus,2-s2.0-9444229435
"Lenzen, M., Dey, C., Foran, B.","7003767895;7006153442;7003364802;","Energy requirements of Sydney households",2004,"Ecological Economics","49","3",,"375","399",,204,"10.1016/j.ecolecon.2004.01.019","https://www.scopus.com/inward/record.uri?eid=2-s2.0-3543145513&doi=10.1016%2fj.ecolecon.2004.01.019&partnerID=40&md5=3d90e8bd5f6718aed83ef013a99d1a9c",Article,"Final","All Open Access, Green",Scopus,2-s2.0-3543145513
"Suh, S., Lenzen, M., Treloar, G.J., Hondo, H., Horvath, A., Huppes, G., Jolliet, O., Klann, U., Krewitt, W., Moriguchi, Y., Munksgaard, J., Norris, G.","7201479719;7003767895;6602703942;7005992165;7202214379;6602869062;7004103647;7801661840;6602096552;7005857017;6603088866;35581958800;","System Boundary Selection in Life-Cycle Inventories Using Hybrid Approaches",2004,"Environmental Science and Technology","38","3",,"657","664",,764,"10.1021/es0263745","https://www.scopus.com/inward/record.uri?eid=2-s2.0-10744220870&doi=10.1021%2fes0263745&partnerID=40&md5=5ae3f1227133b9bc690fc5e0abe6c436",Review,"Final","",Scopus,2-s2.0-10744220870
"Lenzen, M., Schaeffer, R.","7003767895;57204785123;","Interrelational income distribution in Brazil",2004,"Developing Economies","42","3",,"371","391",,8,"10.1111/j.1746-1049.2004.tb00943.x","https://www.scopus.com/inward/record.uri?eid=2-s2.0-6344282746&doi=10.1111%2fj.1746-1049.2004.tb00943.x&partnerID=40&md5=33dfa49c40635a7809c5e5b022090e27",Article,"Final","",Scopus,2-s2.0-6344282746
"Lenzen, M., Schaeffer, R.","7003767895;57204785123;","Environmental and social accounting for Brazil",2004,"Environmental and Resource Economics","27","2",,"201","226",,24,"10.1023/B:EARE.0000017281.24020.49","https://www.scopus.com/inward/record.uri?eid=2-s2.0-1642374636&doi=10.1023%2fB%3aEARE.0000017281.24020.49&partnerID=40&md5=d710ce63f12aacffffd565a0f6b70c92",Review,"Final","",Scopus,2-s2.0-1642374636
"Lenzen, M., Pade, L.-L., Munksgaard, J.","7003767895;6507948684;6603088866;","CO2 multipliers in multi-region input-output models",2004,"Economic Systems Research","16","4",,"391","412",,337,"10.1080/0953531042000304272","https://www.scopus.com/inward/record.uri?eid=2-s2.0-11244279604&doi=10.1080%2f0953531042000304272&partnerID=40&md5=bc34fd4479e2b264485c681e1faf7517",Article,"Final","",Scopus,2-s2.0-11244279604
"Lenzen, M., Wachsmann, U.","7003767895;6701715269;","Wind turbines in Brazil and Germany: An example of geographical variability in life-cycle assessment",2004,"Applied Energy","77","2",,"119","130",,86,"10.1016/S0306-2619(03)00105-3","https://www.scopus.com/inward/record.uri?eid=2-s2.0-0142215262&doi=10.1016%2fS0306-2619%2803%2900105-3&partnerID=40&md5=3e5726c4064df93b48790000b3a0373c",Article,"Final","",Scopus,2-s2.0-0142215262
"Wier, M., Munksgaard, J., Christoffersen, L.B., Jensen, T.S., Pedersen, O.G., Keiding, H., Lenzen, M.","7004875353;6603088866;11940059500;11940680200;7202725888;6701413285;7003767895;","Environmental performance indices, family types and consumption patterns",2003,"Advances in Ecological Sciences","18",,,"657","667",,1,,"https://www.scopus.com/inward/record.uri?eid=2-s2.0-2942637929&partnerID=40&md5=b122504f57f26b8e2f13fbebeb36c984",Conference Paper,"Final","",Scopus,2-s2.0-2942637929
"Wood, R., Lenzen, M.","57196060442;7003767895;","An application of a modified ecological footprint method and structural path analysis in a comparative institutional study",2003,"Local Environment","8","4",,"365","386",,62,"10.1080/13549830306670","https://www.scopus.com/inward/record.uri?eid=2-s2.0-0141465013&doi=10.1080%2f13549830306670&partnerID=40&md5=a0ca8537db71a944fbcb237ef37f31e2",Article,"Final","",Scopus,2-s2.0-0141465013
"Lenzen, M.","7003767895;","Environmentally important paths, linkages and key sectors in the Australian economy",2003,"Structural Change and Economic Dynamics","14","1",,"1","34",,181,"10.1016/S0954-349X(02)00025-5","https://www.scopus.com/inward/record.uri?eid=2-s2.0-0037341733&doi=10.1016%2fS0954-349X%2802%2900025-5&partnerID=40&md5=a88235e8caaf660a72ef5e3ac0d9238f",Article,"Final","",Scopus,2-s2.0-0037341733
"Lenzen, M., Lundie, S., Bransgrove, G., Charet, L., Sack, F.","7003767895;56107451300;6505482440;6504053930;7005684825;","Assessing the ecological footprint of a large metropolitan water supplier: Lessons for water management and planning towards sustainability",2003,"Journal of Environmental Planning and Management","46","1",,"113","141",,50,"10.1080/713676700","https://www.scopus.com/inward/record.uri?eid=2-s2.0-0141867259&doi=10.1080%2f713676700&partnerID=40&md5=f77771ae6c75e9615a651c6e03227d01",Article,"Final","",Scopus,2-s2.0-0141867259
"Lenzen, M., Murray, S.A., Korte, B., Dey, C.J.","7003767895;7402406272;6701826557;7006153442;","Environmental impact assessment including indirect effects - A case study using input-output analysis",2003,"Environmental Impact Assessment Review","23","3",,"263","282",,110,"10.1016/S0195-9255(02)00104-X","https://www.scopus.com/inward/record.uri?eid=2-s2.0-0037656378&doi=10.1016%2fS0195-9255%2802%2900104-X&partnerID=40&md5=3742a70a70c842872447b7fbaf5f55b8",Review,"Final","",Scopus,2-s2.0-0037656378
"Lenzen, M.","7003767895;","A guide for compiling inventories in hybrid life-cycle assessments: Some Australian results",2002,"Journal of Cleaner Production","10","6",,"545","572",,132,"10.1016/S0959-6526(02)00007-0","https://www.scopus.com/inward/record.uri?eid=2-s2.0-0036885235&doi=10.1016%2fS0959-6526%2802%2900007-0&partnerID=40&md5=61e189a7e6a2342937f29437f9f94c9c",Article,"Final","",Scopus,2-s2.0-0036885235
"Lenzen, M., Treloar, G.","7003767895;6602703942;","Differential convergence of life-cycle inventories toward upstream production layers: Implications for life-cycle assessment",2002,"Journal of Industrial Ecology","6","3-4",,"137","160",,74,"10.1162/108819802766269575","https://www.scopus.com/inward/record.uri?eid=2-s2.0-0037790768&doi=10.1162%2f108819802766269575&partnerID=40&md5=6024e96cf0c4c1bc35fd23bd52a27189",Article,"Final","",Scopus,2-s2.0-0037790768
"Ng, N., Collins, R.E., Lenzen, M.","7004040508;7403350627;7003767895;","Bakeable, all-metal demountable vacuum seal to a flat glass surface",2002,"Journal of Vacuum Science and Technology A: Vacuum, Surfaces and Films","20","4",,"1384","1389",,3,"10.1116/1.1486228","https://www.scopus.com/inward/record.uri?eid=2-s2.0-0036649686&doi=10.1116%2f1.1486228&partnerID=40&md5=47ddc586ebdbb345407d3d2e287dae45",Article,"Final","",Scopus,2-s2.0-0036649686
"Lenzen, M., Dey, C.J.","7003767895;7006153442;","Economic, energy and greenhouse emissions impacts of some consumer choice, technology and government outlay options",2002,"Energy Economics","24","4",,"377","403",,84,"10.1016/S0140-9883(02)00007-5","https://www.scopus.com/inward/record.uri?eid=2-s2.0-0036640759&doi=10.1016%2fS0140-9883%2802%2900007-5&partnerID=40&md5=2c38c203e82f313c50b886ba042484ad",Article,"Final","",Scopus,2-s2.0-0036640759
"Lenzen, M., Munksgaard, J.","7003767895;6603088866;","Energy and CO2 life-cycle analyses of wind turbines-review and applications",2002,"Renewable Energy","26","3",,"339","362",,225,"10.1016/S0960-1481(01)00145-8","https://www.scopus.com/inward/record.uri?eid=2-s2.0-0036629138&doi=10.1016%2fS0960-1481%2801%2900145-8&partnerID=40&md5=08c3981a2716984a12adc0805ef01fd2",Article,"Final","",Scopus,2-s2.0-0036629138
"Lenzen, M., Dey, C., Murray, J.","7003767895;7006153442;15840058700;","A Personal Approach to Teaching about Climate Change",2002,"Australian Journal of Environmental Education","18","1",,"35","45",,6,"10.1017/S0814062600001105","https://www.scopus.com/inward/record.uri?eid=2-s2.0-3543075690&doi=10.1017%2fS0814062600001105&partnerID=40&md5=84e2dc4c38aea55e3af8a2989520e0f1",Article,"Final","",Scopus,2-s2.0-3543075690
